text,start,stop
"the other kinds of things
that involve",00:41:57.050,00:41:58.930
interaction with faculty.,00:41:58.930,00:42:01.150
So it can be done.,00:42:01.150,00:42:02.350
But I don't recommend it.,00:42:02.350,00:42:03.310
"By the way, all of the four
activities that we have here",00:42:03.310,00:42:06.970
show similar regression lines.,00:42:06.970,00:42:08.440
"But what about that
five point scale?",00:42:11.280,00:42:12.930
"Let me explain how that
works to you.",00:42:12.930,00:42:14.940
"We love to have people
ask us what the class",00:42:14.940,00:42:18.060
average is on a quiz.,00:42:18.060,00:42:20.430
"Because that's when we get
to use our blank stare.",00:42:20.430,00:42:23.480
"Because we have no idea
what the class average",00:42:23.480,00:42:26.180
ever is on any quiz.,00:42:26.180,00:42:28.740
Here's what we do.,00:42:28.740,00:42:29.990
"Like everybody else, we
start off with a score",00:42:46.110,00:42:48.660
from zero to 100.,00:42:48.660,00:42:50.680
"But then we say to ourselves,
what score would you get if",00:42:50.680,00:42:54.750
"you had a thorough understanding
of the material?",00:42:54.750,00:42:57.260
"And we say, well, for this
particular exam, it's this",00:42:57.260,00:43:00.400
number right here.,00:43:00.400,00:43:02.480
"And what score would you
get if you had a good",00:43:02.480,00:43:04.630
understanding of the material?,00:43:04.630,00:43:05.500
That's that score.,00:43:05.500,00:43:07.340
"And what happens if you're
down here is that you're",00:43:07.340,00:43:10.040
"following off the edge of the
range in which we think you",00:43:10.040,00:43:12.670
need to do more work.,00:43:12.670,00:43:14.940
"So what we do is, we say that if
you're in this range here--",00:43:14.940,00:43:18.830
"following MIT convention
with GPAs and stuff,",00:43:18.830,00:43:21.520
that gets you a five.,00:43:21.520,00:43:23.440
"If you're in this range
down here, there's a",00:43:23.440,00:43:25.300
sharp drop off to four.,00:43:25.300,00:43:28.170
"If you're in this range
down here, there's a",00:43:28.170,00:43:29.710
sharp fall off to three.,00:43:29.710,00:43:33.070
"So that means if you're in the
middle of one of those",00:43:33.070,00:43:34.950
"plateaus there's no point
in arguing with this.",00:43:34.950,00:43:37.790
"Because it's not going
to do you any good.",00:43:37.790,00:43:40.550
"We have these boundaries where
we think performance break",00:43:40.550,00:43:43.020
points are.,00:43:43.020,00:43:45.430
"So you say, well that seems
a little harsh.",00:43:45.430,00:43:47.870
"Blah, blah, blah, blah, blah,
and start arguing.",00:43:47.870,00:43:49.850
"But then we will come back with
a second major innovation",00:43:49.850,00:43:53.560
we have in the course.,00:43:53.560,00:43:54.860
"That is that your grade is
calculated in several parts.",00:43:54.860,00:44:00.300
"Part one is the max of
your grade on Q1, and",00:44:00.300,00:44:06.970
part one of the final.,00:44:06.970,00:44:09.830
"So in other words, you get
two shots at everything.",00:44:09.830,00:44:12.780
"So if you have complete glorious
undeniable horrible F",00:44:12.780,00:44:18.080
"on the first quiz, it gets
erased on the final if you do",00:44:18.080,00:44:21.540
"well on that part
of the final.",00:44:21.540,00:44:23.910
"So each quiz has
a corresponding",00:44:23.910,00:44:25.590
mirror on the final.,00:44:25.590,00:44:27.080
"You get the max of the score you
got on those two pieces.",00:44:27.080,00:44:32.680
"And now you say to me,
I'm an MIT student.",00:44:32.680,00:44:36.540
I have a lot of guts.,00:44:36.540,00:44:38.066
"I'm only going to
take the final.",00:44:38.066,00:44:39.740
It has been done.,00:44:44.020,00:44:46.060
We don't recommend it.,00:44:46.060,00:44:49.400
"And the reason we don't
recommend it is that we don't",00:44:49.400,00:44:51.970
"expect everybody to do
all of the final.",00:44:51.970,00:44:53.730
"So there would be a lot of time
pressure if you had to do",00:44:53.730,00:44:55.740
"all of the final, all five
parts of the final.",00:44:55.740,00:45:00.200
So we have four quizzes.,00:45:00.200,00:45:02.890
"And the final has a fifth part
because there's some material",00:45:02.890,00:45:05.590
"that we teach you after the last
date on which we can give",00:45:05.590,00:45:08.710
"you a final by institute
rules.",00:45:08.710,00:45:11.010
"But that's roughly
how it works.",00:45:11.010,00:45:12.050
"And you can read about more of
the details in the FAQ on the",00:45:12.050,00:45:16.690
subject homepage.,00:45:16.690,00:45:17.940
So now we're almost done.,00:45:19.910,00:45:21.050
"I just want to talk a little bit
about how we're going to",00:45:21.050,00:45:24.190
"communicate with you in the
next few days, while we're",00:45:24.190,00:45:27.840
getting ourselves organized.,00:45:27.840,00:45:29.710
"So, number one-- if I could ask
the TAs to help me pass",00:45:29.710,00:45:32.560
these out--,00:45:32.560,00:45:34.570
"we need to schedule you
into tutorials.",00:45:34.570,00:45:37.890
"So we're going to ask you to
fill out this form, and give",00:45:37.890,00:45:39.970
it to us before you leave.,00:45:39.970,00:45:41.220
"So you'll be hearing from
us once we do the sort.",00:45:44.250,00:45:48.910
"There's the issue of whether
we're going to have ordinary",00:45:48.910,00:45:58.100
"recitation and a mega recitation
this week.",00:45:58.100,00:46:00.500
So pay attention.,00:46:00.500,00:46:01.460
"Otherwise, you're going to be
stranded in a classroom with",00:46:01.460,00:46:03.630
nothing to do.,00:46:03.630,00:46:04.990
"We're not going to have any
regular recitations this week.",00:46:04.990,00:46:07.450
"Are we having regular recitation
this week,",00:46:10.010,00:46:11.410
[INAUDIBLE]?,00:46:11.410,00:46:11.720
No.,00:46:11.720,00:46:14.270
"We may, and probably will, have
a mega recitation this",00:46:14.270,00:46:19.890
"week that's devoted to
a Python review.",00:46:19.890,00:46:24.480
"Now we know that there are
many of you who are",00:46:24.480,00:46:27.810
"celebrating a religious holiday
on Friday, and so we",00:46:27.810,00:46:31.250
"will be putting a lot of
resources online so you can",00:46:31.250,00:46:34.680
"get that review in
another way.",00:46:34.680,00:46:38.060
"We probably will have a Python
review on Friday.",00:46:38.060,00:46:42.740
"And we ask that you look at
our home page for further",00:46:42.740,00:46:45.640
"information about that as
the week progresses.",00:46:45.640,00:46:49.520
So that's all folks.,00:46:49.520,00:46:50.640
"That concludes what we're
going to do today.",00:46:50.640,00:46:52.470
"And as soon as you give us
your form, we're through.",00:46:52.470,00:46:56.750
