text,start,stop
"Although it gets hard to
see any color but red.",00:43:47.300,00:43:51.820
So we have s.,00:43:51.820,00:43:55.340
"When we visited a, then the
parent of a would become s.",00:43:55.340,00:44:00.810
"When we visited z, the
parent of z would be a.",00:44:00.810,00:44:05.150
Parent of x is going to be s.,00:44:05.150,00:44:07.640
Parent of d is going to be x.,00:44:07.640,00:44:09.925
"The parent of c
is going to be x.",00:44:09.925,00:44:12.765
The parent of f--,00:44:12.765,00:44:14.364
"it could have been either
way, but the way I did it,",00:44:14.364,00:44:16.530
"d went first, and so
that became its parent.",00:44:16.530,00:44:21.200
"And I think for v,
c was its parent.",00:44:21.200,00:44:25.327
"So that's what the parent
pointers will look like.",00:44:25.327,00:44:27.410
They always follow edges.,00:44:27.410,00:44:28.820
"They actually follow
edges backwards.",00:44:28.820,00:44:30.760
"If this was a directed
graph, the graph",00:44:30.760,00:44:32.620
"might be directed that way
but the parent pointers",00:44:32.620,00:44:35.420
go back along the edges.,00:44:35.420,00:44:37.270
So it's a way to return.,00:44:37.270,00:44:38.390
It's a way to return to s.,00:44:38.390,00:44:41.710
"If you follow these pointers,
all roads lead to s.",00:44:41.710,00:44:44.580
"Because we started at s,
that's the property we have.",00:44:48.140,00:44:50.550
"In fact, these pointers
always form a tree,",00:44:50.550,00:44:54.180
and the root of the tree is s.,00:44:54.180,00:44:56.280
"In fact, these pointers form
what are called shortest paths.",00:44:56.280,00:44:59.860
"Let me write down a
little bit about this.",00:44:59.860,00:45:05.730
Shortest path properties.,00:45:19.970,00:45:21.285
"If you take a node, and
you take its parent,",00:45:45.910,00:45:51.400
"and you take the
parent of the parent,",00:45:51.400,00:45:53.170
"and so on, eventually
you get to s.",00:45:53.170,00:45:56.600
"And if you read it
backwards, that will actually",00:45:56.600,00:45:59.540
be a path in the graph.,00:45:59.540,00:46:01.880
"And it will be a shortest
path, in the graph,",00:46:01.880,00:46:09.420
"from s to v.
Meaning, if you look",00:46:09.420,00:46:14.610
"at all paths in the graph
that go from s to v--",00:46:14.610,00:46:17.180
"So say we're going from
s to v, how about that,",00:46:17.180,00:46:21.460
we compute this path out of BFS.,00:46:21.460,00:46:23.230
"Which is, follow a
parent of v is c, parent",00:46:23.230,00:46:25.450
"of c is x, parent of x is s.",00:46:25.450,00:46:27.670
Read it backwards.,00:46:27.670,00:46:28.600
"That gives us a
path from s to v.",00:46:28.600,00:46:30.590
"The claim is, that
is the shortest",00:46:30.590,00:46:32.140
"way to get from s to v. It
might not be the only one.",00:46:32.140,00:46:35.420
"Like if you're going from s
to f, there's two short paths.",00:46:35.420,00:46:38.330
"There's this one
of length three.",00:46:38.330,00:46:40.330
"There's this one
of length three..",00:46:40.330,00:46:42.160
Uses three edges.,00:46:42.160,00:46:43.390
Same length.,00:46:43.390,00:46:45.300
"And in the parent
pointers, we can only",00:46:45.300,00:46:47.110
"afford to encode
one of those paths",00:46:47.110,00:46:48.640
"because in general there might
be exponentially many ways",00:46:48.640,00:46:51.015
to get from one node to another.,00:46:51.015,00:46:52.690
"We find a shortest path, not
necessarily the only one.",00:46:52.690,00:46:56.940
And the length of that path--,00:46:56.940,00:47:00.600
"So shortest here means that
you use the fewest edges.",00:47:00.600,00:47:03.750
"And the length will
be level of v. That's",00:47:03.750,00:47:07.910
what we're keeping track of.,00:47:07.910,00:47:10.729
"If the level's zero, you can
get there with zero steps.",00:47:10.729,00:47:13.020
"If the level's one, you
get there with one steps.",00:47:13.020,00:47:15.060
"Because we're visiting
everything you can possibly",00:47:15.060,00:47:17.143
"get in k steps, the
level is telling you what",00:47:17.143,00:47:19.830
that shortest path distance is.,00:47:19.830,00:47:21.411
"And the parent
pointers are actually",00:47:21.411,00:47:22.910
giving you the shortest path.,00:47:22.910,00:47:25.030
That's the cool thing about BFS.,00:47:25.030,00:47:27.090
"Yeah, BFS explores the vertices.",00:47:27.090,00:47:28.620
"Sometimes, that's
all you care about.",00:47:28.620,00:47:30.416
"But in some sense,
what really matters,",00:47:30.416,00:47:32.040
"is it finds the shortest way to
get from anywhere to anywhere.",00:47:32.040,00:47:36.200
"For a Rubik's Cube,
that's nice because you",00:47:36.200,00:47:40.200
"run BFS from the start
state of the Rubik's Cube.",00:47:40.200,00:47:43.260
"Then you say, oh,
I'm in this state.",00:47:43.260,00:47:45.190
You look up this state.,00:47:45.190,00:47:46.724
You look at its level.,00:47:46.724,00:47:47.640
"It says, oh, you can
get there in nine steps.",00:47:47.640,00:47:50.590
"That's, I think, the average.",00:47:50.590,00:47:52.260
So I'm guessing.,00:47:52.260,00:47:53.501
"I don't know how to
do this in nine steps.",00:47:53.501,00:47:55.250
"Great, so now you
know how to solve it.",00:47:58.470,00:48:00.220
"You just look at
the parent pointer.",00:48:00.220,00:48:01.720
"The parent pointer gives
you another configuration.",00:48:01.720,00:48:03.095
"You say, oh, what move was that?",00:48:03.095,00:48:05.030
And then you do that move.,00:48:05.030,00:48:06.480
I'm not going to solve it.,00:48:06.480,00:48:07.940
"Then you look at the
parent pointer of that.",00:48:07.940,00:48:09.360
You do that move.,00:48:09.360,00:48:10.045
"You look at the parent
pointer of that.",00:48:10.045,00:48:11.510
You do that move.,00:48:11.510,00:48:12.080
"Eventually, you'll get
to the solved state,",00:48:12.080,00:48:13.871
"and you will do it using
the fewest possible moves.",00:48:13.871,00:48:16.430
"So if you can afford to put the
whole graph in memory, which",00:48:16.430,00:48:20.590
"you can't for a big Rubik's Cube
but you can for a small one,",00:48:20.590,00:48:23.450
"then this will give you a
strategy, the optimal strategy,",00:48:23.450,00:48:27.560
"God's algorithm if you will,
for every configuration.",00:48:27.560,00:48:32.400
It solves all of them.,00:48:32.400,00:48:34.200
Which is great.,00:48:34.200,00:48:36.199
"What is the running
time of this algorithm?",00:48:36.199,00:48:37.990
"I claim it's order V plus E.
But it looked a little wasteful",00:48:37.990,00:48:41.870
"because it was checking
vertices over and over and over.",00:48:41.870,00:48:45.300
"But if you think
about it carefully,",00:48:45.300,00:48:47.260
you're only looking--,00:48:47.260,00:48:49.246
"what's the right
way to say this--",00:48:49.246,00:48:51.270
you only check every edge once.,00:48:51.270,00:48:55.584
"Or in undirected graphs,
you check them twice,",00:48:55.584,00:48:57.500
once from each side.,00:48:57.500,00:49:00.820
"A vertex enters the
frontier only once.",00:49:00.820,00:49:04.290
"Because once it's in the
frontier, it gets a level set.",00:49:04.290,00:49:07.610
"And once it has a level set,
it'll never go in again.",00:49:07.610,00:49:11.450
It'll never get added to next.,00:49:11.450,00:49:14.450
"So s gets added once then we
check all the neighbors of s.",00:49:14.450,00:49:17.440
"a gets added once, then we
check all the neighbors of a.",00:49:17.440,00:49:19.910
"Each of these guys
gets added once.",00:49:19.910,00:49:21.520
We check all the neighbors.,00:49:21.520,00:49:22.950
"So the total running
time is going",00:49:22.950,00:49:24.410
"to be the sum over all
vertices of the size",00:49:24.410,00:49:27.490
"of the adjacency list of v. So
this is the number of neighbors",00:49:27.490,00:49:33.530
that v has.,00:49:33.530,00:49:35.220
And this is going to be?,00:49:35.220,00:49:37.579
Answer?,00:49:37.579,00:49:38.079
"AUDIENCE: Two times
the number of edges.",00:49:42.336,00:49:44.004
PROFESSOR: Sorry,00:49:44.004,00:49:44.670
"AUDIENCE: Double
the number of edges.",00:49:44.670,00:49:46.211
"PROFESSOR: Twice the number of
edges for undirected graphs.",00:49:46.211,00:49:48.930
"It's going to be the number
of edges for directed graphs.",00:49:48.930,00:49:51.330
This is the Handshaking Lemma.,00:49:51.330,00:49:52.770
"If you don't remember
the Handshaking Lemma,",00:49:52.770,00:49:54.670
you should read the textbook.,00:49:54.670,00:49:57.330
Six o four two stuff.,00:49:57.330,00:49:59.116
"Basically you visit
every edge twice.",00:50:03.300,00:50:06.780
"For directed graphs, you
visit every edge once.",00:50:06.780,00:50:10.870
"But it's order E. We
also spend order V",00:50:10.870,00:50:13.590
because we touch every vertex.,00:50:13.590,00:50:15.790
"So the total running
time is order V plus E.",00:50:15.790,00:50:18.770
"In fact, the way this is going,
you can be a little tighter",00:50:18.770,00:50:23.240
"and say it's order E. I just
want to mention in reality--",00:50:23.240,00:50:26.827
"Sometimes you don't care about
just what you can reach from s,",00:50:26.827,00:50:29.410
"you really want to
visit every vertex.",00:50:29.410,00:50:31.410
"Then you need another
outer loop that's",00:50:31.410,00:50:33.710
"iterating over all the vertices
as potential choices for s.",00:50:33.710,00:50:38.170
"And you then can visit all the
vertices in the entire graph",00:50:38.170,00:50:41.160
even if it's disconnected.,00:50:41.160,00:50:42.930
"We'll talk more about
that next class.",00:50:42.930,00:50:45.040
That's it for BFS.,00:50:45.040,00:50:46.607
