text,start,stop
"tell you that a certain event C
occurred, we're placed in a",00:19:39.230,00:19:42.770
"new universe where
event C occurred.",00:19:42.770,00:19:45.220
"We have new probabilities
for that universe.",00:19:45.220,00:19:47.515
"These are the conditional
probabilities.",00:19:47.515,00:19:49.880
"And conditional probabilities
also satisfy",00:19:49.880,00:19:52.960
this kind of property.,00:19:52.960,00:19:54.820
"So this is just our usual
additivity axiom but the",00:19:54.820,00:19:58.380
"applied in a new model, in which
we were told that event",00:19:58.380,00:20:02.290
C occurred.,00:20:02.290,00:20:03.250
"So conditional probabilities
do not taste or smell any",00:20:03.250,00:20:06.580
"different than ordinary
probabilities do.",00:20:06.580,00:20:09.970
"Conditional probabilities, given
a specific event B, just",00:20:09.970,00:20:14.350
"form a probability law
on our sample space.",00:20:14.350,00:20:19.480
"It's a different probability
law but it's still a",00:20:19.480,00:20:22.460
"probability law that has all
of the desired properties.",00:20:22.460,00:20:26.430
"OK, so where do conditional
probabilities come up?",00:20:26.430,00:20:30.360
"They do come up in quizzes
and they do",00:20:30.360,00:20:32.450
come up in silly problems.,00:20:32.450,00:20:34.070
So let's start with this.,00:20:34.070,00:20:35.680
"We have this example
from last time.",00:20:35.680,00:20:37.790
"Two rolls of a die, all possible
pairs of roles are",00:20:37.790,00:20:42.220
"equally likely, so every element
in this square has",00:20:42.220,00:20:46.410
probability of 1/16.,00:20:46.410,00:20:47.660
"So all elements are
equally likely.",00:20:50.300,00:20:52.330
That's our original model.,00:20:52.330,00:20:54.280
"Then somebody comes and tells us
that the minimum of the two",00:20:54.280,00:20:57.210
rolls is equal to zero.,00:20:57.210,00:20:59.530
What's that event?,00:20:59.530,00:21:02.060
"The minimum equal to zero can
happen in many ways, if we get",00:21:02.060,00:21:05.990
"two zeros or if we
get a zero and--",00:21:05.990,00:21:08.990
"sorry, if we get two
two's, or get a two",00:21:08.990,00:21:13.140
and something larger.,00:21:13.140,00:21:14.830
"And so the is our new event B.
The red event is the event B.",00:21:14.830,00:21:21.400
"And now we want to calculate
probabilities",00:21:21.400,00:21:23.500
inside this new universe.,00:21:23.500,00:21:25.310
"For example, you may be
interested in the question,",00:21:25.310,00:21:28.770
"questions about the maximum
of the two rolls.",00:21:28.770,00:21:31.960
"In the new universe, what's
the probability that the",00:21:31.960,00:21:34.310
maximum is equal to one?,00:21:34.310,00:21:37.550
"The maximum being equal to
one is this black event.",00:21:37.550,00:21:44.320
"And given that we're told that
B occurred, this black events",00:21:44.320,00:21:49.240
cannot happen.,00:21:49.240,00:21:50.300
"So this probability
is equal to zero.",00:21:50.300,00:21:53.240
"How about the maximum
being equal to two,",00:21:53.240,00:21:56.500
given that event B?,00:21:56.500,00:21:59.110
"OK, we can use the
definition here.",00:21:59.110,00:22:01.760
"It's going to be the probability
that the maximum",00:22:01.760,00:22:05.730
"is equal to two and B occurs
divided by the probability of",00:22:05.730,00:22:10.590
"B. The probability that the
maximum is equal to two.",00:22:10.590,00:22:16.020
"OK, what's the event that the
maximum is equal to two?",00:22:16.020,00:22:19.470
Let's draw it.,00:22:19.470,00:22:20.340
"This is going to be
the blue event.",00:22:20.340,00:22:22.300
"The maximum is equal to
two if we get any",00:22:22.300,00:22:25.950
of those blue points.,00:22:25.950,00:22:28.520
"So the intersection of the two
events is the intersection of",00:22:28.520,00:22:32.310
"the red event and
the blue event.",00:22:32.310,00:22:35.170
"There's only one point in
their intersection.",00:22:35.170,00:22:37.770
"So the probability of
that intersection",00:22:37.770,00:22:39.640
happening is 1/16.,00:22:39.640,00:22:41.080
That's the numerator.,00:22:43.740,00:22:45.160
How about the denominator?,00:22:45.160,00:22:47.110
"The event B consists of five
elements, each one of which",00:22:47.110,00:22:50.610
had probability of 1/16.,00:22:50.610,00:22:52.270
So that's 5/16.,00:22:52.270,00:22:54.570
And so the answer is 1/5.,00:22:54.570,00:22:58.340
"Could we have gotten this
answer in a faster way?",00:22:58.340,00:23:02.830
Yes.,00:23:02.830,00:23:04.190
Here's how it goes.,00:23:04.190,00:23:05.560
"We're trying to find the
conditional probability that",00:23:05.560,00:23:09.060
"we get this point, given
that B occurred.",00:23:09.060,00:23:13.210
B consist of five elements.,00:23:13.210,00:23:15.570
"All of those five elements were
equally likely when we",00:23:15.570,00:23:18.250
"started, so they remain equally
likely afterwards.",00:23:18.250,00:23:22.720
"Because when we define
conditional probabilities, we",00:23:22.720,00:23:25.180
"keep the same proportions
inside the set.",00:23:25.180,00:23:28.110
"So the five red elements
were equally likely.",00:23:28.110,00:23:31.940
"They remain equally likely
in the conditional world.",00:23:31.940,00:23:35.050
"So conditional event B having
happened, each one of these",00:23:35.050,00:23:39.080
"five elements has the
same probability.",00:23:39.080,00:23:41.580
"So the probability that we
actually get this point is",00:23:41.580,00:23:44.300
going to be 1/5.,00:23:44.300,00:23:46.210
And so that's the shortcut.,00:23:46.210,00:23:48.280
"More generally, whenever you
have a uniform distribution on",00:23:48.280,00:23:53.070
"your initial sample space,
when you condition on an",00:23:53.070,00:23:56.470
"event, your new distribution is
still going to be uniform,",00:23:56.470,00:24:01.000
"but on the smaller events
of that we considered.",00:24:01.000,00:24:05.010
"So we started with a uniform
distribution on the big square",00:24:05.010,00:24:09.780
"and we ended up with a
uniform distribution",00:24:09.780,00:24:13.730
just on the red point.,00:24:13.730,00:24:17.230
"Now besides silly problems,
however, conditional",00:24:17.230,00:24:19.850
"probabilities show up in real
and interesting situations.",00:24:19.850,00:24:25.070
"And this example is going
to give you some",00:24:25.070,00:24:27.390
idea of how that happens.,00:24:27.390,00:24:30.430
OK.,00:24:30.430,00:24:32.250
"Actually, in this example,
instead of starting with a",00:24:32.250,00:24:35.450
"probability model in terms of
regular probabilities, I'm",00:24:35.450,00:24:39.480
"actually going to define the
model in terms of conditional",00:24:39.480,00:24:43.070
probabilities.,00:24:43.070,00:24:43.890
"And we'll see how
this is done.",00:24:43.890,00:24:45.880
So here's the story.,00:24:45.880,00:24:48.330
"There may be an airplane flying
up in the sky, in a",00:24:48.330,00:24:52.210
"particular sector of the sky
that you're watching.",00:24:52.210,00:24:55.400
"Sometimes there is one sometimes
there isn't.",00:24:55.400,00:24:57.950
"And from experience you know
that when you look up, there's",00:24:57.950,00:25:01.760
"five percent probability that
the plane is flying above",00:25:01.760,00:25:04.400
"there and 95% probability that
there's no plane up there.",00:25:04.400,00:25:09.670
"So event A is the event that the
plane is flying out there.",00:25:09.670,00:25:14.930
"Now you bought this wonderful
radar that's looks up.",00:25:14.930,00:25:19.140
"And you're told in the
manufacturer's specs that, if",00:25:19.140,00:25:23.300
"there is a plane out there,
your radar is going to",00:25:23.300,00:25:27.310
"register something, a
blip on the screen",00:25:27.310,00:25:30.090
with probability 99%.,00:25:30.090,00:25:32.940
"And it will not register
anything with",00:25:32.940,00:25:35.540
probability one percent.,00:25:35.540,00:25:37.500
"So this particular part of the
picture is a self-contained",00:25:37.500,00:25:43.890
"probability model of what your
radar does in a world where a",00:25:43.890,00:25:50.280
plane is out there.,00:25:50.280,00:25:52.530
"So I'm telling you that the
plane is out there.",00:25:52.530,00:25:55.380
"So we're now dealing with
conditional probabilities",00:25:55.380,00:25:58.240
"because I gave you some
particular information.",00:25:58.240,00:26:00.920
"Given this information that the
plane is out there, that's",00:26:00.920,00:26:04.120
"how your radar is going to
behave with probability 99% is",00:26:04.120,00:26:07.770
"going to detect it, with
probability one percent is",00:26:07.770,00:26:10.320
going to miss it.,00:26:10.320,00:26:11.620
"So this piece of the picture
is a self-contained",00:26:11.620,00:26:14.100
probability model.,00:26:14.100,00:26:15.060
"The probabilities
add up to one.",00:26:15.060,00:26:17.130
"But it's a piece of
a larger model.",00:26:17.130,00:26:20.300
"Similarly, there's the
other possibility.",00:26:20.300,00:26:22.820
"Maybe a plane is not up there
and the manufacturer specs",00:26:22.820,00:26:27.980
"tell you something about
false alarms.",00:26:27.980,00:26:32.630
"A false alarm is the situation
where the plane is not there,",00:26:32.630,00:26:37.490
"but for some reason your radar
picked up some noise or",00:26:37.490,00:26:41.190
"whatever and shows a
blip on the screen.",00:26:41.190,00:26:43.700
"And suppose that this happens
with probability ten percent.",00:26:43.700,00:26:46.790
"Whereas with probability
90% your radar",00:26:46.790,00:26:49.170
gives the correct answer.,00:26:49.170,00:26:51.220
"So this is sort of a model of
what's going to happen with",00:26:51.220,00:26:55.430
"respect to both the plane --
we're given probabilities",00:26:55.430,00:26:59.430
"about this -- and we're given
probabilities about how the",00:26:59.430,00:27:02.000
radar behaves.,00:27:02.000,00:27:04.120
"So here I have indirectly
specified the probability law",00:27:04.120,00:27:07.740
"in our model by starting with
conditional probabilities as",00:27:07.740,00:27:10.810
"opposed to starting with
ordinary probabilities.",00:27:10.810,00:27:13.670
"Can we derive ordinary
probabilities starting from",00:27:13.670,00:27:17.160
the conditional number ones?,00:27:17.160,00:27:18.740
"Yeah, we certainly can.",00:27:18.740,00:27:20.340
"Let's look at this event, A
intersection B, which is the",00:27:20.340,00:27:25.810
"event up here, that there
is a plane and our",00:27:25.810,00:27:31.160
radar picks it up.,00:27:31.160,00:27:33.750
"How can we calculate
this probability?",00:27:33.750,00:27:35.760
"Well we use the definition of
conditional probabilities and",00:27:35.760,00:27:38.600
"this is the probability of
A times the conditional",00:27:38.600,00:27:41.430
"probability of B given A.
So it's 0.05 times 0.99.",00:27:41.430,00:27:50.260
"And the answer, in
case you care--",00:27:50.260,00:27:53.290
It's 0.0495.,00:27:53.290,00:27:56.730
OK.,00:27:56.730,00:27:57.650
"So we can calculate the
probabilities of final",00:27:57.650,00:28:01.370
"outcomes, which are the leaves
of the tree, by using the",00:28:01.370,00:28:05.120
"probabilities that
we have along the",00:28:05.120,00:28:07.250
branches of the tree.,00:28:07.250,00:28:09.000
"So essentially, what we ended
up doing was to multiply the",00:28:09.000,00:28:11.950
"probability of this
branch times the",00:28:11.950,00:28:13.700
probability of that branch.,00:28:13.700,00:28:17.220
"Now, how about the answer
to this question.",00:28:17.220,00:28:20.690
"What is the probability
that our radar is",00:28:20.690,00:28:25.350
going to register something?,00:28:25.350,00:28:28.660
"OK, this is an event that can
happen in multiple ways.",00:28:28.660,00:28:32.800
"It's the event that consists
of this outcome.",00:28:32.800,00:28:38.020
"There is a plane and the radar
registers something together",00:28:38.020,00:28:41.640
"with this outcome, there is no
plane but the radar still",00:28:41.640,00:28:46.440
registers something.,00:28:46.440,00:28:48.470
"So to find the probability of
this event, we need the",00:28:48.470,00:28:52.650
"individual probabilities
of the two outcomes.",00:28:52.650,00:28:56.940
"For the first outcome, we
already calculated it.",00:28:56.940,00:29:00.780
"For the second outcome, the
probability that this happens",00:29:00.780,00:29:03.870
"is going to be this probability
95% times 0.10,",00:29:03.870,00:29:08.480
"which is the conditional
probability for taking this",00:29:08.480,00:29:11.280
"branch, given that there
was no plane out there.",00:29:11.280,00:29:15.070
So we just add the numbers.,00:29:15.070,00:29:18.080
"0.05 times 0.99 plus 0.95
times 0.1 and the",00:29:18.080,00:29:26.950
final answer is 0.1445.,00:29:26.950,00:29:31.720
OK.,00:29:31.720,00:29:32.410
"And now here's the interesting
question.",00:29:32.410,00:29:35.730
"Given that your radar recorded
something, how likely is it",00:29:35.730,00:29:41.480
"that there is an airplane
up there?",00:29:41.480,00:29:45.070
"Your radar registering
something --",00:29:45.070,00:29:46.810
"that can be caused
by two things.",00:29:46.810,00:29:48.730
"Either there's a plane there,
and your radar did its job.",00:29:48.730,00:29:52.390
"Or there was nothing, but your
radar fired a false alarm.",00:29:52.390,00:29:57.400
"What's the probability that this
is the case as opposed to",00:29:57.400,00:30:01.690
that being the case?,00:30:01.690,00:30:05.370
OK.,00:30:05.370,00:30:06.460
"The intuitive shortcut would
be that it should be the",00:30:06.460,00:30:10.510
probability--,00:30:10.510,00:30:12.930
"you look at their relative odds
of these two elements and",00:30:12.930,00:30:15.820
"you use them to find out how
much more likely it is to be",00:30:15.820,00:30:19.570
"there as opposed
to being there.",00:30:19.570,00:30:21.730
"But instead of doing this,
let's just write down the",00:30:21.730,00:30:24.240
definition and just use it.,00:30:24.240,00:30:26.570
"It's the probability of A and
B happening, divided by the",00:30:26.570,00:30:30.480
"probability of B. This is just
our definition of conditional",00:30:30.480,00:30:34.250
probabilities.,00:30:34.250,00:30:35.540
"Now we have already found
the numerator.",00:30:35.540,00:30:39.300
"We have already calculated
the denominator.",00:30:39.300,00:30:42.450
"So we take the ratio of these
two numbers and we find the",00:30:42.450,00:30:46.440
final answer --,00:30:46.440,00:30:47.650
which is 0.34.,00:30:47.650,00:30:54.490
OK.,00:30:54.490,00:30:55.980
"There's this slightly
curious thing that's",00:30:55.980,00:30:59.040
happened in this example.,00:30:59.040,00:31:02.270
"Doesn't this number feel
a little too low?",00:31:02.270,00:31:08.380
My radar --,00:31:08.380,00:31:10.700
"So this is a conditional
probability, given that my",00:31:10.700,00:31:13.820
"radar said there is something
out there, that there is",00:31:13.820,00:31:17.110
indeed something there.,00:31:17.110,00:31:19.200
"So it's sort of the probability
that our radar",00:31:19.200,00:31:21.960
gave the correct answer.,00:31:21.960,00:31:24.560
"Now, the specs of our radar
we're pretty good.",00:31:24.560,00:31:28.580
"In this situation, it gives
you the correct",00:31:28.580,00:31:31.460
answer 99% of the time.,00:31:31.460,00:31:34.160
"In this situation, it gives
you the correct",00:31:34.160,00:31:36.020
answer 90% of the time.,00:31:36.020,00:31:38.400
"So you would think
that your radar",00:31:38.400,00:31:39.730
there is really reliable.,00:31:39.730,00:31:41.870
"But yet here the radar recorded
something, but the",00:31:41.870,00:31:47.730
"chance that the answer that
you get out of this is the",00:31:47.730,00:31:51.900
"right one, given that it
recorded something, the chance",00:31:51.900,00:31:55.180
"that there is an airplane
out there is only 30%.",00:31:55.180,00:31:58.970
"So you cannot really rely on
the measurements from your",00:31:58.970,00:32:01.980
"radar, even though the specs of
the radar were really good.",00:32:01.980,00:32:06.650
What's the reason for this?,00:32:06.650,00:32:08.620
"Well, the reason is that false
alarms are pretty common.",00:32:08.620,00:32:17.730
"Most of the time there's
nothing.",00:32:17.730,00:32:20.110
"And there's a ten percent
probability of false alarms.",00:32:20.110,00:32:23.750
"So there's roughly a ten percent
probability that in",00:32:23.750,00:32:26.640
"any given experiment, you
have a false alarm.",00:32:26.640,00:32:29.730
"And there is about the five
percent probability that",00:32:29.730,00:32:33.450
"something out there and
your radar gets it.",00:32:33.450,00:32:37.090
"So when your radar records
something, it's actually more",00:32:37.090,00:32:41.350
"likely to be a false
alarm rather than",00:32:41.350,00:32:44.980
being an actual airplane.,00:32:44.980,00:32:46.860
"This has probability ten
percent roughly.",00:32:46.860,00:32:49.100
"This has probability roughly
five percent",00:32:49.100,00:32:52.000
"So conditional probabilities
are sometimes",00:32:52.000,00:32:55.130
"counter-intuitive in terms of
the answers that they get.",00:32:55.130,00:32:58.250
"And you can make similar
stories about doctors",00:32:58.250,00:33:01.210
"interpreting the results
of tests.",00:33:01.210,00:33:04.370
"So you tested positive for
a certain disease.",00:33:04.370,00:33:07.560
"Does it mean that you have
the disease necessarily?",00:33:07.560,00:33:11.260
"Well if that disease has been
eradicated from the face of",00:33:11.260,00:33:14.590
"the earth, testing positive
doesn't mean that you have the",00:33:14.590,00:33:17.900
"disease, even if the test
was designed to be",00:33:17.900,00:33:21.740
a pretty good one.,00:33:21.740,00:33:23.320
"So unfortunately, doctors do get
it wrong also sometimes.",00:33:23.320,00:33:28.190
"And the reasoning that
comes in such",00:33:28.190,00:33:29.990
situations is pretty subtle.,00:33:29.990,00:33:32.290
"Now for the rest of the lecture,
what we're going to",00:33:32.290,00:33:34.890
"do is to take this example where
we did three things and",00:33:34.890,00:33:40.710
abstract them.,00:33:40.710,00:33:41.880
"These three trivial calculations
that's we just",00:33:41.880,00:33:44.540
"did are three very important,
very basic tools that you use",00:33:44.540,00:33:50.190
"to solve more general
probability problems.",00:33:50.190,00:33:53.350
So what's the first one?,00:33:53.350,00:33:55.040
"We find the probability of a
composite event, two things",00:33:55.040,00:33:58.040
"happening, by multiplying
probabilities and conditional",00:33:58.040,00:34:01.300
probabilities.,00:34:01.300,00:34:03.130
"More general version of this,
look at any situation, maybe",00:34:03.130,00:34:08.639
"involving lots and
lots of events.",00:34:08.639,00:34:10.860
"So here's a story that event A
may happen or may not happen.",00:34:10.860,00:34:15.510
"Given that A occurred, it's
possible that B happens or",00:34:15.510,00:34:19.440
that B does not happen.,00:34:19.440,00:34:21.360
"Given that B also happens, it's
possible that the event C",00:34:21.360,00:34:25.280
"also happens or that event
C does not happen.",00:34:25.280,00:34:29.770
"And somebody specifies for you
a model by giving you all",00:34:29.770,00:34:33.400
"these conditional probabilities
along the way.",00:34:33.400,00:34:36.230
"Notice what we move along
the branches as the tree",00:34:36.230,00:34:39.570
progresses.,00:34:39.570,00:34:40.690
"Any point in the tree
corresponds to certain events",00:34:40.690,00:34:45.110
having happened.,00:34:45.110,00:34:47.050
"And then, given that this
has happened, we specify",00:34:47.050,00:34:50.980
conditional probabilities.,00:34:50.980,00:34:52.360
"Given that this has happened,
how likely is it for that C",00:34:52.360,00:34:55.989
also occurs?,00:34:55.989,00:34:57.900
"Given a model of this kind, how
do we find the probability",00:34:57.900,00:35:00.890
or for this event?,00:35:00.890,00:35:02.660
"The answer is extremely
simple.",00:35:02.660,00:35:05.310
"All that you do is move along
with the tree and multiply",00:35:05.310,00:35:09.930
"conditional probabilities
along the way.",00:35:09.930,00:35:12.950
"So in terms of frequencies, how
often do all three things",00:35:12.950,00:35:16.900
"happen, A, B, and C?",00:35:16.900,00:35:19.310
"You first see how often
does A occur.",00:35:19.310,00:35:22.450
"Out of the times that
A occurs, how",00:35:22.450,00:35:24.860
often does B occur?,00:35:24.860,00:35:26.710
"And out of the times where both
A and B have occurred,",00:35:26.710,00:35:29.630
how often does C occur?,00:35:29.630,00:35:31.660
"And you can just multiply those
three frequencies with",00:35:31.660,00:35:34.390
each other.,00:35:34.390,00:35:36.440
"What is the formal
proof of this?",00:35:36.440,00:35:39.740
"Well, the only thing we have in
our hands is the definition",00:35:39.740,00:35:43.000
of conditional probabilities.,00:35:43.000,00:35:44.890
So let's just use this.,00:35:44.890,00:35:49.660
And--,00:35:49.660,00:35:50.910
OK.,00:35:54.370,00:35:55.000
"Now, the definition of
conditional probabilities",00:35:55.000,00:35:58.210
"tells us that the probability
of two things is the",00:35:58.210,00:36:00.770
"probability of one of them
times a conditional",00:36:00.770,00:36:03.660
probability.,00:36:03.660,00:36:04.620
"Unfortunately, here we have the",00:36:04.620,00:36:05.850
probability of three things.,00:36:05.850,00:36:07.310
What can I do?,00:36:07.310,00:36:09.000
"I can put a parenthesis in here
and think of this as the",00:36:09.000,00:36:13.570
"probability of this and that
and apply our definition of",00:36:13.570,00:36:18.640
"conditional probabilities
here.",00:36:18.640,00:36:20.300
"The probability of two things
happening is the probability",00:36:20.300,00:36:23.920
"that the first happens times
the conditional probability",00:36:23.920,00:36:28.430
"that the second happens, given
A and B, given that the first",00:36:28.430,00:36:34.070
one happened.,00:36:34.070,00:36:35.330
"So this is just the definition
of the conditional probability",00:36:35.330,00:36:38.850
"of an event, given
another event.",00:36:38.850,00:36:41.980
"That other event is a
composite one, but",00:36:41.980,00:36:44.270
that's not an issue.,00:36:44.270,00:36:45.330
It's just an event.,00:36:45.330,00:36:47.300
"And then we use the definition
of conditional probabilities",00:36:47.300,00:36:50.040
"once more to break this apart
and make it P(A), P(B given A)",00:36:50.040,00:36:56.290
"and then finally,
the last term.",00:36:56.290,00:36:58.260
OK.,00:37:00.930,00:37:01.270
"So this proves the formula
that I have up",00:37:01.270,00:37:03.680
there on the slides.,00:37:03.680,00:37:05.290
"And if you wish to calculate
any other",00:37:05.290,00:37:07.470
probability in this diagram.,00:37:07.470,00:37:09.330
"For example, if you want to
calculate this probability,",00:37:09.330,00:37:12.590
"you would still multiply the
conditional probabilities",00:37:12.590,00:37:15.580
"along the different branches
of the tree.",00:37:15.580,00:37:18.560
"In particular, here in this
branch, you would have the",00:37:18.560,00:37:22.360
"conditional probability of
C complement, given A",00:37:22.360,00:37:26.670
"intersection B complement,
and so on.",00:37:26.670,00:37:29.790
"So you write down probabilities
along all those",00:37:29.790,00:37:32.070
"tree branches and just multiply
them as you go.",00:37:32.070,00:37:35.940
"So this was the first skill
that we are covering.",00:37:38.510,00:37:44.450
What was the second one?,00:37:44.450,00:37:46.690
"What we did was to calculate
the total probability of a",00:37:46.690,00:37:53.240
"certain event B that
consisted of--",00:37:53.240,00:37:58.520
"was made up from different
possibilities, which",00:37:58.520,00:38:02.820
"corresponded to different
scenarios.",00:38:02.820,00:38:05.580
"So we wanted to calculate the
probability of this event B",00:38:05.580,00:38:08.870
"that consisted of those
two elements.",00:38:08.870,00:38:12.030
Let's generalize.,00:38:12.030,00:38:13.280
So we have our big model.,00:38:18.600,00:38:23.080
"And this sample space
is partitioned",00:38:23.080,00:38:26.110
in a number of sets.,00:38:26.110,00:38:27.410
"In our radar example, we had
a partition in two sets.",00:38:27.410,00:38:30.620
"Either a plane is there, or
a plane is not there.",00:38:30.620,00:38:33.600
"Since we're trying to
generalize, now I'm going to",00:38:33.600,00:38:35.850
"give you a picture for the case
of three possibilities or",00:38:35.850,00:38:39.410
three possible scenarios.,00:38:39.410,00:38:41.360
"So whatever happens in the
world, there are three",00:38:41.360,00:38:45.160
"possible scenarios,
A1, A2, A3.",00:38:45.160,00:38:49.660
"So think of these as there's
nothing in the air, there's an",00:38:49.660,00:38:54.695
"airplane in the air, or there's
a flock of geese",00:38:54.695,00:38:58.190
flying in the air.,00:38:58.190,00:38:59.490
"So there's three possible
scenarios.",00:38:59.490,00:39:03.050
"And then there's a certain event
B of interest, such as a",00:39:03.050,00:39:08.972
"radar records something or
doesn't record something.",00:39:08.972,00:39:12.800
We specify this model by giving,00:39:12.800,00:39:15.870
probabilities for the Ai's--,00:39:15.870,00:39:18.040
"That's the probability of
the different scenarios.",00:39:20.690,00:39:23.420
"And somebody also gives us the
probabilities that this event",00:39:23.420,00:39:27.180
"B is going to occur, given
that the Ai-th",00:39:27.180,00:39:31.010
scenario has occurred.,00:39:31.010,00:39:33.480
"Think of the Ai's
as scenarios.",00:39:33.480,00:39:36.230
"And we want to calculate the
overall probability of the",00:39:39.130,00:39:43.110
"event B. What's happening
in this example?",00:39:43.110,00:39:47.210
"Perhaps, instead of this
picture, it's easier to",00:39:47.210,00:39:49.640
"visualize if I go back to the
picture I was using before.",00:39:49.640,00:39:54.970
"We have three possible
scenarios, A1, A2, A3.",00:39:54.970,00:39:59.990
