text,start,stop
"And under each scenario, B may
happen or B may not happen.",00:39:59.990,00:40:05.150
And so on.,00:40:11.360,00:40:12.250
"So here we have A2 intersection
B. And here we",00:40:12.250,00:40:16.060
"have A3 intersection B. In the
previous slide, we found how",00:40:16.060,00:40:22.110
"to calculate the probability
of any event of this kind,",00:40:22.110,00:40:25.350
"which is done by multiplying
probabilities here and",00:40:25.350,00:40:28.870
"conditional probabilities
there.",00:40:28.870,00:40:31.100
"Now we are asked to calculate
the total probability of the",00:40:31.100,00:40:34.320
"event B. The event B can happen
in three possible ways.",00:40:34.320,00:40:38.410
It can happen here.,00:40:38.410,00:40:39.900
It can happen there.,00:40:39.900,00:40:41.700
And it can happen here.,00:40:41.700,00:40:43.780
"So this is our event B. It
consists of three elements.",00:40:43.780,00:40:50.020
"To calculate the total
probability of our event B,",00:40:50.020,00:40:53.370
"all we need to do is to add
these three probabilities.",00:40:53.370,00:40:56.730
"So B is an event that consists
of these three elements.",00:40:59.440,00:41:03.510
"There are three ways
that B can happen.",00:41:03.510,00:41:06.450
"Either B happens together with
A1, or B happens together with",00:41:06.450,00:41:10.390
"A2, or B happens together
with A3.",00:41:10.390,00:41:13.030
"So we need to add the
probabilities of these three",00:41:13.030,00:41:15.340
contingencies.,00:41:15.340,00:41:16.630
"For each one of those
contingencies, we can",00:41:16.630,00:41:18.980
"calculate its probability by
using the multiplication rule.",00:41:18.980,00:41:23.020
"So the probability of A1 and
B happening is this--",00:41:23.020,00:41:27.580
"It's the probability of A1
and then B happening",00:41:27.580,00:41:30.030
given that A1 happens.,00:41:30.030,00:41:32.020
"The probability of this
contingency is found by taking",00:41:32.020,00:41:36.140
"the probability that A2 happens
times the conditional",00:41:36.140,00:41:39.470
"probability of A2, given
that B happened.",00:41:39.470,00:41:42.350
"And similarly for
the third one.",00:41:42.350,00:41:44.640
"So this is the general rule
that we have here.",00:41:44.640,00:41:48.030
"The rule is written for the
case of three scenarios.",00:41:48.030,00:41:50.830
"But obviously, it has a
generalization for the case of",00:41:50.830,00:41:54.020
"four or five or more
scenarios.",00:41:54.020,00:41:57.440
"It gives you a way of breaking
up the calculation of an event",00:41:57.440,00:42:02.050
"that can happen in multiple ways
by considering individual",00:42:02.050,00:42:06.740
"probabilities for the different
ways that the event",00:42:06.740,00:42:09.720
can happen.,00:42:09.720,00:42:10.970
OK.,00:42:12.950,00:42:14.640
So--,00:42:14.640,00:42:16.300
Yes?,00:42:16.300,00:42:16.656
"AUDIENCE: Does this
have to change for",00:42:16.656,00:42:18.180
infinite sample space?,00:42:18.180,00:42:19.800
JOHN TSISIKLIS: No.,00:42:19.800,00:42:20.760
"This is true whether
your sample space",00:42:20.760,00:42:23.050
is infinite or finite.,00:42:23.050,00:42:25.450
"What I'm using in this argument
that we have a",00:42:25.450,00:42:28.410
"partition into just three
scenarios, three events.",00:42:28.410,00:42:33.670
"So it's a partition to a finite
number of events.",00:42:33.670,00:42:36.720
"It's also true if it's a
partition into an infinite",00:42:36.720,00:42:41.100
sequence of events.,00:42:41.100,00:42:43.670
"But that's, I think, one of the
theoretical problems at",00:42:43.670,00:42:47.550
the end of the chapter.,00:42:47.550,00:42:49.430
"You probably may not
need it for now.",00:42:49.430,00:42:54.350
"OK, going back to
the story here.",00:42:54.350,00:42:57.550
"There are three possible
scenarios about what could",00:42:57.550,00:43:00.410
"happen in the world that
are captured here.",00:43:00.410,00:43:03.390
"Event, under each scenario,
event B may or may not happen.",00:43:03.390,00:43:08.660
"And so these probabilities tell
us the likelihoods of the",00:43:08.660,00:43:11.850
different scenarios.,00:43:11.850,00:43:13.270
"These conditional probabilities
tell us how",00:43:13.270,00:43:17.640
"likely is it for B to happen
under one scenario, or the",00:43:17.640,00:43:21.030
"other scenario, or the
other scenario.",00:43:21.030,00:43:23.760
"The overall probability of
B is found by taking some",00:43:23.760,00:43:28.510
"combination of the probabilities
of B in the",00:43:28.510,00:43:32.380
"different possible
worlds, in the",00:43:32.380,00:43:34.250
different possible scenarios.,00:43:34.250,00:43:36.230
"Under some scenario, B
may be very likely.",00:43:36.230,00:43:38.690
"Under another scenario, it
may be very unlikely.",00:43:38.690,00:43:42.280
"We take all of these into
account and weigh them",00:43:42.280,00:43:45.740
"according to the likelihood
of the scenarios.",00:43:45.740,00:43:48.590
"Now notice that since A1, A2,
and three form a partition,",00:43:48.590,00:43:53.040
"these three probabilities
have what property?",00:43:53.040,00:43:58.530
Add to what?,00:43:58.530,00:44:00.810
They add to one.,00:44:00.810,00:44:03.640
"So it's the probability of this
branch, plus this branch,",00:44:03.640,00:44:06.020
plus this branch.,00:44:06.020,00:44:07.240
"So what we have here is a
weighted average of the",00:44:07.240,00:44:11.660
"probabilities of the B's into
the different worlds, or in",00:44:11.660,00:44:15.120
the different scenarios.,00:44:15.120,00:44:16.690
Special case.,00:44:16.690,00:44:17.860
"Suppose the three scenarios
are equally likely.",00:44:17.860,00:44:20.370
"So P of A1 equals 1/3, equals
to P of A2, P of A3.",00:44:20.370,00:44:25.300
what are we saying here?,00:44:25.300,00:44:27.320
"In that case of equally likely
scenarios, the probability of",00:44:27.320,00:44:31.750
"B is the average of the
probabilities of B in the",00:44:31.750,00:44:35.920
"three different words, or in the
three different scenarios.",00:44:35.920,00:44:38.835
OK.,00:44:42.950,00:44:43.450
"So to finally, the last step.",00:44:43.450,00:44:46.630
"If we go back again two slides,
the last thing that we",00:44:46.630,00:44:53.800
"did was to calculate a
conditional probability of",00:44:53.800,00:44:57.510
"this kind, probability of
A given B, which is a",00:44:57.510,00:45:01.760
"probability associated
essentially with",00:45:01.760,00:45:04.080
an inference problem.,00:45:04.080,00:45:05.630
"Given that our radar recorded
something, how likely is it",00:45:05.630,00:45:09.840
that the plane was up there?,00:45:09.840,00:45:12.060
"So we're trying to infer whether
a plane was up there",00:45:12.060,00:45:15.240
"or not, based on the information
that we've got.",00:45:15.240,00:45:18.610
So let's generalize once more.,00:45:18.610,00:45:20.770
"And we're just going to rewrite
what we did in that",00:45:24.560,00:45:28.250
"example, but in terms of general
symbols instead of the",00:45:28.250,00:45:32.190
specific numbers.,00:45:32.190,00:45:33.650
"So once more, the model that we
have involves probabilities",00:45:33.650,00:45:38.180
of the different scenarios.,00:45:38.180,00:45:40.480
"These we call them prior
probabilities.",00:45:40.480,00:45:42.830
"They're are our initial beliefs
about how likely each",00:45:42.830,00:45:46.690
scenario is to occur.,00:45:46.690,00:45:49.360
"We also have a model of our
measuring device that tells us",00:45:49.360,00:45:54.500
"under that scenario how likely
is it that our radar will",00:45:54.500,00:45:58.110
register something or not.,00:45:58.110,00:46:00.140
"So we're given again these
conditional probabilities.",00:46:00.140,00:46:03.220
We're given the conditional,00:46:03.220,00:46:04.330
probabilities for these branches.,00:46:04.330,00:46:06.950
"Then we are told that
event B occurred.",00:46:06.950,00:46:11.050
"And on the basis of this new
information, we want to form",00:46:11.050,00:46:15.330
"some new beliefs about the
relative likelihood of the",00:46:15.330,00:46:18.510
different scenarios.,00:46:18.510,00:46:20.110
"Going back again to our radar
example, an airplane was",00:46:20.110,00:46:23.790
present with probability 5%.,00:46:23.790,00:46:26.340
"Given that the radar recorded
something, we're going to",00:46:26.340,00:46:29.180
change our beliefs.,00:46:29.180,00:46:30.540
"Now, a plane is present
with probability 34%.",00:46:30.540,00:46:34.870
"The radar, since we saw
something, we are going to",00:46:34.870,00:46:38.270
"revise our beliefs as to whether
the plane is out there",00:46:38.270,00:46:41.880
or is not there.,00:46:41.880,00:46:43.130
"And so what we need to do is to
calculate the conditional",00:46:46.040,00:46:52.660
"probabilities of the different
scenarios, given the",00:46:52.660,00:46:57.290
information that we got.,00:46:57.290,00:46:59.340
"So initially, we have these
probabilities for the",00:46:59.340,00:47:02.330
different scenarios.,00:47:02.330,00:47:04.000
"Once we get the information,
we update them and we",00:47:04.000,00:47:06.870
"calculate our revised
probabilities or conditional",00:47:06.870,00:47:09.760
"probabilities given the
observation that we made.",00:47:09.760,00:47:14.130
OK.,00:47:14.130,00:47:14.730
So what do we do?,00:47:14.730,00:47:15.760
"We just use the definition
of conditional",00:47:15.760,00:47:17.620
probabilities twice.,00:47:17.620,00:47:19.360
"By definition the conditional
probability is the probability",00:47:19.360,00:47:22.490
"of two things happening divided
by the probability of",00:47:22.490,00:47:25.740
the conditioning event.,00:47:25.740,00:47:27.960
"Now, I'm using the definition
of conditional probabilities",00:47:27.960,00:47:30.480
"once more, or rather I use
the multiplication rule.",00:47:30.480,00:47:33.550
"The probability of two things
happening is the probability",00:47:33.550,00:47:35.970
of the first and the second.,00:47:35.970,00:47:38.740
"So these are things that
are given to us.",00:47:38.740,00:47:41.190
"They're the probabilities of
the different scenarios.",00:47:41.190,00:47:43.430
"And it's the model of our
measuring device, which we",00:47:43.430,00:47:47.750
assume to be available.,00:47:47.750,00:47:51.810
And how about the denominator?,00:47:51.810,00:47:53.450
"This is total probability of the
event B. But we just found",00:47:53.450,00:47:57.780
"that's it's easy to calculate
using the formula in the",00:47:57.780,00:48:01.140
previous slide.,00:48:01.140,00:48:02.400
"To find the overall probability
of event B",00:48:02.400,00:48:04.750
"occurring, we look at the
probabilities of B occurring",00:48:04.750,00:48:08.260
"under the different scenario
and weigh them according to",00:48:08.260,00:48:11.560
"the probabilities of
all the scenarios.",00:48:11.560,00:48:13.710
"So in the end, we have a formula
for the conditional",00:48:13.710,00:48:17.370
"probability, A's given B,
based on the data of the",00:48:17.370,00:48:22.730
"problem, which were
probabilities of the different",00:48:22.730,00:48:25.090
"scenarios and conditional
probabilities of",00:48:25.090,00:48:27.360
"B, given the A's.",00:48:27.360,00:48:29.490
"So what this calculation does
is, basically, it reverses the",00:48:29.490,00:48:33.320
order of conditioning.,00:48:33.320,00:48:35.310
"We are given conditional
probabilities of these kind,",00:48:35.310,00:48:39.000
"where it's B given A and we
produce new conditional",00:48:39.000,00:48:42.950
"probabilities, where things
go the other way.",00:48:42.950,00:48:46.630
"So schematically, what's
happening here is that we have",00:48:46.630,00:48:53.530
"model of cause and
effect and--",00:48:53.530,00:48:59.995
"So a scenario occurs and that
may cause B to happen or may",00:49:02.550,00:49:09.840
not cause it to happen.,00:49:09.840,00:49:11.880
"So this is a cause/effect
model.",00:49:11.880,00:49:14.495
"And it's modeled using
probabilities, such as",00:49:17.300,00:49:20.090
probability of B given Ai.,00:49:20.090,00:49:23.350
"And what we want to do is
inference where we are told",00:49:23.350,00:49:28.710
"that B occurs, and we want
to infer whether Ai",00:49:28.710,00:49:35.910
also occurred or not.,00:49:35.910,00:49:38.580
"And the appropriate
probabilities for that are the",00:49:38.580,00:49:42.050
"conditional probabilities
that A occurred,",00:49:42.050,00:49:45.010
given that B occurred.,00:49:45.010,00:49:48.110
"So we're starting with a causal
model of our situation.",00:49:48.110,00:49:52.250
"It models from a given cause how
likely is a certain effect",00:49:52.250,00:49:57.220
to be observed.,00:49:57.220,00:49:58.830
"And then we do inference, which
answers the question,",00:49:58.830,00:50:02.920
"given that the effect was
observed, how likely is it",00:50:02.920,00:50:06.730
"that the world was in this
particular situation or state",00:50:06.730,00:50:10.870
or scenario.,00:50:10.870,00:50:12.940
"So the name of the Bayes rule
comes from Thomas Bayes, a",00:50:12.940,00:50:17.260
"British theologian back
in the 1700s.",00:50:17.260,00:50:20.750
It actually--,00:50:20.750,00:50:21.530
"This calculation addresses
a basic problem, a basic",00:50:21.530,00:50:25.000
"philosophical problem, how one
can learn from experience or",00:50:25.000,00:50:30.230
"from experimental data and
some systematic way.",00:50:30.230,00:50:33.300
"So the British at that time
were preoccupied with this",00:50:33.300,00:50:35.840
type of question.,00:50:35.840,00:50:36.710
"Is there a basic theory that
about how we can incorporate",00:50:36.710,00:50:41.200
"new knowledge to previous
knowledge.",00:50:41.200,00:50:44.280
"And this calculation made an
argument that, yes, it is",00:50:44.280,00:50:47.600
"possible to do that in
a systematic way.",00:50:47.600,00:50:50.100
"So the philosophical
underpinnings of this have a",00:50:50.100,00:50:53.040
"very long history and a lot
of discussion around them.",00:50:53.040,00:50:57.050
"But for our purposes, it's just
an extremely useful tool.",00:50:57.050,00:51:00.560
"And it's the foundation of
almost everything that gets",00:51:00.560,00:51:03.550
"done when you try to do
inference based on partial",00:51:03.550,00:51:07.190
observations.,00:51:07.190,00:51:08.860
Very well.,00:51:08.860,00:51:09.690
Till next time.,00:51:09.690,00:51:10.940
