text,start,stop
"The following content is
provided under a Creative",00:00:00.040,00:00:02.460
Commons license.,00:00:02.460,00:00:03.870
"Your support will help MIT
OpenCourseWare continue to",00:00:03.870,00:00:06.910
"offer high quality educational
resources for free.",00:00:06.910,00:00:10.560
"To make a donation or view
additional materials from",00:00:10.560,00:00:13.460
"hundreds of MIT courses, visit
MIT OpenCourseWare at",00:00:13.460,00:00:19.290
ocw.mit.edu,00:00:19.290,00:00:22.004
"JOHN TSISIKLIS: So here's
the agenda for today.",00:00:22.004,00:00:24.966
"We're going to do a
very quick review.",00:00:24.966,00:00:26.848
"And then we're going
to introduce some",00:00:26.848,00:00:28.936
very important concepts.,00:00:28.936,00:00:30.560
"The idea is that all
information is--",00:00:30.560,00:00:34.060
Information is always partial.,00:00:34.060,00:00:36.450
"And the question is what do we
do to probabilities if we have",00:00:36.450,00:00:40.260
"some partial information about
the random experiments.",00:00:40.260,00:00:43.340
"We're going to introduce the
important concept of",00:00:43.340,00:00:45.770
conditional probability.,00:00:45.770,00:00:47.530
"And then we will see three
very useful ways",00:00:47.530,00:00:50.860
in which it is used.,00:00:50.860,00:00:52.670
"And these ways basically
correspond to divide and",00:00:52.670,00:00:55.410
"conquer methods for breaking
up problems",00:00:55.410,00:00:58.070
into simpler pieces.,00:00:58.070,00:01:00.120
"And also one more fundamental
tool which allows us to use",00:01:00.120,00:01:04.010
"conditional probabilities to do
inference, that is, if we",00:01:04.010,00:01:07.420
"get a little bit of information
about some",00:01:07.420,00:01:09.440
"phenomenon, what can we
infer about the things",00:01:09.440,00:01:12.620
that we have not seen?,00:01:12.620,00:01:14.640
So our quick review.,00:01:14.640,00:01:17.050
"In setting up a model of a
random experiment, the first",00:01:17.050,00:01:22.100
"thing to do is to come up with
a list of all the possible",00:01:22.100,00:01:25.930
outcomes of the experiment.,00:01:25.930,00:01:27.870
"So that list is what we
call the sample space.",00:01:27.870,00:01:31.120
It's a set.,00:01:31.120,00:01:32.480
"And the elements of the
sample space are all",00:01:32.480,00:01:34.580
the possible outcomes.,00:01:34.580,00:01:35.720
Those possible outcomes must be,00:01:35.720,00:01:37.560
distinguishable from each other.,00:01:37.560,00:01:39.690
They're mutually exclusive.,00:01:39.690,00:01:41.020
"Either one happens or the other
happens, but not both.",00:01:41.020,00:01:44.900
"And they are collectively
exhaustive, that is no matter",00:01:44.900,00:01:47.440
"what the outcome of the
experiment is going to be an",00:01:47.440,00:01:50.480
element of the sample space.,00:01:50.480,00:01:52.130
"And then we discussed last
time that there's also an",00:01:52.130,00:01:54.200
"element of art in how to choose
your sample space,",00:01:54.200,00:01:57.510
"depending on how much detail
you want to capture.",00:01:57.510,00:02:01.440
This is usually the easy part.,00:02:01.440,00:02:03.130
"Then the more interesting part
is to assign probabilities to",00:02:03.130,00:02:06.980
"our model, that is to make some
statements about what we",00:02:06.980,00:02:10.660
"believe to be likely and what
we believe to be unlikely.",00:02:10.660,00:02:14.610
"The way we do that is by
assigning probabilities to",00:02:14.610,00:02:17.720
subsets of the sample space.,00:02:17.720,00:02:20.510
"So as we have our sample space
here, we may have a subset A.",00:02:20.510,00:02:26.120
"And we assign a number to that
subset P(A), which is the",00:02:26.120,00:02:31.090
"probability that this
event happens.",00:02:31.090,00:02:33.910
"Or this is the probability that
when we do the experiment",00:02:33.910,00:02:37.080
"and we get an outcome it's the
probability that the outcome",00:02:37.080,00:02:39.860
"happens to fall inside
that event.",00:02:39.860,00:02:41.850
"We have certain rules that
probabilities should satisfy.",00:02:41.850,00:02:44.500
They're non-negative.,00:02:44.500,00:02:46.210
"The probability of the overall
sample space is equal to one,",00:02:46.210,00:02:49.780
"which expresses the fact that
we're are certain, no matter",00:02:49.780,00:02:52.900
"what, the outcome is going
to be an element",00:02:52.900,00:02:55.480
of the sample space.,00:02:55.480,00:02:56.830
"Well, if we set the top right
so that it exhausts all",00:02:56.830,00:02:59.760
"possibilities, this should
be the case.",00:02:59.760,00:03:03.190
"And then there's another
interesting property of",00:03:03.190,00:03:05.480
"probabilities that says that,
if we have two events or two",00:03:05.480,00:03:09.240
"subsets that are disjoint, and
we're interested in the",00:03:09.240,00:03:11.910
"probability, that one or the
other happens, that is the",00:03:11.910,00:03:17.670
"outcome belongs to A or belongs
to B. For disjoint",00:03:17.670,00:03:21.870
"events the total probability of
these two, taken together,",00:03:21.870,00:03:25.320
"is just the sum of their
individual probabilities.",00:03:25.320,00:03:28.030
"So probabilities behave
like masses.",00:03:28.030,00:03:30.270
"The mass of the object
consisting of A and B is the",00:03:30.270,00:03:34.760
"sum of the masses of
these two objects.",00:03:34.760,00:03:37.230
"Or you can think of
probabilities as areas.",00:03:37.230,00:03:39.720
"They have, again, the
same property.",00:03:39.720,00:03:41.240
"The area of A together with B is
the area of A plus the area",00:03:41.240,00:03:45.490
B.,00:03:45.490,00:03:46.410
"But as we discussed at the end
of last lecture, it's useful",00:03:46.410,00:03:50.290
"to have in our hands a more
general version of this",00:03:50.290,00:03:53.970
"additivity property, which says
the following, if we take",00:03:53.970,00:03:58.990
a sequence of sets--,00:03:58.990,00:04:00.982
"A1, A2, A3, A4, and so on.",00:04:00.982,00:04:07.480
"And we put all of those
sets together.",00:04:07.480,00:04:09.630
It's an infinite sequence.,00:04:09.630,00:04:11.410
"And we ask for the probability
that the outcome falls",00:04:11.410,00:04:14.950
"somewhere in this infinite
union, that is we are asking",00:04:14.950,00:04:19.170
"for the probability that the
outcome belongs to one of",00:04:19.170,00:04:22.640
"these sets, and assuming that
the sets are disjoint, we can",00:04:22.640,00:04:27.950
"again find the probability for
the overall set by adding up",00:04:27.950,00:04:32.820
"the probabilities of the
individual sets.",00:04:32.820,00:04:36.000
"So this is a nice and
simple property.",00:04:36.000,00:04:38.910
"But it's a little more subtle
than you might think.",00:04:38.910,00:04:43.130
"And let's see what's going
on by considering",00:04:43.130,00:04:45.820
the following example.,00:04:45.820,00:04:47.770
"We had an example last time
where we take our sample space",00:04:47.770,00:04:51.850
to be the unit square.,00:04:51.850,00:04:53.800
"And we said let's consider a
probability law that says that",00:04:53.800,00:04:58.110
"the probability of a subset is
just the area of that subset.",00:04:58.110,00:05:04.190
"So let's consider this
probability law.",00:05:04.190,00:05:07.630
OK.,00:05:07.630,00:05:08.530
"Now the unit square is
the set --let me just",00:05:08.530,00:05:13.990
draw it this way--,00:05:13.990,00:05:15.210
"the unit square is the union of
one element set consisting",00:05:15.210,00:05:20.520
all of the points.,00:05:20.520,00:05:21.680
"So the unit square is made up
by the union of the various",00:05:21.680,00:05:28.280
points inside the square.,00:05:28.280,00:05:30.740
So union over all x's and y's.,00:05:30.740,00:05:33.830
OK?,00:05:33.830,00:05:34.770
"So the square is made
up out of all the",00:05:34.770,00:05:36.690
points that this contains.,00:05:36.690,00:05:38.400
"And now let's do
a calculation.",00:05:38.400,00:05:41.140
"One is the probability of our
overall sample space, which is",00:05:41.140,00:05:45.060
the unit square.,00:05:45.060,00:05:47.260
"Now the unit square is the union
of these things, which,",00:05:47.260,00:06:02.000
"according to our additivity
axiom, is the sum of the",00:06:02.000,00:06:06.810
"probabilities of all of these
one element sets.",00:06:06.810,00:06:10.595
"Now what is the probability
of a one element set?",00:06:16.830,00:06:20.580
"What is the probability of
this one element set?",00:06:20.580,00:06:23.520
"What's the probability that our
outcome is exactly that",00:06:23.520,00:06:26.100
particular point?,00:06:26.100,00:06:27.490
"Well, it's the area of that
set, which is zero.",00:06:27.490,00:06:31.460
So it's just the sum of zeros.,00:06:31.460,00:06:33.990
"And by any reasonable
definition the",00:06:33.990,00:06:35.950
sum of zeros is zero.,00:06:35.950,00:06:38.370
"So we just proved that
one is equal to zero.",00:06:38.370,00:06:42.220
OK.,00:06:42.220,00:06:42.680
"Either probability theory is
dead or there is some mistake",00:06:42.680,00:06:48.340
in the derivation that I did.,00:06:48.340,00:06:51.030
"OK, the mistake is quite
subtle and it",00:06:51.030,00:06:54.580
comes at this step.,00:06:54.580,00:06:57.300
"We're sort of applied the
additivity axiom by saying",00:06:57.300,00:07:00.640
"that the unit square is the
union of all those sets.",00:07:00.640,00:07:04.040
"Can we really apply our
additivity axiom.",00:07:04.040,00:07:06.500
Here's the catch.,00:07:06.500,00:07:07.260
"The additivity axiom applies
to the case where we have a",00:07:07.260,00:07:11.470
"sequence of disjoint events
and we take their union.",00:07:11.470,00:07:17.180
Is this a sequence of sets?,00:07:17.180,00:07:21.740
"Can you make up the whole unit
square by taking a sequence of",00:07:21.740,00:07:27.780
"elements inside it and cover
the whole unit square?",00:07:27.780,00:07:31.310
"Well if you try, if you start
looking at the sequence of one",00:07:31.310,00:07:34.900
"element points, that sequence
will never be able to exhaust",00:07:34.900,00:07:40.910
the whole unit square.,00:07:40.910,00:07:43.100
"So there's a deeper reason
behind that.",00:07:43.100,00:07:45.680
"And the reason is that infinite
sets are not all of",00:07:45.680,00:07:48.790
the same size.,00:07:48.790,00:07:50.130
"The integers are an
infinite set.",00:07:50.130,00:07:52.620
"And you can arrange the integers
in a sequence.",00:07:52.620,00:07:55.510
"But the continuous set
like the units",00:07:55.510,00:07:57.630
square is a bigger set.,00:07:57.630,00:08:00.205
It's so-called uncountable.,00:08:00.205,00:08:02.050
"It has more elements than
any sequence could have.",00:08:02.050,00:08:06.160
"So this union here is not of
this kind, where we would have",00:08:06.160,00:08:13.610
a sequence of events.,00:08:13.610,00:08:16.930
"It's a different
kind of union.",00:08:16.930,00:08:18.370
"It's a Union that involves a
union of many, many more sets.",00:08:18.370,00:08:23.070
"So the countable additivity
axiom does not",00:08:23.070,00:08:25.420
apply in this case.,00:08:25.420,00:08:27.360
"Because, we're not dealing
with a sequence of sets.",00:08:27.360,00:08:30.230
"And so this is the
incorrect step.",00:08:30.230,00:08:33.780
"So at some level you might think
that this is puzzling",00:08:33.780,00:08:37.240
and awfully confusing.,00:08:37.240,00:08:38.580
"On the other hand, if you think
about areas of the way",00:08:38.580,00:08:41.070
"you're used to them from
calculus, there's nothing",00:08:41.070,00:08:43.520
mysterious about it.,00:08:43.520,00:08:44.940
"Every point on the unit
square has zero area.",00:08:44.940,00:08:47.460
"When you put all the points
together, they make up",00:08:47.460,00:08:50.140
"something that has
finite area.",00:08:50.140,00:08:52.330
"So there shouldn't be any
mystery behind it.",00:08:52.330,00:08:55.470
"Now, one interesting thing that
this discussion tells us,",00:08:55.470,00:09:00.230
"especially the fact that the
single elements set has zero",00:09:00.230,00:09:03.670
"area, is the following--",00:09:03.670,00:09:05.790
"Individual points have
zero probability.",00:09:05.790,00:09:08.960
"After you do the experiment and
you observe the outcome,",00:09:08.960,00:09:12.390
"it's going to be an
individual point.",00:09:12.390,00:09:14.660
"So what happened in that
experiment is something that",00:09:14.660,00:09:18.160
"initially you thought had zero
probability of occurring.",00:09:18.160,00:09:21.820
"So if you happen to get some
particular numbers and you",00:09:21.820,00:09:25.420
"say, ""Well, in the beginning,
what did I think about those",00:09:25.420,00:09:28.290
specific numbers?,00:09:28.290,00:09:29.280
"I thought they had
zero probability.",00:09:29.280,00:09:31.290
"But yet those particular
numbers did occur.""",00:09:31.290,00:09:36.250
"So one moral from this is that
zero probability does not mean",00:09:36.250,00:09:41.640
impossible.,00:09:41.640,00:09:42.890
"It just means extremely,
extremely unlikely by itself.",00:09:42.890,00:09:46.920
"So zero probability
things do happen.",00:09:46.920,00:09:49.420
"In such continuous models,
actually zero probability",00:09:49.420,00:09:53.340
"outcomes are everything
that happens.",00:09:53.340,00:09:56.930
"And the bumper sticker version
of this is to always expect",00:09:56.930,00:10:00.790
the unexpected.,00:10:00.790,00:10:02.220
Yes?,00:10:02.220,00:10:05.095
AUDIENCE: [INAUDIBLE].,00:10:05.095,00:10:06.345
"JOHN TSISIKLIS: Well,
probability is supposed to be",00:10:08.532,00:10:11.800
a real number.,00:10:11.800,00:10:12.530
"So it's either zero or it's
a positive number.",00:10:12.530,00:10:16.220
"So you can think of the
probability of things just",00:10:16.220,00:10:21.350
"close to that point and those
probabilities are tiny and",00:10:21.350,00:10:25.040
close to zero.,00:10:25.040,00:10:26.390
"So that's how we're going to
interpret probabilities in",00:10:26.390,00:10:28.780
continuous models.,00:10:28.780,00:10:29.810
"But this is two chapters
ahead.",00:10:29.810,00:10:31.340
Yeah?,00:10:33.950,00:10:34.230
"AUDIENCE: How do we interpret
probability of zero?",00:10:34.230,00:10:36.198
"If we can use models that
way, then how about",00:10:36.198,00:10:37.674
probability of one?,00:10:37.674,00:10:38.658
"That it it's extremely
likely but not",00:10:38.658,00:10:40.462
necessarily for certain?,00:10:40.462,00:10:42.110
"JOHN TSISIKLIS: That's
also the case.",00:10:42.110,00:10:43.320
"For example, if you ask in this
continuous model, if you",00:10:43.320,00:10:47.450
"ask me for the probability that
x, y, is different than",00:10:47.450,00:10:52.190
"the zero, zero this is
the whole square,",00:10:52.190,00:10:55.840
except for one point.,00:10:55.840,00:10:57.220
"So the area of this is
going to be one.",00:10:57.220,00:11:01.150
"But this event is not entirely
certain because the zero, zero",00:11:01.150,00:11:06.330
outcome is also possible.,00:11:06.330,00:11:08.210
"So again, probability of one
means essential certainty.",00:11:08.210,00:11:12.330
"But it still allows the
possibility that the outcome",00:11:12.330,00:11:16.450
might be outside that set.,00:11:16.450,00:11:18.320
"So these are some of the weird
things that are happening when",00:11:18.320,00:11:20.910
you have continuous models.,00:11:20.910,00:11:22.680
"And that's why we start to
this class with discrete",00:11:22.680,00:11:25.240
"models, on which would
be spending the",00:11:25.240,00:11:27.050
next couple of weeks.,00:11:27.050,00:11:30.400
OK.,00:11:30.400,00:11:30.820
"So now once we have set up our
probability model and we have",00:11:30.820,00:11:35.650
"a legitimate probability law
that has these properties,",00:11:35.650,00:11:39.160
"then the rest is
usually simple.",00:11:39.160,00:11:43.070
"Somebody asks you a question of
calculating the probability",00:11:43.070,00:11:45.950
of some event.,00:11:45.950,00:11:47.520
"While you were told something
about the probability law,",00:11:47.520,00:11:50.270
"such as for example the
probabilities are equal to",00:11:50.270,00:11:52.520
"areas, and then you just
need to calculate.",00:11:52.520,00:11:55.460
"In these type of examples
somebody would give you a set",00:11:55.460,00:11:58.730
"and you would have
to calculate the",00:11:58.730,00:12:00.230
area of that set.,00:12:00.230,00:12:01.500
"So the rest is just calculation
and simple.",00:12:01.500,00:12:06.060
"Alright, so now it's time
to start with our main",00:12:06.060,00:12:09.390
business for today.,00:12:09.390,00:12:12.600
"And the starting point
is the following--",00:12:12.600,00:12:16.880
"You know something
about the world.",00:12:16.880,00:12:18.920
"And based on what you know when
you set up a probability",00:12:18.920,00:12:21.690
"model and you write down
probabilities for the",00:12:21.690,00:12:23.820
different outcomes.,00:12:23.820,00:12:26.000
"Then something happens, and
somebody tells you a little",00:12:26.000,00:12:28.950
"more about the world, gives
you some new information.",00:12:28.950,00:12:33.620
"This new information, in
general, should change your",00:12:33.620,00:12:37.430
"beliefs about what happened
or what may happen.",00:12:37.430,00:12:41.240
"So whenever we're given new
information, some partial",00:12:41.240,00:12:44.550
"information about the outcome
of the experiment, we should",00:12:44.550,00:12:47.400
revise our beliefs.,00:12:47.400,00:12:49.750
"And conditional probabilities
are just the probabilities",00:12:49.750,00:12:54.470
"that apply after the revision
of our beliefs, when we're",00:12:54.470,00:12:58.820
given some information.,00:12:58.820,00:13:00.580
"So lets make this into
a numerical example.",00:13:00.580,00:13:04.510
"So inside the sample space, this
part of the sample space,",00:13:04.510,00:13:07.870
"let's say has probability 3/6,
this part has 2/6, and that",00:13:07.870,00:13:12.580
part has 1/6.,00:13:12.580,00:13:14.550
"I guess that means that out here
we have zero probability.",00:13:14.550,00:13:17.940
"So these were our initial
beliefs about the outcome of",00:13:17.940,00:13:21.900
the experiment.,00:13:21.900,00:13:23.270
"Suppose now that someone
comes and tells you",00:13:23.270,00:13:27.160
that event B occurred.,00:13:27.160,00:13:30.960
"So they don't tell you the
full outcome with the",00:13:30.960,00:13:33.560
experiment.,00:13:33.560,00:13:34.440
"But they just tell you that the
outcome is known to lie",00:13:34.440,00:13:38.960
inside this set B.,00:13:38.960,00:13:41.060
"Well then, you should certainly
change your beliefs",00:13:41.060,00:13:44.320
in some way.,00:13:44.320,00:13:45.560
"And your new beliefs about what
is likely to occur and",00:13:45.560,00:13:48.420
"what is not is going to be
denoted by this notation.",00:13:48.420,00:13:51.770
"This is the conditional
probability that the event A",00:13:51.770,00:13:55.330
"is going to occur, the
probability that the outcome",00:13:55.330,00:13:57.970
"is going to fall inside the set
A given that we are told",00:13:57.970,00:14:01.580
"and we're sure that the event
lies inside the event B Now",00:14:01.580,00:14:05.890
"once you're told that the
outcome lies inside the event",00:14:05.890,00:14:09.000
"B, then our old sample space
in some ways is irrelevant.",00:14:09.000,00:14:13.740
"We have then you sample space,
which is just the set B. We",00:14:13.740,00:14:16.975
"are certain that the outcome
is going to be inside B.",00:14:16.975,00:14:21.020
"For example, what is this
conditional probability?",00:14:21.020,00:14:25.465
It should be one.,00:14:29.120,00:14:30.160
"Given that I told you that B
occurred, you're certain that",00:14:30.160,00:14:33.250
"B occurred, so this has
unit probability.",00:14:33.250,00:14:36.380
"So here we see an instance of
revision of our beliefs.",00:14:36.380,00:14:40.340
"Initially, event B had the
probability of (2+1)/6 --",00:14:40.340,00:14:44.880
that's 1/2.,00:14:44.880,00:14:46.300
"Initially, we thought B
had probability 1/2.",00:14:46.300,00:14:49.500
"Once we're told that B occurred,
the new probability",00:14:49.500,00:14:52.370
of B is equal to one.,00:14:52.370,00:14:54.250
OK.,00:14:54.250,00:14:55.160
"How do we revise the probability
that A occurs?",00:14:55.160,00:15:00.860
"So we are going to have the
outcome of the experiment.",00:15:00.860,00:15:03.950
"We know that it's inside B. So
we will either get something",00:15:03.950,00:15:07.330
"here, and A does not occur.",00:15:07.330,00:15:09.200
"Or something inside here,
and A does occur.",00:15:09.200,00:15:12.570
"What's the likelihood that,
given that we're inside B, the",00:15:12.570,00:15:16.280
outcome is inside here?,00:15:16.280,00:15:18.160
"Here's how we're going
to think about.",00:15:18.160,00:15:21.380
"This part of this set B, in
which A also occurs, in our",00:15:21.380,00:15:26.110
"initial model was twice as
likely as that part of B. So",00:15:26.110,00:15:31.280
"outcomes inside here
collectively were twice as",00:15:31.280,00:15:36.220
likely as outcomes out there.,00:15:36.220,00:15:38.950
"So we're going to keep the same
proportions and say, that",00:15:38.950,00:15:43.240
"given that we are inside the set
B, we still want outcomes",00:15:43.240,00:15:47.280
"inside here to be twice as
likely outcomes there.",00:15:47.280,00:15:51.120
"So the proportion of the
probabilities should be two",00:15:51.120,00:15:55.800
versus one.,00:15:55.800,00:15:57.570
"And these probabilities should
add up to one because together",00:15:57.570,00:16:01.210
"they make the conditional
probability of B. So the",00:16:01.210,00:16:04.340
"conditional probabilities should
be 2/3 probability of",00:16:04.340,00:16:09.260
"being here and 1/3 probability
of being there.",00:16:09.260,00:16:13.080
"That's how we revise
our probabilities.",00:16:13.080,00:16:16.860
"That's a reasonable, intuitively
reasonable, way of",00:16:16.860,00:16:20.740
doing this revision.,00:16:20.740,00:16:22.230
"Let's translate what we
did into a definition.",00:16:22.230,00:16:26.650
"The definition says the
following, that the",00:16:26.650,00:16:29.490
"conditional probability of A
given that B occurred is",00:16:29.490,00:16:33.410
calculated as follows.,00:16:33.410,00:16:35.270
"We look at the total probability
of B. And out of",00:16:35.270,00:16:39.430
"that probability that was inside
here, what fraction of",00:16:39.430,00:16:43.190
"that probability is assigned to
points for which the event",00:16:43.190,00:16:48.310
A also occurs?,00:16:48.310,00:16:49.780
"Does it give us the same numbers
as we got with this",00:16:54.480,00:16:56.860
heuristic argument?,00:16:56.860,00:16:58.420
"Well in this example,
probability of A intersection",00:16:58.420,00:17:01.530
"B is 2/6, divided by total
probability of B, which is",00:17:01.530,00:17:06.359
"3/6, and so it's 2/3, which
agrees with this answer that's",00:17:06.359,00:17:12.369
we got before.,00:17:12.369,00:17:13.589
"So the former indeed matches
what we were trying to do.",00:17:13.589,00:17:18.280
One little technical detail.,00:17:18.280,00:17:21.040
"If the event B has zero
probability, and then here we",00:17:21.040,00:17:24.970
"have a ratio that doesn't
make sense.",00:17:24.970,00:17:27.770
"So in this case, we say that
conditional probabilities are",00:17:27.770,00:17:30.470
not defined.,00:17:30.470,00:17:31.720
"Now you can take this definition
and unravel it and",00:17:34.780,00:17:38.980
write it in this form.,00:17:38.980,00:17:40.260
"The probability of A
intersection B is the",00:17:40.260,00:17:43.510
"probability of B times the
conditional probability.",00:17:43.510,00:17:46.780
"So this is just consequence of
the definition but it has a",00:17:50.350,00:17:53.820
nice interpretation.,00:17:53.820,00:17:55.370
"Think of probabilities
as frequencies.",00:17:55.370,00:17:57.930
"If I do the experiment over and
over, what fraction of the",00:17:57.930,00:18:01.480
"time is it going to be the case
that both A and B occur?",00:18:01.480,00:18:05.300
"Well, there's going to be a
certain fraction of the time",00:18:05.300,00:18:08.490
at which B occurs.,00:18:08.490,00:18:10.820
"And out of those times when B
occurs, there's going to be a",00:18:10.820,00:18:14.760
"further fraction of
the experiments in",00:18:14.760,00:18:17.270
which A also occurs.,00:18:17.270,00:18:19.410
"So interpret the conditional
probability as follows.",00:18:19.410,00:18:21.930
"You only look at those
experiments at which",00:18:21.930,00:18:24.320
B happens to occur.,00:18:24.320,00:18:26.050
"And look at what fraction of
those experiments where B",00:18:26.050,00:18:29.820
"already occurred, event
A also occurs.",00:18:29.820,00:18:33.670
"And there's a symmetrical
version of this equality.",00:18:33.670,00:18:39.610
"There's symmetry between the
events B and A. So you also",00:18:39.610,00:18:44.660
"have this relation that
goes the other way.",00:18:44.660,00:18:48.890
"OK, so what do we use these
conditional probabilities for?",00:18:48.890,00:18:53.950
"First, one comment.",00:18:53.950,00:18:55.120
"Conditional probabilities
are just like ordinary",00:18:55.120,00:18:58.100
probabilities.,00:18:58.100,00:18:59.170
"They're the new probabilities
that apply in a new universe",00:18:59.170,00:19:02.820
"where event B is known
to have occurred.",00:19:02.820,00:19:07.300
"So we had an original
probability model.",00:19:07.300,00:19:10.620
We are told that B occurs.,00:19:10.620,00:19:12.210
We revise our model.,00:19:12.210,00:19:13.840
"Our new model should still be
legitimate probability model.",00:19:13.840,00:19:16.690
"So it should satisfy all sorts
of properties that ordinary",00:19:16.690,00:19:20.770
probabilities do satisfy.,00:19:20.770,00:19:23.210
"So for example, if A and B are
disjoint events, then we know",00:19:23.210,00:19:29.230
"that the probability of A
union B is equal to the",00:19:29.230,00:19:33.830
"probability of A plus
probability of B. And now if I",00:19:33.830,00:19:39.230
