text,start,stop
"but at least it's
a way to solve it.",00:42:04.721,00:42:06.410
"Probably in polynomial time
because we think of B as things",00:42:06.410,00:42:09.015
"you can solve in
polynomial time.",00:42:09.015,00:42:10.390
Great.,00:42:10.390,00:42:13.160
"So just convert
problem A, which you",00:42:13.160,00:42:20.730
"want to solve, into some problem
B that you know how to solve.",00:42:20.730,00:42:27.615
That's reduction.,00:42:30.690,00:42:32.370
"Let me give you some examples
that we've already seen,",00:42:32.370,00:42:35.460
"just to fit this into your
mental map of the class.",00:42:35.460,00:42:38.065
"It's kind of a funny one
but it's a very simple one.",00:42:42.640,00:42:45.060
"So how do you solve
unweighted shortest paths?",00:42:52.470,00:42:54.460
In general?,00:42:58.300,00:42:59.810
Easy one.,00:42:59.810,00:43:00.670
"Give you a graph with no
weights on the edges and I",00:43:00.670,00:43:02.794
"want to the shortest
path from s to t.",00:43:02.794,00:43:04.466
AUDIENCE: BFS,00:43:04.466,00:43:05.390
PROFESSOR: BFS.,00:43:05.390,00:43:06.180
"Linear time, right?",00:43:06.180,00:43:07.600
"Well, that's if
you're smart or if you",00:43:07.600,00:43:10.050
feel like implementing BFS.,00:43:10.050,00:43:11.250
"Suppose someone
gave you Djikstra.",00:43:11.250,00:43:14.380
"Said, here, look, I've
got Djikstra code.",00:43:14.380,00:43:16.125
You don't have to do anything.,00:43:16.125,00:43:17.375
"There's Djisktra
code right there.",00:43:17.375,00:43:18.940
"But Djikstra solves
weighted shortest path.",00:43:18.940,00:43:21.100
I don't have any weights.,00:43:21.100,00:43:22.160
What do I do?,00:43:22.160,00:43:24.960
Set the weights to 1.,00:43:24.960,00:43:28.140
"It's very easy, but
this is a reduction--",00:43:28.140,00:43:30.630
a simple example of reduction.,00:43:30.630,00:43:32.460
"Not the smartest of reductions,
but it's a reduction.",00:43:32.460,00:43:35.330
"So I can convert
unweighted shortest paths",00:43:38.840,00:43:40.780
"into weighted shortest paths
by adding weights of 1.",00:43:40.780,00:43:43.750
Done.,00:43:43.750,00:43:44.320
"Adding weights of
0 would not work.",00:43:44.320,00:43:46.070
But weights of 1.,00:43:46.070,00:43:47.170
OK.,00:43:47.170,00:43:47.900
Weights of 2 also works.,00:43:47.900,00:43:49.492
"Pick your favorite number, but
as long as you're consistent",00:43:49.492,00:43:51.950
about it.,00:43:51.950,00:43:52.780
That's a reduction.,00:43:52.780,00:43:54.520
"Here's some more
interesting ones.",00:43:54.520,00:43:56.570
"On the problems set--
problem set six--",00:43:56.570,00:44:03.920
"there was this RenBook problem,
""I Can Haz Moar Frendz?""",00:44:03.920,00:44:08.205
"That was the name
of the problem.",00:44:08.205,00:44:09.580
"And the goal was
to solve-- to find",00:44:09.580,00:44:14.640
"paths that minimize
the product of weights.",00:44:14.640,00:44:17.884
"But what we've
covered in class is",00:44:17.884,00:44:19.300
"how to solve a problem when
it's the sum of weights.",00:44:19.300,00:44:21.910
How do you do it?,00:44:21.910,00:44:23.890
"In one word, or less?",00:44:23.890,00:44:26.070
Logs.,00:44:26.070,00:44:26.990
Just take logs.,00:44:26.990,00:44:28.920
"That converts
products into sums.",00:44:28.920,00:44:31.597
Now you start to get the flavor.,00:44:31.597,00:44:32.930
"This is a problem that you could
take Djikstra or Bellman-Ford,",00:44:32.930,00:44:37.150
"and change all the
relaxation steps",00:44:37.150,00:44:39.390
"and change it to work
directly with products.",00:44:39.390,00:44:42.470
"That would work,
but it's more work.",00:44:42.470,00:44:46.570
"You have to prove that
that's still correct.",00:44:46.570,00:44:49.200
It's annoying to think about.,00:44:49.200,00:44:50.500
And it's annoying to program.,00:44:50.500,00:44:52.660
"It's not modular,
blah, blah, blah.",00:44:52.660,00:44:54.590
"Whereas if you just
do this reduction,",00:44:54.590,00:44:56.720
"you can use exactly the
code that you had before,",00:44:56.720,00:44:59.990
at the end.,00:44:59.990,00:45:01.960
So that's nice.,00:45:01.960,00:45:03.220
"This is why
reductions are really",00:45:03.220,00:45:04.670
"the most common algorithm design
technique because you don't",00:45:04.670,00:45:07.562
"want to implement an algorithm
for every single problem you",00:45:07.562,00:45:10.020
have.,00:45:10.020,00:45:10.700
"It would be nice if you could
reuse some of those algorithms",00:45:10.700,00:45:13.200
that you had before.,00:45:13.200,00:45:14.630
Reductions let you do that.,00:45:14.630,00:45:17.100
"Another one, which was on the
quiz in the true-false-- quiz",00:45:17.100,00:45:21.680
"two-- was converting longest
path into shortest path.",00:45:21.680,00:45:25.532
"We didn't phrase
it as a reduction.",00:45:25.532,00:45:26.990
"It was just can you
solve longest path using",00:45:26.990,00:45:29.730
Bellman-Ford.,00:45:29.730,00:45:30.910
And the answer is yes.,00:45:30.910,00:45:31.832
You just negate all the weights.,00:45:31.832,00:45:33.165
"And that converts a
longest path problem",00:45:33.165,00:45:34.900
into a shortest path problem.,00:45:34.900,00:45:37.660
Easy.,00:45:37.660,00:45:40.310
"Also on the quiz-- maybe I don't
need to write all of these down",00:45:40.310,00:45:43.030
"because they're a little
bit weird problems.",00:45:43.030,00:45:45.200
We made them up.,00:45:45.200,00:45:46.370
"There was the-- what was
the duck tour called?",00:45:46.370,00:45:50.220
Bird tours?,00:45:50.220,00:45:50.990
Bird tours?,00:45:50.990,00:45:51.950
Aviation tours?,00:45:51.950,00:45:52.700
Whatever.,00:45:52.700,00:45:53.610
"You want to visit a bunch of
sites in some specified order.",00:45:53.610,00:45:56.990
"The point in that problem
is you could reduce it",00:45:56.990,00:45:58.990
"to a single shortest
paths query.",00:45:58.990,00:46:02.900
"And so if you already
have shortest path code,",00:46:02.900,00:46:05.682
you don't have to think much.,00:46:05.682,00:46:06.890
"You just do the
graph application.",00:46:06.890,00:46:08.400
Done.,00:46:08.400,00:46:09.970
"Then there's the
leaky tank problem,",00:46:09.970,00:46:11.600
"which is also a graph
reduction problem.",00:46:11.600,00:46:14.570
"You could represent all
these extra weird things",00:46:14.570,00:46:16.570
"that were happening
in your car by just",00:46:16.570,00:46:18.640
changing the graph a little bit.,00:46:18.640,00:46:20.202
"And it's a very
powerful technique.",00:46:20.202,00:46:21.660
"In this class, we see it
mostly in graph reductions.",00:46:21.660,00:46:24.860
"But it could apply
all over the place.",00:46:24.860,00:46:28.120
"And while this is a powerful
technique for coming up",00:46:28.120,00:46:30.810
"with new algorithms, it's
also a powerful technique",00:46:30.810,00:46:34.310
"for proving things
like Tetris is NP-hard.",00:46:34.310,00:46:41.380
"So what we proved
is that a problem",00:46:41.380,00:46:43.830
"called 3-Partition can
be reduced to Tetris.",00:46:43.830,00:46:49.600
What's 3-Partition?,00:46:57.810,00:46:58.610
"3-Partition is I
give you n numbers.",00:46:58.610,00:47:01.000
"I want to know can I
divide them into triples,",00:47:01.000,00:47:03.930
each of the same sum.,00:47:03.930,00:47:06.450
So I have n numbers.,00:47:06.450,00:47:07.780
"Divide them into n
over 3 groups of 3,",00:47:07.780,00:47:10.170
"such that the sum of
each of the 3s is equal.",00:47:10.170,00:47:14.030
"Sounds like an easy
enough problem.",00:47:14.030,00:47:15.780
But it's an NP-complete problem.,00:47:15.780,00:47:18.230
"And people knew that since
one of the first papers.",00:47:18.230,00:47:22.950
"I guess that was late
'70s, early '80s, by Karp.",00:47:22.950,00:47:26.790
"So Karp already proved
this is standing",00:47:26.790,00:47:28.800
on the shoulders of giants.,00:47:28.800,00:47:32.410
"Karp proved 3-Partition
is NP-complete,",00:47:32.410,00:47:34.360
"so I don't need to
think about that.",00:47:34.360,00:47:37.060
"All I need to
focus on is showing",00:47:37.060,00:47:39.210
"that Tetris is harder
than 3-Partition.",00:47:39.210,00:47:43.470
This is what I mean by harder.,00:47:43.470,00:47:45.270
"Harder means-- so when
I can reduce A to B,",00:47:45.270,00:47:48.990
"we say the A-- B is at least
as hard as A. Why's that?",00:47:48.990,00:48:02.090
"Because I can solve A by solving
B. I just apply this reduction",00:48:02.090,00:48:05.820
"and then solve B. So if I
had some good way to solve B,",00:48:05.820,00:48:08.570
"it would turn into a
good way to solve A.",00:48:08.570,00:48:11.110
"Now 3-Partition-- which
is A, here-- we're",00:48:11.110,00:48:14.940
"pretty sure there's no good
algorithm for solving this.",00:48:14.940,00:48:17.440
"Pretty sure it's not in P.
And so Tetris better not be P",00:48:17.440,00:48:22.900
"either because if
Tetris were in P, then",00:48:22.900,00:48:25.430
"we could just take
our 3-Partition,",00:48:25.430,00:48:27.140
"reduce it to Tetris, and then
3-Partition would be in P.",00:48:27.140,00:48:30.990
"In fact, all of the
NP-complete problems,",00:48:30.990,00:48:33.210
you can reduce to each other.,00:48:33.210,00:48:36.470
"And so to show that something
is at that little position,",00:48:36.470,00:48:39.820
"NP-complete, all
you need to do is",00:48:39.820,00:48:41.900
"find some known
NP-complete problem",00:48:41.900,00:48:44.120
and reduce it to your problem.,00:48:44.120,00:48:47.520
"So reductions are super useful
for getting positive results",00:48:47.520,00:48:51.400
"for making new
algorithms, but also",00:48:51.400,00:48:53.580
"for proving negative results--
showing that one problem is",00:48:53.580,00:48:56.110
harder than another.,00:48:56.110,00:48:57.310
"And if you already
believe this is hard,",00:48:57.310,00:48:59.080
"then you should
believe this is hard.",00:48:59.080,00:49:00.621
"I think that's all I
really have time for.",00:49:08.570,00:49:12.060
"I'll give you a couple
more NP-complete problems.",00:49:12.060,00:49:14.480
Kind of fun.,00:49:14.480,00:49:15.930
"Traveling salesman problem,
you may have heard of.",00:49:15.930,00:49:18.896
Let's say you have a graph.,00:49:18.896,00:49:20.020
"And you want to find out
the shortest path that",00:49:20.020,00:49:22.040
"visits all the vertices,
not just one vertex.",00:49:22.040,00:49:25.770
That's NP-complete.,00:49:25.770,00:49:28.680
"We solved longest common
subsequence for two strings,",00:49:28.680,00:49:31.680
"but if I give you
n strings that you",00:49:31.680,00:49:33.280
"need to find the longest
common subsequence of,",00:49:33.280,00:49:35.238
that's NP-complete.,00:49:35.238,00:49:37.730
"Minesweeper, Sudoku, most
puzzles that are interesting",00:49:37.730,00:49:41.560
are NP-complete.,00:49:41.560,00:49:43.990
SAT.,00:49:43.990,00:49:45.360
"SAT is a-- I give you a Boolean
formula like x or y AND NOT",00:49:45.360,00:49:53.120
x-- something like that.,00:49:53.120,00:49:55.050
"I want to know is there some
setting of the variables that",00:49:55.050,00:49:57.499
makes this thing come out true?,00:49:57.499,00:49:58.790
"Is it possible to
make this true?",00:49:58.790,00:50:01.634
That's NP-complete complete.,00:50:01.634,00:50:02.800
"This was actually
the first problem",00:50:02.800,00:50:04.310
that was shown NP-complete.,00:50:04.310,00:50:05.610
"There's this issue, right?",00:50:05.610,00:50:06.880
"If I'm going to show
everything's NP-complete",00:50:06.880,00:50:08.754
"by reduction, how the
heck do I get started?",00:50:08.754,00:50:10.910
What's the first problem?,00:50:10.910,00:50:12.360
And this is the first problem.,00:50:12.360,00:50:15.620
"You could sort of prove it
by definition, almost, of NP,",00:50:15.620,00:50:18.580
here.,00:50:18.580,00:50:19.480
But I won't do that.,00:50:19.480,00:50:22.760
Three coloring a graph.,00:50:22.760,00:50:24.610
Shortest paths.,00:50:24.610,00:50:25.280
This is fun.,00:50:25.280,00:50:26.010
"Shortest paths in
a graph is hard.",00:50:26.010,00:50:27.840
"But in the real world, we
live in a three dimensional,",00:50:27.840,00:50:30.620
geometric environment.,00:50:30.620,00:50:31.880
"What if I want to
find the shortest",00:50:31.880,00:50:33.338
"path from this point,
where I am, to that point,",00:50:33.338,00:50:35.620
"over on the ceiling
or something.",00:50:35.620,00:50:37.500
And I can fly.,00:50:37.500,00:50:40.020
That's NP-complete.,00:50:40.020,00:50:41.669
It's kind of weird.,00:50:41.669,00:50:42.460
"Shortest paths in a two
dimensional environment",00:50:42.460,00:50:44.160
is polynomial.,00:50:44.160,00:50:44.743
"It's a good thing that we are
on ground because, then, we",00:50:44.743,00:50:47.532
"can model things
by two dimensions.",00:50:47.532,00:50:48.990
We can model things by graphs.,00:50:48.990,00:50:50.470
"But in 3D, shortest
paths is NP-complete.",00:50:50.470,00:50:53.500
"So all these things where
a problem-- knapsack,",00:50:53.500,00:50:56.139
that's another one.,00:50:56.139,00:50:56.930
We've already covered knapsack.,00:50:56.930,00:50:58.221
"We saw a pseudo-polynomial
algorithm.",00:50:58.221,00:50:59.990
"Turns out, you can't do
better than pseudo-polynomial",00:50:59.990,00:51:02.390
"unless P equals NP because
knapsack is NP-complete.",00:51:02.390,00:51:07.030
So there you go.,00:51:07.030,00:51:08.160
"Computational complexity
in 50 minutes.",00:51:08.160,00:51:11.313
