text,start,stop
"The following
content is provided",00:00:00.080,00:00:01.770
"under a Creative
Commons license.",00:00:01.770,00:00:04.010
"Your support will help MIT
OpenCourseWare continue",00:00:04.010,00:00:06.860
"to offer high quality
educational resources for free.",00:00:06.860,00:00:10.720
"To make a donation or
view additional materials",00:00:10.720,00:00:13.330
"from hundreds of MIT courses,
visit MIT OpenCourseWare",00:00:13.330,00:00:17.228
at ocw.mit.edu.,00:00:17.228,00:00:17.853
"PROFESSOR: So today's
lecture is on sorting.",00:00:23.290,00:00:27.010
"We'll be talking about specific
sorting algorithms today.",00:00:27.010,00:00:31.310
"I want to start
by motivating why",00:00:31.310,00:00:34.570
"we're interested in sorting,
which should be fairly easy.",00:00:34.570,00:00:37.105
"Then I want to discuss
a particular sorting",00:00:39.690,00:00:42.490
"algorithm that's
called insertion sort.",00:00:42.490,00:00:45.470
"That's probably the
simplest sorting algorithm",00:00:45.470,00:00:47.860
"you can write, it's
five lines of code.",00:00:47.860,00:00:51.942
"It's not the best
sorting algorithm",00:00:51.942,00:00:53.400
"that's out there and so
we'll try and improve it.",00:00:53.400,00:00:57.430
"We'll also talk about merge
sort, which is a divide",00:00:57.430,00:01:00.470
"and conquer algorithm
and that's going",00:01:00.470,00:01:03.250
"to motivate the last thing
that I want to spend time on,",00:01:03.250,00:01:09.010
"which is recurrences and
how you solve recurrences.",00:01:09.010,00:01:12.300
"Typically the
recurrences that we'll",00:01:12.300,00:01:14.230
"be looking at in double o six
are going to come from divide",00:01:14.230,00:01:18.120
"and conquer problems
like merge sort",00:01:18.120,00:01:20.760
"but you'll see
this over and over.",00:01:20.760,00:01:24.300
"So let's talk about why
we're interested in sorting.",00:01:24.300,00:01:26.965
"There's some fairly
obvious applications",00:01:30.110,00:01:34.370
"like if you want to
maintain a phone book,",00:01:34.370,00:01:37.490
"you've got a bunch of names
and numbers corresponding",00:01:37.490,00:01:42.010
"to a telephone
directory and you want",00:01:42.010,00:01:44.830
"to keep them in
sorted order so it's",00:01:44.830,00:01:46.330
"easy to search, mp3 organizers,
spreadsheets, et cetera.",00:01:46.330,00:01:51.510
"So there's lots of
obvious applications.",00:01:51.510,00:01:54.590
"There's also some
interesting problems",00:01:54.590,00:01:59.630
"that become easy once
items are sorted.",00:01:59.630,00:02:05.900
"One example of that
is finding a median.",00:02:13.790,00:02:18.170
"So let's say that you
have a bunch of items",00:02:23.860,00:02:27.220
"in an array a zero through
n and a zero through n",00:02:27.220,00:02:36.210
"contains n numbers and
they're not sorted.",00:02:36.210,00:02:38.650
"When you sort, you
turn this into b 0",00:02:44.850,00:02:48.950
"through n, where if
it's just numbers, then",00:02:48.950,00:02:52.760
"you may sort them in increasing
order or decreasing order.",00:02:52.760,00:02:55.660
"Let's just call it
increasing order for now.",00:02:55.660,00:02:58.690
"Or if they're records,
and they're not numbers,",00:02:58.690,00:03:01.650
"then you have to provide
a comparison function",00:03:01.650,00:03:04.520
"to determine which record is
smaller than another record.",00:03:04.520,00:03:08.050
"And that's another
input that you",00:03:08.050,00:03:09.520
"have to have in order
to do the sorting.",00:03:09.520,00:03:12.980
"So it doesn't really
matter what the items are",00:03:12.980,00:03:15.310
"as long as you have the
comparison function.",00:03:15.310,00:03:17.580
"Think of it as less
than or equal to.",00:03:17.580,00:03:19.930
"And if you have that and
it's straightforward,",00:03:19.930,00:03:23.750
"obviously, to check that 3
is less than 4, et cetera.",00:03:23.750,00:03:27.090
"But it may be a little
more complicated",00:03:27.090,00:03:29.640
"for more sophisticated
sorting applications.",00:03:29.640,00:03:32.990
"But the bottom line is that if
you have your algorithm that",00:03:32.990,00:03:36.570
"takes a comparison
function as an input,",00:03:36.570,00:03:39.120
"you're going to be able to,
after a certain amount of time,",00:03:39.120,00:03:42.670
get B 0 n.,00:03:42.670,00:03:45.100
"Now if you wanted to find the
median of the set of numbers",00:03:45.100,00:03:48.680
"that were originally
in the array A,",00:03:48.680,00:03:51.720
"what would you do once you
have the sorted array B?",00:03:51.720,00:03:56.090
"AUDIENCE: Isn't there a more
efficient algorithm for median?",00:03:56.090,00:03:59.124
PROFESSOR: Absolutely.,00:03:59.124,00:04:00.040
"But this is sort of a side
effect of having a sorted list.",00:04:00.040,00:04:08.120
"If you happen to
have a sorted list,",00:04:08.120,00:04:10.240
"there's many ways
that you could imagine",00:04:10.240,00:04:15.090
building up a sorted list.,00:04:15.090,00:04:16.310
"One way is you have something
that's completely unsorted",00:04:16.310,00:04:19.779
"and you run insertion
sort or merge sort.",00:04:19.779,00:04:22.620
"Another way would be to
maintain a sorted list as you're",00:04:22.620,00:04:25.140
getting items put into the list.,00:04:25.140,00:04:27.660
"So if you happened
to have a sorted list",00:04:27.660,00:04:29.640
"and you need to have this
sorted list for some reason,",00:04:29.640,00:04:32.600
"the point I'm making here
is that finding the median",00:04:32.600,00:04:35.440
is easy.,00:04:35.440,00:04:37.140
"And it's easy because
all you have to do",00:04:37.140,00:04:39.430
"is look at-- depending
on whether n is odd",00:04:39.430,00:04:43.805
or even-- look at B of n over 2.,00:04:43.805,00:04:47.527
"That would give you the
median because you'd",00:04:47.527,00:04:49.360
"have a bunch of numbers
that are less than that",00:04:49.360,00:04:54.210
"and the equal set of numbers
that are greater than that,",00:04:54.210,00:04:56.830
"which is the
definition of median.",00:04:56.830,00:04:59.770
"So this is not necessarily the
best way, as you pointed out,",00:04:59.770,00:05:05.030
of finding the median.,00:05:05.030,00:05:06.400
"But it's constant time if
you have a sorted list.",00:05:06.400,00:05:11.320
"That's the point
I wanted to make.",00:05:11.320,00:05:14.650
"There are other things
that you could do.",00:05:14.650,00:05:16.720
"And this came up
in Erik's lecture,",00:05:16.720,00:05:20.780
"which is the notion of
binary search-- finding",00:05:20.780,00:05:25.570
"an element in an array--
a specific element.",00:05:25.570,00:05:28.650
"You have a list of items--
again a 0 through n.",00:05:28.650,00:05:34.090
"And you're looking for a
specific number or item.",00:05:34.090,00:05:39.600
"You could, obviously,
scan the array,",00:05:43.550,00:05:46.640
"and that would take you
linear time to find this item.",00:05:46.640,00:05:50.260
"If the array happened
to be sorted,",00:05:50.260,00:05:53.100
"then you can find this
in logarithmic time",00:05:53.100,00:05:58.530
"using what's called
binary search.",00:05:58.530,00:06:00.295
"Let's say you're looking
for a specific item.",00:06:03.600,00:06:05.880
Let's call it k.,00:06:05.880,00:06:08.280
"Binary search, roughly
speaking, would",00:06:08.280,00:06:11.140
"work like-- you go compare
k to, again, B of n over 2,",00:06:11.140,00:06:20.200
"and decide, given
that B is sorted,",00:06:20.200,00:06:23.780
"you get to look at
1/2 of the array.",00:06:23.780,00:06:28.400
"If B of n over 2 is not
exactly k, then-- well,",00:06:28.400,00:06:33.080
if it's exactly k you're done.,00:06:33.080,00:06:34.390
"Otherwise, you look
at the left half.",00:06:34.390,00:06:36.770
"You do your divide
and conquer paradigm.",00:06:36.770,00:06:39.670
"And you can do this
in logarithmic time.",00:06:39.670,00:06:42.820
"So keep this in mind,
because binary search",00:06:42.820,00:06:45.700
"is going to come up
in today's lecture",00:06:45.700,00:06:48.530
and again in other lectures.,00:06:48.530,00:06:50.760
"It's really a great
paradigm of divide",00:06:50.760,00:06:53.750
"and conquer--
probably the simplest.",00:06:53.750,00:06:56.020
"And it, essentially,
takes something",00:06:56.020,00:06:57.690
"that's linear--
a linear search--",00:06:57.690,00:07:01.040
"and turns it into
logarithmic search.",00:07:01.040,00:07:03.770
"So those are a
couple of problems",00:07:03.770,00:07:06.540
"that become easy if
you have a sorted list.",00:07:06.540,00:07:10.950
"And there's some not
so obvious applications",00:07:10.950,00:07:21.270
"of sorting-- for example,
data compression.",00:07:21.270,00:07:25.150
"If you wanted to
compress a file,",00:07:25.150,00:07:27.790
"one of the things that
you could do is to--",00:07:27.790,00:07:30.530
"and it's a set of items--
you could sort the items.",00:07:30.530,00:07:35.330
"And that automatically
finds duplicates.",00:07:35.330,00:07:37.870
"And you could say, if I have 100
items that are all identical,",00:07:37.870,00:07:42.940
"I'm going to compress the file
by representing the item once",00:07:42.940,00:07:47.779
"and, then, having
a number associated",00:07:47.779,00:07:49.320
"with the frequency of that
item-- similar to what",00:07:49.320,00:07:52.770
document distance does.,00:07:52.770,00:07:54.440
"Document distance can
be viewed as a way",00:07:54.440,00:07:57.750
"of compressing
your initial input.",00:07:57.750,00:07:59.770
"Obviously, you lose the works of
Shakespeare or whatever it was.",00:07:59.770,00:08:03.240
"And it becomes a bunch
of words and frequencies.",00:08:03.240,00:08:06.560
"But it is something that
compresses the input",00:08:06.560,00:08:12.870
"and gives you a
different representation.",00:08:12.870,00:08:15.590
"And so people use sorting as a
subroutine in data compression.",00:08:15.590,00:08:20.395
Computer graphics uses sorting.,00:08:23.190,00:08:27.360
"Most of the time,
when you render",00:08:27.360,00:08:30.560
"scenes in computer graphics,
you have many layers",00:08:30.560,00:08:32.870
corresponding to the scenes.,00:08:32.870,00:08:34.559
"It turns out that,
in computer graphics,",00:08:34.559,00:08:38.550
"most of the time you're
actually rendering",00:08:38.550,00:08:40.299
"front to back because,
when you have a big opaque",00:08:40.299,00:08:44.410
"object in front, you want
to render that first,",00:08:44.410,00:08:48.887
"so you don't have to worry
about everything that's",00:08:48.887,00:08:50.970
"occluded by this
big opaque object.",00:08:50.970,00:08:54.060
"And that makes things
more efficient.",00:08:54.060,00:08:56.590
"And so you keep things
sorted front to back,",00:08:56.590,00:08:58.700
"most of the time, in
computer graphics rendering.",00:08:58.700,00:09:01.160
"But some of the time, if you're
worried about transparency,",00:09:01.160,00:09:03.860
"you have to render
things back to front.",00:09:03.860,00:09:05.660
"So typically, you
have sorted lists",00:09:05.660,00:09:08.390
"corresponding to the different
objects in both orders--",00:09:08.390,00:09:11.550
"both increasing order
and decreasing order.",00:09:11.550,00:09:13.730
And you're maintaining that.,00:09:13.730,00:09:15.230
"So sorting is a real
important subroutine",00:09:15.230,00:09:19.190
"in pretty much any sophisticated
application you look at.",00:09:19.190,00:09:23.090
"So it's worthwhile to look
at the variety of sorting",00:09:23.090,00:09:26.780
algorithms that are out there.,00:09:26.780,00:09:28.350
"And we're going to do
some simple ones, today.",00:09:28.350,00:09:30.432
"But if you go and
look at Wikipedia",00:09:30.432,00:09:31.890
"and do a Google search,
there's all sorts",00:09:31.890,00:09:35.270
"of sorts like cocktail
sort, and bitonic sort,",00:09:35.270,00:09:38.030
and what have you.,00:09:38.030,00:09:41.900
"And there's reasons why each of
these sorting algorithms exist.",00:09:41.900,00:09:45.900
"Because in specific
cases, they end up",00:09:45.900,00:09:49.830
"winning on types of inputs
or types of problems.",00:09:49.830,00:09:53.055
"So let's take a look at our
first sorting algorithm.",00:09:55.660,00:09:59.470
"I'm not going to write code
but it will be in the notes.",00:09:59.470,00:10:03.640
"And it is in your document
distance Python files.",00:10:03.640,00:10:08.860
"But I'll just give
you pseudocode here",00:10:08.860,00:10:10.770
"and walk through what
insertion sort looks like",00:10:10.770,00:10:13.750
"because the purpose
of describing",00:10:13.750,00:10:17.460
"this algorithm to you is
to analyze its complexity.",00:10:17.460,00:10:20.756
"We need to do some
counting here,",00:10:20.756,00:10:22.130
"with respect to this
algorithm, to figure out",00:10:22.130,00:10:25.230
"how fast it's going to run
in and what the worst case",00:10:25.230,00:10:28.610
complexity is.,00:10:28.610,00:10:30.280
So what is insertion sort?,00:10:30.280,00:10:32.585
"For i equals 1, 2, through n,
given an input to be sorted,",00:10:32.585,00:10:41.780
"what we're going to do is
we're going to insert A of i",00:10:41.780,00:10:46.600
in the right position.,00:10:46.600,00:10:48.470
"And we're going
to assume that we",00:10:48.470,00:10:51.170
"are sort of midway through
the sorting process, where",00:10:51.170,00:10:55.220
"we have sorted A 0
through i minus 1.",00:10:55.220,00:11:00.920
"And we're going to
expand this to this array",00:11:00.920,00:11:04.340
to have i plus 1 elements.,00:11:04.340,00:11:07.590
"And A of i is going
to get inserted",00:11:07.590,00:11:09.650
into the correct position.,00:11:09.650,00:11:12.830
"And we're going to do
this by pairwise swaps",00:11:12.830,00:11:23.640
"down to the correct position
for the number that is initially",00:11:23.640,00:11:32.730
in A of i.,00:11:32.730,00:11:33.490
"So let's go through
an example of this.",00:11:36.050,00:11:42.410
"We're going to sort
in increasing order.",00:11:42.410,00:11:44.840
Just have six numbers.,00:11:44.840,00:11:45.885
"And initially, we
have 5, 2, 4, 6, 1, 3.",00:11:50.430,00:11:54.805
"And we're going to
take a look at this.",00:11:54.805,00:11:56.430
"And you start with the index
1, or the second element,",00:11:56.430,00:12:00.550
"because the very first
element-- it's a single element",00:12:00.550,00:12:03.620
"and it's already
sorted by definition.",00:12:03.620,00:12:06.050
But you start from here.,00:12:06.050,00:12:07.930
"And this is what
we call our key.",00:12:07.930,00:12:10.890
"And that's essentially a pointer
to where we're at, right now.",00:12:10.890,00:12:15.250
"And the key keeps
moving to the right",00:12:15.250,00:12:17.020
"as we go through the different
steps of the algorithm.",00:12:17.020,00:12:20.007
"And so what you do
is you look at this",00:12:20.007,00:12:21.590
and you have-- this is A of i.,00:12:21.590,00:12:24.830
That's your key.,00:12:24.830,00:12:26.030
"And you have A of
0 to 0, which is 5.",00:12:26.030,00:12:30.070
"And since we want to
sort in increasing order,",00:12:30.070,00:12:34.260
this is not sorted.,00:12:34.260,00:12:35.940
And so we do a swap.,00:12:35.940,00:12:37.720
"So what this would do in
this step is to do a swap.",00:12:37.720,00:12:42.400
"And we would go obtain
2, 5, 4, 6, 1, 3.",00:12:42.400,00:12:51.830
"So all that's happened here,
in this step-- in the very",00:12:51.830,00:12:55.080
"first step where the key
is in the second position--",00:12:55.080,00:12:57.360
is one swap happened.,00:12:57.360,00:13:00.020
"Now, your key is
here, at item 4.",00:13:00.020,00:13:03.340
"Again, you need to put
4 into the right spot.",00:13:03.340,00:13:05.980
And so you do pairwise swaps.,00:13:05.980,00:13:08.670
"And in this case, you
have to do one swap.",00:13:08.670,00:13:11.280
"And you get 2, 4, 5.",00:13:11.280,00:13:12.750
"And you're done
with this iteration.",00:13:12.750,00:13:15.650
"So what happens here is
you have 2, 4, 5, 6, 1, 3.",00:13:15.650,00:13:27.850
"And now, the key
is over here, at 6.",00:13:27.850,00:13:33.010
"Now, at this point,
things are kind of easy,",00:13:33.010,00:13:37.860
"in the sense that you look
at it and you say, well, I",00:13:37.860,00:13:41.180
"know this part is
already started.",00:13:41.180,00:13:43.480
6 is greater than 5.,00:13:43.480,00:13:44.970
So you have to do nothing.,00:13:44.970,00:13:47.000
"So there's no swaps that
happen in this step.",00:13:47.000,00:13:51.530
"So all that happens
here is you're",00:13:51.530,00:13:56.440
"going to move the key to
one step to the right.",00:13:56.440,00:14:02.280
"So you have 2, 4, 5, 6, 1, 3.",00:14:02.280,00:14:06.370
And your key is now at 1.,00:14:06.370,00:14:10.270
"Here, you have to do more work.",00:14:10.270,00:14:11.910
"Now, you see one aspect of the
complexity of this algorithm--",00:14:11.910,00:14:16.770
"given that you're doing
pairwise swaps-- the way",00:14:16.770,00:14:19.470
"this algorithm was defined, in
pseudocode, out there, was I'm",00:14:19.470,00:14:23.420
"going to use pairwise swaps
to find the correct position.",00:14:23.420,00:14:27.760
"So what you're going
to do is you're",00:14:27.760,00:14:29.640
"going to have to
swap first 1 and 6.",00:14:29.640,00:14:34.080
"And then you'll
swap-- 1 is over here.",00:14:34.080,00:14:36.310
"So you'll swap this
position and that position.",00:14:36.310,00:14:39.970
"And then you'll
swap-- essentially,",00:14:39.970,00:14:44.580
"do 4 swaps to get to
the point where you have",00:14:44.580,00:14:49.910
"1, 2, 4, 5, 6, 3.",00:14:49.910,00:14:52.970
So this is the result.,00:14:52.970,00:14:56.650
"1, 2, 4, 5, 6, 3.",00:14:59.190,00:15:03.770
"And the important thing
to understand, here,",00:15:03.770,00:15:06.360
"is that you've done
four swaps to get 1",00:15:06.360,00:15:09.050
to the correct position.,00:15:09.050,00:15:10.160
"Now, you could imagine a
different data structure",00:15:10.160,00:15:12.480
"where you move this over
there and you shift them",00:15:12.480,00:15:15.470
all to the right.,00:15:15.470,00:15:16.930
"But in fact, that shifting
of these four elements",00:15:16.930,00:15:20.230
"is going to be computed
in our model as four",00:15:20.230,00:15:23.630
"operations, or
four steps, anyway.",00:15:23.630,00:15:26.244
"So there's no getting
away from the fact",00:15:26.244,00:15:27.910
"that you have to do
four things here.",00:15:27.910,00:15:30.660
"And the way the code that
we have for insertion sort",00:15:30.660,00:15:36.830
"does this is by
using pairwise swaps.",00:15:36.830,00:15:39.400
So we're almost done.,00:15:39.400,00:15:41.470
"Now, we have the key at 3.",00:15:41.470,00:15:49.490
"And now, 3 needs to get put
into the correct position.",00:15:49.490,00:15:52.910
"And so you've got
to do a few swaps.",00:15:52.910,00:15:55.350
This is the last step.,00:15:55.350,00:15:58.320
"And what happens here is 3 is
going to get swapped with 6.",00:15:58.320,00:16:03.580
"And then 3 needs to
get swapped with 5.",00:16:03.580,00:16:06.520
"And then 3 needs to
get swapped with 4.",00:16:06.520,00:16:09.770
"And then, since 3 is
greater than 2, you're done.",00:16:09.770,00:16:12.985
"So you have 1, 2, 3, 4, 5, 6.",00:16:12.985,00:16:16.325
And that's it.,00:16:18.880,00:16:21.180
"So, analysis.",00:16:21.180,00:16:22.820
How many steps do I have?,00:16:25.380,00:16:26.630
AUDIENCE: n squared?,00:16:30.670,00:16:32.150
"PROFESSOR: No, how
many steps do I have?",00:16:32.150,00:16:36.310
"I guess that wasn't
a good question.",00:16:36.310,00:16:40.120
"If I think of a step as
being a movement of the key,",00:16:40.120,00:16:43.930
how many steps do I have?,00:16:43.930,00:16:46.215
I have theta n steps.,00:16:46.215,00:16:49.930
"And in this case, you can
think of it as n minus 1 steps,",00:16:49.930,00:16:56.570
since you started with 2.,00:16:56.570,00:16:58.030
"But let's just call
it theta n steps,",00:16:58.030,00:17:03.900
in terms of key positions.,00:17:03.900,00:17:06.780
And you're right.,00:17:10.060,00:17:11.150
"It is n square because,
at any given step,",00:17:11.150,00:17:15.349
"it's quite possible that
I have to do theta n work.",00:17:15.349,00:17:19.730
"And one example is
this one, right here,",00:17:19.730,00:17:22.400
where I had to do four swaps.,00:17:22.400,00:17:25.160
"And in general, you can
construct a scenario",00:17:25.160,00:17:27.599
"where, towards the
end of the algorithm,",00:17:27.599,00:17:31.470
you'd have to do theta n work.,00:17:31.470,00:17:34.120
"But if you had a list
that was reverse sorted.",00:17:34.120,00:17:37.560
"You would, essentially,
have to do, on an average n",00:17:37.560,00:17:40.960
"by two swaps as you go
through each of the steps.",00:17:40.960,00:17:43.850
And that's theta n.,00:17:43.850,00:17:45.300
So each step is theta n swaps.,00:17:45.300,00:17:52.150
"And when I say
swaps, I could also",00:17:55.930,00:17:58.740
"say each step is theta
n compares and swaps.",00:17:58.740,00:18:06.645
"And this is going
to be important",00:18:06.645,00:18:08.020
"because I'm going to ask
you an interesting question",00:18:08.020,00:18:10.430
in a minute.,00:18:10.430,00:18:11.700
But let me summarize.,00:18:11.700,00:18:13.840
"What I have here is a
theta n squared algorithm.",00:18:13.840,00:18:16.470
"The reason this is
a theta n squared",00:18:16.470,00:18:17.970
"algorithm is because
I have theta n steps",00:18:17.970,00:18:22.760
and each step is theta n.,00:18:22.760,00:18:26.860
"When I'm counting,
what am I counting",00:18:26.860,00:18:29.140
it terms of operations?,00:18:29.140,00:18:30.730
"The assumption here--
unspoken assumption--",00:18:30.730,00:18:33.510
"has been that an operation
is a compare and a swap",00:18:33.510,00:18:36.810
"and they're, essentially,
equal in cost.",00:18:36.810,00:18:39.540
"And in most computers,
that's true.",00:18:39.540,00:18:41.850
"You have a single
instruction and, say, the x86",00:18:41.850,00:18:45.210
"or the MIPS architecture
that can do a compare,",00:18:45.210,00:18:47.700
"and the same thing for
swapping registers.",00:18:47.700,00:18:50.660
"So perfectly
reasonably assumption",00:18:50.660,00:18:52.640
"that compares and
swaps for numbers",00:18:52.640,00:18:56.480
have exactly the same cost.,00:18:56.480,00:18:58.410
"But if you had a record and
you were comparing records,",00:18:58.410,00:19:01.900
"and the comparison function that
you used for the records was",00:19:01.900,00:19:05.700
"in itself a method
call or a subroutine,",00:19:05.700,00:19:08.820
"it's quite possible
that all you're doing",00:19:08.820,00:19:11.290
"is swapping pointers or
references to do the swap,",00:19:11.290,00:19:15.600
"but the comparison could be
substantially more expensive.",00:19:15.600,00:19:17.985
"Most of the time-- and
we'll differentiate",00:19:22.870,00:19:24.920
"if it becomes
necessary-- we're going",00:19:24.920,00:19:27.150
"to be counting comparisons
in the sorting algorithms",00:19:27.150,00:19:29.560
that we'll be putting out.,00:19:29.560,00:19:31.230
"And we'll be assuming that
either comparison swaps are",00:19:31.230,00:19:36.130
"roughly the same or
that compares are--",00:19:36.130,00:19:41.040
"and we'll say which one,
of course-- that compares",00:19:41.040,00:19:44.570
"are substantially more
expensive than swaps.",00:19:44.570,00:19:47.830
"So if you had either of those
cases for insertion sort,",00:19:47.830,00:19:52.270
"you have a theta n
squared algorithm.",00:19:52.270,00:19:54.226
"You have theta n
squared compares",00:19:54.226,00:19:55.600
and theta n squared swaps.,00:19:55.600,00:19:58.200
"Now, here's a question.",00:19:58.200,00:20:00.780
"Let's say that compares are
more expensive than swaps.",00:20:00.780,00:20:11.179
"And so, I'm concerned
about the theta",00:20:11.179,00:20:12.720
n squared comparison cost.,00:20:12.720,00:20:14.750
"I'm not as concerned, because of
the constant factors involved,",00:20:17.270,00:20:20.880
"with the theta n
squared swap cost.",00:20:20.880,00:20:22.710
This is a question question.,00:20:25.410,00:20:28.730
"What's a simple fix-- change
to this algorithm that",00:20:28.730,00:20:33.590
"would give me a better
complexity in the case",00:20:33.590,00:20:37.260
"where compares are
more expensive,",00:20:37.260,00:20:39.900
"or I'm only looking at the
complexity of compares.",00:20:39.900,00:20:43.300
"So the theta
whatever of compares.",00:20:43.300,00:20:46.990
Anyone?,00:20:46.990,00:20:47.950
"Yeah, back there.",00:20:47.950,00:20:48.661
AUDIENCE: [INAUDIBLE],00:20:48.661,00:20:49.536
"PROFESSOR: You could
compare with the middle.",00:20:56.356,00:20:58.230
What did I call it?,00:20:58.230,00:20:59.021
I called it something.,00:21:01.910,00:21:03.120
"What you just said, I
called it something.",00:21:03.120,00:21:06.161
AUDIENCE: Binary search.,00:21:06.161,00:21:07.160
PROFESSOR: Binary search.,00:21:07.160,00:21:07.740
That's right.,00:21:07.740,00:21:08.310
Two cushions for this one.,00:21:08.310,00:21:10.280
"So you pick them
up after lecture.",00:21:10.280,00:21:12.221
So you're exactly right.,00:21:12.221,00:21:13.220
You got it right.,00:21:13.220,00:21:13.928
"I called it binary
search, up here.",00:21:13.928,00:21:18.160
"And so you can
take insertion sort",00:21:18.160,00:21:21.620
"and you can sort of trivially
turn it into a theta n log n",00:21:21.620,00:21:24.800
"algorithm if we
are talking about n",00:21:24.800,00:21:27.200
being the number of compares.,00:21:27.200,00:21:29.910
"And all you have to do
to do that is to say,",00:21:29.910,00:21:32.425
"you know what, I'm
going to replace",00:21:32.425,00:21:34.280
this with binary search.,00:21:34.280,00:21:37.950
"And you can do that-- and
that was the key observation--",00:21:37.950,00:21:42.720
"because A of 0 through i
minus 1 is already sorted.",00:21:42.720,00:21:47.990
"And so you can do binary search
on that part of the array.",00:21:47.990,00:21:51.909
So let me just write that down.,00:21:51.909,00:21:53.200
"Do a binary search on A
of 0 through i minus 1,",00:21:56.750,00:22:04.000
which is already sorted.,00:22:04.000,00:22:05.095
"And essentially, you can think
of it as theta log i time,",00:22:10.540,00:22:16.780
