text,start,stop
"but merge sort in Python, if
you write a little curve fit",00:43:56.650,00:44:07.380
"program to do this, is 2.2n log
n microseconds for a given n.",00:44:07.380,00:44:17.790
"So this is the
merge sort routine.",00:44:17.790,00:44:19.625
"And if you look at
insertion sort, in Python,",00:44:22.450,00:44:32.230
"that's something like 0.2
n square microseconds.",00:44:32.230,00:44:39.410
"So you see the
constant factors here.",00:44:39.410,00:44:42.700
"If you do insertion sort in C,
which is a compiled language,",00:44:42.700,00:44:48.230
"then, it's much faster.",00:44:48.230,00:44:50.420
It's about 20 times faster.,00:44:50.420,00:44:52.935
"It's 0.01 n squared
microseconds.",00:44:55.440,00:44:59.230
"So a little bit of
practice on the side.",00:44:59.230,00:45:00.960
We do ask you to write code.,00:45:00.960,00:45:02.714
And this is important.,00:45:02.714,00:45:03.630
"The reason we're
interested in algorithms",00:45:03.630,00:45:04.930
"is because people
want to run them.",00:45:04.930,00:45:06.770
"And what you can see is that
you can actually find an n-- so",00:45:06.770,00:45:13.860
"regardless of whether
you're Python or C,",00:45:13.860,00:45:16.300
"this tells you that asymptotic
complexity is pretty important",00:45:16.300,00:45:20.020
"because, once n gets
beyond about 4,000,",00:45:20.020,00:45:24.140
"you're going to see that
merge sort in Python",00:45:24.140,00:45:27.260
beats insertion sort in C.,00:45:27.260,00:45:30.350
"So the constant
factors get subsumed",00:45:30.350,00:45:35.430
beyond certain values of n.,00:45:35.430,00:45:37.160
"So that's why asymptotic
complexity is important.",00:45:37.160,00:45:39.835
"You do have a
factor of 20, here,",00:45:39.835,00:45:41.210
"but that doesn't really
help you in terms",00:45:41.210,00:45:43.270
"of keeping an n square
algorithm competitive.",00:45:43.270,00:45:47.440
"It stays competitive
for a little bit longer,",00:45:47.440,00:45:49.400
but then falls behind.,00:45:49.400,00:45:50.510
"That's what I wanted
to cover for sorting.",00:45:54.520,00:45:57.387
"So hopefully, you
have a sense of what",00:45:57.387,00:45:58.970
"happens with these two
sorting algorithms.",00:45:58.970,00:46:02.040
"We'll look at a very different
sorting algorithm next time,",00:46:02.040,00:46:05.200
"using heaps, which is a
different data structure.",00:46:05.200,00:46:08.460
"The last thing I want to do in
the couple minutes I have left",00:46:08.460,00:46:11.330
"is give you a little more
intuition as to recurrence",00:46:11.330,00:46:14.810
"solving based on this diagram
that I wrote up there.",00:46:14.810,00:46:18.680
"And so we're going to use
exactly this structure.",00:46:18.680,00:46:21.460
"And we're going to look at a
couple of different recurrences",00:46:21.460,00:46:24.250
"that I won't really
motivate in terms",00:46:24.250,00:46:26.360
"of having a specific
algorithm, but I'll just",00:46:26.360,00:46:29.420
write out the recurrence.,00:46:29.420,00:46:31.150
"And we'll look at the
recursion tree for that.",00:46:31.150,00:46:36.340
"And I'll try and tease out of
you the complexity associated",00:46:36.340,00:46:41.900
"with these recurrences of
the overall complexity.",00:46:41.900,00:46:45.635
"So let's take a look at T
of n equals 2 T of n over 2",00:46:49.480,00:46:58.000
plus c n squared.,00:46:58.000,00:47:00.310
"Let me just call that c--
no need for the brackets.",00:47:02.820,00:47:08.360
So constant c times n squared.,00:47:08.360,00:47:10.970
"So if you had a
crummy merge routine,",00:47:10.970,00:47:13.200
"and it was taking n square,
and you coded it up wrong.",00:47:13.200,00:47:18.020
"It's not a great motivation
for this recurrence,",00:47:18.020,00:47:20.050
"but it's a way this
recurrence could have come up.",00:47:20.050,00:47:23.980
"So what does this
recursive tree look like?",00:47:23.980,00:47:27.470
"Well it looks kind of
the same, obviously.",00:47:27.470,00:47:29.580
"You have c n square; you
have c n square divided by 4;",00:47:29.580,00:47:33.210
"c n square divided by
4; c n square divided",00:47:33.210,00:47:36.620
"by 16, four times.",00:47:36.620,00:47:40.620
"Looking a little bit
different from the other one.",00:47:40.620,00:47:44.460
"The levels and the leaves
are exactly the same.",00:47:44.460,00:47:47.560
"Eventually n is going
to go down to 1.",00:47:47.560,00:47:49.720
"So you will see c
all the way here.",00:47:49.720,00:47:53.280
"And you're going
to have n leaves.",00:47:53.280,00:47:54.735
"And you will have, as
before, 1 plus log n levels.",00:47:57.880,00:48:03.380
Everything is the same.,00:48:03.380,00:48:05.070
"And this is why I like this
recursive tree formulation so",00:48:05.070,00:48:07.590
"much because, now,
all I have to do",00:48:07.590,00:48:09.370
"is add up the work associated
with each of the levels",00:48:09.370,00:48:14.710
"to get the solution
to the recurrence.",00:48:14.710,00:48:17.100
"Now, take a look at
what happens, here.",00:48:17.100,00:48:18.770
"c n square; c n square divided
by 2; c n square divided by 4.",00:48:18.770,00:48:25.350
And this is n times c.,00:48:25.350,00:48:27.890
So what does that add up to?,00:48:30.890,00:48:34.316
AUDIENCE: [INAUDIBLE],00:48:34.316,00:48:35.839
"PROFESSOR: Yeah, exactly.",00:48:35.839,00:48:36.880
Exactly right.,00:48:36.880,00:48:37.920
"So if you look at what
happens, here, this dominates.",00:48:37.920,00:48:40.430
"All of the other things are
actually less than that.",00:48:44.340,00:48:47.520
"And you said bounded
by two c n square",00:48:47.520,00:48:49.250
"because this part is
bounded by c n square",00:48:49.250,00:48:51.420
"and I already have c n
square up at the top.",00:48:51.420,00:48:54.490
"So this particular algorithm
that corresponds to this crummy",00:48:54.490,00:48:58.100
"merge sort, or wherever
this recurrence came from,",00:48:58.100,00:49:02.300
is a theta n squared algorithm.,00:49:02.300,00:49:06.700
"And in this case,
all of the work done",00:49:06.700,00:49:10.520
"is at the root-- at the
top level of the recursion.",00:49:10.520,00:49:15.360
"Here, there was a
roughly equal amount",00:49:15.360,00:49:17.650
"of work done in each of
the different levels.",00:49:17.650,00:49:21.630
"Here, all of the work
was done at the root.",00:49:21.630,00:49:26.610
"And so to close
up shop, here, let",00:49:26.610,00:49:29.460
"me just give you real
quick a recurrence where",00:49:29.460,00:49:34.210
"all of the work is done at
the leaves, just for closure.",00:49:34.210,00:49:40.470
"So if I had, magically, a merge
routine that actually happened",00:49:40.470,00:49:45.770
"in constant time, either
through buggy analysis,",00:49:45.770,00:49:48.710
"or because of it
was buggy, then what",00:49:48.710,00:49:51.890
"does the tree look
like for that?",00:49:51.890,00:49:55.650
"And I can think of
this as being theta 1.",00:49:55.650,00:49:58.280
"Or I can think of this as
being just a constant c.",00:49:58.280,00:50:01.156
I'll stick with that.,00:50:01.156,00:50:02.030
"So I have c, c, c.",00:50:02.030,00:50:05.246
"Woah, I tried to move that up.",00:50:09.890,00:50:11.350
That doesn't work.,00:50:11.350,00:50:13.750
"So I have n leaves, as before.",00:50:13.750,00:50:15.545
"And so if I look at
what I have, here, I",00:50:18.314,00:50:19.980
have c at the top level.,00:50:19.980,00:50:21.840
"I have 2c, and so
on and so forth.",00:50:21.840,00:50:25.870
4c.,00:50:25.870,00:50:26.930
"And then I go all
the way down to nc.",00:50:26.930,00:50:30.940
"And so what happens
here is this dominates.",00:50:30.940,00:50:33.380
"And so, in this recurrence, the
whole thing runs in theta n.",00:50:36.010,00:50:41.600
"So the solution to
that is theta n.",00:50:41.600,00:50:46.300
"And what you have here
is all of the work",00:50:46.300,00:50:50.970
being done at the leaves.,00:50:50.970,00:50:54.450
"We're not going to really cover
this theorem that gives you",00:50:54.450,00:50:58.440
"a mechanical way of figuring
this out because we think",00:50:58.440,00:51:02.340
"the recursive tree is a
better way of looking at.",00:51:02.340,00:51:05.780
"But you can see that, depending
on what that function is,",00:51:05.780,00:51:08.920
"in terms of the work being
done in the merge routine,",00:51:08.920,00:51:12.130
"you'd have different
versions of recurrences.",00:51:12.130,00:51:14.490
"I'll stick around, and people
who answered questions, please",00:51:14.490,00:51:16.990
pick up you cushions.,00:51:16.990,00:51:18.270
See you next time.,00:51:18.270,00:51:20.240
