text,start,stop
"wants to go toward the maximum
values, and the next player",00:22:06.110,00:22:08.490
"wants to go toward the
minimum values.",00:22:08.490,00:22:10.380
"But none of the static values
have been computed yet.",00:22:10.380,00:22:13.950
"So, I better start
computing them.",00:22:13.950,00:22:16.770
"That's the first
one I find, 2.",00:22:16.770,00:22:19.226
"Now, as soon as I see that 2, as
soon as the minimizer sees",00:22:19.226,00:22:21.840
"that 2, the minimizer knows that
the value of this node",00:22:21.840,00:22:25.580
can't be any greater than 2.,00:22:25.580,00:22:27.390
"Because he'll always choose to
go down this way if this",00:22:27.390,00:22:30.020
"branch produces a
bigger number.",00:22:30.020,00:22:32.390
"So, we can say that the
minimizer is assured already",00:22:32.390,00:22:35.910
"that the score there will be
equal to or less than 2.",00:22:35.910,00:22:40.580
"Now, we go over and compute
the next number.",00:22:40.580,00:22:43.580
There's a 7.,00:22:43.580,00:22:44.980
"Now, I know this is exactly
equal to 2, because he'll",00:22:44.980,00:22:46.850
never go down toward a 7.,00:22:46.850,00:22:49.570
"As soon as the minimizer says
equal to 2, the maximizer",00:22:49.570,00:22:52.420
"says, OK, I can do equal
to or greater than 2.",00:22:52.420,00:22:55.390
"One, minimizer says equal
to or less than 1.",00:23:00.560,00:23:06.010
Now what?,00:23:06.010,00:23:08.142
"Did you prepare those
2 numbers?",00:23:08.142,00:23:12.275
"The maximizer knows that if he
goes down here, he can't do",00:23:12.275,00:23:16.360
better than 1.,00:23:16.360,00:23:17.990
"He already knows if he goes
over here, he an get a 2.",00:23:17.990,00:23:23.510
"It's as if this branch
doesn't even exist.",00:23:23.510,00:23:27.850
"Because the maximizer would
never choose to go down there.",00:23:27.850,00:23:31.840
"So, you have to see that.",00:23:31.840,00:23:33.160
"This is the important essence
of the notion the alpha-beta",00:23:33.160,00:23:38.330
"algorithm, which is a layering
on top of minimax that cuts",00:23:38.330,00:23:41.630
"off large sections of
the search tree.",00:23:41.630,00:23:44.870
"So, one more time.",00:23:44.870,00:23:47.420
"We've developed a situation so
we know that the maximizer",00:23:47.420,00:23:49.620
"gets a 2 going down to the left,
and he sees that if he",00:23:49.620,00:23:54.720
"goes down to the right, he
can't do better than 1.",00:23:54.720,00:23:58.000
"So, he says to himself, it's
as if that branch doesn't",00:23:58.000,00:24:01.420
"exist and the overall
score is 2.",00:24:01.420,00:24:05.230
"And it doesn't matter what
that static value is.",00:24:05.230,00:24:08.980
"It can be 8, as it was,
it can be plus 1,000.",00:24:08.980,00:24:13.350
It doesn't matter.,00:24:13.350,00:24:14.015
"It can be minus 1,000.",00:24:14.015,00:24:16.040
"Or it could be plus infinity
or minus infinity.",00:24:16.040,00:24:19.420
"It doesn't matter, because
the maximizer will always",00:24:19.420,00:24:23.620
go the other way.,00:24:23.620,00:24:26.470
"So, that's the alpha-beta
algorithm.",00:24:26.470,00:24:29.270
"Can you guess why it's called
the alpha-beta algorithm?",00:24:29.270,00:24:32.300
"Well, because in the algorithm
there are two parameters,",00:24:32.300,00:24:34.210
alpha and beta.,00:24:34.210,00:24:37.080
"So, it's important to understand
that alpha-beta is",00:24:37.080,00:24:38.750
not an alternative to minimax.,00:24:38.750,00:24:41.810
It's minimax with a flourish.,00:24:41.810,00:24:44.230
"It's something layered on top
like we layered things on top",00:24:44.230,00:24:47.610
"of branch and bound to make
it more efficient.",00:24:47.610,00:24:49.605
"We layer stuff on top
of minimax to",00:24:49.605,00:24:52.290
make it more efficient.,00:24:52.290,00:24:55.300
"As you say to me, well, that's
a pretty easy example.",00:24:55.300,00:24:57.250
And it is.,00:24:57.250,00:24:57.700
"So, let's try a little
bit more complex one.",00:24:57.700,00:24:59.810
"This is just to see if I can
do it without screwing up.",00:25:07.330,00:25:09.550
"The reason I do one that's
complex is not just to show",00:25:12.220,00:25:15.320
"how tough I am in front
of a large audience.",00:25:15.320,00:25:17.640
"But, rather, there's certain
points of interest that only",00:25:17.640,00:25:20.450
"occur in a tree of depth
four or greater.",00:25:20.450,00:25:24.030
"That's the reason for
this example.",00:25:24.030,00:25:26.010
"But work with me and let's
see if we can work",00:25:26.010,00:25:28.120
our way through it.,00:25:28.120,00:25:29.670
"What I'm going to do is I'll
circle the numbers that we",00:25:29.670,00:25:34.810
actually have to compute.,00:25:34.810,00:25:36.790
"So, we actually have
to compute 8.",00:25:36.790,00:25:39.480
"As soon as we do that, the
minimizer knows that that node",00:25:39.480,00:25:42.430
"is going to have a score of
equal to or less than 8",00:25:42.430,00:25:44.450
"without looking at
anything else.",00:25:44.450,00:25:46.960
"Then, he looks at 7.",00:25:46.960,00:25:50.020
"So, that's equal to 7.",00:25:50.020,00:25:51.516
"Because the minimizer will
clearly go to the right.",00:25:51.516,00:25:54.910
"As soon as that is determined,
then the maximizer knows that",00:25:54.910,00:25:57.330
"the score here is equal
to or greater than 8.",00:25:57.330,00:26:00.580
"Now, we evaluate the 3.",00:26:00.580,00:26:03.680
"The minimizer knows equal
to or less than 3.",00:26:03.680,00:26:06.418
SPEAKER 4: [INAUDIBLE].,00:26:06.418,00:26:09.286
"SPEAKER 1: Oh, sorry, the
minimizer at 7, yeah.",00:26:09.286,00:26:14.920
"OK, now what happens?",00:26:14.920,00:26:17.930
"Well, let's see, the maximizer
gets a 7 going that way.",00:26:17.930,00:26:20.240
"He can't do better than 3 going
that way, so we got",00:26:20.240,00:26:22.180
"another one of these
cut off situations.",00:26:22.180,00:26:24.980
"It's as if this branch
doesn't even exist.",00:26:24.980,00:26:28.820
"So, this static evaluation
need not be made.",00:26:28.820,00:26:32.860
"And now we know that that's not
merely equal to or greater",00:26:32.860,00:26:35.670
"than 7, but exactly
equal to 7.",00:26:35.670,00:26:37.850
"And we can push that
number back up.",00:26:37.850,00:26:40.530
"That becomes equal to
or less than 7.",00:26:40.530,00:26:43.900
"OK, are you with me so far?",00:26:43.900,00:26:46.360
"Let's get over to the other
side of the tree",00:26:46.360,00:26:47.620
as quickly as possible.,00:26:47.620,00:26:49.300
"So, there's a 9, equal to or
less than 9, 8 equal to 8,",00:26:49.300,00:26:55.410
"push the 8 up equal
or greater than 8.",00:26:55.410,00:27:00.820
"The minimizer can go down
this way and get a 7.",00:27:03.360,00:27:06.740
"He'll certainly never go
that way where the",00:27:06.740,00:27:09.020
maximizer can get an 8.,00:27:09.020,00:27:11.780
"Once again, we've
got a cut off.",00:27:11.780,00:27:13.706
"And if this branch didn't exist,
then that means that",00:27:13.706,00:27:17.900
"these static evaluations
don't have to be made.",00:27:17.900,00:27:21.020
"And this value is
now exactly 7.",00:27:21.020,00:27:25.150
"But there's one more
thing to note here.",00:27:25.150,00:27:27.340
"And that is that not only do
we not have to make these",00:27:27.340,00:27:29.510
"static evaluations down here,
but we don't even have to",00:27:29.510,00:27:32.830
generate these moves.,00:27:32.830,00:27:35.040
"So, we save two ways, both on
static evaluation and on move",00:27:35.040,00:27:38.210
generation.,00:27:38.210,00:27:40.390
"This is a real winner, this
alpha-beta thing, because it",00:27:40.390,00:27:42.770
"saves as enormous amount
of computation.",00:27:42.770,00:27:44.285
"Well, we're on the way now.",00:27:47.130,00:27:47.930
"The maximizer up here is
guaranteed equal to or",00:27:47.930,00:27:50.470
greater than 7.,00:27:50.470,00:27:51.220
"Has anyone found the winning
media move yet?",00:27:51.220,00:27:53.990
Is it to the left?,00:27:53.990,00:27:56.050
"I know that we better keep
going, because we want to",00:27:56.050,00:27:59.240
trust any oracles.,00:27:59.240,00:28:00.490
"So, let's see.",00:28:04.150,00:28:05.090
There's a 1.,00:28:05.090,00:28:05.780
We've calculated that.,00:28:05.780,00:28:06.700
"The minimizer can be guaranteed
equal to or less",00:28:06.700,00:28:08.950
"than 1 at that particular
point.",00:28:08.950,00:28:11.050
Think about that for a while.,00:28:15.130,00:28:17.040
"At the top, the maximizer
knows he can go",00:28:17.040,00:28:19.470
left and get a 7.,00:28:19.470,00:28:23.161
"the minimizer, if the play ever
gets here, can ensure",00:28:23.161,00:28:28.610
"that he's going to drive the
situation to a board",00:28:28.610,00:28:30.860
number that's 1.,00:28:30.860,00:28:33.240
"So, the question is will
the maximizer ever",00:28:33.240,00:28:35.150
permit that to happen?,00:28:35.150,00:28:37.080
And the answer is surely not.,00:28:37.080,00:28:39.920
"So, over here in the development
of this side of",00:28:39.920,00:28:42.090
"the tree, we're always comparing
numbers at adjacent",00:28:42.090,00:28:44.870
levels in the tree.,00:28:44.870,00:28:46.530
"But here's a situation where
we're comparing numbers that",00:28:46.530,00:28:48.780
"are separated from each
other in the tree.",00:28:48.780,00:28:51.210
"And we still concluded that no
further examination of this",00:28:51.210,00:28:54.430
node makes any sense at all.,00:28:54.430,00:28:56.870
This is called deep cut off.,00:28:56.870,00:28:58.120
"And that means that this whole
branch here might as well not",00:29:05.590,00:29:08.810
"exist, and we won't have to
compute that static value.",00:29:08.810,00:29:14.150
All right?,00:29:14.150,00:29:15.530
"So, it looks--",00:29:15.530,00:29:17.950
"you have this stare of
disbelief, which",00:29:17.950,00:29:20.250
is perfectly normal.,00:29:20.250,00:29:21.660
"I have to reconvince myself
every time that",00:29:21.660,00:29:23.510
this actually works.,00:29:23.510,00:29:24.915
"But when you think your way
through it, it is clear that",00:29:24.915,00:29:28.170
"these computations that
I've x-ed out",00:29:28.170,00:29:30.660
don't have to be made.,00:29:30.660,00:29:32.120
"So, let's carry on and see if we
can complete this equal to",00:29:32.120,00:29:34.510
"or less than 8, equal
to 8, equal to 8--",00:29:34.510,00:29:39.670
"because the other branch
doesn't even exist--",00:29:39.670,00:29:42.360
equal to or less than 8.,00:29:42.360,00:29:46.760
"And we compare these two
numbers, do we keep going?",00:29:46.760,00:29:50.700
"Yes, we keep going.",00:29:50.700,00:29:52.020
"Because maybe the maximizer
can go to the right and",00:29:52.020,00:29:54.010
actually get to that 8.,00:29:54.010,00:29:56.870
"So, we have to go over here
and keep working away.",00:29:56.870,00:29:59.990
"There's a nine, equal
to or less than 9,",00:29:59.990,00:30:02.600
another 9 equal to 9.,00:30:02.600,00:30:04.790
"Push that number up equal
to or greater than 9.",00:30:04.790,00:30:08.620
"The minimizer gets an
8 going this way.",00:30:11.360,00:30:14.322
"The maximizer is insured of
getting a 9 going that way.",00:30:14.322,00:30:16.840
"So, once again, we've got
a cut off situation.",00:30:16.840,00:30:18.860
It's as if this doesn't exist.,00:30:18.860,00:30:21.392
"Those static evaluations
are not made.",00:30:21.392,00:30:24.540
"This move generation is not made
and computation is saved.",00:30:24.540,00:30:28.000
"So, let's see if we can do
better on this very example",00:30:32.010,00:30:36.200
using this alpha-beta idea.,00:30:36.200,00:30:38.342
"I'll slow it down a little bit
and change the search type to",00:30:38.342,00:30:42.150
minimax with alpha-beta.,00:30:42.150,00:30:45.110
"We see two numbers on each of
those nodes now, guess what",00:30:45.110,00:30:47.540
they're called.,00:30:47.540,00:30:48.220
We already know.,00:30:48.220,00:30:49.070
They're alpha and beta.,00:30:49.070,00:30:50.430
"So, what's going to happen is
the algorithm proceeds through",00:30:50.430,00:30:53.270
"trees that those numbers are
going to shrink wrap",00:30:53.270,00:30:55.710
"themselves around
the situation.",00:30:55.710,00:30:58.210
"So, we'll start that up.",00:30:58.210,00:30:59.460
"Two static evaluations
were not made.",00:31:04.770,00:31:08.030
Let's try a new tree.,00:31:08.030,00:31:09.280
"Two different ones
were not made.",00:31:14.240,00:31:16.496
"A new tree, still again, two
different ones not made.",00:31:16.496,00:31:25.300
"Let's see what happens when we
use the classroom example, the",00:31:25.300,00:31:29.180
one I did up there.,00:31:29.180,00:31:29.960
"Let's make sure that I
didn't screw it up.",00:31:29.960,00:31:32.900
I'll slow that down to 1.,00:31:32.900,00:31:34.480
"2, same answer.",00:31:45.150,00:31:48.280
"So, you probably didn't realize
it at the start.",00:31:48.280,00:31:50.380
Who could?,00:31:50.380,00:31:51.530
"In fact, the play goes down that
way, over this way, down",00:31:51.530,00:31:56.040
"that way, and ultimately to
the 8, which is not the",00:31:56.040,00:31:59.710
biggest number.,00:31:59.710,00:32:00.390
"And it's not the smallest
number.",00:32:00.390,00:32:01.460
"It's the compromised number
that's arrived at virtue of",00:32:01.460,00:32:03.866
"the fact that this is an
adversarial situation.",00:32:03.866,00:32:07.980
"So, you say to me, how much
energy, how much work do you",00:32:07.980,00:32:12.120
actually saved by doing this?,00:32:12.120,00:32:14.820
"Well, it is the case that in
the optimal situation, if",00:32:14.820,00:32:34.440
"everything is ordered right,
if God has come down and",00:32:34.440,00:32:37.615
"arranged your tree in just
the right way, then the",00:32:37.615,00:32:41.110
"approximate amount of work you
need to do, the approximate",00:32:41.110,00:32:44.980
"number of static evaluations
performed, is approximately",00:32:44.980,00:32:48.340
"equal to 2 times b
to the d over 2.",00:32:48.340,00:32:54.610
We don't care about this 2.,00:32:54.610,00:32:55.870
"We care a whole lot
about that 2.",00:32:55.870,00:32:59.220
"That's the amount of
work that's done.",00:32:59.220,00:33:01.760
"It's b to the d over 2,
instead of b to d.",00:33:01.760,00:33:06.050
What's that mean?,00:33:06.050,00:33:07.000
"Suppose that without
this idea, I can",00:33:07.000,00:33:09.500
go down seven levels.,00:33:09.500,00:33:12.080
"How far can I go down
with this idea?",00:33:12.080,00:33:15.280
14 levels.,00:33:15.280,00:33:17.940
"So, it's the difference
between a",00:33:17.940,00:33:18.910
jerk and a world champion.,00:33:18.910,00:33:21.340
"So, that, however, is only in
the optimal case when God has",00:33:21.340,00:33:24.880
arranged things just right.,00:33:24.880,00:33:26.710
"But in practical situations,
practical game situations, it",00:33:26.710,00:33:29.750
"appears to be the case,
experimentally, that the",00:33:29.750,00:33:32.560
"actual number is close to this
approximation for optimal",00:33:32.560,00:33:36.170
arrangements.,00:33:36.170,00:33:37.760
"So, you'd never not want
to use alpha-beta.",00:33:37.760,00:33:40.462
"It saves an amazing
amount of time.",00:33:40.462,00:33:43.870
"You could look at
it another way.",00:33:43.870,00:33:46.700
"Suppose you go down the same
number of levels, how much",00:33:46.700,00:33:50.990
less work do you have to do?,00:33:50.990,00:33:52.240
"Well, quite a bit.",00:33:55.070,00:33:55.760
"The square root [INAUDIBLE],
right?",00:33:55.760,00:33:59.050
"That's another way of looking
at how it works.",00:33:59.050,00:34:02.720
"So, we could go home at this
point except for one problem,",00:34:02.720,00:34:06.710
"and that is that we pretended
that the branching factor is",00:34:06.710,00:34:11.469
always the same.,00:34:11.469,00:34:13.560
"But, in fact, the branching
factor will vary with the game",00:34:13.560,00:34:17.909
"state and will vary
with the game.",00:34:17.909,00:34:21.510
"So, you can calculate how much
computing you can do in two",00:34:21.510,00:34:23.989
"minutes, or however much time
you have for an average move.",00:34:23.989,00:34:27.223
"And then you could say,
how deep can I go?",00:34:27.223,00:34:30.520
"And you won't know for
sure, because it",00:34:30.520,00:34:32.760
depends on the game.,00:34:32.760,00:34:35.210
"So, in the earlier days of
game-playing programs, the",00:34:35.210,00:34:39.320
"game-playing program left a
lot of computation on the",00:34:39.320,00:34:41.750
"table, because it would make a
decision in three seconds.",00:34:41.750,00:34:45.670
"And it might have made a much
different move if it used all",00:34:45.670,00:34:49.170
"the competition it
had available.",00:34:49.170,00:34:51.520
"Alternatively, it might be
grinding away, and after two",00:34:51.520,00:34:54.969
minutes was consumed.,00:34:54.969,00:34:56.880
"It had no move and just
did something random.",00:34:56.880,00:35:00.410
That's not very good.,00:35:02.920,00:35:05.020
"But that's what the early
game-playing program's did,",00:35:05.020,00:35:06.850
"because no one knew how
deep they could go.",00:35:06.850,00:35:11.980
"So, let's have a look at the
situation here and say, well,",00:35:11.980,00:35:16.910
here's a game tree.,00:35:16.910,00:35:18.670
It's a binary game tree.,00:35:18.670,00:35:20.290
That's level 0.,00:35:20.290,00:35:22.120
That's level 1.,00:35:22.120,00:35:23.890
This is level d minus 1.,00:35:23.890,00:35:26.600
And this is level d.,00:35:26.600,00:35:28.610
"So, down here you
have a situation",00:35:28.610,00:35:32.050
that looks like this.,00:35:32.050,00:35:33.380
"And I left all the game
tree out in between .",00:35:33.380,00:35:37.050
"So, how many leaf nodes
are there down here?",00:35:37.050,00:35:40.940
"b to the d, right?",00:35:40.940,00:35:42.110
"Oh, I'm going to forget about
alpha alpha-beta for a moment.",00:35:42.110,00:35:45.280
"As we did when we looked at
some of those optimal",00:35:45.280,00:35:47.760
"searches, we're going to add
these things one at a time.",00:35:47.760,00:35:50.540
"So, forget about alpha-beta,
assume we're just doing",00:35:50.540,00:35:52.550
straight minimax.,00:35:52.550,00:35:54.290
"In that case, we would have to
calculate all the static",00:35:54.290,00:35:56.970
"values down here
at the bottom.",00:35:56.970,00:35:58.610
And there are b to d of those.,00:35:58.610,00:36:03.160
"How many are there at
this next level up?",00:36:03.160,00:36:06.760
"Well, that must be b
to the d minus 1.",00:36:06.760,00:36:11.720
"How many fewer nodes are there
at the second to the last, the",00:36:11.720,00:36:14.650
"penultimate level, relative
to the final level?",00:36:14.650,00:36:19.390
"Well, 1 over b, right?",00:36:19.390,00:36:23.010
"So, if I'm concerned about not
getting all the way through",00:36:23.010,00:36:26.750
"these calculations at the d
level, I can give myself an",00:36:26.750,00:36:31.070
"insurance policy by calculating
out what the",00:36:31.070,00:36:34.320
"answer would be if I only went
down to the d minus 1th level.",00:36:34.320,00:36:40.590
"Do you get that insurance
policy?",00:36:40.590,00:36:43.540
"Let's say the branching factor
is 10, how much does that",00:36:43.540,00:36:46.510
insurance policy cost me?,00:36:46.510,00:36:48.920
10% of my competition.,00:36:48.920,00:36:51.160
"Because I can do this
calculation and have a move in",00:36:51.160,00:36:53.690
"hand here at level d minus 1 for
only 1/10 of the amount of",00:36:53.690,00:36:59.580
"the computation that's required
to figure out what I",00:36:59.580,00:37:01.730
"would do if I go all the way
down to the base level.",00:37:01.730,00:37:06.000
"OK, is that clear?",00:37:06.000,00:37:08.460
"So this idea is extremely
important in its general form.",00:37:08.460,00:37:13.160
"But we haven't quite got there
yet, because what if the",00:37:13.160,00:37:16.600
"branching factor turns out to be
really big and we can't get",00:37:16.600,00:37:19.070
through this level either?,00:37:19.070,00:37:22.130
"What should we do to
make sure that we",00:37:22.130,00:37:23.860
still have a good move?,00:37:23.860,00:37:26.215
SPEAKER 5: [INAUDIBLE].,00:37:26.215,00:37:27.610
"SPEAKER 1: Right, we can do
it at the b minus 2 level.",00:37:27.610,00:37:32.850
"So, that would be up here.",00:37:32.850,00:37:37.120
"And at that level, the amount
of computation would be b to",00:37:37.120,00:37:40.806
the d minus 2.,00:37:40.806,00:37:42.056
"So, now we've added 10%
plus 10% of that.",00:37:44.800,00:37:51.240
"And our knee jerk is begin
to form, right?",00:37:51.240,00:37:56.270
"What are we going to do in the
end to make sure that no",00:37:56.270,00:37:58.180
matter what we've got a move?,00:37:58.180,00:38:00.458
"CHRISTOPHER: Start from
the very first--",00:38:00.458,00:38:02.095
"SPEAKER 1: Correct, what's
that, Christopher?",00:38:02.095,00:38:03.280
"CHRISTOPHER: Start from
the very first level?",00:38:03.280,00:38:04.250
"SPEAKER 1: Start from the very
first level and give our self",00:38:04.250,00:38:06.515
"an insurance policy for every
level we try to calculate.",00:38:06.515,00:38:11.330
But that might be real costly.,00:38:11.330,00:38:13.780
"So, we better figure out if this
is going to be too big of",00:38:13.780,00:38:15.910
an expense to bear.,00:38:15.910,00:38:18.220
"So, let's see, if we do what
Christopher suggests, then the",00:38:18.220,00:38:22.330
"amount of computation we need
in our insurance policy is",00:38:22.330,00:38:25.860
going to be equal 1--,00:38:25.860,00:38:28.460
"we're going to do it up here at
this level, 2, even though",00:38:28.460,00:38:30.900
"we don't need it, just to make
everything work out easy.",00:38:30.900,00:38:33.560
"1 plus b, that's getting or
insurance policy down here at",00:38:33.560,00:38:37.720
this first level.,00:38:37.720,00:38:39.600
"And we're going to add b squared
all the way down to b",00:38:39.600,00:38:44.460
to d minus 1.,00:38:44.460,00:38:46.820
"That's how much we're going to
spend getting an insurance",00:38:46.820,00:38:49.280
policy at every level.,00:38:49.280,00:38:50.590
"I wished that some of that high
school algebra, right?",00:38:54.020,00:38:58.390
Let's just do it for fun.,00:38:58.390,00:39:01.812
"Oh, unfortunate choice
of variable names.",00:39:01.812,00:39:04.660
bs is equal to--,00:39:04.660,00:39:08.225
"oh, we're going to multiply
all those by b.",00:39:08.225,00:39:10.165
"Now, we'll subtract the first
one from the second one, which",00:39:17.530,00:39:29.520
"tells us that the amount of
calculation needed for our",00:39:29.520,00:39:33.330
"insurance policy is equal
to b to the d minus 1",00:39:33.330,00:39:39.720
over b minus 1.,00:39:39.720,00:39:42.070
Is that a big number?,00:39:46.450,00:39:49.580
"We could do a little algebra on
that and say that b to the",00:39:49.580,00:39:53.562
d is a huge number.,00:39:53.562,00:39:54.430
"So, that minus one
doesn't count.",00:39:54.430,00:39:57.240
And B is probably 10 to 15.,00:39:57.240,00:39:59.620
"So, b minus 1 is, essentially,
equal to b.",00:39:59.620,00:40:03.830
"So, that's approximately equal
b to the d minus 1.",00:40:03.830,00:40:08.441
"So, with an approximation
factored in, the amount of",00:40:11.150,00:40:15.340
"computation needed to do
insurance policies at every",00:40:15.340,00:40:17.140
"level is not much different from
the amount of computation",00:40:17.140,00:40:19.870
"needed to get an insurance
policy at just one level, the",00:40:19.870,00:40:22.770
penultimate one.,00:40:22.770,00:40:24.910
"So, this idea is called
progressive deepening.",00:40:24.910,00:40:27.550
"And now we can visit our gold
star idea list and see how",00:40:40.610,00:40:43.610
"these things match
up with that.",00:40:43.610,00:40:46.170
"First of all, the dead horse
principle comes to the fore",00:40:46.170,00:40:50.050
when we talk about alpha-beta.,00:40:50.050,00:40:51.530
"Because we know with alpha-beta
that we can get rid",00:40:51.530,00:40:53.570
"of a whole lot of the tree and
not do static evaluation, not",00:40:53.570,00:40:56.705
even do move generation.,00:40:56.705,00:40:59.000
"That's the dead horse we
don't want to beat.",00:40:59.000,00:41:01.120
"There's no point in doing that
calculation, because it can't",00:41:01.120,00:41:03.530
figure into the answer.,00:41:03.530,00:41:06.250
"The development of the
progressive deepening idea, I",00:41:06.250,00:41:12.830
"like to think of in terms of
the martial arts principle,",00:41:12.830,00:41:14.860
"we're using the enemy's
characteristics against them.",00:41:14.860,00:41:17.600
"Because of this exponential
blow-up, we have exactly the",00:41:17.600,00:41:20.690
"right characteristics to have
a move available at every",00:41:20.690,00:41:23.610
"level as an insurance policy
against not getting through to",00:41:23.610,00:41:26.260
the next level.,00:41:26.260,00:41:28.360
"And, finally, this whole idea
of progressive deepening can",00:41:28.360,00:41:31.910
"be viewed as a prime example
of what we like to call",00:41:31.910,00:41:34.440
"anytime algorithms that always
have an answer ready to go as",00:41:34.440,00:41:37.670
soon as an answer is demanded.,00:41:37.670,00:41:39.690
"So, as soon as that clock runs
out at two minutes, some",00:41:39.690,00:41:43.400
answer is available.,00:41:43.400,00:41:44.250
"It'll be the best one that the
system can compute in the time",00:41:44.250,00:41:47.460
"available given the
characteristics of the game",00:41:47.460,00:41:49.480
tree as it's developed so far.,00:41:49.480,00:41:51.930
"So, there are other kinds
of anytime algorithms.",00:41:51.930,00:41:53.780
This is an example of one.,00:41:53.780,00:41:56.500
"That's how all game playing
programs work, minimax, plus",00:41:56.500,00:42:01.500
"alpha-beta, plus progressive
deepening.",00:42:01.500,00:42:04.290
"Christopher, is alpha-beta
a alternative to minimax?",00:42:04.290,00:42:08.670
CHRISTOPHER: No.,00:42:08.670,00:42:09.450
"SPEAKER 1: No, it's not.",00:42:09.450,00:42:11.072
"It's something you layer
on top of minimax.",00:42:11.072,00:42:13.100
