text,start,stop
"Does alpha-beta give you a
different answer from minimax?",00:42:13.100,00:42:15.980
CHRISTOPHER: No.,00:42:18.655,00:42:20.920
"No, it doesn't.",00:42:20.920,00:42:21.600
"SPEAKER 1: Let's see everybody
shake their head",00:42:21.600,00:42:23.105
one way or the other.,00:42:23.105,00:42:24.590
"It does not give you an answer
different from minimax.",00:42:24.590,00:42:26.960
That's right.,00:42:26.960,00:42:27.770
"It gives you exactly
the same answer,",00:42:27.770,00:42:29.430
not a different answer.,00:42:29.430,00:42:30.660
It's a speed-up.,00:42:30.660,00:42:32.800
It's not an approximation.,00:42:32.800,00:42:34.570
It's a speed-up.,00:42:34.570,00:42:35.140
It cuts off lots of the tree.,00:42:35.140,00:42:36.835
"It's a dead horse principle
at work.",00:42:36.835,00:42:39.260
"You got a question,
Christopher?",00:42:39.260,00:42:40.618
"CHRISTOPHER: Yeah, since all
of the lines progressively",00:42:40.618,00:42:45.558
"[INAUDIBLE], is it possible to
keep a temporary value if the",00:42:45.558,00:42:50.498
"value [INAUDIBLE] each node of
the tree and then [INAUDIBLE]?",00:42:50.498,00:42:54.944
"SPEAKER 1: Oh, excellent
suggestion.",00:42:54.944,00:42:56.920
"In fact, Christopher
has just--",00:42:56.920,00:42:58.930
"I think, if I can jump ahead
a couple steps--",00:42:58.930,00:43:01.510
"Christopher has reinvented
a very important idea.",00:43:01.510,00:43:04.600
"Progressive deepening not only
ensures you have an answer at",00:43:12.250,00:43:14.295
"any time, it actually improves
the performance of alpha-beta",00:43:14.295,00:43:18.080
"when you layer alpha-beta
on top of it.",00:43:18.080,00:43:21.090
"Because these values that are
calculated at intermediate",00:43:21.090,00:43:25.050
"parts of the tree are used to
reorder the nodes under the",00:43:25.050,00:43:28.890
"tree so as to give you maximum
alpha-beta cut-off.",00:43:28.890,00:43:33.190
"I think that's what you
said, Christopher.",00:43:33.190,00:43:34.650
"But if it isn't, we'll talk
about your idea after class.",00:43:34.650,00:43:39.380
"So, this is what every game
playing program does.",00:43:39.380,00:43:42.170
How is Deep Blue different?,00:43:42.170,00:43:44.510
Not much.,00:43:44.510,00:43:45.760
"So, Deep Blue, as of 1997, did
about 200 million static",00:43:51.830,00:43:57.000
evaluations per second.,00:43:57.000,00:43:59.042
"And it went down, using
alpha-beta,",00:43:59.042,00:44:03.530
"about 14, 15, 16 levels.",00:44:03.530,00:44:08.100
"So, Deep Blue was minimax,
plus alpha-beta, plus",00:44:08.100,00:44:21.800
"progressive deepening, plus
a whole lot of parallel",00:44:21.800,00:44:27.480
"computing, plus an opening book,
plus special purpose",00:44:27.480,00:44:42.080
"stuff for the end game, plus--",00:44:42.080,00:44:47.800
"perhaps the most important
thing--",00:44:47.800,00:44:49.470
uneven tree development.,00:45:04.210,00:45:06.150
"So far, we've pretended that the
tree always goes up in an",00:45:06.150,00:45:08.880
even way to a fixed level.,00:45:08.880,00:45:10.610
"But there's no particular reason
why that has to be so.",00:45:10.610,00:45:13.310
"Some situation down at the
bottom of the tree may be",00:45:16.190,00:45:19.870
particularly dynamic.,00:45:19.870,00:45:21.920
"In the very next move, you might
be able to capture the",00:45:21.920,00:45:23.720
opponent's Queen.,00:45:23.720,00:45:25.780
"So, in circumstances like that,
you want to blow out a",00:45:25.780,00:45:27.750
little extra search.,00:45:27.750,00:45:29.600
"So, eventually, you get to
the idea that there's no",00:45:29.600,00:45:31.280
"particular reason to
have the search go",00:45:31.280,00:45:33.810
down to a fixed level.,00:45:33.810,00:45:35.880
"But, instead, you can develop
the tree in a way that gives",00:45:35.880,00:45:38.920
"you the most confidence
that your",00:45:38.920,00:45:40.800
backed-up numbers are correct.,00:45:40.800,00:45:43.330
"That's the most important of
these extra flourishes added",00:45:43.330,00:45:46.670
"by Deep Blue when it beat
Kasparov in 1997.",00:45:46.670,00:45:51.370
"And now we can come back
and say, well, you",00:45:51.370,00:45:53.890
understand Deep Blue.,00:45:53.890,00:45:54.710
"But is this a model of
anything that goes",00:45:54.710,00:45:56.430
on in our own heads?,00:45:56.430,00:45:58.950
"Is this a model of any kind
of human intelligence?",00:45:58.950,00:46:02.010
"Or is it a different kind
of intelligence?",00:46:02.010,00:46:05.210
"And the answer is
mixed, right?",00:46:05.210,00:46:06.460
"Because we are often in
situations where we are",00:46:06.460,00:46:09.950
playing a game.,00:46:09.950,00:46:11.720
"We're competing with another
manufacturer.",00:46:11.720,00:46:13.470
"We have to think what the other
manufacturer will do in",00:46:13.470,00:46:16.300
"response to what we do
down several levels.",00:46:16.300,00:46:21.500
"On the other hand, is going
down 14 levels what human",00:46:21.500,00:46:26.230
"chess players do when they win
the world championship?",00:46:26.230,00:46:29.705
"It doesn't seem, even to them,
like that's even a remote",00:46:29.705,00:46:33.620
possibility.,00:46:33.620,00:46:35.570
"They have to do something
different, because they don't",00:46:35.570,00:46:37.740
"have that kind of computational
horsepower.",00:46:37.740,00:46:41.180
"This is doing computation in the
same way that a bulldozer",00:46:41.180,00:46:45.350
processes gravel.,00:46:45.350,00:46:47.600
"It's substituting raw power
for sophistication.",00:46:47.600,00:46:51.650
"So, when a human chess master
plays the game, they have a",00:46:51.650,00:46:54.790
"great deal of chess knowledge
in their head and they",00:46:54.790,00:46:56.640
recognize patterns.,00:46:56.640,00:46:58.730
"There are famous experiments,
by the way, that demonstrate",00:46:58.730,00:47:00.910
this in the following way.,00:47:00.910,00:47:03.730
"Show a chessboard to a chess
master and ask them to",00:47:03.730,00:47:08.250
memorize it.,00:47:08.250,00:47:10.130
"They're very good at that, as
long as it's a legitimate",00:47:10.130,00:47:12.950
chessboard.,00:47:12.950,00:47:14.180
"If the pieces are placed
randomly, they're no",00:47:14.180,00:47:16.510
good at it at all.,00:47:16.510,00:47:18.380
"So, it's very clear that they've
developed a repertoire",00:47:18.380,00:47:21.502
"of chess knowledge that makes
it possible for them to",00:47:21.502,00:47:24.550
"recognize situations and play
the game much more like number",00:47:24.550,00:47:28.150
1 up there.,00:47:28.150,00:47:29.940
"So, Deep Blue is manifesting
some kind of intelligence.",00:47:29.940,00:47:33.150
But it's not our intelligence.,00:47:33.150,00:47:34.360
It's bulldozer intelligence.,00:47:34.360,00:47:36.800
"So, it's important to understand
that kind of",00:47:36.800,00:47:38.330
"intelligence, too.",00:47:38.330,00:47:40.020
"But it's not necessarily the
same kind of intelligence that",00:47:40.020,00:47:42.290
we have in our own head.,00:47:42.290,00:47:43.540
"So, that concludes what we're
going to do today.",00:47:46.160,00:47:47.570
"And, as you know, on Wednesday
we have a celebration of",00:47:47.570,00:47:49.790
"learning, which is familiar to
you if you take a 309.1.",00:47:49.790,00:47:56.940
"And, therefore, I will
see you on Wednesday,",00:47:56.940,00:48:00.440
"all of you, I imagine.",00:48:00.440,00:48:01.690
