text,start,stop
"But still, even if
they didn't, there",01:18:03.290,01:18:05.290
"was nothing about
equilibration of the gas that",01:18:05.290,01:18:07.990
would be missed by this.,01:18:07.990,01:18:10.910
"So it's a perfectly reasonable
approximation and assumption,",01:18:10.910,01:18:15.710
"therefore, for us
to drop this term.",01:18:15.710,01:18:20.040
"And we'll see that although
that is physically motivated,",01:18:20.040,01:18:23.020
"it actually doesn't resolve
this question of irreversibility",01:18:23.020,01:18:26.980
"yet, because that's also
potentially a system",01:18:26.980,01:18:31.650
that you could set up.,01:18:31.650,01:18:33.130
"You just eliminate all of
the three-body interactions",01:18:33.130,01:18:35.880
from the problem.,01:18:35.880,01:18:37.030
"Still, you could have
a very reversible set",01:18:37.030,01:18:39.330
"of conditions and
deterministic process",01:18:39.330,01:18:42.570
that you could reverse in time.,01:18:42.570,01:18:45.850
"But still, it's
sort of allows us",01:18:45.850,01:18:48.180
"to have something that
is more manageable,",01:18:48.180,01:18:51.250
"which is what we will
be looking at next.",01:18:51.250,01:18:54.340
"Before I go to what
is next, I also",01:18:54.340,01:18:57.270
"mentioned that there is
one other limit where",01:18:57.270,01:19:01.450
"one can do things,
which is when,",01:19:01.450,01:19:04.420
"within the range of
interaction of one particle,",01:19:04.420,01:19:07.580
there are many other particles.,01:19:07.580,01:19:09.930
"So you are in the dense limit,
nd cubed greater than 1.",01:19:09.930,01:19:15.180
"This does not happen for a
liquid, because for a liquid,",01:19:15.180,01:19:18.000
"the range does not allow many
particles to come within it.",01:19:18.000,01:19:22.230
"But it happens
for a plasma where",01:19:22.230,01:19:24.100
"you have long-range
Coulomb interaction.",01:19:24.100,01:19:26.800
"And within the range
of Coulomb interaction,",01:19:26.800,01:19:29.780
"you could have many
other interactions.",01:19:29.780,01:19:32.140
"And so that limit you will
explore in the problem set",01:19:32.140,01:19:36.620
"leads to a different description
of approach to equilibrium.",01:19:36.620,01:19:41.290
It's called the Vlasov equation.,01:19:41.290,01:19:44.210
"What we are going to proceed
with now will lead to something",01:19:44.210,01:19:48.140
"else, which is called--
in the dilute limit,",01:19:48.140,01:19:52.310
"it will get the
Boltzmann equation.",01:19:52.310,01:19:54.306
OK?,01:19:58.766,01:19:59.266
So let's see what we have.,01:20:03.250,01:20:06.925
"So currently, we
achieved something.",01:20:19.200,01:20:26.210
"We want to describe
properties of a few particles",01:20:26.210,01:20:34.140
"in the system-- densities
that describe only,",01:20:34.140,01:20:37.450
"say, one particle by itself
if one was not enough.",01:20:37.450,01:20:41.990
"But I can terminate
the equations.",01:20:41.990,01:20:44.040
"And with one-particle density
and two-particle density,",01:20:44.040,01:20:48.740
"I should have an
appropriate description",01:20:48.740,01:20:51.240
of how the system evolves.,01:20:51.240,01:20:54.730
"Let's think about
it one more time.",01:20:54.730,01:20:57.310
So what is happening here?,01:20:57.310,01:20:59.115
"There is the
one-particle description",01:20:59.115,01:21:02.450
"that tells you how the
density for one particle,",01:21:02.450,01:21:06.580
"or an ensemble, the probability
for one particle, its position",01:21:06.580,01:21:10.430
and momentum evolves.,01:21:10.430,01:21:12.740
"But it requires
knowledge of what",01:21:12.740,01:21:15.300
"would happen with a
second particle present.",01:21:15.300,01:21:19.150
"But the equations that we
have for the density that",01:21:19.150,01:21:23.220
"involves two particles is
simply a description of things",01:21:23.220,01:21:28.020
"that you would do if you had
deterministic trajectories.",01:21:28.020,01:21:32.390
"There is nothing else
on the right-hand side.",01:21:32.390,01:21:35.130
"So basically, all you
need to do is in order",01:21:35.130,01:21:38.930
"to determine this, is to have
full knowledge of what happens",01:21:38.930,01:21:43.240
"if two particles come
together, collide together, go",01:21:43.240,01:21:46.810
"away, all kinds of things.",01:21:46.810,01:21:48.880
"So if you have those
trajectories for two particles,",01:21:48.880,01:21:52.410
"you can, in principle,
build this density.",01:21:52.410,01:21:55.540
It's still not an easy task.,01:21:55.540,01:21:57.480
"But in principle,
one could do that.",01:21:57.480,01:22:00.050
"And so this is the
description of f2.",01:22:00.050,01:22:03.840
"And we expect f2 to
describe processes",01:22:03.840,01:22:09.050
"in which, over a very
rapid timescale, say,",01:22:09.050,01:22:12.960
"momenta gets shifted from one
direction to another direction.",01:22:12.960,01:22:18.200
"But then there is something
about the overall behavior that",01:22:18.200,01:22:23.270
"should follow, more or less, f1.",01:22:23.270,01:22:26.030
"Again, what do I mean?",01:22:26.030,01:22:27.920
"What I mean is the following,
that if I open this box,",01:22:27.920,01:22:33.400
there is what you would observe.,01:22:33.400,01:22:35.720
"The density would kind
of gush through here.",01:22:35.720,01:22:39.060
"And so you can
have a description",01:22:39.060,01:22:40.860
"for how the density, let's
say in coordinate space,",01:22:40.860,01:22:44.480
"would be evolving as
a function of time.",01:22:44.480,01:22:47.590
"If I ask how does the
two-particle prescription",01:22:47.590,01:22:51.630
"evolve, well, the two-particle
prescription, part of it",01:22:51.630,01:22:55.780
"is what's the
probability that I have",01:22:55.780,01:22:57.450
"a particle here and
a particle there?",01:22:57.450,01:22:59.890
"And if the two particles, if
the separations are far apart,",01:22:59.890,01:23:04.120
"you would be justified to
say that that is roughly",01:23:04.120,01:23:06.880
"the product of the probabilities
that I have something here",01:23:06.880,01:23:09.920
and something there.,01:23:09.920,01:23:11.710
"When you become very close
to each other, however,",01:23:11.710,01:23:14.960
"over the range of
interactions and collisions,",01:23:14.960,01:23:17.900
"that will have to be modified,
because at those descriptions",01:23:17.900,01:23:21.510
"from here, you
would have to worry",01:23:21.510,01:23:24.760
"about the collisions, and the
exchange of momenta, et cetera.",01:23:24.760,01:23:28.830
"So in that sense, part of f2
is simply following f1 slowly.",01:23:28.830,01:23:35.610
"And part of f1 captures all of
the collisions that you have.",01:23:35.610,01:23:42.340
"In fact, that part of f2 that
captures in the collisions,",01:23:42.340,01:23:45.600
"we would like to simplify
as much as possible.",01:23:45.600,01:23:49.930
"And that's the next
task that we do.",01:23:49.930,01:23:52.960
"So what I need to do
is to somehow express",01:23:52.960,01:24:02.340
"the f2 that appears
in the first equation",01:24:02.340,01:24:06.630
"while solving this equation
that is the second one.",01:24:06.630,01:24:09.690
"I will write the answer
that we will eventually",01:24:12.870,01:24:15.790
"deal with and
explain it next time.",01:24:15.790,01:24:18.740
"So the ultimate result would
be that the left-hand side,",01:24:18.740,01:24:21.760
"we will have the terms
that we have currently.",01:24:21.760,01:24:23.910
f1.,01:24:33.800,01:24:36.280
"On the right-hand
side, what we find",01:24:36.280,01:24:39.660
"is that I need to
integrate over all momenta",01:24:39.660,01:24:44.240
"of a second particle
and something that",01:24:44.240,01:24:47.320
"is like a distance to the
target-- one term that",01:24:47.320,01:24:53.940
"is the flux of
incoming particles.",01:24:53.940,01:24:56.700
"And then we would have f2
after collision minus f2",01:24:59.580,01:25:11.930
before collision.,01:25:11.930,01:25:12.880
"And this is really
the Boltzmann equation",01:25:18.580,01:25:21.390
"after one more approximation,
where we replace f2 with f1.",01:25:21.390,01:25:26.890
f1.,01:25:26.890,01:25:28.420
"But what all of that
means symbolically",01:25:28.420,01:25:30.730
"and what it is we'll have
to explain next time.",01:25:30.730,01:25:34.780
