text,start,stop
"Let's calculate the evolution
of one-particle and two-particle",00:53:38.560,00:53:41.770
densities.,00:53:41.770,00:53:42.800
"Maybe they will tell us about
this non-equilibrium situation",00:53:42.800,00:53:45.980
that we set up.,00:53:45.980,00:53:47.340
"But we see that the time
evolution of the first particle",00:53:47.340,00:53:50.860
"density requires
two-particle density.",00:53:50.860,00:53:53.410
"Two-particle density requires
three-particle densities.",00:53:53.410,00:53:56.700
"So we sort of made this
ladder, which ultimately will",00:53:56.700,00:54:01.250
"[? terminate ?] at the
Nth particle densities.",00:54:01.250,00:54:03.740
"And so we have not
really gained much.",00:54:03.740,00:54:08.040
"So we have to now look at these
equations a little bit more",00:54:08.040,00:54:13.050
and try to inject more physics.,00:54:13.050,00:54:17.150
"So let's write down the
first two terms explicitly.",00:54:17.150,00:54:20.755
"So what I will do is I will
take this Poisson bracket of H",00:54:23.340,00:54:28.580
"and f, to the left-hand
side, and use the Hamiltonian",00:54:28.580,00:54:32.850
"that we have over here
to write the terms.",00:54:32.850,00:54:37.760
"So the equation that we
have for f1-- and I'm",00:54:37.760,00:54:41.680
"going to write it as a
whole bunch of derivatives",00:54:41.680,00:54:44.360
acting on f1.,00:54:44.360,00:54:46.980
f1 is a function of p1 q1 t.,00:54:46.980,00:54:52.930
"And essentially, what
Liouville's theorem",00:54:52.930,00:54:57.100
"says is that as you move
along the trajectory,",00:54:57.100,00:55:01.100
"the total derivative is
0, because the expansion",00:55:01.100,00:55:06.290
of the flows is incompressible.,00:55:06.290,00:55:08.720
So what does that mean?,00:55:08.720,00:55:10.670
"It means that d by dt, which
is this argument, plus q1 dot",00:55:10.670,00:55:17.870
"times d by dq1 plus
p1 dot by d by dp1.",00:55:17.870,00:55:25.126
"So here, I should write
p1 dot and q1 dot.",00:55:27.960,00:55:31.775
"In the absence of
everything else is 0.",00:55:34.670,00:55:37.340
"Then, of course, for q1
dot, we use the momentum",00:55:37.340,00:55:44.790
that we would get out of this.,00:55:44.790,00:55:46.820
"q1 dot is momentum
divided by mass.",00:55:46.820,00:55:53.060
So that's the velocity.,00:55:53.060,00:55:55.790
"And p1 dot, changing
momentum, is",00:55:55.790,00:55:59.740
"the force, is minus dH by dq1.",00:55:59.740,00:56:02.905
"So this is minus d of this
one particle potential divided",00:56:02.905,00:56:09.360
by dq1 dotted by [? h ?] p1.,00:56:09.360,00:56:14.630
"So if you were asked to think
about one particle in a box,",00:56:14.630,00:56:21.240
"then you know its
equation of motion.",00:56:21.240,00:56:24.400
"If you have many,
many realizations",00:56:24.400,00:56:27.470
"of that particle in a box,
you can construct a density.",00:56:27.470,00:56:32.080
"Each one of the elements
of the trajectory,",00:56:32.080,00:56:34.186
"you know how they
evolve according",00:56:34.186,00:56:36.250
to [? Newton's ?] equation.,00:56:36.250,00:56:38.010
"And you can see how the
density would evolve.",00:56:38.010,00:56:43.120
"It would evolve
according to this.",00:56:43.120,00:56:45.540
"I would have said, equal to 0.",00:56:45.540,00:56:48.280
"But I can't set it to 0 if I'm
really thinking about a gas,",00:56:48.280,00:56:53.420
"because my particle
can come and collide",00:56:53.420,00:56:56.360
"with a second
particle in the gas.",00:56:56.360,00:57:00.050
"The second particle
can be anywhere.",00:57:00.050,00:57:02.980
"And what it will do is that
it will exert a force, which",00:57:02.980,00:57:11.570
"would be like this,
on particle one.",00:57:11.570,00:57:15.000
"And this force will
change the momentum.",00:57:15.000,00:57:17.300
"So my variation of
the momentum will not",00:57:17.300,00:57:20.040
"come only from the
external force,",00:57:20.040,00:57:22.410
"but also from the
force that is coming",00:57:22.410,00:57:27.100
"from some other
particle in the medium.",00:57:27.100,00:57:30.380
"So that's where
this d by dp really",00:57:30.380,00:57:33.640
"gets not only the
external force but also",00:57:33.640,00:57:37.080
the force from somebody else.,00:57:37.080,00:57:39.890
"But then I need to know
where this other particle is,",00:57:39.890,00:57:42.830
"given that I know where
my first particle is.",00:57:42.830,00:57:45.830
"So I have to include here a
two-particle density which",00:57:45.830,00:57:50.340
"depends on p1 as
well as q2 at time t.",00:57:50.340,00:57:56.740
OK.,00:57:56.740,00:57:58.230
Fine.,00:57:58.230,00:58:00.546
"Now you say, OK, let's write
down-- I need to know f2.",00:58:00.546,00:58:05.420
"Let's write down
the equation for f2.",00:58:05.420,00:58:07.220
So I will write it more rapidly.,00:58:07.220,00:58:12.110
"I have p1 over m, d by dq1.",00:58:12.110,00:58:15.500
"I have p2 over m, d by dq2.",00:58:15.500,00:58:22.232
"I will have dU by dq1, d by dp1.",00:58:22.232,00:58:27.450
"I will have dU by dq2, d by dp2.",00:58:27.450,00:58:35.580
"I will have also a term from
the collision between q1 and q2.",00:58:35.580,00:58:40.470
"And once it will change the
momentum of the first particle,",00:58:44.500,00:58:49.680
"but it will change the
momentum of the second particle",00:58:49.680,00:58:52.490
in the opposite direction.,00:58:52.490,00:58:53.735
"So I will put the
two of them together.",00:58:53.735,00:58:57.110
"So this is all of the terms that
I would get from H2, Poisson",00:58:57.110,00:59:03.050
"bracket with density acting
on the two-particle density.",00:59:03.050,00:59:06.600
"And the answer would be
0 if the two particles",00:59:09.530,00:59:13.220
were the only thing in the box.,00:59:13.220,00:59:15.490
"But there's also
other particles.",00:59:15.490,00:59:17.910
"So there can be
interactions and collisions",00:59:17.910,00:59:20.770
with a third particle.,00:59:20.770,00:59:22.700
"And for that, I
would need to know,",00:59:22.700,00:59:25.920
"let's actually try
to simplify notation.",00:59:25.920,00:59:29.680
"This is the force that is
exerted from two to one.",00:59:29.680,00:59:35.470
"So I will have here the
force from three to one",00:59:35.470,00:59:41.822
dotted by d by dp1.,00:59:41.822,00:59:44.075
Right.,00:59:48.380,00:59:49.240
"And the force that is
exerted from three to two",00:59:49.240,00:59:52.600
"dotted by d by dp2 acting on
a three-particle density that",00:59:52.600,00:59:57.910
involves everything up to three.,00:59:57.910,01:00:02.870
"And now let's write
the third one.",01:00:02.870,01:00:04.880
[LAUGHTER],01:00:04.880,01:00:07.380
"So that, I will leave
to next lecture.",01:00:08.380,01:00:10.390
"But anyway, so this
is the structure.",01:00:10.390,01:00:14.250
"Now, this is the
point at which we",01:00:14.250,01:00:15.840
"would like to inject some
physics into the problem.",01:00:15.840,01:00:23.340
"So what we are going to do is to
estimate the various terms that",01:00:23.340,01:00:30.080
"are appearing in this
equation to see whether there",01:00:30.080,01:00:33.880
"is some approximation
that we can make",01:00:33.880,01:00:37.582
"to make the equations more
treatable and handle-able.",01:00:37.582,01:00:42.680
All right?,01:00:42.680,01:00:45.090
"So let's try to look
at the case of a gas--",01:00:45.090,01:00:54.900
let's say the gas in this room.,01:00:54.900,01:00:58.160
"A typical thing
that is happening",01:00:58.160,01:01:01.790
"in the particles of
the gas in this room",01:01:01.790,01:01:03.690
is that they are zipping around.,01:01:03.690,01:01:06.240
"Their velocity is of
the order-- again,",01:01:06.240,01:01:09.760
"just order of magnitude,
hundreds of meters per second.",01:01:09.760,01:01:14.991
OK?,01:01:14.991,01:01:15.490
"So we are going to, again,
be very sort of limited",01:01:15.490,01:01:20.899
"in what we are
trying to describe.",01:01:20.899,01:01:22.315
There is this experiment.,01:01:22.315,01:01:24.110
Gas expands into a chamber.,01:01:24.110,01:01:26.585
"In room temperature, typical
velocities are of this order.",01:01:26.585,01:01:30.802
"Now we are going to
use that to estimate",01:01:30.802,01:01:34.620
"the magnitude of the
various terms that",01:01:34.620,01:01:36.710
are appearing in this equation.,01:01:36.710,01:01:39.830
"Now, the whole thing
about this equation",01:01:39.830,01:01:42.200
is variation with time.,01:01:42.200,01:01:44.870
"So the entity that
we are looking",01:01:44.870,01:01:46.920
"at in all of these
brackets is this d by dt,",01:01:46.920,01:01:51.450
"which means that the various
terms in this differential",01:01:51.450,01:01:55.830
"equation, apart
from d by dt, have",01:01:55.830,01:01:58.980
"to have dimensions
of inverse time.",01:01:58.980,01:02:03.320
"So we are going to
try to characterize",01:02:03.320,01:02:06.620
what those inverse times are.,01:02:06.620,01:02:08.220
"So what are the typical
magnitudes of various terms?",01:02:12.430,01:02:21.355
"If I look at the
first equation, I",01:02:25.640,01:02:28.740
"said what that first
equation describes.",01:02:28.740,01:02:31.640
"That first equation describes
for you a particle in a box.",01:02:31.640,01:02:35.180
"We've forgotten about
everything else.",01:02:35.180,01:02:38.390
"So if I have a
particle in a box,",01:02:38.390,01:02:41.710
what is the characteristic time?,01:02:41.710,01:02:43.590
"It has to be set by the
size of the box, given",01:02:43.590,01:02:46.730
"that I am moving
with that velocity.",01:02:46.730,01:02:49.740
"So there is a
timescale that I would",01:02:49.740,01:02:52.550
"call extrinsic in the
sense that it is not really",01:02:52.550,01:02:57.215
a property of the gas.,01:02:57.215,01:02:58.640
"It will be different if
I make the box bigger.",01:02:58.640,01:03:02.020
"There's a timescale
over which I would",01:03:02.020,01:03:04.010
"go from one side of the box
to another side of the box.",01:03:04.010,01:03:07.430
"So this is kind of
a timescale that",01:03:07.430,01:03:09.920
"is related to the term
that knows something",01:03:09.920,01:03:13.100
"about the box, which
is dU by dq, d by dp.",01:03:13.100,01:03:17.140
"I would say that if I were to
assign some typical magnitude",01:03:17.140,01:03:21.480
"to this type of
term, I would say",01:03:21.480,01:03:24.170
"that it is related to having
to traverse a distance that",01:03:24.170,01:03:31.980
"is of the order of
the size of the box,",01:03:31.980,01:03:39.630
"given the velocity
that I have specified.",01:03:39.630,01:03:42.640
This is an inverse timescale.,01:03:42.640,01:03:44.465
Right?,01:03:44.465,01:03:45.950
"And let's sort of
imagine that I have an--",01:03:45.950,01:03:50.190
"and I will call this
timescale 1 over tau U,",01:03:50.190,01:03:55.620
"because it is sort of
determined by my external U.",01:03:55.620,01:04:00.610
"Let's say we have
a typical size that",01:04:00.610,01:04:03.070
is of the order of millimeter.,01:04:03.070,01:04:04.760
"If I make it larger,
it will be larger.",01:04:04.760,01:04:06.890
"So actually, let's say we
have 10 to the minus 3 meters.",01:04:06.890,01:04:12.520
"Actually, let's make it bigger.",01:04:12.520,01:04:14.340
"Let's make it of the order
of 10 to the minus 1 meter.",01:04:14.340,01:04:18.740
Kind of reasonable-sized box.,01:04:18.740,01:04:20.900
"Then you would say
that this 1 over tau c",01:04:20.900,01:04:24.270
"is of the order of 10 to the 2
divided by 10 to the minus 1,",01:04:24.270,01:04:29.010
"which is of the order of 1,000.",01:04:29.010,01:04:31.110
"Basically, it
takes a millisecond",01:04:31.110,01:04:35.390
"to traverse a box
that is a fraction",01:04:35.390,01:04:38.530
"of a meter with
these velocities.",01:04:38.530,01:04:42.220
OK?,01:04:42.220,01:04:42.720
You say fine.,01:04:42.720,01:04:44.450
"That is the kind
of timescale that I",01:04:44.450,01:04:46.360
"have in the first equation
that I have in my hierarchy.",01:04:46.360,01:04:50.100
"And that kind of
term is certainly",01:04:50.100,01:04:52.070
"also present in the second
equation for the hierarchy.",01:04:52.070,01:04:56.950
"If I have two particles,
maybe these two particles",01:04:56.950,01:04:59.860
"are orbiting each
other, et cetera.",01:04:59.860,01:05:01.990
"Still, their center of
mass would move, typically,",01:05:01.990,01:05:04.880
with this velocity.,01:05:04.880,01:05:06.569
"And it would take
this amount of time",01:05:06.569,01:05:08.110
"to go across the
size of the box.",01:05:08.110,01:05:11.010
"But there is another
timescale inside there",01:05:11.010,01:05:15.210
"that I would call intrinsic,
which involves dV/dq, d by dp.",01:05:15.210,01:05:25.815
"Now, if I was to see what
the characteristic magnitude",01:05:31.380,01:05:36.770
"of this term is, it would
have to be V divided",01:05:36.770,01:05:42.470
"by a lens scale that
characterizes the potential.",01:05:42.470,01:05:47.730
"And the potential, let's
say, is of the order",01:05:47.730,01:05:50.040
"of atomic size or
molecular size.",01:05:50.040,01:05:52.780
Let's call it d.,01:05:52.780,01:05:54.230
"So this is an atomic
size-- or molecular size.",01:05:54.230,01:05:58.910
"More correctly, really, it's
the range of the interaction",01:06:03.740,01:06:07.240
that you have between particles.,01:06:07.240,01:06:09.730
"And typical values of
these [? numbers ?]",01:06:09.730,01:06:13.280
"are of the order of 10
angstroms, or angstroms,",01:06:13.280,01:06:17.320
or whatever.,01:06:17.320,01:06:18.080
"Let's say 10 to the
minus 10 meters.",01:06:18.080,01:06:19.905
Sorry.,01:06:22.920,01:06:23.480
"The first one I would
like to call tau U.",01:06:23.480,01:06:27.250
"This second time,
that I will call",01:06:27.250,01:06:30.070
"1 over tau c for collisions,
is going to be the ratio of 10",01:06:30.070,01:06:36.414
to the 2 to 10 to the minus 10.,01:06:36.414,01:06:39.950
"It's of the order of 10
to the 12 in both seconds.",01:06:39.950,01:06:45.010
OK?,01:06:45.010,01:06:47.340
"So you can see that this term is
much, much larger in magnitude",01:06:47.340,01:06:54.700
"than the term that was
governing the first equation.",01:06:54.700,01:06:58.584
OK?,01:06:58.584,01:06:59.400
"And roughly, what you
expect in a situation",01:06:59.400,01:07:03.730
"such as this-- let's imagine,
rather than shooting particles",01:07:03.730,01:07:11.840
"from here, you are
shooting bullets.",01:07:11.840,01:07:17.990
"And then the bullets
would come and basically",01:07:17.990,01:07:20.370
"have some kind of
trajectory, et cetera.",01:07:20.370,01:07:23.440
"The characteristic time
for a single one of them",01:07:23.440,01:07:27.360
"would be basically
something that",01:07:27.360,01:07:31.150
"is related to the
size of the box.",01:07:31.150,01:07:33.230
"How long does it take a bullet
to go over the size of the box?",01:07:33.230,01:07:38.170
"But if two of these
bullets happen",01:07:38.170,01:07:40.620
"to come together and
collide, then there's",01:07:40.620,01:07:45.130
"a very short period
of time over which",01:07:45.130,01:07:48.650
"they would go in
different directions.",01:07:48.650,01:07:51.100
"And the momenta
would get displaced",01:07:51.100,01:07:53.690
from what they were before.,01:07:53.690,01:07:55.600
"And that timescale is
of the order of this.",01:07:55.600,01:07:59.600
"But in the situation
that I set up,",01:08:02.910,01:08:05.880
"this particular
time is too rapid.",01:08:05.880,01:08:09.510
"There is another
more important time,",01:08:09.510,01:08:12.480
"which is, how long
do I have to wait",01:08:12.480,01:08:16.880
"for two of these particles,
or two of these bullets,",01:08:16.880,01:08:20.330
to come and hit each other?,01:08:20.330,01:08:23.550
"So it's not the duration of the
collision that is irrelevant,",01:08:23.550,01:08:28.080
"but how long it would be for
me to find another particle",01:08:28.080,01:08:32.450
to collide with.,01:08:32.450,01:08:34.500
"And actually, that is what
is governed by the terms",01:08:34.500,01:08:38.779
that I have on the other side.,01:08:38.779,01:08:41.399
"Because the terms on the
other side, what they say is I",01:08:41.399,01:08:44.600
have to find another particle.,01:08:44.600,01:08:47.270
"So if I look at the terms that
I have on the right-hand side",01:08:47.270,01:08:55.470
"and try to construct
a characteristic time",01:08:55.470,01:08:58.290
"out of them, I have to compare
the probability that I will",01:08:58.290,01:09:02.279
"have, or the density that
I will have for s plus 1,",01:09:02.279,01:09:06.840
"integrated over some
volume, over which",01:09:06.840,01:09:16.080
"the force between these
particles is non-zero.",01:09:16.080,01:09:20.184
"And then in order to
construct a timescale for it,",01:09:23.770,01:09:27.580
"I know that the d by dt on
the left-hand side acts on fs.",01:09:27.580,01:09:32.279
"On the right-hand
side, I have fs plus 1.",01:09:32.279,01:09:35.250
"So again, just if I want
to construct dimensionally,",01:09:35.250,01:09:37.824
"it's a ratio that
involves s plus 1 to s.",01:09:37.824,01:09:44.529
OK?,01:09:44.529,01:09:46.640
"So I have to do an
additional integration",01:09:46.640,01:09:52.569
"over a volume in phase space
over which two particles can",01:09:52.569,01:09:59.410
have substantial interactions.,01:09:59.410,01:10:01.820
"Because that's where
this [? dv ?] by dq",01:10:01.820,01:10:03.710
"would be non-zero, provided
that there is a density for s",01:10:03.710,01:10:09.820
"plus 1 particle
compared to s particles.",01:10:09.820,01:10:13.300
"If you think about
it, that means",01:10:13.300,01:10:15.000
"that I have to look
at the typical density",01:10:15.000,01:10:18.390
"or particles times d cubed for
these additional operations",01:10:18.390,01:10:26.770
"multiplied by this collision
time that I had before.",01:10:26.770,01:10:32.480
OK?,01:10:32.480,01:10:34.300
"And this whole thing I will
call 1 over tau collision.",01:10:34.300,01:10:39.945
"And another way of getting
the same result is as follows.",01:10:42.620,01:10:50.080
"This is typically how you get
collision times by pictorially.",01:10:50.080,01:10:56.190
"You say that I have something
that can interact over",01:10:56.190,01:11:01.320
some characteristic size d.,01:11:01.320,01:11:05.530
"It moves in space
with velocity v",01:11:05.530,01:11:11.640
"so that if I wait a time
that I will call tau,",01:11:11.640,01:11:17.050
"within that time,
I'm essentially",01:11:17.050,01:11:19.840
"sweeping a volume of space that
has volume d squared v tau.",01:11:19.840,01:11:28.690
"So my cross section, if my
dimension is d, is d squared.",01:11:28.690,01:11:33.000
"I sweep in the other
direction by [? aman ?] d tau.",01:11:33.000,01:11:36.680
"And how many particles
will I encounter?",01:11:36.680,01:11:40.290
"Well, if I know
the density, which",01:11:40.290,01:11:42.130
"is the number of
particles per unit volume,",01:11:42.130,01:11:45.020
I have to multiply this by n.,01:11:45.020,01:11:48.450
"So how far do I have
to go until I hit 1?",01:11:48.450,01:11:51.930
I'll call that tau x.,01:11:51.930,01:11:54.340
"Then my formula
for tau x would be",01:11:54.340,01:11:57.910
"1 over nvd squared, which
is exactly what I have here.",01:11:57.910,01:12:05.080
"1 over tau x is
nd squared v. OK?",01:12:05.080,01:12:12.280
"So in order to compare
the terms that I",01:12:12.280,01:12:19.020
"have on the right-hand
side with the terms",01:12:19.020,01:12:22.710
"on the left-hand
side, I notice that I",01:12:22.710,01:12:25.850
"need to know something
about nd cubed.",01:12:25.850,01:12:31.210
"So nd cubed tells you
if I have a particle",01:12:31.210,01:12:36.110
"here and this particle has
a range of interactions",01:12:36.110,01:12:40.000
"that I call d, how many
other particles fall",01:12:40.000,01:12:44.950
"within that range
of interaction?",01:12:44.950,01:12:46.370
"Now, for the gas in this room,
the range of the interaction",01:12:49.490,01:12:53.750
"is of the order of the
size of the molecule.",01:12:53.750,01:12:55.680
It is very small.,01:12:55.680,01:12:58.350
"And the distance between
molecules in this room",01:12:58.350,01:13:01.180
is far apart.,01:13:01.180,01:13:03.340
"And indeed, you can estimate
that for gas, nd cubed",01:13:03.340,01:13:10.770
"has to be of the order
of 10 to the minus 4.",01:13:10.770,01:13:14.480
And how do I know that?,01:13:14.480,01:13:16.260
"Because if I were to take all of
the gas particles in this room",01:13:16.260,01:13:20.610
"and put them together so
that they are touching,",01:13:20.610,01:13:24.560
then I would have a liquid.,01:13:24.560,01:13:26.690
"And the density of,
say, typical liquid",01:13:26.690,01:13:29.600
"is of the order of 10,000 times
larger than the density of air.",01:13:29.600,01:13:33.740
"So basically, it has to
be a number of this order.",01:13:33.740,01:13:37.516
OK?,01:13:37.516,01:13:39.960
So fine.,01:13:39.960,01:13:41.355
Let's look at our equations.,01:13:44.180,01:13:47.310
"So what I find is that
in this equation for f2,",01:13:47.310,01:13:53.170
"on the left-hand
side, I have a term",01:13:53.170,01:13:56.570
"that has magnitude that is
very large-- 1 over tau c.",01:13:56.570,01:14:00.850
"Whereas the term on
the right-hand side,",01:14:04.020,01:14:07.280
"in terms of magnitude,
is something like this.",01:14:07.280,01:14:12.210
"And in fact, this will be
true for every equation",01:14:15.420,01:14:17.920
in the hierarchy.,01:14:17.920,01:14:20.420
"So maybe if I am in the
limit where nd cubed is much,",01:14:20.420,01:14:25.570
"much less than 1-- such as
the gas in this room, which",01:14:25.570,01:14:29.950
"is called the dilute limit-- I
can ignore the right-hand side.",01:14:29.950,01:14:34.490
"I can set the
right-hand side to 0.",01:14:34.490,01:14:38.511
OK?,01:14:38.511,01:14:39.010
"Now, I can't do that
for the first equation,",01:14:41.720,01:14:45.380
"because the first
equation is really",01:14:45.380,01:14:47.320
"the only equation in the
hierarchy that does not",01:14:47.320,01:14:50.020
"have the collision term
on the left-hand side.",01:14:50.020,01:14:53.484
Right?,01:14:53.484,01:14:54.950
"And so for the first equation,
I really need to keep that.",01:14:54.950,01:14:59.611
"And actually, it goes
back to all of the story",01:14:59.611,01:15:03.650
that we've had over here.,01:15:03.650,01:15:07.340
"Remember that we said
this rho equilibrium has",01:15:07.340,01:15:11.540
"to be a function of H
and conserved quantities.",01:15:11.540,01:15:16.600
"Suppose I go to my
Hamiltonian and I",01:15:16.600,01:15:20.170
"ignore all of these
interactions, which",01:15:20.170,01:15:24.290
"is what I would
have done if I just",01:15:24.290,01:15:26.710
"look at the first term over
here and set the collision",01:15:26.710,01:15:31.370
"term on the
right-hand side to 0.",01:15:31.370,01:15:34.040
What would happen then?,01:15:34.040,01:15:36.380
"Then clearly, for each
one of the particles,",01:15:36.380,01:15:40.180
"I have-- let's say it's energy
is going to be conserved.",01:15:40.180,01:15:44.480
"Maybe the magnitude
of its momentum",01:15:44.480,01:15:46.330
"is going to be conserved in
the appropriate geometry.",01:15:46.330,01:15:49.450
"And so there will
be a huge number",01:15:49.450,01:15:52.390
"of individual
conserved quantities",01:15:52.390,01:15:55.870
"that I would have
to put over there.",01:15:55.870,01:15:58.300
"Indeed, if I sort of
go back to the picture",01:15:58.300,01:16:00.560
"that I was drawing over
here, if I ignore collisions",01:16:00.560,01:16:04.860
"between the particles, then
the bullets that I send",01:16:04.860,01:16:08.810
"will always be following
a trajectory such as this",01:16:08.810,01:16:13.740
"forever, because momentum
will be conserved.",01:16:13.740,01:16:17.200
"You will always-- I mean,
except up to reflection.",01:16:17.200,01:16:19.990
"And say the
magnitude of velocity",01:16:19.990,01:16:21.760
"would be always
following the same thing.",01:16:21.760,01:16:25.030
OK?,01:16:25.030,01:16:26.380
"So however, if there is
a collision between two",01:16:26.380,01:16:30.050
"of the particles-- so the
particles that come in here,",01:16:30.050,01:16:34.090
"they have different velocities,
they will hit each other.",01:16:34.090,01:16:37.290
"The moment they hit
each other, they",01:16:37.290,01:16:38.810
go off different directions.,01:16:38.810,01:16:41.080
"And after a certain
number of hits,",01:16:41.080,01:16:43.400
"then I will lose all
of the regularity",01:16:43.400,01:16:45.460
of what I had in the beginning.,01:16:45.460,01:16:48.490
"And so essentially,
this second term",01:16:48.490,01:16:54.390
"on the right-hand
with the collisions",01:16:54.390,01:16:57.680
"is the thing that
is necessary for me",01:16:57.680,01:17:00.550
"to ensure that my gas does come
to equilibrium in the sense",01:17:00.550,01:17:06.200
"that their momenta get
distributed and reversed.",01:17:06.200,01:17:09.870
"I really need to
keep track of that.",01:17:09.870,01:17:12.890
"And also, you can see that
the timescales for which",01:17:12.890,01:17:16.350
"this kind of
equilibration takes place",01:17:16.350,01:17:18.800
"has to do with this
collision time.",01:17:18.800,01:17:22.770
"But as far as this term
is concerned, for the gas",01:17:22.770,01:17:28.030
"or for that system of bullets,
it doesn't really matter.",01:17:28.030,01:17:31.570
"Because for this term
to have been important,",01:17:31.570,01:17:35.030
"it would have been
necessary for something",01:17:35.030,01:17:37.510
"interesting to physically occur
should three particles come",01:17:37.510,01:17:41.470
together simultaneously.,01:17:41.470,01:17:44.520
"And if I complete
the-- say that never",01:17:44.520,01:17:47.450
"in the history of this
system three particles will",01:17:47.450,01:17:51.350
"come together, they do
come together in reality.",01:17:51.350,01:17:55.900
It's not that big a difference.,01:17:55.900,01:17:58.800
"It's only a factor of
10 to the 4 difference",01:17:58.800,01:18:00.780
"between the right-hand side
and the left-hand side.",01:18:00.780,01:18:03.290
