text,start,stop
that I'm not integrating over.,00:24:25.560,00:24:27.920
"And to sort of
make a distinction,",00:24:27.920,00:24:30.390
"I will label them by N. And
it includes the interaction",00:24:30.390,00:24:35.870
among those particles.,00:24:35.870,00:24:37.770
"And I can similarly
write something",00:24:45.900,00:24:48.930
"that pertains to coordinates
that I am integrating over.",00:24:48.930,00:24:55.780
I will label them by j and k.,00:24:55.780,00:24:58.930
"So this is s plus 1 to N, pj
squared over 2m plus u of qj",00:24:58.930,00:25:10.010
"plus 1/2 sum over j and
k, V of qj minus qk.",00:25:10.010,00:25:17.820
OK?,00:25:20.858,00:25:23.790
"So everything that involves one
set of coordinates, everything",00:25:23.790,00:25:27.420
"that involves the other
set of coordinates.",00:25:27.420,00:25:29.310
"So what is left are terms
that [? copy ?] one set of",00:25:29.310,00:25:35.090
coordinates to another.,00:25:35.090,00:25:37.090
"So N running from 1 to s,
j running from s plus 1",00:25:37.090,00:25:41.680
"to N, V between qm and qj.",00:25:41.680,00:25:48.340
OK?,00:25:48.340,00:25:48.840
"So let me rewrite this
equation rather than in terms",00:25:57.970,00:26:01.980
"of-- f in terms of the
probabilities' rhos.",00:26:01.980,00:26:09.450
"So the difference
only is that I don't",00:26:09.450,00:26:13.890
"have to include this
factor out front.",00:26:13.890,00:26:17.210
So I have dVi.,00:26:17.210,00:26:19.610
"I have the d rho by dt, which
is the commutator of H with rho,",00:26:19.610,00:26:27.150
"which I have been writing
as Hs plus HN minus s.",00:26:27.150,00:26:33.636
I'm changing the way I write s.,00:26:33.636,00:26:35.920
Sorry.,00:26:35.920,00:26:37.080
Plus H prime and rho.,00:26:37.080,00:26:41.376
OK?,00:26:41.376,00:26:44.250
"So there is a bit
of mathematics to be",00:26:44.250,00:26:46.650
performed to analyze this.,00:26:46.650,00:26:50.160
"There are three terms
that I will label a, b,",00:26:50.160,00:26:53.400
"and c, which are
the three Poisson",00:26:53.400,00:26:59.160
"brackets that I
have to evaluate.",00:26:59.160,00:27:02.450
"So the contribution
that I call a",00:27:02.450,00:27:06.310
"is the integral
over coordinates s",00:27:06.310,00:27:15.430
"plus 1 to N, of the Poisson
bracket of Hs with rho.",00:27:15.430,00:27:24.020
"Now, the Poisson bracket
is given up here.",00:27:24.020,00:27:29.130
"It is a sum that involves N
terms over all N particles.",00:27:29.130,00:27:35.650
"But since, if I'm
evaluating it for Hs and Hs",00:27:35.650,00:27:42.540
"will only give nonzero
derivatives with respect",00:27:42.540,00:27:46.270
"to the coordinates
that are present in it,",00:27:46.270,00:27:49.400
"this sum of N terms
actually becomes simply",00:27:49.400,00:27:51.755
a sum of small N terms.,00:27:51.755,00:27:54.850
"So I will get a sum over
N running from 1 to s.",00:27:54.850,00:28:01.860
These are the only terms.,00:28:01.860,00:28:03.570
"And I will get the things that
I have for d rho by dpN-- sorry,",00:28:03.570,00:28:11.715
"rho by dqN, dHs by dpN minus
d rho by dpN, dHs by dqN.",00:28:11.715,00:28:25.496
OK?,00:28:33.207,00:28:33.707
Did I make a mistake?,00:28:39.040,00:28:40.634
"AUDIENCE: Isn't it the Poisson
bracket of rho H, not H rho?",00:28:40.634,00:28:46.418
PROFESSOR: Rho.,00:28:46.418,00:28:47.382
"Oh, yes.",00:28:51.250,00:28:51.970
"So I have to put
a minus sign here.",00:28:51.970,00:28:54.720
Right.,00:28:54.720,00:28:55.220
Good.,00:28:55.220,00:28:56.200
Thank you.,00:28:56.200,00:28:57.180
OK.,00:29:01.590,00:29:02.580
"Now, note that these
derivatives and operations that",00:29:02.580,00:29:08.740
"involve Hs involve
coordinates that are not",00:29:08.740,00:29:13.800
"appearing in the
integration process.",00:29:13.800,00:29:18.460
"So I can take
these entities that",00:29:18.460,00:29:20.770
"do not depend on
variables that are part",00:29:20.770,00:29:23.190
"of the integration outside the
integration, which means that I",00:29:23.190,00:29:30.080
"can then write the
result as being",00:29:30.080,00:29:35.590
"an exchange of the order
of the Poisson bracket",00:29:35.590,00:29:44.480
and the integration.,00:29:44.480,00:29:47.850
"So I would essentially have the
integration only appear here,",00:29:47.850,00:30:04.750
"which is the same
thing as Hs and rho s.",00:30:04.750,00:30:17.940
This should be rho s.,00:30:17.940,00:30:19.350
"This is the definition of rho s,
which is the same thing as rho.",00:30:24.800,00:30:28.200
OK.,00:30:31.492,00:30:31.992
What does it mean physically?,00:30:34.807,00:30:36.015
"So it's actually much
easier to tell you",00:30:36.015,00:30:40.430
"what it means physically
than to do the math.",00:30:40.430,00:30:43.810
"So what we saw was
happening was that if I",00:30:43.810,00:30:48.500
"have a Hamiltonian that
describes N particles, then",00:30:48.500,00:30:52.960
"for that Hamiltonian,
the corresponding density",00:30:52.960,00:30:58.370
"satisfies this
Liouville equation.",00:30:58.370,00:30:59.980
D rho by dt is HN rho.,00:30:59.980,00:31:02.810
"And this was a consequence of
this divergence-less character",00:31:02.810,00:31:07.620
"of the flow that we
have in this space,",00:31:07.620,00:31:09.810
"that the equations that
we write down over here",00:31:09.810,00:31:13.620
"for p dot and q
dot in terms of H",00:31:13.620,00:31:17.220
"had this character that
the divergence was 0.",00:31:17.220,00:31:21.820
OK?,00:31:21.820,00:31:23.410
"Now, this is true if I have
any number of particles.",00:31:23.410,00:31:28.230
"So if I focus simply
on s of the particles,",00:31:28.230,00:31:34.410
"and they are governed
by this Hamiltonian,",00:31:34.410,00:31:38.416
"and I don't have anything
else in the universe,",00:31:38.416,00:31:41.640
"as far as this
Hamiltonian is concerned,",00:31:41.640,00:31:44.400
"I should have the analog
of a Liouville equation.",00:31:44.400,00:31:48.740
"So the term that I have obtained
over there from this first term",00:31:48.740,00:31:52.720
"is simply stating
that d rho s by dt,",00:31:52.720,00:31:56.430
"if there was no other
interaction with anybody else,",00:31:56.430,00:31:59.620
"would simply satisfy the
corresponding Liouville",00:31:59.620,00:32:02.960
equation for s particles.,00:32:02.960,00:32:06.170
"And because of that, we
also expect and anticipate--",00:32:06.170,00:32:09.620
"and I'll show that
mathematically--",00:32:09.620,00:32:11.990
"that the next term
in the series,",00:32:11.990,00:32:13.890
"that is the Poisson bracket
of N minus s and rho,",00:32:13.890,00:32:18.800
"should be 0, because as
far as this s particles",00:32:18.800,00:32:23.760
"that I'm focusing on
and how they evolve,",00:32:23.760,00:32:28.780
"they really don't care about
what all the other particles",00:32:28.780,00:32:33.290
"are doing if they
are not [INAUDIBLE].",00:32:33.290,00:32:35.970
"So anything interesting
should ultimately",00:32:35.970,00:32:37.685
come from this third term.,00:32:37.685,00:32:39.940
"But let's actually go and do the
calculation for the second term",00:32:39.940,00:32:44.530
"to show that this anticipation
that the answer should be 0",00:32:44.530,00:32:49.510
does hold up and why.,00:32:49.510,00:32:51.190
"So for the second term, I need
to calculate a similar Poisson",00:32:55.100,00:33:02.410
"bracket, except that
this second Poisson",00:33:02.410,00:33:05.690
bracket involves H of N minus s.,00:33:05.690,00:33:09.290
"And H of N minus s, when
I put in the full sum,",00:33:09.290,00:33:14.790
"will only get contribution from
terms that start from s plus 1.",00:33:14.790,00:33:19.530
"So the same way that
that started from N,",00:33:19.530,00:33:22.100
"this contribution starts
from s plus 1 to N.",00:33:22.100,00:33:27.840
"And actually, I can just write
the whole thing as above, d",00:33:27.840,00:33:31.360
"rho by d qj dotted by d HN minus
s by dpj, plus d rho by-- no,",00:33:31.360,00:33:50.570
"this is the rho. d rho by d pj
dotted by dHN minus s by dqj.",00:33:50.570,00:34:01.990
"So now I have a totally
different situation",00:34:11.340,00:34:16.010
"from the previous case,
because the previous case,",00:34:16.010,00:34:19.010
"the derivatives were over
things I was not integrating.",00:34:19.010,00:34:22.630
"I could take outside
the integral.",00:34:22.630,00:34:26.500
"Now all of the
derivatives involve things",00:34:26.500,00:34:29.010
that I'm integrating over.,00:34:29.010,00:34:31.252
"Now, when that happens, then
you do integration by parts.",00:34:31.252,00:34:36.090
"So what you do is
you take rho outside",00:34:36.090,00:34:42.620
"and let the derivative
act on everything else.",00:34:42.620,00:34:47.400
OK?,00:34:47.400,00:34:49.080
"So what do we end up with if
we do integration by parts?",00:34:49.080,00:34:54.219
I will get surface terms.,00:35:02.640,00:35:06.140
"Surface terms are essentially
rho-evaluated when",00:35:06.140,00:35:09.130
"the coordinates are at
infinity or at the edge",00:35:09.130,00:35:11.660
"of your space, where rho is 0.",00:35:11.660,00:35:14.360
So there is no surface term.,00:35:14.360,00:35:17.080
"There is an overall
change in sign,",00:35:17.080,00:35:19.140
"so I will get a product
i running from s plus 1",00:35:19.140,00:35:23.540
"to N, dVi.",00:35:23.540,00:35:27.420
Now the rho comes outside.,00:35:27.420,00:35:30.640
"And the derivative acts on
everything that is left.",00:35:30.640,00:35:34.840
"So the first term will
give me a second derivative",00:35:34.840,00:35:37.470
"of HN minus s, with respect
to p, with respect to q.",00:35:37.470,00:35:45.930
"And the second term will be
essentially the opposite way",00:35:45.930,00:35:49.560
of doing the derivative.,00:35:49.560,00:35:50.560
"And these two are,
of course, the same.",00:35:57.130,00:35:58.787
And the answer is 0.,00:35:58.787,00:35:59.620
OK?,00:36:03.106,00:36:04.600
"So we do expect that
the evolution of all",00:36:04.600,00:36:10.845
"the other particles
should not affect",00:36:10.845,00:36:13.650
"the subset that
we are looking at.",00:36:13.650,00:36:15.920
And that's worn out also.,00:36:15.920,00:36:18.550
"So the only thing
that potentially",00:36:18.550,00:36:20.710
"will be relevant and exciting
is the last term, number c.",00:36:20.710,00:36:26.470
So let's take a look at that.,00:36:26.470,00:36:29.030
"So here, I have to do an
integration over variables",00:36:29.030,00:36:34.170
that I am not interested.,00:36:34.170,00:36:38.580
"And then I need now,
however, to do a full Poisson",00:36:38.580,00:36:49.470
"bracket of a whole
bunch of terms,",00:36:49.470,00:36:53.080
"because now the terms
that I'm looking at",00:36:53.080,00:36:55.900
have coordinates from both sets.,00:36:55.900,00:36:58.510
"So I have to be a
little bit careful.",00:36:58.510,00:37:01.200
"So let me just make sure that
I follow the notes that I",00:37:01.200,00:37:10.160
"have here and don't
make mistakes.",00:37:10.160,00:37:11.720
OK.,00:37:15.620,00:37:17.140
"So this H prime
involves two sums.",00:37:17.140,00:37:19.935
"So I will write the first
sum, N running from 1 to s.",00:37:23.260,00:37:31.730
"And then I have the second
sum, j running from s",00:37:31.730,00:37:37.480
plus 1 to N. What do I need?,00:37:37.480,00:37:42.890
I need the-- OK.,00:37:42.890,00:38:01.774
Let's do it the following way.,00:38:04.740,00:38:07.490
"So what I have to do
for the Poisson bracket",00:38:07.490,00:38:12.910
"is a sum that involves
all coordinates.",00:38:12.910,00:38:16.690
"So let's just write
this whole expression.",00:38:16.690,00:38:20.070
"But first, for
coordinates 1 through s.",00:38:20.070,00:38:23.700
"So I have a sum N
running from 1 to s.",00:38:23.700,00:38:27.500
"And then I will
write the term that",00:38:27.500,00:38:29.360
"corresponds to
coordinates s plus 1 to m.",00:38:29.360,00:38:32.456
"For the first set of
coordinates, what do I have?",00:38:32.456,00:38:37.400
I have d rho by dqn.,00:38:37.400,00:38:43.520
"And then I have
d H prime by dpn.",00:38:43.520,00:38:47.510
"So I didn't write
H prime explicitly.",00:38:47.510,00:38:50.410
"I'm just breaking
the sum over here.",00:38:50.410,00:38:54.150
"And then I have sum j
running from s plus 1 to N,",00:38:54.150,00:39:04.590
"d rho by dqj times
d H prime by dpj.",00:39:04.590,00:39:14.381
"And again, my H prime
is this entity over here",00:39:14.381,00:39:20.690
"that [? copies ?]
coordinates from both sets.",00:39:20.690,00:39:25.100
OK.,00:39:25.100,00:39:26.780
"First thing is I claim that one
of these two sets of sums is 0.",00:39:26.780,00:39:32.970
You tell me which.,00:39:32.970,00:39:34.926
AUDIENCE: The first.,00:39:34.926,00:39:36.300
PROFESSOR: Why first?,00:39:36.300,00:39:37.830
"AUDIENCE: Because H prime is
independent of p [? dot. ?]",00:39:37.830,00:39:42.764
PROFESSOR: That's true.,00:39:48.416,00:39:50.200
OK.,00:39:50.200,00:39:50.700
That's very good.,00:39:50.700,00:39:52.170
"And then it sort of brings
up a very important question,",00:39:52.170,00:39:55.580
"which is, I forgot to
write two more terms.",00:39:55.580,00:39:57.710
[LAUGHTER],00:39:57.710,00:40:01.787
"Running to s of d rho by dpn,
d H prime by dqn minus sum j",00:40:01.787,00:40:19.630
"s plus 1 to N of d rho by
dpj dot dH prime by dqj.",00:40:19.630,00:40:32.320
"So indeed, both answers
now were correct.",00:40:32.320,00:40:35.760
"Somebody said that
the first term",00:40:35.760,00:40:37.620
"is a 0, because H prime
does not depend on pn.",00:40:37.620,00:40:41.770
"And somebody over here
said that this term is 0.",00:40:41.770,00:40:45.310
And maybe they can explain why.,00:40:45.310,00:40:48.844
AUDIENCE: [INAUDIBLE].,00:40:48.844,00:40:51.149
"PROFESSOR: Same
reason as up here.",00:40:51.149,00:40:53.250
"That is, I can do
integration by parts.",00:40:53.250,00:40:55.460
AUDIENCE: [INAUDIBLE].,00:40:55.460,00:40:57.196
"PROFESSOR: To get rid of this
term plus this term together.",00:40:57.196,00:41:03.890
"So it's actually
by itself is not 0.",00:41:03.890,00:41:08.310
"But if I do
integration by parts,",00:41:08.310,00:41:11.710
"I will have-- actually,
even by itself, it is 0,",00:41:11.710,00:41:14.550
"because I would have d
by dqj, d by pj, H prime.",00:41:14.550,00:41:19.183
"And H prime, you cannot
have a double derivative pj.",00:41:19.183,00:41:22.900
"So each one of them,
actually, by itself is 0.",00:41:22.900,00:41:25.740
"But in general, they would
also cancel each other",00:41:25.740,00:41:28.480
through their single process.,00:41:28.480,00:41:30.621
Yes.,00:41:30.621,00:41:31.120
"AUDIENCE: Do you have the sign
of [? dH ?] of [? H prime? ?]",00:41:31.120,00:41:34.100
"PROFESSOR: Did I have
the sign incorrect?",00:41:34.100,00:41:35.820
Yes.,00:41:35.820,00:41:36.570
"Because for some
reason or other,",00:41:36.570,00:41:39.120
"I keep reading from here, which
is rho and H. So let's do this.",00:41:39.120,00:41:46.048
OK?,00:41:49.476,00:41:49.976
AUDIENCE: Excuse me.,00:41:49.976,00:41:50.824
PROFESSOR: Yes?,00:41:50.824,00:41:51.449
AUDIENCE: [INAUDIBLE].,00:41:51.449,00:41:54.886
PROFESSOR: OK.,00:41:54.886,00:41:55.920
"Yes, it is different.",00:41:55.920,00:41:57.170
Yes.,00:41:57.170,00:41:57.670
"So what I said, if I had
a more general Hamiltonian",00:41:57.670,00:42:03.430
"that also depended
on momentum, then",00:42:03.430,00:42:07.200
"this term would, by itself
not 0, but would cancel,",00:42:07.200,00:42:11.020
"be the corresponding
term from here.",00:42:11.020,00:42:13.370
"But the way that I
have for H prime,",00:42:13.370,00:42:15.290
"indeed, each term by
itself would be 0.",00:42:15.290,00:42:19.010
OK.,00:42:19.010,00:42:19.510
"So hopefully-- then
what do we have?",00:42:19.510,00:42:24.330
"So actually, let's keep the
sign correct and do this,",00:42:27.150,00:42:34.240
"because I need this right
sign for the one term",00:42:34.240,00:42:37.290
that is preserved.,00:42:37.290,00:42:38.040
So what does that say?,00:42:38.040,00:42:39.330
"It is a sum, n
running from 1 to s.",00:42:39.330,00:42:47.870
OK?,00:42:51.030,00:42:52.330
I have d H prime by dqn.,00:42:52.330,00:42:56.940
And I have this integration.,00:42:59.500,00:43:01.100
"I have the integration i running
from s plus 1 to N dV of i.",00:43:01.100,00:43:10.150
"I have d rho by
dpn dot producted",00:43:10.150,00:43:16.480
with d H prime by dqN.,00:43:16.480,00:43:19.410
"d H prime by dqn I can
calculate from here,",00:43:19.410,00:43:23.760
"is a sum over terms j
running from s plus 1",00:43:23.760,00:43:31.940
to N of V of qn minus qj.,00:43:31.940,00:43:42.280
All right.,00:43:52.440,00:43:53.010
AUDIENCE: Question.,00:43:56.433,00:43:57.411
PROFESSOR: Yes.,00:43:57.411,00:43:58.878
"AUDIENCE: Why aren't you
differentiating [? me ?]",00:43:58.878,00:44:02.045
"if you're
differentiating H prime?",00:44:02.045,00:44:04.095
PROFESSOR: d by dqj.,00:44:07.884,00:44:10.200
All right?,00:44:13.400,00:44:14.442
AUDIENCE: Where is the qn?,00:44:14.442,00:44:17.025
PROFESSOR: d by dqn.,00:44:17.025,00:44:19.161
Thank you.,00:44:19.161,00:44:20.604
Right.,00:44:20.604,00:44:22.050
"Because always, pn of
qn would go together.",00:44:22.050,00:44:25.390
Thank you.,00:44:25.390,00:44:26.764
OK.,00:44:26.764,00:44:27.264
All right.,00:44:31.121,00:44:31.620
"So we have to slog
through these derivations.",00:44:31.620,00:44:34.870
"And then I'll give you
the physical meaning.",00:44:34.870,00:44:38.980
So I can rearrange this.,00:44:38.980,00:44:43.075
Let's see what's happening here.,00:44:46.750,00:44:49.910
"I have here a sum
over particles that",00:44:49.910,00:44:55.180
"are not listed on
the left-hand side.",00:44:55.180,00:44:58.980
"So when I wrote
this d rho by dt,",00:44:58.980,00:45:02.660
"I had listed coordinates
going from p1 through qs that",00:45:02.660,00:45:07.090
"were s coordinates
that were listed.",00:45:07.090,00:45:09.940
"If you like, you can think
of them as s particles.",00:45:09.940,00:45:12.520
"Now, this sum involves
the remaining particles.",00:45:17.030,00:45:21.460
What is this?,00:45:21.460,00:45:22.540
Up to a sign.,00:45:22.540,00:45:23.690
"This is the force that
is exerted by particle j",00:45:23.690,00:45:28.000
"from the list of
particles that I'm not",00:45:28.000,00:45:30.150
"interested on one of the
particles on the list",00:45:30.150,00:45:33.410
that I am interested.,00:45:33.410,00:45:35.262
OK?,00:45:35.262,00:45:38.090
"Now, I expect that at the end
of the day, all of the particles",00:45:38.090,00:45:42.140
"that I am not interested
I can treat equivalently,",00:45:42.140,00:45:46.950
"like everything
that we had before,",00:45:46.950,00:45:49.460
"like how I got this factor
of N or N minus 1 over there.",00:45:49.460,00:45:55.140
"I expect that all of these will
give me the same result, which",00:45:55.140,00:46:01.700
"is proportional to the number
of these particles, which",00:46:01.700,00:46:06.410
is N minus s.,00:46:06.410,00:46:08.462
OK?,00:46:08.462,00:46:11.110
"And then I can focus on just
one of the terms in this sum.",00:46:11.110,00:46:14.950
"Let's say the term
that corresponds to j,",00:46:14.950,00:46:17.495
being s plus 1.,00:46:17.495,00:46:18.450
"Now, having done that,
I have to be careful.",00:46:23.480,00:46:28.870
"I can do separately
the integration",00:46:28.870,00:46:32.210
"over the volume of this one
coordinate that I'm keeping,",00:46:32.210,00:46:37.660
V of s plus 1.,00:46:37.660,00:46:39.930
And what do I have here?,00:46:39.930,00:46:42.270
"I have the force that
exerted on particle number N",00:46:42.270,00:46:49.180
"by the particle that
is labelled s plus 1.",00:46:49.180,00:46:52.520
"And this force is dot
producted with a gradient",00:46:57.880,00:47:03.540
"along the momentum in direction
of particle N of its density.",00:47:03.540,00:47:12.390
"Actually, this is the
density of all particles.",00:47:12.390,00:47:15.820
"This is the rho that
corresponds to the joint.",00:47:15.820,00:47:20.510
"But I had here s
plus 1 integrations.",00:47:20.510,00:47:24.950
"One of them I wrote
down explicitly.",00:47:24.950,00:47:27.860
All the others I do over here.,00:47:27.860,00:47:30.028
Of the density.,00:47:36.860,00:47:38.540
"So basically, I change the
order of the derivative",00:47:38.540,00:47:43.770
"and the integrations over
the variables not involved",00:47:43.770,00:47:46.890
in the remainder.,00:47:46.890,00:47:48.670
"And the reason I
did that, of course,",00:47:48.670,00:47:51.450
"is that then this
is my rho s plus 1.",00:47:51.450,00:47:54.875
OK?,00:47:58.590,00:48:00.930
"So what we have at
the end of the day",00:48:00.930,00:48:05.160
"is that if I take the time
variation of an s particle",00:48:05.160,00:48:13.130
"density, I will get one
term that I expected,",00:48:13.130,00:48:21.380
"which is if those s particles
were interacting only",00:48:21.380,00:48:26.060
"with themselves, I would
write the Liouville equation",00:48:26.060,00:48:30.620
"that would be
appropriate to them.",00:48:30.620,00:48:34.460
"But because of the
collisions that I",00:48:34.460,00:48:36.510
"can have with particles
that are not over here,",00:48:36.510,00:48:41.930
"suddenly, the momenta that
I'm looking at could change.",00:48:41.930,00:48:46.010
"And because of that, I
have a correction term here",00:48:46.010,00:48:50.400
"that really describes
the collisions.",00:48:50.400,00:48:53.170
"It says here that
these s particles",00:48:53.170,00:48:57.980
"were following the
trajectory that",00:48:57.980,00:49:00.870
"was governed by the
Hamiltonian that",00:49:00.870,00:49:03.400
was peculiar to the s particles.,00:49:03.400,00:49:06.330
"But suddenly, one of them had
a collision with somebody else.",00:49:06.330,00:49:11.210
So which one of them?,00:49:11.210,00:49:12.800
"Well, any one of them.",00:49:12.800,00:49:14.200
"So I could get a contribution
from any one of the s particles",00:49:14.200,00:49:20.160
"that is listed over here, having
a collision with somebody else.",00:49:20.160,00:49:24.970
"How do I describe
the effect of that?",00:49:24.970,00:49:27.970
"I have to do an integration over
where this new particle that I",00:49:27.970,00:49:37.020
am colliding with could be.,00:49:37.020,00:49:39.160
"I have to specify both where the
particle is that I am colliding",00:49:39.160,00:49:43.090
"with, as well as its momentum.",00:49:43.090,00:49:47.750
So that's this.,00:49:47.750,00:49:50.100
"Then I need to know the
force that this particle is",00:49:50.100,00:49:55.190
exerting on me.,00:49:55.190,00:49:56.420
"So that's the V of qs plus
1 minus qN divided by dqN.",00:49:56.420,00:50:05.680
"This is the force that is
exerted by this particle",00:50:05.680,00:50:10.240
that I don't see on myself.,00:50:10.240,00:50:13.980
"Then I have to multiply this,
or a dot product of this,",00:50:13.980,00:50:18.990
"with d by dpN, because what
happens in the process,",00:50:18.990,00:50:23.840
"because of this force, the
momentum of the N particle",00:50:23.840,00:50:28.150
is changing.,00:50:28.150,00:50:29.880
"The variation of
that is captured",00:50:29.880,00:50:34.300
"through looking at
the density that",00:50:34.300,00:50:38.080
"has all of these particles in
addition to this new particle",00:50:38.080,00:50:44.370
that I am colliding with.,00:50:44.370,00:50:46.250
"But, of course, I am not really
interested in the coordinate",00:50:46.250,00:50:50.270
"of this new particle,
so I integrate over it.",00:50:50.270,00:50:54.970
"There are N minus
s such particles.",00:50:54.970,00:50:57.670
"So I really have to put
a factor of N minus s",00:50:57.670,00:51:00.280
"here for all of
potential collisions.",00:51:00.280,00:51:04.640
And so that's the equation.,00:51:04.640,00:51:05.775
"Again, it is more common,
rather than to write",00:51:09.010,00:51:13.900
"the equation for rho, to
write the equation for f.",00:51:13.900,00:51:20.150
"And the f's and the
rhos where simply",00:51:20.150,00:51:22.730
"related by these factors of
N factorial over N minus 1",00:51:22.730,00:51:27.270
s factorial.,00:51:27.270,00:51:28.880
"And the outcome of that
is that the equation for f",00:51:28.880,00:51:36.550
"simply does not have this
additional factor of N minus s,",00:51:36.550,00:51:41.160
"because that disappears
in the ratio of rho",00:51:41.160,00:51:44.190
of s plus 1 and rho s.,00:51:44.190,00:51:46.230
"And it becomes a sum over
N running from 1 to s.",00:51:46.230,00:51:53.690
"Integral over coordinates and
momenta of a particle s plus 1.",00:51:53.690,00:52:01.790
"The force exerted
by particle s plus 1",00:52:04.620,00:52:08.660
"on particle N used to vary the
momentum of the N particle.",00:52:08.660,00:52:19.540
"And the whole thing would depend
on the density that includes,",00:52:19.540,00:52:25.040
"in addition to the s
particles that I had before,",00:52:25.040,00:52:30.850
"the new particle that
I am colliding with.",00:52:30.850,00:52:33.810
OK?,00:52:36.642,00:52:39.010
"So there is a set
of equations that",00:52:39.010,00:52:42.190
"relates the different densities
and how they evolve in time.",00:52:42.190,00:52:48.730
"The evolution of f1, which is
the thing that I am interested,",00:52:48.730,00:52:53.660
"will have, on the
right-hand side,",00:52:53.660,00:52:55.420
something that involves f2.,00:52:55.420,00:52:57.850
"The evolution of
f2 will involve f3.",00:52:57.850,00:53:01.100
"And this whole thing is
called a BBGKY hierarchy,",00:53:01.100,00:53:05.910
"after people whose names
I have in the notes.",00:53:05.910,00:53:09.760
[SOFT LAUGHTER],00:53:09.760,00:53:11.500
"But again, what have
we learned beyond what",00:53:13.620,00:53:19.450
we had in the original case?,00:53:19.450,00:53:21.315
"And originally,
we had an equation",00:53:21.315,00:53:23.720
"that was governing a function
in 6N-dimensional space, which",00:53:23.720,00:53:29.370
we really don't need.,00:53:29.370,00:53:30.770
"So we tried our
best to avoid that.",00:53:30.770,00:53:33.500
"We said that all of the physics
is in one particle, maybe",00:53:33.500,00:53:36.700
two particle densities.,00:53:36.700,00:53:38.560
