text,start,stop
"The following
content is provided",00:00:00.060,00:00:01.780
"under a Creative
Commons license.",00:00:01.780,00:00:04.019
"Your support will help MIT
OpenCourseWare continue",00:00:04.019,00:00:06.870
"to offer high-quality
educational resources for free.",00:00:06.870,00:00:10.730
"To make a donation or
view additional materials",00:00:10.730,00:00:13.330
"from hundreds of MIT courses,
visit MIT OpenCourseWare",00:00:13.330,00:00:17.217
at ocw.mit.edu.,00:00:17.217,00:00:17.842
PROFESSOR: OK.,00:00:20.540,00:00:21.840
Let's start.,00:00:21.840,00:00:22.463
"So last time, we started
with kinetic theory.",00:00:26.420,00:00:30.000
"And we will focus for
gas systems mostly.",00:00:36.120,00:00:39.205
"And the question
that we would like",00:00:43.890,00:00:45.730
"to think about and answer
somehow is the following.",00:00:45.730,00:00:50.140
"You start with a gas
that is initially",00:00:50.140,00:00:56.260
confined to one chamber.,00:00:56.260,00:00:57.765
"And you can calculate all of
its thermodynamic properties.",00:01:01.400,00:01:06.180
"You open at time 0 a
hole, allowing the gas",00:01:06.180,00:01:11.560
"to escape into a second
initially empty chamber.",00:01:11.560,00:01:17.290
"And after some time,
the whole system",00:01:17.290,00:01:19.400
"will come to a new
equilibrium position.",00:01:19.400,00:01:22.320
It's a pretty reversible thing.,00:01:22.320,00:01:25.040
"You can do this experiment
many, many times.",00:01:25.040,00:01:27.620
"And you will always get
roughly the same amount of time",00:01:27.620,00:01:31.690
"for the situation to
start from one equilibrium",00:01:31.690,00:01:34.280
and reach another equilibrium.,00:01:34.280,00:01:36.820
So how do we describe that?,00:01:36.820,00:01:38.250
"It's slightly beyond what
we did in thermodynamics,",00:01:38.250,00:01:41.010
"because we want to go
from one equilibrium state",00:01:41.010,00:01:43.990
to another equilibrium state.,00:01:43.990,00:01:46.910
"Now, we said, OK, we know
the equations of motion",00:01:46.910,00:01:50.260
"that governs the particles
that are described by this.",00:01:50.260,00:01:55.200
"So here we can say that we
have, let's say, N particles.",00:01:55.200,00:02:00.970
"They have their own
momenta and coordinates.",00:02:00.970,00:02:05.930
"And we know that these
momenta and coordinates evolve",00:02:05.930,00:02:09.160
"in time, governed
by some Hamiltonian,",00:02:09.160,00:02:12.230
"which is a function of all of
these momenta and coordinates.",00:02:12.230,00:02:17.290
OK?,00:02:17.290,00:02:17.880
Fine.,00:02:17.880,00:02:19.270
"How do we go from
a situation which",00:02:19.270,00:02:21.400
"describes a whole
bunch of things",00:02:21.400,00:02:23.100
"and coordinates that
are changing with time",00:02:23.100,00:02:25.580
"to some microscopic description
of macroscopic variables going",00:02:25.580,00:02:33.400
"from one equilibrium
state to another?",00:02:33.400,00:02:36.850
"So our first attempt
in that direction",00:02:36.850,00:02:39.740
"was to say, well, I could start
with many, many, many examples",00:02:39.740,00:02:46.390
of the same situation.,00:02:46.390,00:02:49.260
"Each one of them would
correspond to a different",00:02:49.260,00:02:52.190
trajectory of p's and q's.,00:02:52.190,00:02:55.500
"And so what we can
do is to construct",00:02:55.500,00:02:59.300
"some kind of an ensemble
average, or ensemble density,",00:02:59.300,00:03:05.720
"first, which is what we did.",00:03:05.720,00:03:08.800
"We can say that the very, very
many examples of this situation",00:03:08.800,00:03:15.255
"that I can have will
correspond to different points",00:03:15.255,00:03:20.300
"at some particular
instant of time,",00:03:20.300,00:03:23.890
"occupying this
6N-dimensional phase space,",00:03:23.890,00:03:28.085
"out of which I can construct
some kind of a density in phase",00:03:28.085,00:03:32.330
space.,00:03:32.330,00:03:34.950
"But then I realize that since
each one of these trajectories",00:03:34.950,00:03:39.320
"is evolving according
to this Hamiltonian,",00:03:39.320,00:03:42.490
"this density could potentially
be a function of time.",00:03:42.490,00:03:45.320
"And we described the
equation for the evolution",00:03:48.030,00:03:52.710
of that density with time.,00:03:52.710,00:03:54.850
"And we could write it in
this form-- V rho by dt",00:03:54.850,00:03:59.980
"is the Poisson bracket of
the Hamiltonian with rho.",00:03:59.980,00:04:05.350
"And this Poisson
bracket was defined",00:04:05.350,00:04:10.120
"as a sum over all
of your coordinates.",00:04:10.120,00:04:13.650
Oops.,00:04:16.339,00:04:16.839
"We had d rho by d vector qi,
dot product with dH by dpi minus",00:04:22.490,00:04:34.660
the other [? way. ?],00:04:34.660,00:04:36.116
"So there are essentially
three N terms-- well,",00:04:42.470,00:04:47.740
"actually, six N terms, but three
N pairs of terms in this sum.",00:04:47.740,00:04:52.920
"I can either use
some index alpha",00:04:52.920,00:04:55.890
"running from one to
three N, or indicate them",00:04:55.890,00:04:59.460
"as contributions of things that
come from individual particles",00:04:59.460,00:05:05.100
"and then use this notation
with three vectors.",00:05:05.100,00:05:08.210
"So this is essentially
a combination",00:05:08.210,00:05:11.280
of sum of three terms.,00:05:11.280,00:05:14.440
OK?,00:05:14.440,00:05:16.900
"So I hope that
somehow this equation",00:05:16.900,00:05:22.910
"can describe the evolution
that goes on over here.",00:05:22.910,00:05:28.420
"And ultimately, when I wait
sufficiently long time,",00:05:28.420,00:05:32.660
"I will reach a situation
where d rho by dt",00:05:32.660,00:05:36.910
does not change anymore.,00:05:36.910,00:05:39.455
"And I will find some density
that is invariant on time.",00:05:39.455,00:05:43.830
I'll call that rho equilibrium.,00:05:43.830,00:05:46.650
"And so we saw that we could have
our rho equilibrium, which then",00:05:46.650,00:05:51.810
"should have zero Poisson bracket
with H to be a function of H",00:05:51.810,00:05:58.620
"and any other
conserved quantity.",00:05:58.620,00:06:00.140
OK?,00:06:05.900,00:06:08.780
"So in principle,
we sort of thought",00:06:08.780,00:06:14.582
"of a way of describing
how the system will evolve",00:06:14.582,00:06:21.030
"in equilibrium--
towards an equilibrium.",00:06:21.030,00:06:24.660
"And indeed, we will find that in
statistical mechanics later on,",00:06:24.660,00:06:30.290
"we are going to rely heavily
on these descriptions",00:06:30.290,00:06:35.340
"of equilibrium
densities, which are",00:06:35.340,00:06:38.370
"governed by only
the Hamiltonian.",00:06:38.370,00:06:41.090
"And if there are any other
conserved quantities,",00:06:41.090,00:06:43.850
typically there are not.,00:06:43.850,00:06:45.150
"So this is the general
form that we'll ultimately",00:06:45.150,00:06:49.650
be using a lot.,00:06:49.650,00:06:52.630
"But we started
with a description",00:06:52.630,00:06:56.730
"of evolution of
these coordinates",00:06:56.730,00:06:58.820
"in time, which is
time-reversible.",00:06:58.820,00:07:01.420
"And we hope to end up
with a situation that",00:07:05.870,00:07:08.835
"is analogous to what we
describe thermodynamically,",00:07:08.835,00:07:12.180
"we describe something that
goes to some particular state,",00:07:12.180,00:07:18.410
"and basically
stays there, as far",00:07:18.410,00:07:20.230
"as the macroscopic
description is concerned.",00:07:20.230,00:07:23.620
"So did we somehow manage to just
look at something else, which",00:07:23.620,00:07:29.550
"is this density, and
achieve this transition",00:07:29.550,00:07:32.470
"from reversibility
to irreversibility?",00:07:32.470,00:07:35.520
And the answer is no.,00:07:35.520,00:07:36.760
"This equation-- also,
if you find, indeed,",00:07:36.760,00:07:40.610
"a rho that goes from here to
here, you can set t to minus t",00:07:40.610,00:07:47.230
"and get a rho that goes
from back here to here.",00:07:47.230,00:07:49.705
"It has the same
time-reversibility.",00:07:49.705,00:07:52.500
"So somehow, we have to
find another solution.",00:07:52.500,00:07:56.400
"And the solution that we
will gradually build upon",00:07:56.400,00:08:00.180
"relies more on
physics rather than",00:08:00.180,00:08:03.150
"the rigorous mathematical
nature of this thing.",00:08:03.150,00:08:06.850
"Physically, we know
that this happens.",00:08:06.850,00:08:09.310
All of us have seen this.,00:08:09.310,00:08:11.560
"So somehow, we should be able
to use physical approximation",00:08:11.560,00:08:16.026
"and assumptions that
are compatible with what",00:08:16.026,00:08:18.860
is observed.,00:08:18.860,00:08:20.260
"And if, during that,
we have to sort of make",00:08:20.260,00:08:24.280
"mathematical
approximations, so be it.",00:08:24.280,00:08:27.450
"In fact, we have to make
mathematical approximations,",00:08:27.450,00:08:30.330
"because otherwise, there is
this very strong reversibility",00:08:30.330,00:08:35.620
condition.,00:08:35.620,00:08:37.000
"So let's see how we are about
to proceed, thinking more",00:08:37.000,00:08:41.030
in terms of physics.,00:08:41.030,00:08:43.820
"Now, the information
that I have over here,",00:08:43.820,00:08:47.840
"either in this
description of ensemble",00:08:47.840,00:08:50.335
"or in this description
in terms of trajectories,",00:08:50.335,00:08:53.220
is just enormous.,00:08:53.220,00:08:55.960
"I can't think of any
physical process which",00:08:55.960,00:09:01.090
"would need to keep track of the
joined positions of coordinates",00:09:01.090,00:09:05.990
"and momenta of 10
to the 23 particles,",00:09:05.990,00:09:08.900
"and know them with infinite
precision, et cetera.",00:09:08.900,00:09:13.190
"Things that I make
observations with",00:09:13.190,00:09:15.280
"and I say, we see this,
well, what do we see?",00:09:15.280,00:09:18.790
"We see that something has some
kind of a density over here.",00:09:18.790,00:09:24.090
It has some kind of pressure.,00:09:24.090,00:09:26.010
"Maybe there is, in the
middle of this process,",00:09:26.010,00:09:28.720
some flow of gas particles.,00:09:28.720,00:09:30.530
"We can talk about the
velocity of those things.",00:09:30.530,00:09:33.420
"And let's say even
when we are sort",00:09:33.420,00:09:35.130
"of being very non-equilibrium
and thinking about velocity",00:09:35.130,00:09:39.460
"of those particles going from
one side to the other side,",00:09:39.460,00:09:43.550
"we really don't care which
particle among the 10 to the 23",00:09:43.550,00:09:48.060
"is at some instant
of time contributing",00:09:48.060,00:09:50.520
"to the velocity of the
gas that is swishing past.",00:09:50.520,00:09:55.130
"So clearly, any physical
observable that we make",00:09:55.130,00:09:59.720
"is something that
does not require",00:09:59.720,00:10:03.780
all of those degrees of freedom.,00:10:03.780,00:10:05.890
"So let's just construct
some of those things",00:10:05.890,00:10:08.060
"that we may find
useful and see how",00:10:08.060,00:10:10.480
"we would describe
evolutions of them.",00:10:10.480,00:10:13.170
"I mean, the most useful
thing, indeed, is the density.",00:10:13.170,00:10:16.020
"So what I could do
is I can actually",00:10:16.020,00:10:19.850
"construct a
one-particle density.",00:10:19.850,00:10:23.210
"So I want to look at
some position in space",00:10:23.210,00:10:26.455
"at some time t and
ask whether or not",00:10:26.455,00:10:30.530
there are particles there.,00:10:30.530,00:10:34.960
"I don't care which
one of the particles.",00:10:34.960,00:10:37.220
"Actually, let's put in a
little bit more information;",00:10:37.220,00:10:40.300
"also, keep track of whether,
at some instant of time,",00:10:40.300,00:10:44.090
"I see at this
location particles.",00:10:44.090,00:10:47.350
"And these particles,
I will also ask",00:10:47.350,00:10:49.370
which direction they are moving.,00:10:49.370,00:10:51.020
"Maybe I'm also going
to think about the case",00:10:51.020,00:10:53.650
"where, in the intermediate,
I am flowing from one side",00:10:53.650,00:10:57.640
to another.,00:10:57.640,00:10:58.270
"And keeping track of both
of these is important.",00:10:58.270,00:11:01.840
"I said I don't care which
one of these particles",00:11:01.840,00:11:06.510
is contributing.,00:11:06.510,00:11:09.340
"So that means that I have
to sum over all particles",00:11:09.340,00:11:18.180
"and ask whether
or not, at time t,",00:11:18.180,00:11:23.345
"there is a particle at
location q with momentum p.",00:11:23.345,00:11:29.818
"So these delta functions are
supposed to enforce that.",00:11:32.890,00:11:37.490
"And again, I'm not thinking
about an individual trajectory,",00:11:37.490,00:11:41.860
"because I think, more or
less, all of the trajectories",00:11:41.860,00:11:44.750
"are going to behave
the same way.",00:11:44.750,00:11:46.970
"And so what I will do
is I take an ensemble",00:11:46.970,00:11:50.940
average of this quantity.,00:11:50.940,00:11:53.161
OK?,00:11:53.161,00:11:53.660
So what does that mean?,00:11:53.660,00:11:55.300
"To do an ensemble
average, we said",00:11:55.300,00:11:57.650
"I have to integrate the
density function, rho,",00:11:57.650,00:12:04.200
"which depends on all
of the coordinates.",00:12:04.200,00:12:06.970
"So I have coordinate
for particle one,",00:12:06.970,00:12:09.910
"coordinate-- particle and
momentum, particle and momentum",00:12:09.910,00:12:14.780
"for particle two,
for particle three,",00:12:14.780,00:12:17.690
"all the way to
particle number N.",00:12:17.690,00:12:22.750
"And this is something
that depends on time.",00:12:22.750,00:12:24.970
"That's where the time
dependence comes from.",00:12:24.970,00:12:26.920
"And again, let's think
about the time dependence",00:12:26.920,00:12:29.030
"where 0 is you
lift the partition",00:12:29.030,00:12:31.620
"and you allow things to
go from one to the other.",00:12:31.620,00:12:34.750
"So there is a non-equilibrium
process that you are following.",00:12:34.750,00:12:38.950
"What I need to do is I have
to multiply this density",00:12:38.950,00:12:44.120
"with the function that I
have to consider the average.",00:12:44.120,00:12:50.130
"Well, the function being a
delta function, it's very nice.",00:12:50.130,00:12:53.790
"The first term in the sum,
we'll set simply q1 equals to q.",00:12:53.790,00:12:59.980
"And it will set p1
equals to p when",00:12:59.980,00:13:04.440
"I do the integration
over p1 and q1.",00:13:04.440,00:13:08.490
"But then I'm left to have to do
the integration over particle",00:13:08.490,00:13:12.940
"two, particle three,
particle four, and so forth.",00:13:12.940,00:13:20.155
OK?,00:13:20.155,00:13:21.580
"But this is only the
first term in the sum.",00:13:21.580,00:13:24.930
"Then I have to write the
sum for particle number two,",00:13:24.930,00:13:27.480
"particle number
three, et cetera.",00:13:27.480,00:13:30.220
"But all of the particles,
as far as I'm concerned,",00:13:30.220,00:13:33.070
are behaving the same way.,00:13:33.070,00:13:34.720
"So I just need to multiply
this by a factor of N.",00:13:34.720,00:13:44.510
"Now, this is something that
actually we encountered before.",00:13:44.510,00:13:49.700
"Recall that this rho is a
joint probability distribution.",00:13:49.700,00:13:54.500
"It's a joint
probability distribution",00:13:54.500,00:13:56.600
"of all N particles, their
locations, and momentum.",00:13:56.600,00:14:01.010
"And we gave a name to taking
a joint probability density",00:14:01.010,00:14:10.510
"function, which this
is, and integrating",00:14:10.510,00:14:13.180
over some subset of variables.,00:14:13.180,00:14:16.266
"The answer is an unconditional
probability distribution.",00:14:16.266,00:14:21.150
"So essentially, the
end of this story",00:14:21.150,00:14:24.380
"is if I integrate
over coordinates",00:14:24.380,00:14:27.630
"of two all the way to N, I will
get an unconditional result",00:14:27.630,00:14:32.060
"pertaining to the first
set of coordinate.",00:14:32.060,00:14:34.840
"So this is the same thing
up to a factor of N--",00:14:34.840,00:14:38.470
"the unconditional probability
that I will call rho one.",00:14:38.470,00:14:43.110
"Actually, I should
have called this f1.",00:14:43.110,00:14:44.885
"So this is something
that is defined",00:14:47.830,00:14:50.570
to be the one particle density.,00:14:50.570,00:14:52.470
"I don't know why this name stuck
to it, because this one, that",00:14:58.540,00:15:04.430
"is up to a factor of
N different from it,",00:15:04.430,00:15:07.220
"is our usual unconditional
probability for one particle.",00:15:07.220,00:15:13.340
"So this is rho of p1 being
p, q1 being q at time.",00:15:13.340,00:15:28.944
OK?,00:15:28.944,00:15:30.850
"So essentially, what I've said
is I have a joint probability.",00:15:30.850,00:15:35.930
"I'm really interested
in one of the particles,",00:15:35.930,00:15:37.990
"so I just integrate
over all the others.",00:15:37.990,00:15:41.890
"And this is kind of
not very elegant,",00:15:41.890,00:15:47.190
"but that's somehow
the way that it",00:15:47.190,00:15:49.100
has appeared in the literature.,00:15:49.100,00:15:51.090
"The entity that I
have on the right",00:15:51.090,00:15:53.790
"is the properly
normalized probability.",00:15:53.790,00:15:59.730
"Once I multiply by N, it's a
quantity this is called f1.",00:15:59.730,00:16:05.960
"And it's called a density
and used very much",00:16:05.960,00:16:10.130
in the literature.,00:16:10.130,00:16:12.170
OK?,00:16:12.170,00:16:13.236
"And that's the thing that
I think will be useful.",00:16:13.236,00:16:16.240
"Essentially, all of
the things that I",00:16:16.240,00:16:20.420
"know about observations
of a system,",00:16:20.420,00:16:23.020
"such as its density,
its velocity, et cetera,",00:16:23.020,00:16:26.870
"I should be able
to get from this.",00:16:26.870,00:16:30.080
"Sometimes we need a little
bit more information,",00:16:30.080,00:16:33.800
"so I allow for the
possibility that I may also",00:16:33.800,00:16:36.610
"need to focus on a
two-particle density, where",00:16:36.610,00:16:41.570
"I keep information pertaining
to two particles at time t",00:16:41.570,00:16:48.710
"and I integrate over everybody
else that I'm not interested.",00:16:48.710,00:16:52.570
"So I introduce an integration
over coordinates number",00:16:52.570,00:16:58.180
"two-- sorry, number
three all the way to N",00:16:58.180,00:17:03.720
"to not have to repeat this
combination all the time.",00:17:03.720,00:17:09.280
"The 6N-dimensional
phase space for particle",00:17:09.280,00:17:12.520
i I will indicate by dVi.,00:17:12.520,00:17:15.839
"So I take the full N particle
density, if you like,",00:17:15.839,00:17:24.329
"integrate over
everybody except 2.",00:17:24.329,00:17:28.160
"And up to a normalization
of NN minus 1,",00:17:28.160,00:17:32.950
"this is called a
two-particle density.",00:17:32.950,00:17:35.940
"And again, absent
this normalization,",00:17:35.940,00:17:41.160
"this is simply the
unconditional probability",00:17:41.160,00:17:44.750
"that I would construct out
of this joint probability",00:17:44.750,00:17:47.592
[INAUDIBLE].,00:17:47.592,00:17:48.092
"And just for some mathematical
purposes, the generalization",00:17:55.970,00:18:00.340
"of this to S particles,
we will call fs.",00:18:00.340,00:18:05.370
"So this depends on p1
through qs at time t.",00:18:05.370,00:18:11.510
"And this is going to
be N factorial divided",00:18:11.510,00:18:14.740
"by N minus S
factorial in general.",00:18:14.740,00:18:18.910
"And they join the unconditional
probability that depends on S",00:18:18.910,00:18:24.110
"coordinates p1
through qs at time t.",00:18:24.110,00:18:29.466
OK?,00:18:34.312,00:18:34.812
"You'll see why I need
these higher ones",00:18:37.740,00:18:40.860
"although, in reality, all my
interest is on this first one,",00:18:40.860,00:18:47.620
"because practically
everything that I need",00:18:47.620,00:18:50.120
"to know about this initial
experiment that I set up",00:18:50.120,00:18:54.190
"and how a gas expands I
should be able to extract",00:18:54.190,00:18:57.550
from this one-particle density.,00:18:57.550,00:19:00.004
OK?,00:19:00.004,00:19:02.220
So how do I calculate this?,00:19:02.220,00:19:05.350
"Well, what I would
need to do is to look",00:19:05.350,00:19:08.770
"at the time variation
of fs with t",00:19:08.770,00:19:15.150
"to calculate the time dependence
of any one of these quantities.",00:19:15.150,00:19:20.290
"Ultimately, I want to have
an equation for df1 by dt.",00:19:20.290,00:19:24.040
But let's write the general one.,00:19:24.040,00:19:26.330
"So the general one is up
to, again, this N factorial,",00:19:26.330,00:19:33.850
"N minus s factorial
and integral over",00:19:33.850,00:19:44.510
"coordinates that I'm not
interested, of d rho by dt.",00:19:44.510,00:19:50.740
OK?,00:19:55.830,00:19:56.380
"So I just take the time
derivative inside the integral,",00:19:56.380,00:20:01.080
"because I know how
d rho by dt evolves.",00:20:01.080,00:20:04.580
"And so this is going to be
simply the Poisson bracket of H",00:20:04.580,00:20:11.900
and rho.,00:20:11.900,00:20:13.190
And I would proceed from there.,00:20:13.190,00:20:14.540
"Actually, to proceed
further and in order",00:20:17.980,00:20:20.150
"to be able to say things
that are related to physics,",00:20:20.150,00:20:25.870
"I need to say something
about the Hamiltonian.",00:20:25.870,00:20:28.410
"I can't do so in the
most general case.",00:20:28.410,00:20:32.940
"So let's write the
kind of Hamiltonian",00:20:32.940,00:20:35.030
"that we are interested
and describes the gas-- so",00:20:35.030,00:20:39.930
"the Hamiltonian for
the gas in this room.",00:20:39.930,00:20:44.530
"One term is simply
the kinetic energy.",00:20:44.530,00:20:46.640
"Another term is
that gas particles",00:20:52.360,00:20:55.420
are confined by some potential.,00:20:55.420,00:20:57.520
"The potential could be as easy
as the walls of this room.",00:20:57.520,00:21:01.740
"Or it could be some
more general potential",00:21:01.740,00:21:05.370
"that could include gravity,
whatever else you want.",00:21:05.370,00:21:09.660
"So let's include
that possibility.",00:21:09.660,00:21:14.850
"So these are so-called
one-body terms,",00:21:14.850,00:21:17.680
"because they pertain to the
coordinates of one particle.",00:21:17.680,00:21:21.670
"And then there are
two-body terms.",00:21:21.670,00:21:24.225
"So for example, I could look
at all pairs of particles.",00:21:24.225,00:21:27.840
"Let's say i not equal to j
to avoid self-interaction.",00:21:27.840,00:21:33.480
V of qi minus qj.,00:21:33.480,00:21:36.730
"So certainly, two particles
in this gas in this room,",00:21:36.730,00:21:40.910
"when they get close
enough, they certainly",00:21:40.910,00:21:44.760
can pass through each other.,00:21:44.760,00:21:46.290
They each have a size.,00:21:46.290,00:21:47.840
"But even when they are
a few times their sizes,",00:21:47.840,00:21:51.970
"they start to feel
some interaction, which",00:21:51.970,00:21:54.120
causes them to collide.,00:21:54.120,00:21:55.270
Yes.,00:21:55.270,00:21:56.269
"AUDIENCE: The whole
series of arguments",00:21:56.269,00:21:58.145
"that we're developing,
do these only hold",00:21:58.145,00:22:00.021
for time-independent potentials?,00:22:00.021,00:22:01.897
PROFESSOR: Yes.,00:22:01.897,00:22:04.620
"Although, it is not that
difficult to sort of",00:22:04.620,00:22:07.820
"go through all of
these arguments",00:22:07.820,00:22:10.200
"and see where the corresponding
modifications are going to be.",00:22:10.200,00:22:13.940
"But certainly, the
very first thing",00:22:13.940,00:22:15.860
"that we are using, which is
this one, we kind of implicitly",00:22:15.860,00:22:21.030
"assume the time-independent
Hamiltonian.",00:22:21.030,00:22:23.810
"So you have to start changing
things from that point.",00:22:23.810,00:22:27.370
OK?,00:22:30.615,00:22:31.115
"So in principle, you could
have three-body and higher body",00:22:34.090,00:22:37.071
terms.,00:22:37.071,00:22:37.570
"But essentially, most
of the relevant physics",00:22:37.570,00:22:40.990
is captured by this.,00:22:40.990,00:22:42.330
"Even for things
like plasmas, this",00:22:42.330,00:22:44.970
"would be a reasonably
good approximation,",00:22:44.970,00:22:48.400
"with the Coulomb
interaction appearing here.",00:22:48.400,00:22:51.630
OK?,00:22:51.630,00:22:53.860
"Now, what I note is that what
I have to calculate over here",00:22:53.860,00:23:00.500
is a Poisson bracket.,00:23:00.500,00:23:04.710
"And then I have to integrate
that Poisson bracket.",00:23:04.710,00:23:08.760
"Poisson bracket
involves a whole bunch",00:23:08.760,00:23:10.860
"of derivatives over
all set of quantities.",00:23:10.860,00:23:14.620
"And I realize that when I'm
integrating over derivatives,",00:23:14.620,00:23:20.200
"there are
simplifications that can",00:23:20.200,00:23:22.280
"take place, such as
integration by parts.",00:23:22.280,00:23:25.410
"But that only will take
place when the derivative",00:23:25.410,00:23:30.260
"is one of the variables
that is being integrated.",00:23:30.260,00:23:34.590
"Now, this whole process has
separated out arguments of rho,",00:23:34.590,00:23:41.370
"as far as this
expression is concerned,",00:23:41.370,00:23:44.100
"into two sets-- one set, or the
set that is appearing out here,",00:23:44.100,00:23:48.980
"the first s ones that don't
undergo the integration,",00:23:48.980,00:23:53.820
"and then the remainder that
do undergo the integration.",00:23:53.820,00:23:58.250
"So this is going to be relevant
when we do our manipulations.",00:23:58.250,00:24:02.020
"And therefore, it is useful
to rewrite this Hamiltonian",00:24:02.020,00:24:06.400
in terms of three entities.,00:24:06.400,00:24:07.725
"The first one that I call
H sub s-- so if you like,",00:24:12.560,00:24:15.660
"this is an end
particle Hamiltonian.",00:24:15.660,00:24:18.550
"I can write an H sub s, which
is just exactly the same thing,",00:24:18.550,00:24:22.720
"except that it
applies to coordinates",00:24:22.720,00:24:25.560
