text,start,stop
that f ( 0 ) = 0.,00:45:48.660,00:45:50.780
"Again, common sense.",00:45:50.780,00:45:52.560
"You're allowed to use
your common sense.",00:45:52.560,00:45:54.590
"You're allowed to notice
a value of the",00:45:54.590,00:45:56.250
function and put it in.,00:45:56.250,00:45:58.320
"So there's nothing
wrong with that.",00:45:58.320,00:46:00.270
"If you happen to have
such a value.",00:46:00.270,00:46:03.960
"So, now we can guess what
our function is",00:46:03.960,00:46:06.060
going to look like.,00:46:06.060,00:46:06.650
"It's going to maybe come
down like this.",00:46:06.650,00:46:10.010
Come up like this.,00:46:10.010,00:46:11.670
And come down like this.,00:46:11.670,00:46:13.130
"That could be what
it looks like.",00:46:13.130,00:46:15.230
"But, you know, another
possibility is it sort of",00:46:15.230,00:46:17.390
"comes along here and
goes out that way.",00:46:17.390,00:46:19.820
"Comes along here and goes
out that way, who knows?",00:46:19.820,00:46:22.260
"It happens, by the way, that
it's an odd function.",00:46:22.260,00:46:25.280
Right?,00:46:25.280,00:46:25.570
Those are all odd powers.,00:46:25.570,00:46:26.640
"So, actually, it's symmetric
on the right half",00:46:26.640,00:46:28.710
and the left half.,00:46:28.710,00:46:29.860
And crosses at 0.,00:46:29.860,00:46:31.610
"So everything that we do on the
right is going to be the",00:46:31.610,00:46:33.310
"same as what happens
on the left.",00:46:33.310,00:46:34.530
"That's another piece
of common sense.",00:46:34.530,00:46:36.620
"You want to make use of that as
much as possible, whenever",00:46:36.620,00:46:39.000
you're drawing anything.,00:46:39.000,00:46:40.060
"Don't want to throw
out information.",00:46:40.060,00:46:42.340
"So this function happens
to be odd.",00:46:42.340,00:46:46.540
"Odd, and f ( 0 ) = 0.",00:46:46.540,00:46:48.700
"I'm considering those to be
kinds of precalculus skills",00:46:48.700,00:46:52.520
"that I want you to use
as much as you can.",00:46:52.520,00:47:00.610
"So now, here's the first feature
which is unfortunately",00:47:00.610,00:47:03.990
"ignored in most discussions
of functions.",00:47:03.990,00:47:08.880
"And it's strange, because
nowadays we",00:47:08.880,00:47:11.340
have graphing things.,00:47:11.340,00:47:13.380
"And it's really the only part
of the exercise that you",00:47:13.380,00:47:19.410
"couldn't do, at least on this
relatively simpleminded level,",00:47:19.410,00:47:26.420
with a graphing calculator.,00:47:26.420,00:47:28.180
"And that is what I would call
the ends of the problem.",00:47:28.180,00:47:33.790
"So what happens off the screen,
is the question.",00:47:33.790,00:47:37.000
"And that basically is the
theoretical part of the",00:47:37.000,00:47:39.600
"problem that you have
to address.",00:47:39.600,00:47:41.430
You can program this.,00:47:41.430,00:47:42.920
"You can draw all the pictures
that you want.",00:47:42.920,00:47:45.410
"But what you won't see is
what's off the screen.",00:47:45.410,00:47:48.190
"You need to know something
to figure out",00:47:48.190,00:47:50.260
what's off the screen.,00:47:50.260,00:47:51.780
"So, in this case, I'm talking
about what's off the screen",00:47:51.780,00:47:54.560
"going to the right, or
going to the left.",00:47:54.560,00:48:01.930
So let's check the ends.,00:48:01.930,00:48:06.100
"So here, let's just
take a look.",00:48:06.100,00:48:07.680
"We have the function f(x), which
is, sorry, 3x - x^3.",00:48:07.680,00:48:12.280
"Again this is a precalculus
sort of thing.",00:48:12.280,00:48:14.620
"And we're imagining now,
let's just do x",00:48:14.620,00:48:16.650
goes to plus infinity.,00:48:16.650,00:48:18.360
So what happens here.,00:48:18.360,00:48:19.670
"When x is gigantic, this term
is completely negligible.",00:48:19.670,00:48:25.460
"And it just behaves like -
x^3, which goes to minus",00:48:25.460,00:48:29.410
"infinity as x goes
to plus infinity.",00:48:29.410,00:48:32.600
"And similarly, f (x) goes to
plus infinity if x goes to",00:48:32.600,00:48:42.170
minus infinity.,00:48:42.170,00:48:46.150
"Now let me pull down this
picture again, and show you",00:48:46.150,00:48:50.060
"what piece of the information
we've got.",00:48:50.060,00:48:53.140
"We now know that it is
heading up this way.",00:48:53.140,00:48:55.610
"It doesn't go like this,
it goes up like that.",00:48:55.610,00:48:58.560
"And I'm going to put an
arrow for it, And it's",00:48:58.560,00:49:00.470
going down like this.,00:49:00.470,00:49:02.580
"Heading down to minus infinity
as x goes out",00:49:02.580,00:49:06.210
farther to the right.,00:49:06.210,00:49:07.310
"And going out to plus infinity
as x goes farther to the left.",00:49:07.310,00:49:15.120
"So now there's hardly
anything left of",00:49:15.120,00:49:19.270
this function to describe.,00:49:19.270,00:49:21.910
"There's really nothing left
except maybe decoration.",00:49:21.910,00:49:27.120
"And we kind of like that
decoration, so we will pay",00:49:27.120,00:49:31.540
attention to it.,00:49:31.540,00:49:32.560
"And to do that, we'll have to
check the second derivative.",00:49:32.560,00:49:35.580
"So if we differentiate a
second time, the first",00:49:35.580,00:49:38.200
"derivative was, remember,
3 - 3x^2.",00:49:38.200,00:49:42.680
"So the second derivative
is - 6x.",00:49:42.680,00:49:53.540
"So now we notice that f'' (x) is
negative if x is positive.",00:49:53.540,00:50:02.470
"And f'' ( x) is positive
if x is negative.",00:50:02.470,00:50:08.310
"And so in this part
it's concave down.",00:50:08.310,00:50:13.170
"And in this part it's
concave up.",00:50:13.170,00:50:18.990
"And now I'm going to switch
the boards so that",00:50:18.990,00:50:21.170
"you'll, and draw it.",00:50:21.170,00:50:24.860
"And you see that it was begging
to be this way.",00:50:24.860,00:50:30.630
"So we'll fill in the
rest of it here.",00:50:30.630,00:50:32.960
Maybe in a nice color here.,00:50:32.960,00:50:35.560
"So this is the whole graph and
this is the correct graph.",00:50:35.560,00:50:38.100
"It comes down in one swoop down
here, and comes up here.",00:50:38.100,00:50:41.450
"And then it changes to concave
down right at the origin.",00:50:41.450,00:50:46.620
"So this point is of interest,
not only because it's the",00:50:46.620,00:50:49.670
"place where it crosses the axis,
but it's also what's",00:50:49.670,00:50:52.630
called an inflection point.,00:50:52.630,00:51:00.690
"Inflection point, that's a point
where because f'' at",00:51:00.690,00:51:04.170
that place is equal to 0.,00:51:04.170,00:51:07.620
"So it's a place where the
second derivative is 0.",00:51:07.620,00:51:10.970
"We also consider those to
be interesting points.",00:51:10.970,00:51:15.160
"Now, so let me just making
one closing remark here.",00:51:15.160,00:51:21.010
"Which is that all of this
information fits together.",00:51:21.010,00:51:26.590
"And we're going to have much,
much harder examples of this",00:51:26.590,00:51:29.610
"where you'll actually have to
think about what's going on.",00:51:29.610,00:51:32.570
"But there's a lot of stuff
protecting you.",00:51:32.570,00:51:35.190
"And functions will behave
themselves and turn around",00:51:35.190,00:51:39.990
appropriately.,00:51:39.990,00:51:40.920
"Anyway, we'll talk about
it next time.",00:51:40.920,00:51:43.570
