text,start,stop
"The following content is
provided under a Creative",00:00:00.090,00:00:02.330
Commons license.,00:00:02.330,00:00:03.610
"Your support will help MIT
OpenCourseWare continue to",00:00:03.610,00:00:06.710
"offer high quality educational
resources for free.",00:00:06.710,00:00:10.010
"To make a donation or to view
additional materials from",00:00:10.010,00:00:12.850
"hundreds of MIT courses, visit
MIT OpenCourseWare at",00:00:12.850,00:00:16.880
ocw.mit.edu.,00:00:16.880,00:00:22.180
PROF.,00:00:22.180,00:00:22.240
"JERISON: So, we're ready to
begin Lecture 10, and what I'm",00:00:22.240,00:00:25.940
"going to begin with is
by finishing up some",00:00:25.940,00:00:29.060
things from last time.,00:00:29.060,00:00:33.880
"We'll talk about approximations,
and I want to",00:00:33.880,00:00:42.810
"fill in a number of comments and
get you a little bit more",00:00:42.810,00:00:50.420
"oriented in the point of view
that I'm trying to express",00:00:50.420,00:00:54.350
about approximations.,00:00:54.350,00:00:55.980
"So, first of all, I want to
remind you of the actual",00:00:55.980,00:00:59.740
"applied example that I
wrote down last time.",00:00:59.740,00:01:03.800
"So that was this
business here.",00:01:03.800,00:01:08.730
"There was something from
special relativity.",00:01:08.730,00:01:11.590
"And the approximation that
we used was the linear",00:01:11.590,00:01:15.990
"approximation, with a - 1/2
power that comes out to be t(",00:01:15.990,00:01:20.360
1 1/2 v^2 / C^2).,00:01:20.360,00:01:23.730
"I want to reiterate why
this is a useful way",00:01:27.340,00:01:30.290
of thinking of things.,00:01:30.290,00:01:31.930
"And why this is that this
comes up in real life.",00:01:31.930,00:01:34.830
"Why this is maybe more important
than everything that",00:01:34.830,00:01:37.200
"I've taught you about
technically so far.",00:01:37.200,00:01:39.820
"So, first of all, what this is
telling us is the change in t",00:01:39.820,00:01:46.750
"/ t, if you do the arithmetic
here and subtract t that's",00:01:46.750,00:01:51.440
"using the change in
t is t' - t here.",00:01:51.440,00:01:55.970
"If you work that out, this is
approximately the same as 1/2",00:01:55.970,00:02:01.440
(v^2 / C^2).,00:02:01.440,00:02:04.140
So what is this saying?,00:02:04.140,00:02:06.270
"This is saying that if you have
this satellite, which is",00:02:06.270,00:02:08.670
"going at speed v, and little c
is the speed of light, then",00:02:08.670,00:02:13.280
"the change in the watch down
here on earth, relative to the",00:02:13.280,00:02:18.220
"time on the satellite, is going
to be proportional to",00:02:18.220,00:02:22.270
this ratio here.,00:02:22.270,00:02:24.050
"So, physically, this
makes sense.",00:02:24.050,00:02:25.710
This is time divided by time.,00:02:25.710,00:02:28.120
"And this is velocity squared
divided by velocity squared.",00:02:28.120,00:02:30.670
"So, in each case, the
units divide out.",00:02:30.670,00:02:32.620
"So this is a dimensionless
quantity.",00:02:32.620,00:02:34.880
"And this is a dimensionless
quantity.",00:02:34.880,00:02:36.960
"And the only point here that
we're trying to make is just",00:02:36.960,00:02:41.560
this notion of proportionality.,00:02:41.560,00:02:43.440
So I want to write this down.,00:02:43.440,00:02:45.470
"Just, in summary.",00:02:45.470,00:02:48.010
"So the error fraction, if you
like, which is sort of the",00:02:48.010,00:02:51.100
"number of significant digits
that we have in our",00:02:51.100,00:02:55.030
"measurement, is proportional,
in this",00:02:55.030,00:03:00.390
"case, to this quantity.",00:03:00.390,00:03:04.860
"It happens to be proportional
to this quantity here.",00:03:04.860,00:03:09.030
"And the factor is, happens
to be, 1/2.",00:03:09.030,00:03:16.980
"So these proportionality
factors are what",00:03:16.980,00:03:20.450
we're looking for.,00:03:20.450,00:03:21.350
Their rates of change.,00:03:21.350,00:03:22.590
"Their rates of change of
something with respect to",00:03:22.590,00:03:24.380
something else.,00:03:24.380,00:03:25.550
"Now, on your homework,
you have something",00:03:25.550,00:03:28.800
rather similar to this.,00:03:28.800,00:03:30.740
"So in Problem, on Part 2b, Part
II, Problem 1, there's",00:03:30.740,00:03:38.880
"the speed of a pitch, right?",00:03:38.880,00:03:41.580
"And the speed of the pitch is
changing depending on how high",00:03:41.580,00:03:44.640
the mound is.,00:03:44.640,00:03:45.600
"And the point here is that
that's approximately",00:03:45.600,00:03:48.390
"proportional to the change in
the height of the mound.",00:03:48.390,00:03:52.320
"In that problem, we had this
delta h, that was the x",00:03:52.320,00:03:55.390
variable in that problem.,00:03:55.390,00:03:56.890
"And what you're trying to
figure out is what the",00:03:56.890,00:03:58.780
"constant of proportionality
is.",00:03:58.780,00:04:03.350
"That's what you're aiming
for in this problem.",00:04:03.350,00:04:04.820
"So there's a linear
relationship, approximately,",00:04:04.820,00:04:08.070
"to all intents and purposes
this is an equality.",00:04:08.070,00:04:11.890
"Because the lower
order terms are",00:04:11.890,00:04:13.290
unimportant for the problem.,00:04:13.290,00:04:14.720
"Just as over here, this function
is a little bit",00:04:14.720,00:04:17.120
complicated.,00:04:17.120,00:04:18.020
"This function is a little
more simple.",00:04:18.020,00:04:19.800
"For the purposes of this
problem, they are the same.",00:04:19.800,00:04:22.800
"Because the errors are
negligible for the particular",00:04:22.800,00:04:28.240
problem that we're working on.,00:04:28.240,00:04:29.760
"So we might as well work with
the simpler relationship.",00:04:29.760,00:04:34.210
"And similarly, over here, so
you could do this with, in",00:04:34.210,00:04:37.920
"this case with square roots,
it's not so hard here with",00:04:37.920,00:04:40.280
reciprocals of square roots.,00:04:40.280,00:04:41.980
"It's also not terribly hard
to do it numerically.",00:04:41.980,00:04:45.300
"And the reason why we're not
doing it numerically is that,",00:04:45.300,00:04:49.030
"as I say, this is something
that happens all across",00:04:49.030,00:04:52.570
engineering.,00:04:52.570,00:04:53.560
"People are looking for these
linear relationships between",00:04:53.560,00:04:56.040
"the change in some input and
the change in the output.",00:04:56.040,00:05:00.240
"And if you don't make these
simplifications, then when you",00:05:00.240,00:05:03.910
"get, say, a dozen of them
together, you can't figure out",00:05:03.910,00:05:07.680
what's going on.,00:05:07.680,00:05:09.540
In this case the design of the,00:05:09.540,00:05:11.090
"satellite, it's very important.",00:05:11.090,00:05:12.640
"The speed actually isn't
just one speed.",00:05:12.640,00:05:15.160
"Because it's the relative speed
of u to the satellite.",00:05:15.160,00:05:19.070
"And you might be, it depends
on your angle of sight with",00:05:19.070,00:05:21.750
"the satellite what
the speed is.",00:05:21.750,00:05:22.890
So it varies quite a bit.,00:05:22.890,00:05:24.300
"So you really need this
rule of thumb.",00:05:24.300,00:05:26.280
"Then there are all
kinds of other",00:05:26.280,00:05:27.640
considerations in this question.,00:05:27.640,00:05:29.080
"Like, for example, there's the
fact that we're sitting on",00:05:29.080,00:05:31.530
"Earth and so we're rotating
around on what's called a",00:05:31.530,00:05:34.250
non-inertial frame.,00:05:34.250,00:05:36.250
"So there's the question
of that acceleration.",00:05:36.250,00:05:38.790
"There's the question that the
gravity that I experience here",00:05:38.790,00:05:41.220
"on Earth is not the same
as up at the satellite.",00:05:41.220,00:05:44.830
"And that also creates a
difference in time, as a",00:05:44.830,00:05:48.070
result of general relativity.,00:05:48.070,00:05:49.580
"So all of these considerations
come down to formulas which",00:05:49.580,00:05:54.470
"are this complicated or
maybe a tiny bit more.",00:05:54.470,00:05:56.910
Not really that much.,00:05:56.910,00:05:58.330
"And then people simplify them
enormously to these very",00:05:58.330,00:06:00.700
simple-minded rules.,00:06:00.700,00:06:02.090
"And they don't keep track
of what's going on.",00:06:02.090,00:06:05.130
"So in order to design the
system, you must make these",00:06:05.130,00:06:08.070
"simplifications, otherwise you
can't even think about",00:06:08.070,00:06:10.440
what's going on.,00:06:10.440,00:06:12.630
This comes up in everything.,00:06:12.630,00:06:13.860
"In weather forecasting,
economic forecasting.",00:06:13.860,00:06:17.680
"Figuring out whether there's
going to be an asteroid that's",00:06:17.680,00:06:19.880
going to hit the Earth.,00:06:19.880,00:06:22.140
"Every single one of these things
involves dozens of",00:06:22.140,00:06:24.580
these considerations.,00:06:24.580,00:06:27.900
"OK, there was a question
that I saw, here.",00:06:27.900,00:06:30.050
Yes.,00:06:30.050,00:06:30.450
STUDENT: [INAUDIBLE],00:06:30.450,00:06:38.920
PROF.,00:06:38.920,00:06:39.320
JERISON: Yeah.,00:06:39.320,00:06:40.120
"Basically, any problem where
you have a derivative, the",00:06:40.120,00:06:42.600
"rate of change also depends upon
what the base point is.",00:06:42.600,00:06:46.100
That's the question.,00:06:46.100,00:06:46.850
"You're saying, doesn't this
delta v also depend, I had a",00:06:46.850,00:06:50.060
base point in that problem.,00:06:50.060,00:06:51.050
"I happened to decide that
pitchers pitch on average",00:06:51.050,00:06:53.290
about 90 miles an hour.,00:06:53.290,00:06:55.350
"Whereas, in fact, some pitchers
pitch at 100 miles an",00:06:55.350,00:06:58.390
"hour, some pitch at 80 miles
an hour, and of course they",00:06:58.390,00:07:00.410
vary the speed of the pitch.,00:07:00.410,00:07:02.040
"And so, this varies
a little bit.",00:07:02.040,00:07:03.510
"In fact, that's sort of
a second order effect.",00:07:03.510,00:07:05.165
"It does change the constant
of proportionality.",00:07:05.165,00:07:08.220
"It's a rate of change at
a different base point.",00:07:08.220,00:07:11.790
Which we're considering fixed.,00:07:11.790,00:07:14.230
"In fact, that's sort of
a second order effect.",00:07:14.230,00:07:17.060
"When you actually do the
computations, what you",00:07:17.060,00:07:19.250
"discover is that it doesn't
make that much difference.",00:07:19.250,00:07:21.940
To the a.,00:07:21.940,00:07:22.630
"And that's something that
you get from experience.",00:07:22.630,00:07:25.040
"That it turns out, which
things matter and",00:07:25.040,00:07:28.270
which things don't.,00:07:28.270,00:07:28.980
"And yet again, that's exactly
the same sort of consideration",00:07:28.980,00:07:31.820
"but at the next order of what
I'm talking about here is.",00:07:31.820,00:07:34.670
"You have to have enough
experience with numbers to",00:07:34.670,00:07:36.540
"know that if you take, if you
vary something a little bit",00:07:36.540,00:07:39.210
"it's not going to change
the answer that you're",00:07:39.210,00:07:40.950
looking for very much.,00:07:40.950,00:07:42.680
"And that's exactly the point
that I'm making.",00:07:42.680,00:07:45.530
"So I can't make them all at
once, all such points.",00:07:45.530,00:07:51.830
"So that's my pitch for
understanding things from this",00:07:51.830,00:07:55.590
point of view.,00:07:55.590,00:07:56.470
"Now, we're going to go
on, now, to quadratic",00:07:56.470,00:08:00.090
"approximations, which are a
little more complicated.",00:08:00.090,00:08:13.290
"So, we talked a little bit about
this last time but I",00:08:13.290,00:08:16.110
didn't finish.,00:08:16.110,00:08:16.850
So I want to finish this up.,00:08:16.850,00:08:19.930
"And the first thing that I
should say is that you use the",00:08:19.930,00:08:26.920
"when the linear approximation
is not enough.",00:08:26.920,00:08:35.680
"OK, so, that's something that
you really need to get a",00:08:35.680,00:08:38.660
little experience with.,00:08:38.660,00:08:40.390
"In economics, I told you they
use logarithms. So sometimes",00:08:40.390,00:08:44.480
they use log linear functions.,00:08:44.480,00:08:46.030
"Sometimes they use log quadratic
functions when the",00:08:46.030,00:08:48.190
log linear ones don't work.,00:08:48.190,00:08:49.860
"So most modeling in
economics is with",00:08:49.860,00:08:51.840
log quadratic functions.,00:08:51.840,00:08:53.730
"And if you've made it
any more complicated",00:08:53.730,00:08:55.250
"than that, it's useless.",00:08:55.250,00:08:56.740
And it's a mess.,00:08:56.740,00:08:57.850
And people don't do it.,00:08:57.850,00:08:58.810
"So they stick with the quadratic
ones, typically.",00:08:58.810,00:09:02.790
"So the basic formula here, and
I'm going to take the base",00:09:02.790,00:09:07.010
"point to be 0, is that f (
x ) is approximately f",00:09:07.010,00:09:10.745
( 0 ) f' ( 0 )x.,00:09:10.745,00:09:14.380
That's the linear part.,00:09:14.380,00:09:16.100
Plus this extra term.,00:09:16.100,00:09:17.520
Which is f'' ( 0 ) / 2x^2.,00:09:17.520,00:09:21.440
"And this is supposed to
work for x near 0.",00:09:21.440,00:09:27.740
"So it shows in the base point
as simply as possible.",00:09:27.740,00:09:34.310
"So here's more or less where
we left off last time.",00:09:34.310,00:09:38.060
"And one thing that I said I was
going to explain, which I",00:09:38.060,00:09:41.950
"will now, is why it's
(1/2) f'' ( 0 ).",00:09:41.950,00:09:48.390
So we need to know that.,00:09:48.390,00:09:51.610
"So let's work that out
here first of all.",00:09:51.610,00:09:54.770
"So I'm just going to
do it by example.",00:09:54.770,00:09:57.290
"So if you like, the answer is
just, well, what happens when",00:09:57.290,00:10:00.720
you have a parabola?,00:10:00.720,00:10:03.600
A parabola's a quadratic.,00:10:03.600,00:10:06.640
"It had better, its quadratic
approximation",00:10:06.640,00:10:08.750
had better be itself.,00:10:08.750,00:10:10.450
It's got to be the best one.,00:10:10.450,00:10:11.480
So it's got to be itself.,00:10:11.480,00:10:13.010
"So this formula, if it's
going to work, has",00:10:13.010,00:10:15.500
to work on the nose.,00:10:15.500,00:10:19.550
For quadratic functions.,00:10:19.550,00:10:21.890
"So, let's take a look.",00:10:21.890,00:10:23.770
"If I differentiate,
I get b 2cx.",00:10:23.770,00:10:28.130
"If I differentiate a second
time, I get 2c.",00:10:28.130,00:10:32.230
And now let's plug it in.,00:10:32.230,00:10:34.580
"Well, we can recover, what is
it that we want to recover?",00:10:34.580,00:10:39.450
"We want to recover these numbers
a, b and c using the",00:10:39.450,00:10:42.650
derivatives evaluated at 0.,00:10:42.650,00:10:45.930
So let's see.,00:10:45.930,00:10:49.500
"It's pretty easy, actually.
f ( 0 ) = a.",00:10:49.500,00:10:52.680
That's on the nose.,00:10:52.680,00:10:53.360
"If you plug in x = 0 here,
these terms drop",00:10:53.360,00:10:56.320
out and you get a.,00:10:56.320,00:10:58.070
"And now, f' ( 0 ), whoops
that was wrong.",00:10:58.070,00:11:02.220
"So I wrote f' but what
I meant was f.",00:11:02.220,00:11:05.100
So f ( 0 ) is a.,00:11:05.100,00:11:07.950
"Let's back up. f ( 0 ) is a, so
if I plug in x = 0 I get a.",00:11:07.950,00:11:13.130
"Now, f' ( 0 ), that's this next
formula here, f' ( 0 ), I",00:11:13.130,00:11:18.870
"plug in 0 here, and I get b.",00:11:18.870,00:11:21.180
That's also good.,00:11:21.180,00:11:22.230
"And that's exactly what the
linear approximation is",00:11:22.230,00:11:24.620
supposed to be.,00:11:24.620,00:11:25.540
"But now you notice, f'' is 2c.",00:11:25.540,00:11:28.480
"So to recover c, I better
take half of it.",00:11:28.480,00:11:34.440
And that's it.,00:11:34.440,00:11:35.120
That's the reason.,00:11:35.120,00:11:38.010
"There's no chance that any
other formula could work.",00:11:38.010,00:11:40.690
And this one does.,00:11:40.690,00:11:45.050
"So that's the explanation
for the formula.",00:11:45.050,00:11:50.310
"And now I remind you that I
had a collection of basic",00:11:50.310,00:11:53.700
formulas written on the board.,00:11:53.700,00:11:55.090
"And I want to just make sure
we know all of them again.",00:11:55.090,00:12:00.700
"So, first of all, there was
sine x is approximately x.",00:12:00.700,00:12:07.580
"Cosine x is approximately
1 - 1/2 x^2.",00:12:07.580,00:12:12.610
"And e ^ x is approximately
1 x 1/2 x^2.",00:12:12.610,00:12:19.230
"So those were three that
I mentioned last time.",00:12:19.230,00:12:22.230
"And, again, this is
all for x near 0.",00:12:22.230,00:12:28.980
All for x near 0 only.,00:12:28.980,00:12:31.160
"These are wildly wrong, Far
away, but near 0 they're nice,",00:12:31.160,00:12:35.760
"good, quadratic approximations.",00:12:35.760,00:12:37.730
"Now, the other two
approximations that I want to",00:12:37.730,00:12:39.800
"mention are the logarithm and we
use the base point shifted.",00:12:39.800,00:12:46.960
So we can put it at x near 0.,00:12:46.960,00:12:50.500
"And this one - sorry,
this is an",00:12:50.500,00:12:51.630
approximately equals sign there.,00:12:51.630,00:12:55.420
Turns out to be x - 1/2 x^2.,00:12:55.420,00:12:59.410
"And the last one is one (1 x)
^ r, which turns out to be 1",00:12:59.410,00:13:07.350
rx r ( r - 1) / 2x^2.,00:13:07.350,00:13:14.480
"Now, eventually, your mind will
converge on all of these",00:13:14.480,00:13:19.980
"and you'll find them relatively
easy to memorize.",00:13:19.980,00:13:23.380
"But it'll take some
getting used to.",00:13:23.380,00:13:25.820
"And I'm not claiming that you
should recognize them and",00:13:25.820,00:13:30.000
understand them all now.,00:13:30.000,00:13:32.370
"But I'm going to put a giant
box around this.",00:13:32.370,00:13:35.630
STUDENT: [INAUDIBLE],00:13:35.630,00:13:42.150
PROF.,00:13:42.150,00:13:42.293
JERISON: Yes.,00:13:42.293,00:13:42.580
"So the question was, you get all
of these if you use that",00:13:42.580,00:13:45.625
equation there.,00:13:45.625,00:13:45.775
"That's exactly what are you
going to do. so I already did",00:13:45.775,00:13:48.920
"it actually for these
three, last time.",00:13:48.920,00:13:52.350
"But I didn't do it yet
for these two.",00:13:52.350,00:13:55.880
"But I will do it in
about two minutes.",00:13:55.880,00:13:58.490
"Well, maybe five minutes.",00:13:58.490,00:14:00.405
"But first I want to explain just
a few things about these.",00:14:00.405,00:14:10.410
"They all follow from
the basic formula.",00:14:10.410,00:14:12.850
"In fact, that one deserves a
pink box too, doesn't it.",00:14:12.850,00:14:16.780
That one's pretty important.,00:14:16.780,00:14:18.020
Alright.,00:14:18.020,00:14:19.770
Yeah.,00:14:19.770,00:14:23.020
"Maybe even some little
sparkles.",00:14:23.020,00:14:25.100
Alright.,00:14:25.100,00:14:32.830
OK.,00:14:32.830,00:14:33.430
So that's pretty important.,00:14:33.430,00:14:36.390
"Almost as important as
the more basic one",00:14:36.390,00:14:38.450
without this term here.,00:14:38.450,00:14:41.190
"So now, let me just tell you
a little bit more about the",00:14:41.190,00:14:47.880
significance.,00:14:47.880,00:14:54.740
"Again, this is just to reinforce
something that we've",00:14:54.740,00:14:57.050
already done.,00:14:57.050,00:14:57.640
"But it's closely related to
what you're doing on your",00:14:57.640,00:14:59.780
problem set.,00:14:59.780,00:15:00.880
"So it's worth your while
to recall this.",00:15:00.880,00:15:05.230
"So, there's this expression
that we were dealing with.",00:15:05.230,00:15:10.870
"And we talked about
it in lecture.",00:15:10.870,00:15:13.370
"And we showed that this tends
to e as k goes to infinity.",00:15:13.370,00:15:19.900
"So that's what we showed
in lecture.",00:15:19.900,00:15:21.110
"And the way that we did that
was, we took the logarithm and",00:15:21.110,00:15:25.460
"we wrote it as k times, sorry,
the ln of 1 (1 / k).",00:15:25.460,00:15:32.530
"And then we evaluated
the limit of this.",00:15:32.530,00:15:35.780
"And I want to do this limit
again, using linear",00:15:35.780,00:15:39.220
approximation.,00:15:39.220,00:15:40.220
To show you how easy it is.,00:15:40.220,00:15:41.850
"If you just remember the
linear approximation.",00:15:41.850,00:15:44.820
"And then we'll explain
where the quadratic",00:15:44.820,00:15:46.630
approximation comes in.,00:15:46.630,00:15:48.390
"So I claim that this
is approximately",00:15:48.390,00:15:51.770
equal to k ( 1 / k).,00:15:51.770,00:15:59.300
"Now, why is that?",00:15:59.300,00:16:00.750
"Well, that's just this
linear approximation.",00:16:00.750,00:16:04.350
So what did I use here?,00:16:04.350,00:16:05.500
"I used ln of 1 x is
approximately x.",00:16:05.500,00:16:10.600
For x = 1 / k.,00:16:10.600,00:16:14.760
"That's what I used in this
approximation here.",00:16:14.760,00:16:18.600
"And that's the linear
approximation",00:16:18.600,00:16:20.330
to the natural logarithm.,00:16:20.330,00:16:24.010
"And this number is relatively
easy to evaluate.",00:16:24.010,00:16:27.250
I know how to do it.,00:16:27.250,00:16:28.150
It's equal to 1.,00:16:28.150,00:16:31.010
"That's the same, well, so
where does this work?",00:16:31.010,00:16:34.680
"This works where this
thing is near 0.",00:16:34.680,00:16:37.450
"Which is when k is going
to infinity.",00:16:37.450,00:16:41.610
"This thing is working only when
k is going to infinity.",00:16:41.610,00:16:44.170
"So what it's really saying, this
approximation formula,",00:16:44.170,00:16:46.660
"it's really saying that as we
go to infinity, in k, this",00:16:46.660,00:16:50.910
thing is going to 1.,00:16:50.910,00:16:54.720
As k goes to infinity.,00:16:54.720,00:16:58.890
So that's what it's saying.,00:16:58.890,00:17:00.410
That's the substance there.,00:17:00.410,00:17:01.740
"And that's how we want to use
it, in many instances.",00:17:01.740,00:17:05.200
Just to evaluate limits.,00:17:05.200,00:17:06.580
"We also want to realize that
it's nearby when k is pretty",00:17:06.580,00:17:10.000
"large, like 100 or something
like that.",00:17:10.000,00:17:12.800
"Now, so that's the idea of
the linear approximation.",00:17:12.800,00:17:16.660
"Now, if you want to get the rate
of convergence here, so",00:17:16.660,00:17:22.120
"the rate of what's called
convergence.",00:17:22.120,00:17:27.950
"So convergence means how fast
this is going towards that.",00:17:27.950,00:17:34.260
"What I have to do is take
the difference.",00:17:34.260,00:17:36.220
"I have to take ln ak, and I have
to subtract 1 from it.",00:17:36.220,00:17:40.670
"And I know that this is going to
0, and the question is how",00:17:40.670,00:17:43.860
big is this.,00:17:43.860,00:17:47.870
We want it to be very small.,00:17:47.870,00:17:51.760
"And the answer we're going to
get, so the answer just uses",00:17:51.760,00:17:56.810
the quadratic approximation.,00:17:56.810,00:18:03.570
"So if I just have a little bit
more detail, then this",00:18:03.570,00:18:06.750
"expression here, in other words,
I have the next higher",00:18:06.750,00:18:10.580
order term.,00:18:10.580,00:18:11.210
"This is like 1 / k, this
is like 1 / k^2.",00:18:11.210,00:18:15.420
"Then I can understand how big
the difference is between the",00:18:15.420,00:18:21.100
"expression that I've
got and its limit.",00:18:21.100,00:18:24.260
"And so that's what's
on your homework.",00:18:24.260,00:18:26.200
This is on your problem set.,00:18:26.200,00:18:31.610
"OK, so that is more or less an
explanation for one of the",00:18:31.610,00:18:35.210
"things that quadratic
approximations are good for.",00:18:35.210,00:18:38.860
"And I'm going to give you
one more illustration.",00:18:38.860,00:18:42.900
One more illustration.,00:18:42.900,00:18:45.360
"And then we'll actually
check these formulas.",00:18:45.360,00:18:47.580
"Yeah, another question.",00:18:47.580,00:18:48.430
STUDENT: [INAUDIBLE],00:18:48.430,00:18:55.940
PROF.,00:18:55.940,00:18:56.020
"JERISON: That's a very
good question here.",00:18:56.020,00:18:58.470
"When they, which in this case
means maybe, me, when I give",00:18:58.470,00:19:02.520
"you a question, does one specify
whether you want to",00:19:02.520,00:19:11.020
"use a linear or a quadratic
approximation.",00:19:11.020,00:19:14.430
"The answer is, in real life
when you're faced with a",00:19:14.430,00:19:18.920
"problem like this, where some
satellite is orbiting and you",00:19:18.920,00:19:23.130
"want to know the effects of
gravity or something like",00:19:23.130,00:19:25.330
"that, nobody is going to
tell you anything.",00:19:25.330,00:19:28.780
"They're not even going to tell
you whether a linear",00:19:28.780,00:19:30.320
"approximation is relevant, or
a quadratic or anything.",00:19:30.320,00:19:33.740
So you're on your own.,00:19:33.740,00:19:36.170
"When I give you a question, at
least for right now, I'm",00:19:36.170,00:19:40.290
always going to tell you.,00:19:40.290,00:19:42.640
"But as time goes on I'd like you
to get used to when it's",00:19:42.640,00:19:47.050
"enough to get away with a
linear approximation.",00:19:47.050,00:19:49.840
"And you should only use a
quadratic approximation if",00:19:49.840,00:19:53.720
somebody forces you to.,00:19:53.720,00:19:55.690
"You should always start trying
with a linear one.",00:19:55.690,00:19:57.960
"Because the quadratic ones are
much more complicated as",00:19:57.960,00:20:00.480
"you'll see in this
next example.",00:20:00.480,00:20:03.390
"OK, so the example that I want
to use is, you're going to be",00:20:03.390,00:20:06.660
"stuck with it because I'm asking
for the quadratic.",00:20:06.660,00:20:09.110
"So we're going to find the
quadratic approximation near,",00:20:09.110,00:20:17.450
for x near 0.,00:20:17.450,00:20:23.740
To what?,00:20:23.740,00:20:24.525
"Well, this is the same function
that we used in the",00:20:24.525,00:20:29.490
last lecture.,00:20:29.490,00:20:30.840
"I think this was it. e
^ - 3x (1 x) ^ - 1/2.",00:20:30.840,00:20:37.460
OK.,00:20:37.460,00:20:40.670
"So, unfortunately, I stuck it in
the wrong place to be able",00:20:40.670,00:20:45.390
"to fit this very long
formula here.",00:20:45.390,00:20:47.620
