text,start,stop
"And they also have proposed
the third one is they have",00:40:07.950,00:40:11.940
"multiple different encoders to work for
different source languages and",00:40:11.940,00:40:15.350
"wants a single shared decoder to work for
more specific target language.",00:40:15.350,00:40:19.690
"So what's so special about
Google's multilingual NMT system?",00:40:20.800,00:40:25.340
"So first of all,",00:40:25.340,00:40:26.080
"it's really simple because here we only
need one single model that is able to",00:40:26.080,00:40:30.590
"translate from different source languages
to different target languages, and",00:40:30.590,00:40:35.740
"because of the simplicity the system can
trivially scale up to more language pairs.",00:40:35.740,00:40:42.360
"And second, the system improves
the translation quality for",00:40:42.360,00:40:45.770
low resource language.,00:40:45.770,00:40:46.730
"So because the progress of the model
are shared implicitly and so",00:40:47.800,00:40:52.110
"the model is forced to generalize
across language boundaries.",00:40:52.110,00:40:55.730
"So it's observed that if we train
the language that has very little training",00:40:55.730,00:40:59.560
"data with a language pair that
has a lot of training data in one",00:40:59.560,00:41:04.430
"single model, the translation quality for",00:41:04.430,00:41:06.970
"the low-resourced language
is significantly improved.",00:41:06.970,00:41:09.479
"And also the system is able to
perform zero-shot translation.",00:41:10.510,00:41:14.320
"Meaning that the model can
inclusively translate for",00:41:14.320,00:41:17.406
"the language pairs it has never
seen during training time.",00:41:17.406,00:41:20.300
"For example, if we train a model
on Portuguese to English and",00:41:20.300,00:41:24.830
"English to Spanish data,
the model is able to",00:41:24.830,00:41:29.630
"generate reasonable translation for
Portuguese to Spanish directly.",00:41:29.630,00:41:33.780
"Without seeing any data for
the language pair during training time.",00:41:33.780,00:41:37.290
"And this is the architecture for
the models.",00:41:38.910,00:41:42.080
"As we can see, this is kind of
the standard architecture for",00:41:42.080,00:41:45.270
the state-of-the-art NMT system.,00:41:45.270,00:41:47.984
"Where we have multiple stacked layers of
LSTMs for both decoders and encoders and",00:41:47.984,00:41:53.220
"those applied attention mechanism which
we will talk about later in a lecture.",00:41:53.220,00:41:57.400
"So what is the magic here that enables the
system to do a multilingual translation?",00:41:57.400,00:42:01.870
"So it turns out instead of trying to
modify the architecture, they instead",00:42:02.920,00:42:07.350
"modified the input data, by adding the
special artificial token at the beginning",00:42:07.350,00:42:13.010
"of every input sentence, to indicate what
target language you want to translate to.",00:42:13.010,00:42:17.860
"So for example, if you wanna
translate from English to Spanish,",00:42:17.860,00:42:20.800
"we simple add this &lt;2es&gt; token to indicate
that Spanish is the target language.",00:42:20.800,00:42:25.810
"And after adding this artificial token,
we simply just put together",00:42:25.810,00:42:29.450
"all of the multi-lingual data and
just start training.",00:42:29.450,00:42:32.430
"With this simple trick,",00:42:35.312,00:42:37.570
"the system is able to surpass
the state-of-the-art performance for",00:42:37.570,00:42:41.590
"English to German, French to English,
and German to English translation.",00:42:41.590,00:42:46.630
"And they have comparable performance for
English to French translation.",00:42:46.630,00:42:49.822
Both on the WMT benchmark.,00:42:51.050,00:42:53.240
"So and here's a little more detail
about a zero-shot translation.",00:42:54.570,00:42:58.940
The setting is like this.,00:42:58.940,00:43:00.240
"So during training time we train
a model on Portuguese to English and",00:43:00.240,00:43:03.920
English to Spanish data.,00:43:03.920,00:43:05.590
"But during test time we ask the model
to perform Portuguese to Spanish",00:43:05.590,00:43:09.070
translation directly.,00:43:09.070,00:43:10.780
"And it's shown here that the model
is able to have comparable",00:43:10.780,00:43:14.963
"performance as the phrase based
machine translation system.",00:43:14.963,00:43:19.620
And also the NMT system with bridging.,00:43:19.620,00:43:22.418
"And also with a little bit
of incremental training.",00:43:22.418,00:43:24.720
"Meaning that we add a little bit of data
for the Portuguese to Spanish translation.",00:43:24.720,00:43:32.250
"The model is able to surpass all
of the other models listed above.",00:43:32.250,00:43:36.620
"And that's all, thank you.",00:43:37.630,00:43:44.645
"[APPLAUSE]
&gt;&gt; So",00:43:44.645,00:43:45.570
"I think that actually is
a really amazing result.",00:43:45.570,00:43:48.772
"I mean, in some sense,",00:43:48.772,00:43:53.430
"it's actually realizing a long-held
dream of machine translation.",00:43:53.430,00:43:58.090
"So a traditional problem
with machine translation has",00:43:58.090,00:44:02.870
"always been that if you'd like to be able
to translate between a lot of languages,",00:44:02.870,00:44:07.780
"or you're then in a product space
of number of systems, right.",00:44:07.780,00:44:11.050
"So if you'd like to support around
80 languages as Google does.",00:44:11.050,00:44:15.610
"That if you wanna allow translation
between any pairs straightforwardly you",00:44:15.610,00:44:19.470
"have to build 6,400 machine
translation systems.",00:44:19.470,00:44:23.240
"And that's a lot of machine
translation systems.",00:44:23.240,00:44:26.020
And they never quite did that.,00:44:26.020,00:44:27.810
That was a reference to bridging.,00:44:27.810,00:44:29.690
"So if something was being bridged,
what that effectively meant for",00:44:29.690,00:44:33.880
"Google was you were translating
twice via an intermediate",00:44:33.880,00:44:36.860
"language where the intermediate
language was normally English.",00:44:36.860,00:44:39.890
"So the goal has for
a long time has been in MT,",00:44:39.890,00:44:42.948
"is to achieve this dream
of an interlingua.",00:44:42.948,00:44:46.680
"So that if you had an interlingua in the
middle you have to translate each language",00:44:46.680,00:44:51.330
"to and from the interlingua, so you only
need 80 encoders and 80 decoders, so",00:44:51.330,00:44:55.970
it's then the number of languages.,00:44:55.970,00:44:58.290
"And that has sort of never been very
successful, which is why effectively",00:44:58.290,00:45:03.310
"people just sort of build all
of these bilingual systems but",00:45:03.310,00:45:06.840
"this system is now sort of
illustrating how you can actually have",00:45:06.840,00:45:11.700
"the encodings of neural MT system
be an effective interlingua.",00:45:11.700,00:45:16.200
"Okay, so now on to the main technical
content to get through today,",00:45:17.680,00:45:22.720
is introducing this idea of attention.,00:45:22.720,00:45:25.690
"So what's the problem
we want to deal with?",00:45:25.690,00:45:28.080
"So if we're into the sort of
vanilla sequence to sequence,",00:45:28.080,00:45:31.844
encoder-decoder model.,00:45:31.844,00:45:33.900
"We have this problem because
our only representation of",00:45:33.900,00:45:39.650
"the input is this sort of one
fixed-dimensional representation Y",00:45:39.650,00:45:44.980
"which was sort of the state
that our encoder was last in.",00:45:44.980,00:45:50.840
"And so,
we need to kind of carry that through",00:45:50.840,00:45:54.500
"our entire generation of
our translation sentence.",00:45:54.500,00:45:58.180
"And that seems like it might be
a difficult thing to do, and",00:45:58.180,00:46:04.160
"indeed, what was shown was that was
indeed a difficult thing to do and",00:46:04.160,00:46:09.435
"so what people found is
that this initial neural",00:46:09.435,00:46:12.755
"machines translations systems
worked well on short sentences.",00:46:12.755,00:46:17.315
"But if you tried to use them to translate
very long sentences, that their",00:46:17.315,00:46:21.548
"performance started to tank and I'll show
you some numbers on that later; And so",00:46:21.548,00:46:27.000
"the idea that people came up with and
this idea was actually first proposed for",00:46:27.000,00:46:32.540
"vision but was then moved over and
tried for neural",00:46:32.540,00:46:37.220
"machine translation by Kyunghyun Cho and
colleagues at Montreal, was to say,",00:46:37.220,00:46:41.625
"well instead of saying that
our Y that we generate",00:46:41.625,00:46:46.260
"from is just the last hidden states,
why don't we say all of the hidden states",00:46:46.260,00:46:51.990
"of the entire encoding
process are available to us.",00:46:51.990,00:46:56.490
"And so
we sort of have this pool of source states",00:46:56.490,00:46:59.300
"that we can draw from
to do the translation.",00:46:59.300,00:47:02.250
"And so then when we're
translating any particular word,",00:47:02.250,00:47:06.560
"we then want to work out which
of those ones to draw from.",00:47:06.560,00:47:11.390
"So effectively,
the pool of source states becomes kind",00:47:11.390,00:47:16.030
"of like a random access memory which the
neural network is then going to be able",00:47:16.030,00:47:21.220
"to retrieve from as needed when
it wants to do its translation.",00:47:21.220,00:47:25.490
"And it'll find some stuff from it and
use it for translating each word.",00:47:25.490,00:47:30.160
"And so attention for
neural machine translation is one specific",00:47:31.160,00:47:35.530
"instantiation of this, but in general this
sort of builds into a bigger concept that",00:47:35.530,00:47:40.870
"has actually been a very exciting concept
in recent neural networks research and",00:47:40.870,00:47:46.390
"I know at least a couple of Groups
are interested in doing for",00:47:46.390,00:47:49.200
"their final projects is
this idea of can we augment",00:47:49.200,00:47:52.830
neural networks with a memory on the side.,00:47:53.830,00:47:57.580
"So that we cannot only lengthen our
short term memory with an LSTM, but",00:47:57.580,00:48:01.935
"we can actually have a much
longer term memory that",00:48:01.935,00:48:04.555
we can access stuff from as we need it.,00:48:04.555,00:48:06.995
"And attention is a simple
form of doing that.",00:48:06.995,00:48:09.825
"And then some of the more recent work like
neural turing machines is trying to do",00:48:09.825,00:48:14.296
"more sophisticated forms of read-write
memories augmenting neural networks.",00:48:14.296,00:48:19.860
"Okay, so if we want to retrieve as needed,
you could think of that as saying,",00:48:19.860,00:48:24.330
"okay, well,
out of all of this pool of source states,",00:48:24.330,00:48:27.920
"we want to be looking at where in
the input we want to retrieve stuff from.",00:48:27.920,00:48:33.282
"So effectively, after we've said, Je, and",00:48:33.282,00:48:38.280
we wanting to translate the next word.,00:48:38.280,00:48:42.240
"We should be working out,
well, where in here do",00:48:42.240,00:48:45.320
"we want to be paying attention to
decide what to translate next?",00:48:45.320,00:48:49.590
"And if it's French,
we wanna be translating the am next.",00:48:49.590,00:48:52.780
"And so our attention model effectively
sort of becomes like an alignment model.",00:48:52.780,00:48:58.780
"'cause it's saying, well,",00:48:58.780,00:49:00.470
"which part of the source are you
next gonna be translating?",00:49:00.470,00:49:03.730
"So you've got this implicit alignment
between the source and the translation.",00:49:03.730,00:49:08.150
"And that just seems a good idea, 'cause
that's even what human translators do.",00:49:08.150,00:49:13.514
"It's not that a human translator
reads the whole of a big,",00:49:13.514,00:49:16.617
"long sentence and says, okay, got it.",00:49:16.617,00:49:18.778
"And then starts furiously scribbling
down the translation, right?",00:49:18.778,00:49:21.890
"They're looking back at
the source as they translate, and",00:49:21.890,00:49:25.440
are translating different phrases of it.,00:49:25.440,00:49:27.900
"And so Richard mentioned last
week the idea that in training",00:49:27.900,00:49:33.013
"statistical models that one of
the first steps was you worked",00:49:33.013,00:49:38.230
"out these word alignments between
the source and the target.",00:49:38.230,00:49:43.563
"And that was used to extract phrases
that gave you kind of phrases to use in",00:49:43.563,00:49:48.141
a statistical phrase based system.,00:49:48.141,00:49:50.483
"Here, we're not doing that,
it's rather just at",00:49:50.483,00:49:54.701
"translation time by process of
using this attention model.",00:49:54.701,00:49:59.718
"We're implicitly making connections
between source and target,",00:49:59.718,00:50:04.059
which gives us a kind of alignment.,00:50:04.059,00:50:06.640
"But nevertheless, it effectively means
that we're building this end-to-end neural",00:50:06.640,00:50:11.330
"machine translation system that's doing
alignments and translation as it works.",00:50:11.330,00:50:16.460
"So it achieves this NMT vision, and
you do get these good alignments.",00:50:16.460,00:50:21.230
"So we're using this kind of
on the right structure where",00:50:22.550,00:50:26.980
"we're sort of filling in where
the alignments have occurred.",00:50:26.980,00:50:31.670
"And so you can look at where attention
was laid when you're producing",00:50:31.670,00:50:37.018
"a translation,
translating here from French to English.",00:50:37.018,00:50:43.000
"And you can see that this model,
which is a model from people at Montreal,",00:50:43.000,00:50:46.560
"is doing a good job at deciding
where to place attention.",00:50:46.560,00:50:50.930
"So it's starting off with the agreement
on the, and then the interesting part is",00:50:50.930,00:50:56.010
"that sort of French typically has
adjectival modifiers after the head down.",00:50:56.010,00:51:01.340
"So this is the zone, economic, European,",00:51:01.340,00:51:04.250
"which you have to flip in English
to get the European economic area.",00:51:04.250,00:51:08.710
"And so
it's kind of correctly modelling that flip",00:51:08.710,00:51:11.410
"in deciding where to pay
attention in the source.",00:51:11.410,00:51:14.290
"And then kind of goes back to
a more monotonic linear order.",00:51:14.290,00:51:17.830
"Okay, so that looks good,
how do we go about doing that?",00:51:19.490,00:51:24.430
"So what we're gonna be doing is
we've started to generate, and",00:51:24.430,00:51:28.650
we wanna generate the next word.,00:51:28.650,00:51:30.940
"And we want to use our hidden
state to decide where to access",00:51:30.940,00:51:36.395
"our random access memory,
which is all the blue stuff.",00:51:36.395,00:51:41.819
"And so, well we haven't yet generated
the hidden state for the next word, so",00:51:41.819,00:51:46.545
"it seems like our only good choice
is to use, I think I skipped one.",00:51:46.545,00:51:52.580
"Okay, the only good choice is to use",00:51:52.580,00:51:55.310
"the previous hidden state
as the basis of attention.",00:51:55.310,00:51:58.720
"And that's what we do, and then what
we're gonna do is come up with some",00:51:58.720,00:52:04.840
"score that combines it and
elements of the hidden state.",00:52:04.840,00:52:10.950
"And commonly, people are only using
the highest level of the hidden state for",00:52:10.950,00:52:15.080
"attention, and
decides where to pay attention.",00:52:15.080,00:52:18.610
"And so this scoring function,
will score each position and",00:52:18.610,00:52:23.233
"saying, where to pay attention.",00:52:23.233,00:52:25.918
"And I'll get back to the scoring
functions in a minute.",00:52:25.918,00:52:29.000
"And so the model that they proposed was,
we get a score for",00:52:29.000,00:52:33.930
each component of the memory.,00:52:33.930,00:52:36.450
"And then what we're gonna do is
sort of build a representation",00:52:36.450,00:52:41.678
"which combines all of the memories
weighted by the score.",00:52:41.678,00:52:46.617
"So what we're gonna do is
we're going to say, okay,",00:52:46.617,00:52:50.307
"we'll take those scores and
we'll do our standard trick.",00:52:50.307,00:52:54.760
"We'll stick them through
a softmax function and",00:52:54.760,00:52:58.679
"that will then give us a probability
distribution of how much",00:52:58.679,00:53:03.553
"attention to pay to the different
places in the source.",00:53:03.553,00:53:08.062
"And so then, we're going to combine,
okay, then we're going",00:53:08.062,00:53:13.315
"to combine together all of
the hidden states of the encoder,",00:53:13.315,00:53:18.278
"weighted by how much
attention we're paying to it.",00:53:18.278,00:53:22.581
"So that we're taking, these are each
hidden state of the encoder,",00:53:22.581,00:53:27.241
"the amount of attention you're
paying to that position.",00:53:27.241,00:53:31.349
"And then you're just
calculating a weighted sum and",00:53:31.349,00:53:34.318
that then gives us a context vector.,00:53:34.318,00:53:36.830
"So now rather than simply
using the last hidden state",00:53:36.830,00:53:40.170
"as our representation of all of meaning,
we're using the entire of our",00:53:40.170,00:53:45.210
"hidden states of the encoder as
our representation of meaning.",00:53:45.210,00:53:48.840
"And at different points in
time we weight it differently",00:53:48.840,00:53:52.300
to pay attention in different places.,00:53:52.300,00:53:55.160
"And so now what we're gonna do,
is based on what we were.",00:53:55.160,00:53:59.650
This is going automatic on me.,00:54:01.150,00:54:02.650
"Now what we're gonna do is based
on what we were doing before.",00:54:02.650,00:54:05.630
"And so the previous hidden state and the
next and the previous word of the decoder.",00:54:07.780,00:54:14.927
"But also conditioned on
this context vector,",00:54:14.927,00:54:18.956
we're then gonna generate the next word.,00:54:18.956,00:54:22.685
"Okay, so then the question is, well,
how do we actually score that?",00:54:22.685,00:54:29.544
"And at this point we need
some kind of attention",00:54:29.544,00:54:33.388
"function that decides how
to work out the score.",00:54:33.388,00:54:37.910
"And a very simple idea you could use for
that is just to say, well,",00:54:37.910,00:54:42.470
"let's take the dot product between
the decoded hidden state and",00:54:42.470,00:54:48.522
an encoded the hidden state.,00:54:48.522,00:54:50.800
"And we wanna find the ones that are
similar, cuz that means we're in the right",00:54:50.800,00:54:55.138
"ballpark of words that have the same
meaning, and generate from that.",00:54:55.138,00:54:59.171
"And that's a possible
thing that you could do.",00:54:59.171,00:55:02.256
"The one that was proposed by the people
in Montreal was this bottom one.",00:55:02.256,00:55:08.258
"Where we're effectively using a single
layer of neural net, just like",00:55:08.258,00:55:13.073
"the kind of functions that we've been
using everywhere else inside our LSTM.",00:55:13.073,00:55:18.490
"So we're taking the concatenation
of the two hidden states.",00:55:18.490,00:55:23.700
"We're multiplying the biometrics,
putting it through a tanh function.",00:55:23.700,00:55:28.570
"And then multiplying that by another
vector, where both the V and",00:55:28.570,00:55:31.910
W are learned.,00:55:31.910,00:55:33.220
And using that as an attention function.,00:55:33.220,00:55:35.960
"And so that's what they did in their work,
and that worked pretty well.",00:55:35.960,00:55:39.625
"In the work we did at Stanford, so
principally Thang Luong's work, that we",00:55:39.625,00:55:44.962
"proposed using a different attention
function, which is the one in the middle.",00:55:44.962,00:55:50.540
"Which is this bilinear attention function,",00:55:50.540,00:55:53.079
"which has actually been quite
successful and widely adopted.",00:55:53.079,00:55:56.632
"So here, it's kind of like the top
one where you're doing a dot product.",00:55:56.632,00:56:00.890
"But you're sticking in between
the dot product a mediating matrix W.",00:56:00.890,00:56:06.125
"And so that matrix can effectively
then learn how much weight to",00:56:06.125,00:56:11.095
put on different parts of the dot product.,00:56:11.095,00:56:14.489
"To sort of have an idea of
where to pay attention.",00:56:14.489,00:56:17.962
"And that's actually turned out to
be a model that works kind of well.",00:56:17.962,00:56:22.355
"And I think there's a reason
why it works kind of well.",00:56:22.355,00:56:25.144
"Cuz what you would like to do
is kind of have interaction",00:56:25.144,00:56:29.936
terms that look at h_t and h_s together.,00:56:29.936,00:56:33.278
"And even the dot product kind of has
this interaction between h_t and h_s.",00:56:33.278,00:56:37.820
"And this is a more sophisticated way
of getting an interaction between",00:56:37.820,00:56:42.593
h_t and h_s.,00:56:42.593,00:56:43.580
"Whereas if you're using this model with
only a single layer of neural network,",00:56:43.580,00:56:49.330
"you don't actually get
interactions between h_t and h_s.",00:56:49.330,00:56:53.630
"Because you've got the sort of
two parts of this vector and",00:56:53.630,00:56:57.300
"each of them is multiplied by
a separate part of this matrix.",00:56:57.300,00:57:01.460
"And then you put it through a tanh, but
that just rescales it element-wise.",00:57:01.460,00:57:05.330
"And then you multiply it by a vector,
but that just rescales it element-wise.",00:57:05.330,00:57:09.318
"So there's no place that h_t and
h_s actually interact with each other.",00:57:09.318,00:57:14.122
"And that's essentially the same
problem of the sort of classic result",00:57:14.122,00:57:18.928
"that you can't get an xor function
out of a one layer perceptron is",00:57:18.928,00:57:22.764
"because you can't get the two
things to interact with each other.",00:57:22.764,00:57:27.290
"So, this is a very
simple low parameter way",00:57:27.290,00:57:30.890
"in which you can actually
have interaction terms.",00:57:30.890,00:57:33.160
"It seems to work really well for
attention functions.",00:57:33.160,00:57:36.010
"It's not the only way
that you could do it.",00:57:36.010,00:57:38.120
"Another way that you could do things that
a couple of papers have used is to say,",00:57:38.120,00:57:42.170
"well, gee,
a one way neural net's just not enough.",00:57:42.170,00:57:45.180
"Let's make it a two layer
feedforward network.",00:57:45.180,00:57:48.370
"And then we could have arbitrary
interactions again like the xor model.",00:57:48.370,00:57:52.330
"And a couple of people have
also played with that.",00:57:52.330,00:57:55.001
"Another thing that has been explored for
attention that I'll just mention.",00:57:58.537,00:58:02.630
"So the simple model of attention,
you've got this attention function.",00:58:02.630,00:58:06.968
"That spreads attention over
the entire source encoding.",00:58:06.968,00:58:11.288
And you've got a weighting on it.,00:58:11.288,00:58:13.445
"That's kind of simple, it's easy to learn.",00:58:13.445,00:58:15.995
"It's a continuous,
nice differentiable model.",00:58:15.995,00:58:18.757
"It's potentially unpleasant
computationally if you've got very long",00:58:18.757,00:58:23.251
sequences.,00:58:23.251,00:58:24.066
"Because that means if you start thinking
about your back prop algorithm that you're",00:58:24.066,00:58:28.683
"back propagating into
everywhere all the time.",00:58:28.683,00:58:31.361
"So people have also looked some
at having local attention models.",00:58:31.361,00:58:35.226
"Where you're only paying attention to
a subset of the states at one time.",00:58:35.226,00:58:39.826
"And that's more of an exact notion of
retrieving certain things from memory.",00:58:39.826,00:58:44.965
"And that can be good,
especially for long sequences.",00:58:44.965,00:58:49.036
"It's not necessarily compellingly better
just for the performance numbers so far.",00:58:49.036,00:58:54.344
"Okay, so here's a chart that shows you
how some of the performance works out.",00:58:54.344,00:58:59.182
"So what we see is that this
red model has no attention.",00:58:59.182,00:59:05.684
"And so this shows the result that,",00:59:05.684,00:59:08.191
"a no attention model works reasonably
well up to sentences of about length 30.",00:59:08.191,00:59:14.076
"But if you try and run a no
attention machine translation system",00:59:14.076,00:59:19.074
on sentences beyond length 30.,00:59:19.074,00:59:21.814
"Performance just starts
to drop off quite badly.",00:59:21.814,00:59:25.602
"And so in some sense this is
the glass half full story.",00:59:25.602,00:59:31.550
"The glass half full is actually LSTMs
are just miraculous at remembering things.",00:59:31.550,00:59:38.060
"I mean,
I think quite to many peoples' surprise,",00:59:38.060,00:59:41.770
"you can remember out to about length
30 which is actually pretty stunning.",00:59:41.770,00:59:46.150
"But nevertheless,
there's magic and there's magic.",00:59:46.150,00:59:49.480
And you don't get an infinite memory.,00:59:49.480,00:59:51.400
"And if you're trying translate
sentences that are 70 words long.",00:59:51.400,00:59:55.310
"You start to suffer pretty badly with
the basic LSTM model, oops, okay.",00:59:55.310,01:00:02.140
"So then the models that are higher up
is then showing models with attention,",01:00:02.140,01:00:07.944
and I won't go through all the details.,01:00:07.944,01:00:11.037
"The interesting thing is that even for
these shorter sentences.",01:00:11.037,01:00:15.160
"Actually there are a lot of gains from
putting attention into the models.",01:00:15.160,01:00:18.478
"That it actually does just let you do
a much better job of working out where",01:00:18.478,01:00:23.385
to focus on at each generation step.,01:00:23.385,01:00:25.884
And you translate much better.,01:00:25.884,01:00:27.638
"But the most dramatic result is
essentially these curves turn into flat",01:00:27.638,01:00:32.084
"lines, there's a little
bit of a peak here, maybe.",01:00:32.084,01:00:35.680
