text,start,stop
"ANNOUNCER: The following program
is brought to you by Caltech.",00:00:00.570,00:00:03.270
YASER ABU-MOSTAFA: Welcome back.,00:00:15.410,00:00:18.410
"Last time, we finished the VC analysis.",00:00:18.410,00:00:22.370
And that took us three full lectures.,00:00:22.370,00:00:25.950
"The end result was the definition of the
VC dimension of a hypothesis set.",00:00:25.950,00:00:31.800
"It was defined as the most points that
the hypothesis set can shatter.",00:00:31.800,00:00:38.820
"And we used the VC dimension in
establishing that learning is",00:00:38.820,00:00:43.060
"feasible, on one hand, and then in
estimating the example resources that",00:00:43.060,00:00:47.540
are needed in order to learn.,00:00:47.540,00:00:50.540
"One of the important aspects of
the VC analysis is the scope.",00:00:50.540,00:00:55.430
"The VC inequality, and the generalization
bound that corresponds",00:00:55.430,00:00:59.690
"to it, describe the generalization
ability of the final hypothesis you",00:00:59.690,00:01:05.379
are going to pick.,00:01:05.379,00:01:07.320
"It describes that in terms of the VC
dimension of the hypothesis set, and",00:01:07.320,00:01:14.290
"makes a statement that is true for
all but delta of the data sets",00:01:14.290,00:01:19.560
that you might get.,00:01:19.560,00:01:20.820
So this is where it applies.,00:01:20.820,00:01:23.340
"And the most important part of the
application are the disappearing",00:01:23.340,00:01:27.910
"blocks, because it gives the generality
that the VC inequality has.",00:01:27.910,00:01:32.840
"So the VC bound is valid for any
learning algorithm, for any input",00:01:32.840,00:01:39.040
"distribution that may take place, and
also for any target function that you",00:01:39.040,00:01:44.960
may be able to learn.,00:01:44.960,00:01:47.530
So this is the most theoretical part.,00:01:47.530,00:01:49.120
"And then we went into a little bit of
a practical part, where we are asking",00:01:49.120,00:01:52.920
"about the utility of the VC
dimension in practice.",00:01:52.920,00:01:55.850
"You have a learning problem-- someone
comes with a problem, and you would",00:01:55.850,00:01:59.420
"like to know how many examples. What is
the size of the data set you need,",00:01:59.420,00:02:03.360
"in order to be able to achieve
a certain level of performance.",00:02:03.360,00:02:06.840
"The way we did this analysis is by
plotting the core aspect of the delta,",00:02:06.840,00:02:11.980
"the probability of error
in the VC bound.",00:02:11.980,00:02:15.060
"And we found that it's
behaving regularly.",00:02:15.060,00:02:17.790
"We focused on a certain aspect of these
curves, which correspond to",00:02:17.790,00:02:21.860
different VC dimensions.,00:02:21.860,00:02:23.960
"And the main aspect is
below this line.",00:02:23.960,00:02:26.720
"This line designates
the probability 1.",00:02:26.720,00:02:29.340
"We want the probability of the bad event
to be small, so we are working",00:02:29.340,00:02:33.080
in this region.,00:02:33.080,00:02:34.570
"And the x-axis here is the number
of examples-- the size",00:02:34.570,00:02:39.320
of your data set.,00:02:39.320,00:02:40.930
"And we don't particularly care about
the shape of these guys.",00:02:40.930,00:02:43.770
"They could be a little bit
nonlinear, et cetera.",00:02:43.770,00:02:46.280
"But the quantity we are looking for is,
if we cut through this way, what is",00:02:46.280,00:02:54.440
"the behavior of the x-axis, the number
of examples, in terms of the VC",00:02:54.440,00:02:59.280
"dimension, which is the label
for the colored curves?",00:02:59.280,00:03:02.640
"And we realized that, given this analysis,
it is very much proportional.",00:03:02.640,00:03:07.780
"And we were able to say that,
theoretically, the bound will give us",00:03:07.780,00:03:11.620
"that the number of examples needed
would be proportional to the VC",00:03:11.620,00:03:14.000
"dimension, more or less.",00:03:14.000,00:03:16.380
"And although the constant of
proportionality, if you go for the",00:03:16.380,00:03:21.450
"bound, will be horrifically
pessimistic--",00:03:21.450,00:03:24.480
"you will end up requiring tens of
thousands of examples for something",00:03:24.480,00:03:27.660
"for which you really need
only maybe 50 examples--",00:03:27.660,00:03:30.890
"the good news is that the actual
quantity behaves in the",00:03:30.890,00:03:33.890
same way as the bound.,00:03:33.890,00:03:35.330
"So the number of examples needed
is, in practice, as a practical",00:03:35.330,00:03:38.440
"observation, indeed proportional
to the VC dimension.",00:03:38.440,00:03:41.950
"And furthermore, as a rule of thumb,
in order to get to the interesting",00:03:41.950,00:03:45.670
"part, or interesting delta and epsilon,
you need the number of",00:03:45.670,00:03:49.660
"examples to be 10 times
the VC dimension.",00:03:49.660,00:03:52.870
More will be better.,00:03:52.870,00:03:54.110
Less might work.,00:03:54.110,00:03:55.240
"But the ballpark of it is that you have
a factor of 10, in order to start",00:03:55.240,00:03:58.990
"getting interesting generalization
properties.",00:03:58.990,00:04:03.050
"We ended with summarizing the entire
theoretical analysis into a very",00:04:03.050,00:04:07.020
"simple bound, which we are referring
to as the generalization bound, that",00:04:07.020,00:04:11.110
"tells us a bound on the out-of-sample
performance given the in-sample",00:04:11.110,00:04:14.510
performance.,00:04:14.510,00:04:16.060
"And that involved adding
a term, capital Omega.",00:04:16.060,00:04:20.930
"And Omega captures all the
theoretical analysis we had.",00:04:20.930,00:04:24.210
"It's a function of N, function of the
hypothesis set through the VC",00:04:24.210,00:04:26.920
"dimension, function of your tolerance
for probability of error, which is delta.",00:04:26.920,00:04:33.640
"And although this is a bound, we keep
saying that, in reality, E_out will",00:04:33.640,00:04:38.860
"be equal to E_in plus something
that behaves like Omega.",00:04:38.860,00:04:42.240
"And we will take advantage of that,
when we get a technique like",00:04:42.240,00:04:44.750
regularization.,00:04:44.750,00:04:46.090
"So that's the end of the VC analysis,
which is the biggest part of the",00:04:46.090,00:04:50.060
theory here.,00:04:50.060,00:04:51.600
"And we are going to switch today to
another approach, which is the",00:04:51.600,00:04:55.110
bias-variance tradeoff.,00:04:55.110,00:04:57.060
It's a stand-alone theory.,00:04:57.060,00:04:59.320
"It gives us a different angle
on generalization.",00:04:59.320,00:05:02.340
"And I am going to cover it, beginning
to end, during this lecture.",00:05:02.340,00:05:06.540
This is the plan.,00:05:06.540,00:05:09.060
The outline is very simple.,00:05:09.060,00:05:10.540
"We are going to talk about the bias
and variance, define them, see the",00:05:10.540,00:05:13.610
"tradeoff, take a very detailed example--
one particular example-- in",00:05:13.610,00:05:18.530
"order to demonstrate what the
bias and variance are.",00:05:18.530,00:05:21.950
"And then we are going to introduce
a very interesting tool for illustrating",00:05:21.950,00:05:26.310
"learning, which are called
learning curves.",00:05:26.310,00:05:28.360
"And we are going to contrast the
bias-variance analysis versus the VC",00:05:28.360,00:05:31.920
"analysis on these learning curves, and
then apply them to the linear",00:05:31.920,00:05:35.270
"regression case that we
are familiar with.",00:05:35.270,00:05:37.460
So this is the plan.,00:05:37.460,00:05:38.486
"The first part is the
bias and variance.",00:05:38.486,00:05:42.690
"In the big picture, we have been trying
to characterize a tradeoff.",00:05:42.690,00:05:47.790
"And roughly speaking, the tradeoff
is between approximation and",00:05:47.790,00:05:52.740
generalization.,00:05:52.740,00:05:53.620
"So let me discuss this for a moment,
before we put bias and variance into",00:05:53.620,00:05:58.320
the picture.,00:05:58.320,00:05:59.940
We would like to get to small E_out.,00:05:59.940,00:06:02.640
That's the purpose of learning.,00:06:02.640,00:06:03.960
"If E_out is small, then
you have learned.",00:06:03.960,00:06:05.970
"You have a hypothesis that approximates
the target function well.",00:06:05.970,00:06:10.060
"There are two components to this, and
we are very familiar with them now.",00:06:10.060,00:06:14.340
"We are looking for a good
approximation of f.",00:06:14.340,00:06:17.600
That's the approximation part.,00:06:17.600,00:06:19.440
"But we would like that approximation
to hold out-of-sample.",00:06:19.440,00:06:24.960
"We are not going to be happy if we
approximate f well in-sample, and we",00:06:24.960,00:06:29.910
behave badly out-of-sample.,00:06:29.910,00:06:31.510
These are the two components.,00:06:31.510,00:06:34.870
"In the case of a more complex
hypothesis set, you are going to have",00:06:34.870,00:06:41.550
"a better chance of approximating
f, obviously.",00:06:41.550,00:06:44.830
I have more hypotheses to run around.,00:06:44.830,00:06:46.400
"I'll be able to find one of
them that is closer to the",00:06:46.400,00:06:49.220
target function I want.,00:06:49.220,00:06:50.970
"The problem is that, if you have the
bigger hypothesis set, you are going",00:06:50.970,00:06:57.020
"to have a problem identifying
the good hypothesis.",00:06:57.020,00:07:01.620
"That is, if you have fewer hypotheses,
you have a better chance of",00:07:01.620,00:07:06.130
generalization.,00:07:06.130,00:07:07.160
"And one way to look at it is
that, I'm trying to",00:07:07.160,00:07:10.010
approximate the target function.,00:07:10.010,00:07:11.190
You give me a hypothesis set.,00:07:11.190,00:07:13.120
"Now, if I tell you I have
good news for you.",00:07:13.120,00:07:16.470
"The target function is actually
in the hypothesis set.",00:07:16.470,00:07:20.340
"You have the perfect approximation
under your control.",00:07:20.340,00:07:24.870
"Well, it's under your hand, but not
necessarily under your control.",00:07:24.870,00:07:29.280
"Because you still have to navigate
through the hypothesis set in order to",00:07:29.280,00:07:32.670
find the good candidate.,00:07:32.670,00:07:34.390
"And the way you navigate is
through the data set.",00:07:34.390,00:07:37.650
"That is your only resource for finding
one hypothesis versus the other.",00:07:37.650,00:07:42.360
"So the target function could be
sitting there calling for you.",00:07:42.360,00:07:46.650
"Please, I am the target
function, come.",00:07:46.650,00:07:48.360
But you can't see it.,00:07:48.360,00:07:49.560
"You're just navigating with the training
set, you have very limited resources,",00:07:49.560,00:07:52.770
"and you end up with something
that is really bad.",00:07:52.770,00:07:54.880
"Having f in the hypothesis set
is great for approximation.",00:07:59.140,00:08:01.850
"But having a big hypothesis set, that is
big enough to include that, may be",00:08:01.850,00:08:05.500
"bad news, because you will
not be able to get it.",00:08:05.500,00:08:09.080
"Now if you think about it, what is the
ideal hypothesis set for learning?",00:08:09.080,00:08:14.030
"If I only had a hypothesis set that has
a singleton hypothesis, which",00:08:14.030,00:08:18.100
"happens to be the target function, then
I have the best of both worlds.",00:08:18.100,00:08:21.020
The perfect approximation.,00:08:21.020,00:08:22.450
"I will zoom in directly, because
it is only one.",00:08:22.450,00:08:25.170
"Well, you might as well go
and buy a lottery ticket.",00:08:25.170,00:08:29.920
That's the equivalent.,00:08:29.920,00:08:32.090
"We don't know the target function, so
we will have to make the hypothesis set",00:08:32.090,00:08:35.559
big enough to stand a chance.,00:08:35.559,00:08:37.020
"And once we do that, then the question
of generalization kicks in.",00:08:37.020,00:08:40.270
This is this big picture.,00:08:40.270,00:08:41.340
"So let's try to fit the VC analysis in
it, and then fit the bias-variance",00:08:41.340,00:08:46.000
"analysis in it, before we even know what
the bias-variance analysis is, in",00:08:46.000,00:08:49.730
"order to see where we
are going with this.",00:08:49.730,00:08:52.740
So we are quantifying this tradeoff.,00:08:52.740,00:08:55.060
"And the quantification, in the case
of the VC analysis, was what?",00:08:55.060,00:08:59.320
Was the generalization bound.,00:08:59.320,00:09:02.760
E_in is approximation.,00:09:04.560,00:09:05.990
"Because I am actually trying to fit the
target function-- I am just fitting",00:09:05.990,00:09:09.850
them on the sample.,00:09:09.850,00:09:11.310
That's the restriction here.,00:09:11.310,00:09:13.030
"So if I get this well, then I'm
approximating f well, at",00:09:13.030,00:09:15.980
least on some points.,00:09:15.980,00:09:18.130
This guy is purely generalization.,00:09:18.130,00:09:20.520
"The question is, how do you generalize
from in-sample to out-of-sample?",00:09:20.520,00:09:24.750
So this is a way of quantifying it.,00:09:24.750,00:09:27.530
"Now the bias-variance analysis
has another approach.",00:09:27.530,00:09:30.950
"It also decomposes E_out, as you did
in the generalization bound.",00:09:30.950,00:09:36.850
"But it does decompose it into
two different entities.",00:09:36.850,00:09:41.730
"The first one is an approximation
entity, how well H can approximate f.",00:09:41.730,00:09:46.590
"Well, what is the difference then?",00:09:46.590,00:09:48.580
"The difference is that the bias-variance
asks the question, how",00:09:48.580,00:09:51.680
"can H approximate f, overall?",00:09:51.680,00:09:55.170
"Not on your sample. In reality. As if
you had access to the target function,",00:09:55.170,00:10:00.600
"and you are stuck with this hypothesis
set, and you are eagerly looking for",00:10:00.600,00:10:04.800
"which hypothesis best describes
the target function.",00:10:04.800,00:10:08.240
"And then you quantify how well that best
hypothesis performs, and that is",00:10:08.240,00:10:13.370
"your measure of the approximation
ability.",00:10:13.370,00:10:17.270
Then what is the other component?,00:10:17.270,00:10:19.650
"The other component is exactly
what I alluded to.",00:10:19.650,00:10:22.490
Can you zoom in on it?,00:10:22.490,00:10:25.660
"So this is the best hypothesis, and it
has a certain approximation ability.",00:10:25.660,00:10:30.130
"Now I need to pick it, so I have to use
the examples in order to zoom in",00:10:30.130,00:10:34.230
"into the hypothesis set, and
pick this particular one.",00:10:34.230,00:10:37.080
Can I zoom in on it?,00:10:37.080,00:10:38.610
"Or do I get something that is a poor
approximation of the approximation?",00:10:38.610,00:10:44.180
"And that decomposition will
give us the bias-variance.",00:10:44.180,00:10:46.600
"And we'll be able to put them at the
end of the lecture, side by side, in",00:10:46.600,00:10:49.930
"order to compare: here is what the VC
analysis does, and here is what",00:10:49.930,00:10:53.020
bias-variance does.,00:10:53.020,00:10:54.270
"The analysis, from a mathematical
point of view, applies",00:10:59.080,00:11:01.330
to real-valued targets.,00:11:01.330,00:11:02.760
And that's good news.,00:11:02.760,00:11:03.570
"Because remember, in the VC analysis, we
were confined to binary functions",00:11:03.570,00:11:08.210
in the particular analysis that I did.,00:11:08.210,00:11:10.020
"You can extend it, but
it's very technical.",00:11:10.020,00:11:12.340
"So it's a good idea to see the same
tradeoff, and the same generalization",00:11:12.340,00:11:16.050
"questions, apply to real-valued functions.",00:11:16.050,00:11:18.180
"Now we have regression, and we are
able to make a statement about",00:11:18.180,00:11:21.710
"generalization on regression, which we
will apply very specifically to linear",00:11:21.710,00:11:25.820
"regression, the model that we already
studied that has real-valued outputs.",00:11:25.820,00:11:32.060
"And we are going to confine the analysis
here to squared error.",00:11:32.060,00:11:37.790
"The reason we are doing this is that, for
the math to go through in such",00:11:37.790,00:11:41.930
"a way that these two guys decompose
cleanly-- there are no cross terms, we",00:11:41.930,00:11:47.210
will need the squared error.,00:11:47.210,00:11:49.480
"So this is a restriction
of the analysis.",00:11:49.480,00:11:51.770
There are ways to extend it.,00:11:51.770,00:11:53.240
"They are not as clean, so this
is the simplest form that we",00:11:53.240,00:11:56.150
are going to use.,00:11:56.150,00:11:57.270
Let's start.,00:11:57.560,00:12:00.050
Our starting point is E_out.,00:12:00.050,00:12:01.670
So let me put it--,00:12:01.670,00:12:02.920
Don't worry about the gap.,00:12:05.360,00:12:06.640
The gap here will be filled.,00:12:06.640,00:12:09.250
What do we have?,00:12:09.250,00:12:10.095
We have E_out.,00:12:10.095,00:12:11.250
"E_out depends on the hypothesis
you pick.",00:12:11.250,00:12:13.280
"E_out is E_out of your
final hypothesis.",00:12:13.280,00:12:15.710
"How does it perform on
the overall space?",00:12:15.710,00:12:19.690
"And in order to do that, since we are
talking about squared error, you are",00:12:19.690,00:12:23.150
"going to take the value of your
hypothesis, and compare it to the value",00:12:23.150,00:12:26.990
"of the target function,
and take that squared.",00:12:26.990,00:12:28.700
And that will be your error.,00:12:28.700,00:12:30.480
"So this is the building block for
getting the out-of-sample performance.",00:12:30.480,00:12:34.910
"Now the gap here comes from the fact
that, if you look at the final",00:12:34.910,00:12:39.660
"hypothesis, the final hypothesis
depends on a number of things.",00:12:39.660,00:12:43.670
"Among other things, it does depend
on the data set that I'm",00:12:43.670,00:12:47.080
"going to give you, right?",00:12:47.080,00:12:49.550
"Because if I give you a different data
set, you'll find a different final",00:12:49.550,00:12:52.760
hypothesis.,00:12:52.760,00:12:54.220
"That dependency is quite important
in the bias-variance analysis.",00:12:54.220,00:12:58.190
"Therefore, I am going to make
it explicit in the notation.",00:12:58.190,00:13:00.980
"It has always been there, but I didn't
need to carry ugly notation throughout,",00:13:00.980,00:13:05.100
when I'm not using it.,00:13:05.100,00:13:06.170
"Here I'm using it, so we'll
have to live with it.",00:13:06.170,00:13:08.770
"So now I'll make that
dependency explicit.",00:13:08.770,00:13:12.180
"I'm having now a superscript, which
tells me that this g comes from that",00:13:12.180,00:13:16.530
particular data set.,00:13:16.530,00:13:18.120
"If you give me another data set, this
will be a different g.",00:13:18.120,00:13:20.940
"And you take the same g, apply it to x,
compare it to f, and this is your error.",00:13:20.940,00:13:26.280
"And finally, in order for it to be
genuinely out-of-sample error, you",00:13:26.280,00:13:29.740
"need to get the expected value of that
error over the entire space.",00:13:29.740,00:13:33.730
So this is what we have.,00:13:33.730,00:13:35.640
"Now what we would like to do, we would
like to see a decomposition of this",00:13:35.640,00:13:39.720
"quantity into the two conceptual
components, approximation and",00:13:39.720,00:13:44.780
"generalization, that we saw.",00:13:44.780,00:13:46.740
So here's what we are going to do.,00:13:46.740,00:13:50.270
"We are going to take this quantity,
which equals this quantity, as I",00:13:50.270,00:13:55.170
"mentioned here, and then realize
that this depends on the",00:13:55.170,00:13:59.510
particular data set.,00:13:59.510,00:14:02.420
"I would like to rid this from the
dependency on the specific data set",00:14:02.420,00:14:07.420
that I give you.,00:14:07.420,00:14:08.710
"So I'm going to play
the following game.",00:14:08.710,00:14:11.160
"I am going to give you a budget of
N examples, training examples",00:14:11.160,00:14:16.110
to learn from.,00:14:16.110,00:14:18.350
"If I give you that budget N, I could
generate one D and another D and",00:14:18.350,00:14:22.360
"another D, each of them
with N examples.",00:14:22.360,00:14:25.620
"Each of them will result in a different
hypothesis g, and each of",00:14:25.620,00:14:30.220
"them will result in a different
out-of-sample error.",00:14:30.220,00:14:33.180
Correct?,00:14:33.180,00:14:34.460
"So if I want to get rid of the
dependency on the particular sample",00:14:34.460,00:14:37.860
"that I give you, and just know the
behavior-- if I give you N data points,",00:14:37.860,00:14:41.640
"what happens?-- then I would
like to integrate D out.",00:14:41.640,00:14:45.720
"So I am going to get the expected value
of that error, with respect to D.",00:14:45.720,00:14:51.606
"This is not a quantity that
you are going to encounter",00:14:51.606,00:14:53.900
in any given situation.,00:14:53.900,00:14:55.110
"In any given situation, you have
a specific data set to work with.",00:14:55.110,00:14:59.280
"However, if I want to analyze the
general behavior--",00:14:59.280,00:15:03.020
"someone comes to my door, how many
examples do you have, and they tell me",00:15:03.020,00:15:06.410
100. I haven't seen the examples yet.,00:15:06.410,00:15:08.930
"So it stands to logic that I say,
for 100 examples, the following",00:15:08.930,00:15:12.350
behavior follows.,00:15:12.350,00:15:13.370
"So I must be taking an expected value
with respect to all possible",00:15:13.370,00:15:16.550
realizations of 100 examples.,00:15:16.550,00:15:18.770
"And that is, indeed, what
I am going to do.",00:15:18.770,00:15:20.910
"I'm going to get the expected
value of that.",00:15:20.910,00:15:22.670
"And this is the quantity that
I am going to decompose.",00:15:22.670,00:15:25.350
"And this obviously happens to be the
expected value of the other guy, and",00:15:25.350,00:15:28.670
we have that.,00:15:28.670,00:15:29.920
"Now I am going to take this quantity,
the expression for the quantity that",00:15:32.200,00:15:36.260
"I'm interested in, and keep deriving
stuff until I get to the",00:15:36.260,00:15:40.870
decomposition I want.,00:15:40.870,00:15:42.690
"The first order of business,
I have two expectations.",00:15:42.690,00:15:46.020
"The first thing I'm going to do, I am
going to reverse the order of the",00:15:46.020,00:15:48.600
expectations.,00:15:48.600,00:15:51.310
Why can I do that?,00:15:51.310,00:15:52.830
I am integrating.,00:15:52.830,00:15:54.160
"So now I change the order
of integration.",00:15:54.160,00:15:55.750
"I am allowed to do that, because the
integrand is strictly non-negative.",00:15:55.750,00:16:01.150
So I get this.,00:16:01.150,00:16:02.520
"And the reason for that is because
I am really interested in the",00:16:02.520,00:16:05.345
"expectation with respect to D, and I'd
rather not carry the expectation with",00:16:05.345,00:16:09.020
respect to x throughout.,00:16:09.020,00:16:10.710
"So I am going to get rid of that
expectation for a while, until I get",00:16:10.710,00:16:14.170
a clean decomposition.,00:16:14.170,00:16:15.430
"And when I get the clean decomposition,
I'll go back and get",00:16:15.430,00:16:17.920
"the expectation, just to
keep the focus clear.",00:16:17.920,00:16:21.050
You focus on the inside quantity.,00:16:24.540,00:16:27.530
"If I give you the expression for the
inside quantity for any x, then all",00:16:27.530,00:16:30.920
"you need to do in order to get the
quantity that you need, is get the",00:16:30.920,00:16:33.310
"expected value of what I
said, with respect to x.",00:16:33.310,00:16:36.270
"So this is the quantity that we are
going to carry to the next slide.",00:16:36.270,00:16:40.000
Let's do that.,00:16:40.000,00:16:42.350
"And the main notion, in order to evaluate
this quantity, is the notion",00:16:42.350,00:16:46.690
of an average hypothesis.,00:16:46.690,00:16:48.210
It's a pretty interesting idea.,00:16:48.210,00:16:50.880
Here is the idea.,00:16:50.880,00:16:53.530
"You have a hypothesis set, and you are
learning from a particular data set.",00:16:53.530,00:16:58.400
"And I am going to define
a particular hypothesis.",00:16:58.400,00:17:02.120
"I am going to call it the
average hypothesis.",00:17:02.120,00:17:04.619
"And because it's average, I am going
to give it a bar notation.",00:17:04.619,00:17:08.319
So what is this fellow?,00:17:08.319,00:17:10.790
"Well, this fellow is
defined as follows.",00:17:10.790,00:17:15.410
You learn from a data set.,00:17:15.410,00:17:17.230
You get a hypothesis.,00:17:17.230,00:17:18.319
"Someone else learns from
another data set.",00:17:18.319,00:17:20.150
"They get another hypothesis, et cetera.",00:17:20.150,00:17:22.480
"So how about getting the expected
value of these hypotheses?",00:17:22.480,00:17:26.849
What does that formally mean?,00:17:26.849,00:17:28.900
We have x fixed.,00:17:28.900,00:17:30.220
"So we actually are in a good position,
because g of x is really just a random",00:17:30.220,00:17:34.860
variable at this point.,00:17:34.860,00:17:35.920
"It's a random variable, determined
by the choice of your data.",00:17:35.920,00:17:39.250
The data is the randomization source.,00:17:39.250,00:17:41.080
"x is fixed, so you think I have one
test point in the space, that I'm",00:17:41.080,00:17:44.480
interested in.,00:17:44.480,00:17:46.130
"Maybe you are playing the stock market,
and now you are only interested",00:17:46.130,00:17:49.190
in what's going to happen tomorrow.,00:17:49.190,00:17:50.600
"So you take the inputs, and these are
the only inputs you're interested in",00:17:50.600,00:17:53.360
performing on.,00:17:53.360,00:17:54.320
That's your x.,00:17:54.320,00:17:55.770
"And all of the questions
now pertain to this.",00:17:55.770,00:17:57.610
You are learning from other data.,00:17:57.610,00:17:58.650
"And then you ask yourself, how am
I performing on this point?",00:17:58.650,00:18:00.920
That is the point x.,00:18:00.920,00:18:02.880
Now you are looking at this point.,00:18:02.880,00:18:03.900
"And you say, if you give me a data set
versus another, I am going to",00:18:03.900,00:18:06.740
"get different values for the
hypothesis on that point.",00:18:06.740,00:18:10.510
