text,start,stop
"region, and then we had a bound on the
generalization error, which is Omega.",00:51:01.630,00:51:07.030
"And we said that the bound behaves the
same way as the quantity itself.",00:51:07.030,00:51:10.530
"So the bound actually will
not be this thing.",00:51:10.530,00:51:12.230
It will be way bigger.,00:51:12.230,00:51:14.990
"But in proportionality, it will
give us the same proportion.",00:51:14.990,00:51:19.140
"So as you increase N, the generalization
error goes down.",00:51:19.140,00:51:22.520
The bound on it goes down.,00:51:22.520,00:51:23.600
"Omega goes down, which
we already realized.",00:51:23.600,00:51:26.940
"And obviously, you can
take another model.",00:51:26.940,00:51:29.330
"And if the model is very complex, the
discrepancy between them becomes",00:51:29.330,00:51:34.240
"bigger, which agrees with that.",00:51:34.240,00:51:35.840
So this is the decomposition of it.,00:51:35.840,00:51:37.810
"Now I took some liberties, in order
to be able to do that.",00:51:37.810,00:51:40.760
"The VC analysis doesn't
have expected values.",00:51:40.760,00:51:43.210
"So I took expected values
of everything there is.",00:51:43.210,00:51:45.510
"So there is some liberty taken, in
order to put it to fit in that",00:51:45.510,00:51:49.510
"diagram, but the principle holds.",00:51:49.510,00:51:51.295
"The blue region is the in-sample
error, and the red region is",00:51:54.585,00:51:57.610
basically the Omega.,00:51:57.610,00:51:58.620
"That is what happens in
the generalization bound.",00:51:58.620,00:52:01.410
"Think for a moment, which region will be
blue and which region will be red",00:52:01.410,00:52:05.130
in the bias-variance analysis?,00:52:05.130,00:52:06.300
"I'll get exactly the same
curves, the same model.",00:52:06.300,00:52:09.700
So what will it be?,00:52:09.700,00:52:12.310
It will be this.,00:52:12.310,00:52:16.190
That's the difference.,00:52:16.190,00:52:18.740
"In the bias-variance, I got the bias
based on the best approximation.",00:52:18.740,00:52:23.250
"I didn't look at how you
performed in-sample.",00:52:23.250,00:52:26.160
"I assumed hypothetically that you
could look for the best possible",00:52:26.160,00:52:29.770
approximation.,00:52:29.770,00:52:30.950
And I charged the bias for that.,00:52:30.950,00:52:33.100
And this is the bias you have.,00:52:33.100,00:52:35.210
So this is the best you can do.,00:52:35.210,00:52:36.530
And this is the error you are making.,00:52:36.530,00:52:38.090
"Again, there is a liberty taken here.",00:52:38.090,00:52:39.490
"Because this is genuinely the best
approximation in your hypothesis set.",00:52:39.490,00:52:43.800
"The one I am using for the
bias-variance analysis is",00:52:43.800,00:52:46.330
the error on g bar.,00:52:46.330,00:52:48.960
"And we said, g bar will be
close in error to this guy.",00:52:48.960,00:52:51.735
"It may not even be in
the hypothesis set.",00:52:51.735,00:52:53.395
"So there is some liberty, but
it's not a huge liberty.",00:52:53.395,00:52:55.750
"This is very much close to what you
are getting in the bias-variance.",00:52:55.750,00:52:59.140
And the rest of it is the variance.,00:52:59.140,00:53:01.720
"Because you get the bias plus that, and
you will get the expected value of",00:53:01.720,00:53:04.720
the out-of-sample error.,00:53:04.720,00:53:06.870
"Now you can see why they are both
talking about the same thing.",00:53:06.870,00:53:09.350
"Both of them are talking
about approximation.",00:53:09.350,00:53:11.930
That's the blue part.,00:53:11.930,00:53:13.260
Here it's approximation overall.,00:53:13.260,00:53:15.950
And here it's approximation in-sample.,00:53:15.950,00:53:19.750
"And both of them take into consideration
what happens in terms of",00:53:19.750,00:53:22.970
generalization.,00:53:22.970,00:53:24.230
"Well, the red region here
is maybe twice the size.",00:53:24.230,00:53:26.980
Not twice the size,00:53:26.980,00:53:27.850
"in general. It will be twice
the size actually in the",00:53:27.850,00:53:29.440
linear regression example.,00:53:29.440,00:53:31.010
"But basically, they have
the same behavior.",00:53:31.010,00:53:32.390
They have just different scale.,00:53:32.390,00:53:33.800
"So they capture the same principle of
generalizing, or the uncertainty about",00:53:33.800,00:53:38.330
"which hypothesis to pick, or how much
do I lose from going in-sample to",00:53:38.330,00:53:42.720
out-of-sample.,00:53:42.720,00:53:43.400
So they have the same behavior.,00:53:43.400,00:53:45.090
"And the only difference here is that,
here the bias obviously is constant",00:53:45.090,00:53:48.310
"with respect to N. The bias depends
on the hypothesis set.",00:53:48.310,00:53:51.800
Now this is also an assumption.,00:53:51.800,00:53:53.450
"Because it says, I have 2 examples
and take the average.",00:53:53.450,00:53:55.950
I will get an error.,00:53:55.950,00:53:56.950
"If I have 10 examples and take
the average, I get an error.",00:53:56.950,00:53:59.650
Is it the same?,00:53:59.650,00:54:00.480
"Well, in both cases, you effectively used
an infinite number of examples.",00:54:00.480,00:54:03.850
"Because the first one you used two
at a time, and you repeated it",00:54:03.850,00:54:06.610
"an infinite number of times,
and you took an average.",00:54:06.610,00:54:09.430
"This, you used 10 at a time,
and you took an average.",00:54:09.430,00:54:12.380
"I grant you maybe the 10 will
give you a better situation.",00:54:12.670,00:54:14.790
"But again, it's a little bit of
a license, in order to be able to",00:54:14.790,00:54:18.990
"attribute the bias and variance to this
line, which happens to be the",00:54:18.990,00:54:22.710
"best hypothesis proper within
your hypothesis set.",00:54:22.710,00:54:26.210
"So this is the contrast between the
two theoretical approaches we have",00:54:26.210,00:54:28.840
"covered, in this lecture and the
previous three lectures.",00:54:28.840,00:54:31.590
"I am going to end up with the analysis
for the linear regression case.",00:54:34.100,00:54:38.400
"So I'm going to basically go
through it fairly quickly.",00:54:38.400,00:54:41.830
This is a very good exercise to do.,00:54:41.830,00:54:45.610
"And if you read the exercise and you
follow the steps, it will give you",00:54:45.610,00:54:49.110
"very good insight into the
linear regression.",00:54:49.110,00:54:51.190
"I'll try to explain the
highlights of it.",00:54:51.190,00:54:53.780
"Let's start with a reminder
of linear regression.",00:54:53.780,00:54:57.130
"So linear regression,
I'm using a target.",00:54:57.130,00:54:59.250
"For the purpose of simplification, I am
going to use a noisy target, which",00:54:59.250,00:55:04.700
is linear plus noise.,00:55:04.700,00:55:08.280
"So I'm using linear regression to learn
something linear plus noise.",00:55:08.280,00:55:11.450
"If it weren't for the noise,
I would get it perfectly.",00:55:11.450,00:55:13.700
It's already linear.,00:55:13.700,00:55:14.950
"But because of the noise, I will
be deviating a little bit.",00:55:14.950,00:55:17.960
"This is just to make the mathematics
that results easier to handle.",00:55:17.960,00:55:23.360
Now you're given a data set.,00:55:23.360,00:55:25.710
And the data set is a noisy data set.,00:55:25.710,00:55:27.350
"So each of these is picked
independently.",00:55:27.350,00:55:30.190
"This y depends on x, and the only
unknown here is the noise.",00:55:30.190,00:55:34.960
"So you get this value, it gives you
the average, and then you add",00:55:34.960,00:55:37.720
a noise to get the y.,00:55:37.720,00:55:38.970
"Do you remember the linear
regression solution?",00:55:41.310,00:55:43.440
"Regardless of what the target function
is, you look at the data, and this is",00:55:43.440,00:55:46.200
what you get for the solution.,00:55:46.200,00:55:48.770
"You take the input data set,
and the output data set.",00:55:48.770,00:55:52.950
"You do this algebraic combination, and
whatever comes out is your output of",00:55:52.950,00:55:57.480
the linear regression.,00:55:57.480,00:55:58.420
This is your final hypothesis.,00:55:58.420,00:56:00.150
We have done that.,00:56:00.570,00:56:02.590
"And now we are going to think about
a notion of the in-sample error, not",00:56:02.590,00:56:07.050
"in-sample error as a summary quantity,
but the in-sample error pattern.",00:56:07.050,00:56:10.920
"How much error do I get
in the first example?",00:56:10.920,00:56:12.600
"How much error do I get in the
second, third, et cetera?",00:56:12.600,00:56:15.000
Just for our purposes.,00:56:15.000,00:56:16.150
So what would that be?,00:56:16.150,00:56:17.390
"Well, that would be what I got
in the final hypothesis.",00:56:17.390,00:56:22.060
"I apply the final hypothesis
to the input points.",00:56:22.060,00:56:24.900
"I am going to get a pattern of values
that my hypothesis is predicting.",00:56:24.900,00:56:29.020
"I compare them to the actual targets,
which happen to be stored in the y.",00:56:29.020,00:56:32.870
And that would be an error pattern.,00:56:32.870,00:56:34.980
"So it would be plus something
minus something, plus",00:56:34.980,00:56:37.290
something minus something.,00:56:37.290,00:56:38.230
"And if I add the squared values here,
get the average of those, I will",00:56:38.230,00:56:42.110
get what we call the in-sample error.,00:56:42.110,00:56:45.160
"For the out-of-sample error, I am going
to play a simplifying trick here,",00:56:45.160,00:56:48.490
"in order to get the learning
curve in the finite case.",00:56:48.490,00:56:52.650
"Here I am going to consider that, in
order to get the out-of-sample error,",00:56:52.650,00:56:57.270
"what I'm going to do I am going to just
generate the same inputs, which",00:56:57.270,00:57:02.030
is a complete no-no in out-of-sample.,00:57:02.030,00:57:04.060
"Supposedly in out-of-sample, you get
points that you haven't seen before.",00:57:04.060,00:57:07.250
You have seen these x's before.,00:57:07.250,00:57:09.270
"But the redeeming value is that I'm
now going to give you fresh noise.",00:57:09.270,00:57:13.850
"So that's the unknown, and that is what
allows me to say that it plays",00:57:13.850,00:57:18.210
the role of an out-of-sample.,00:57:18.210,00:57:19.710
"I'm going to generate another set of
points with different noises, but on",00:57:19.710,00:57:24.190
"the same inputs in order to
simplify the analysis.",00:57:24.190,00:57:26.770
"You see that the x's
here are involved.",00:57:26.770,00:57:28.860
"And if I use the same inputs,
things will simplify.",00:57:28.860,00:57:31.620
"And in that case, if you ask yourself
what is the out-of-sample error of",00:57:31.620,00:57:34.890
"those, it's exactly the same.",00:57:34.890,00:57:36.010
I evaluated on the points.,00:57:36.010,00:57:37.920
"They happen to be the points
for the out-of-sample.",00:57:37.920,00:57:40.210
And I'm comparing it with y.,00:57:40.210,00:57:41.490
"I'm calling it y dash, which is exactly
the same thing, except with",00:57:41.490,00:57:44.610
"noise dash, another realization
of the noise.",00:57:44.610,00:57:47.590
"This is the outline of the setup to
get us the learning curves we want.",00:57:47.590,00:57:52.950
"When you do the analysis, not that
difficult at all, you will get this",00:57:52.950,00:57:57.210
very interesting curve.,00:57:57.210,00:57:59.530
"This is the learning curve, and
it has very specific values.",00:57:59.530,00:58:02.770
"sigma squared, that's the
variance of the noise.",00:58:02.770,00:58:05.310
This is the best you can do.,00:58:05.310,00:58:06.620
"I expect that, because you told
me the target is linear.",00:58:06.620,00:58:09.460
So I can get that perfectly.,00:58:09.460,00:58:10.970
"But then, there is this added noise.",00:58:10.970,00:58:12.320
I cannot capture the noise.,00:58:12.320,00:58:13.790
"What is the variance of the
noise? sigma squared.",00:58:13.790,00:58:15.490
"So this is the error
that is inevitable.",00:58:15.490,00:58:18.580
Look at the in-sample error.,00:58:18.580,00:58:20.000
"Up to d plus 1, you were perfect.",00:58:20.000,00:58:21.570
"Yeah, of course I am perfect.",00:58:21.570,00:58:22.640
"Because I have d plus 1 parameters in
linear, and I am fitting less than",00:58:22.640,00:58:26.720
"those, so I can fit them perfectly.",00:58:26.720,00:58:28.630
"It doesn't mean much for the
out-of-sample error, but",00:58:28.630,00:58:31.350
that's what I get.,00:58:31.350,00:58:32.310
"I start compromising when
I get more points.",00:58:32.310,00:58:34.610
"And as I go with more points,
here I'm fitting the noise.",00:58:34.610,00:58:39.680
I am fitting the noise less.,00:58:39.680,00:58:40.450
The noise is averaging out.,00:58:40.450,00:58:41.540
"Now I'm getting very, very close,
to as if there was no noise.",00:58:41.540,00:58:44.110
"Because the pattern persists,
which is the linear guy.",00:58:44.110,00:58:47.300
"And the noise, if I get more
examples, more or less cancels out in",00:58:47.300,00:58:50.800
the fitting.,00:58:50.800,00:58:51.440
"I don't have enough degrees of
freedom to fit them all.",00:58:51.440,00:58:53.760
"So I get to average, until
eventually I get to as if",00:58:53.760,00:58:56.760
I am doing it perfectly.,00:58:56.760,00:58:58.030
And out-of-sample goes down.,00:58:58.030,00:59:00.170
"There is a very specific formula that
you can get, which is interesting.",00:59:00.170,00:59:02.960
So let me finish with this.,00:59:02.960,00:59:04.760
"The best approximation error
is sigma squared.",00:59:04.760,00:59:07.270
"That's the line, right?",00:59:07.270,00:59:10.320
What is the expected in-sample error?,00:59:10.320,00:59:12.275
"It has a very simple formula, which is--
everything is scaled by sigma squared.",00:59:12.275,00:59:18.250
"So What you have here is,
it's almost perfect.",00:59:18.250,00:59:21.700
"And you are doing better than perfect, by
this amount, the ratio of d plus 1.",00:59:21.700,00:59:27.210
Remember what d plus 1 was?,00:59:27.210,00:59:28.500
"For the perceptron, it
was the VC dimension.",00:59:28.500,00:59:31.000
"Here it's also a VC dimension of sorts,
the degrees of freedom that",00:59:31.000,00:59:33.930
linear regression has.,00:59:33.930,00:59:35.410
"So we divide the degrees of freedom
by the number of examples.",00:59:35.410,00:59:38.280
That is the factor that you get.,00:59:38.280,00:59:40.720
"And you realize here that this
is the best you can do.",00:59:40.720,00:59:45.220
"And here you are doing
better than the best.",00:59:45.220,00:59:47.440
Why is it better than the best?,00:59:47.440,00:59:48.320
"Because I'm not trying to
fit the whole function.",00:59:48.320,00:59:49.780
I am only fitting the finite sample.,00:59:49.780,00:59:53.020
"So I'm doing very well, and I'm very
happy about it, little that I know",00:59:53.020,00:59:56.260
that I'm actually harming myself.,00:59:56.260,00:59:58.280
"Because what I'm doing here,
I am fitting the noise.",00:59:58.280,01:00:00.400
"And as a result of that, I am deviating
from the optimal guy.",01:00:00.400,01:00:02.870
"And I am paying the price
in out-of-sample error.",01:00:02.870,01:00:06.570
"What is the price I am paying
in out-of-sample error?",01:00:06.570,01:00:08.870
It is the mirror image.,01:00:08.870,01:00:11.500
"I lose exactly in out-of-sample
what I gained in-sample.",01:00:11.500,01:00:16.030
"And the most interesting quantity
is the summary quantity.",01:00:16.030,01:00:18.230
"What is the expected generalization
error?",01:00:18.230,01:00:20.100
"Well, the generalization error is the
difference between this and that.",01:00:20.100,01:00:22.160
I have the formula for them.,01:00:22.160,01:00:23.330
So all I need to do is write this.,01:00:23.330,01:00:26.220
Let me magnify this.,01:00:26.220,01:00:29.510
This is the generalization error.,01:00:29.510,01:00:31.072
"It has the form of the VC dimension
divided by the number of examples.",01:00:31.072,01:00:37.510
"In this case, it's exact.",01:00:37.510,01:00:40.180
And this is what I promised last time.,01:00:40.180,01:00:42.220
"I told you that this rule of
proportionality between a VC dimension",01:00:42.220,01:00:45.260
"and a number of examples persists to
the level where sometimes, you just",01:00:45.260,01:00:49.440
"divide the VC dimension by the number of
examples, and that will give you",01:00:49.440,01:00:52.200
a generalization error.,01:00:52.200,01:00:54.000
"This is the concrete version of it, in
spite of the fact that here is not",01:00:54.000,01:00:57.780
a VC dimension.,01:00:57.780,01:00:58.560
This is real-valued.,01:00:58.560,01:00:59.670
"But it's degrees of freedom,
so it plays the role.",01:00:59.670,01:01:01.970
"We could actually solve for it and
realize that this is indeed the",01:01:01.970,01:01:05.230
"compromise between the degrees of
freedom I have, in the case of linear",01:01:05.230,01:01:08.350
"regression, and the number
of examples I am using.",01:01:08.350,01:01:12.510
So we will stop here.,01:01:12.510,01:01:13.690
"And we will go into questions and
answers after a short break.",01:01:13.690,01:01:17.518
Let's go into the questions.,01:01:22.660,01:01:25.410
MODERATOR: Right.,01:01:25.410,01:01:25.770
"The first question is if you
can go back to slide 19.",01:01:25.770,01:01:28.754
PROFESSOR: 19.,01:01:28.754,01:01:30.004
"MODERATOR: The question is if you can
explain how complex models are better",01:01:34.130,01:01:39.670
than simple models.,01:01:39.670,01:01:41.210
PROFESSOR: OK.,01:01:41.210,01:01:43.260
Better in something.,01:01:43.260,01:01:44.670
"I think the key issue in the theory
is, there is a tradeoff.",01:01:44.670,01:01:49.530
"Nothing is better on all fronts, and
nothing is worse on all fronts.",01:01:49.530,01:01:53.790
"So let's compare the simple model
and the complex model.",01:01:53.790,01:01:57.930
"In terms of the ability to approximate,
whether that ability to",01:01:57.930,01:02:01.730
"approximate is in-sample, or whether
the ability to approximate is",01:02:01.730,01:02:04.870
"absolute, what is the ability to
approximate in the absolute?",01:02:04.870,01:02:09.000
"Here is my hypothesis set, and
I have a target function.",01:02:09.000,01:02:11.640
"The horizontal line, that height gives
you the error of approximation.",01:02:11.640,01:02:19.110
"So if you go from a simple model to
a complex model, you will be able to",01:02:19.110,01:02:23.160
approximate better.,01:02:23.160,01:02:24.550
That is obvious.,01:02:24.550,01:02:25.900
"And that also is inherited if your
approximation is focused only on the",01:02:25.900,01:02:29.960
training examples.,01:02:29.960,01:02:30.730
"In this case, you are comparing
not the horizontal lines,",01:02:30.730,01:02:33.530
but the blue curves.,01:02:33.530,01:02:34.710
"This is the error you make in
approximating the sample you get.",01:02:34.710,01:02:40.050
"And again, the approximation for the
simple model is worse than the",01:02:40.050,01:02:43.790
approximation for the complex model.,01:02:43.790,01:02:45.890
"So if your game is approximation, and
that's your purpose, then obviously",01:02:45.890,01:02:49.820
the complex model is better.,01:02:49.820,01:02:51.852
"In this particular case, you
can also ask yourself about the",01:02:51.852,01:02:55.620
generalization ability.,01:02:55.620,01:02:57.090
"The generalization ability will be the
discrepancy between, either the blue",01:02:57.090,01:03:02.800
and red curve.,01:03:02.800,01:03:03.750
That would be the VC analysis.,01:03:03.750,01:03:05.105
"This would be how much I lose from going
from in-sample to out-of-sample.",01:03:05.105,01:03:09.810
"Or how much I lose from a perfect
approximation, in the case of the",01:03:09.810,01:03:14.920
"bias-variance analysis, to getting E_out,
because of my inability to zoom in on",01:03:14.920,01:03:21.850
the right hypothesis.,01:03:21.850,01:03:22.910
This would be that area here.,01:03:22.910,01:03:25.860
"So whether you are taking the difference
between the blue and red",01:03:25.860,01:03:28.550
"curve, or the difference between the
red curve and the black line, that",01:03:28.550,01:03:32.600
area is smaller here than here.,01:03:32.600,01:03:35.470
"Therefore, the simple model
is better, as far as the",01:03:35.470,01:03:39.310
generalization is concerned.,01:03:39.310,01:03:41.730
"Now because it's a tradeoff, and I have
one of them better and one of",01:03:41.730,01:03:44.880
"them worse, then the question is, when
I put them together, which is better?",01:03:44.880,01:03:48.840
"Because the bottom line in learning
is the red curve.",01:03:48.840,01:03:52.980
That's what I care about.,01:03:52.980,01:03:54.360
"This is the performance of the system
that I'm going to deliver to my",01:03:54.360,01:03:57.070
"customer, and they're going
to test it out-of-sample.",01:03:57.070,01:03:59.760
"And if they get it right,
they will be happy.",01:03:59.760,01:04:03.010
"So now because I have two quantities
that I'm adding, and one of them is",01:04:03.010,01:04:07.140
"going down, and one of them is going
up, then it is obvious that the sum",01:04:07.140,01:04:12.020
could go either way.,01:04:12.020,01:04:13.390
"And in this case, you can see
that it is going either way.",01:04:13.390,01:04:15.860
"For example, if you have few examples,
then E_out here is OK.",01:04:15.860,01:04:20.750
"It's not great, but it's decent.",01:04:20.750,01:04:22.240
"If you have the same number of examples
here, E_out is a disaster.",01:04:22.240,01:04:26.830
"So if you have few examples,
you simply cannot",01:04:26.830,01:04:28.640
afford the complex model.,01:04:28.640,01:04:30.280
"You are better off working with a simple
model, and you will get better",01:04:30.280,01:04:33.210
out-of-sample error.,01:04:33.210,01:04:34.810
"If I give you much bigger resource
of the examples-- if you are here, now",01:04:34.810,01:04:38.260
"this one is limited by the
fact that it's simple.",01:04:38.260,01:04:40.460
It cannot get any better.,01:04:40.460,01:04:41.600
It has all the information.,01:04:41.600,01:04:42.465
"It zooms in perfectly, but
it cannot get any better.",01:04:42.465,01:04:45.040
"This guy now gets to use its degrees of
freedom properly, and gets you to",01:04:45.040,01:04:48.930
a smaller value.,01:04:48.930,01:04:49.860
"So for larger number of points, you
get a better performance here.",01:04:49.860,01:04:53.800
"That's why we are saying that you should
match the complexity of the",01:04:53.800,01:04:57.070
"model to the data resources you have,
which in this case are represented by",01:04:57.070,01:05:02.530
"N. We're talking about different target
functions and different things.",01:05:02.530,01:05:06.790
"But in choosing this model or another,
what really dictates the performance",01:05:06.790,01:05:10.920
"is the number of examples versus
the complexity of the model.",01:05:10.920,01:05:14.246
MODERATOR: OK.,01:05:17.660,01:05:18.910
"When you did the analysis for linear
regression, if you did it using the",01:05:21.340,01:05:25.290
"perceptron model, would you get
the same generalization error?",01:05:25.290,01:05:29.510
PROFESSOR: Let's go for that.,01:05:29.510,01:05:31.085
"The analysis of the bias-variance, and
it's also inherited in the learning",01:05:35.590,01:05:41.440
"curves-- the analysis is very clean
when you use mean squared error.",01:05:41.440,01:05:46.400
"Obviously, you can use mean squared
error in the perceptron.",01:05:46.400,01:05:50.050
There will be a correspondence here.,01:05:50.050,01:05:52.460
"But the ability to get such a clean
formula here really depends on the",01:05:52.460,01:05:57.350
very particulars of linear regression.,01:05:57.350,01:06:01.610
"If you go back to the previous slide,
where the assumption is, it was very",01:06:01.610,01:06:05.480
"critical to make the assumption that the
out-of-sample is this way, and to",01:06:05.480,01:06:09.830
"make the target very specifically linear
plus noise, in order to be able",01:06:09.830,01:06:13.180
to simplify.,01:06:13.180,01:06:14.160
"The result, by the way, holds
in general, asymptotically.",01:06:14.160,01:06:17.240
"So if you take genuine out-of-sample,
which means that you pick different",01:06:17.240,01:06:20.460
"points, you will get
a different matrix X.",01:06:20.460,01:06:22.880
"So you will apply w that you got from
in-sample, you'll apply it to X dash in",01:06:22.880,01:06:27.690
"this case, which is this,
and then y dash.",01:06:27.690,01:06:30.230
"And the problem is that when you plug
it in here, and try to get a formula",01:06:30.230,01:06:33.510
"for that, the formula will depend on
how the X dash relates to the X.",01:06:33.510,01:06:38.670
"When it's the same, they cancel
out neatly, and you get the",01:06:38.670,01:06:41.200
formula that I had.,01:06:41.200,01:06:42.280
"But asymptotically, if you make certain
assumptions about how X is",01:06:42.280,01:06:45.720
"generated and you take the asymptotic
result, you will get the same thing.",01:06:45.720,01:06:49.560
So the short answer is the following.,01:06:49.560,01:06:51.350
"The analysis in the exact form that I
gave, which gives me these very neat",01:06:51.350,01:06:55.190
"results, is very specific to linear
regression, very specific to the",01:06:55.190,01:06:59.030
"choice of out-of-sample as I did it,",01:06:59.030,01:07:00.680
"if you want to give the answer
exactly in a finite case.",01:07:00.680,01:07:03.810
"If you use a perceptron, you will be
able to find a parallel, but it may",01:07:03.810,01:07:06.990
not be as neat.,01:07:06.990,01:07:10.140
MODERATOR: Quick clarification.,01:07:10.140,01:07:11.190
"sigma squared is the variance
of the noise in the--",01:07:11.190,01:07:14.220
PROFESSOR: Yeah.,01:07:14.220,01:07:15.700
I just realized that.,01:07:15.990,01:07:17.810
I have been using bias-variance.,01:07:17.810,01:07:19.820
"The lecture is called bias-variance, and
now we have variance of the noise.",01:07:19.820,01:07:22.830
"So obviously, I am so used to these
things that I didn't notice.",01:07:22.830,01:07:26.000
"When I say the variance here, this has
absolutely nothing to do with the",01:07:26.000,01:07:29.700
