text,start,stop
Now I have a constant.,00:35:07.770,00:35:09.690
"I want to approximate this
guy with a constant.",00:35:09.690,00:35:12.850
What is the constant?,00:35:12.850,00:35:15.610
I guess I have to work with 0.,00:35:15.610,00:35:17.455
That's the best I have.,00:35:17.455,00:35:18.490
"Remember, it's mean squared error.",00:35:18.490,00:35:19.860
"So if I move the 0, the big error will
contribute a lot, because it's squared.",00:35:19.860,00:35:23.820
"So I just put it in the middle,
and this is your hypothesis.",00:35:23.820,00:35:29.560
And how much is your error?,00:35:29.560,00:35:31.660
Big.,00:35:31.660,00:35:32.090
The whole thing is your error.,00:35:32.090,00:35:34.730
Let's quantify it.,00:35:34.730,00:35:35.520
"If you get the expected values of mean
squared error, you'll get a number,",00:35:35.520,00:35:38.010
"which here will be 0.5, and here
will be approximately 0.2.",00:35:38.010,00:35:44.290
So the linear model wins.,00:35:44.290,00:35:46.080
"Yeah, I'm approximating.",00:35:46.080,00:35:47.540
"I have more parameters, sure.",00:35:47.540,00:35:48.750
"If you give me third order, I
will be able to do better.",00:35:48.750,00:35:50.800
"If you give me 17th order, I'll
be able to do better.",00:35:50.800,00:35:53.260
But that's the game.,00:35:53.260,00:35:55.110
"In terms of approximation,
the more the merrier.",00:35:55.110,00:35:57.210
"Because you have all the information.
There's no question of zooming in.",00:35:57.210,00:36:01.670
Now let's go for learning.,00:36:01.670,00:36:04.080
"This course is about machine learning, right?
Not about approximation.",00:36:04.080,00:36:07.080
So this is the important part for us.,00:36:07.080,00:36:09.370
"Let's play the same game with
a view to learning.",00:36:09.370,00:36:12.220
You have two examples.,00:36:12.220,00:36:13.240
You are going to learn from them.,00:36:13.240,00:36:14.560
"You are restricted to one hypothesis
set or the other.",00:36:14.560,00:36:18.510
"So let's start with H_1, and
I'll go to H_0 again.",00:36:18.510,00:36:22.690
This is your target function.,00:36:22.690,00:36:24.610
Now you get two examples.,00:36:24.610,00:36:25.920
"I'm going to, let's say, uniformly pick
two examples independently, and I",00:36:25.920,00:36:29.790
get these two examples.,00:36:29.790,00:36:31.840
"I'd like you to fit the examples, and
we'll see how well you approximate the",00:36:31.840,00:36:35.160
target function.,00:36:35.160,00:36:36.680
"The first item of business is to
get rid of the target function.",00:36:36.680,00:36:39.640
Because you don't know it.,00:36:39.640,00:36:41.300
You only know the examples.,00:36:41.300,00:36:42.770
"So in a learning situation,
this is what you get.",00:36:42.770,00:36:48.150
Now I ask you to fit a line.,00:36:48.150,00:36:50.660
"Line, two points. I can do that.",00:36:50.660,00:36:54.500
This is what you do.,00:36:54.500,00:36:56.150
"Now that you settled on the final
hypothesis, I'm going to grade you.",00:36:56.150,00:36:58.980
"So I'm going to bring back the target
function, and compare this to that, and",00:36:58.980,00:37:03.800
"give you what is your
out-of-sample error.",00:37:03.800,00:37:07.310
Let's do it for H_0.,00:37:07.310,00:37:09.790
You have the same two points.,00:37:09.790,00:37:11.210
You're fitting them with a constant.,00:37:11.210,00:37:13.770
How would you do that?,00:37:13.770,00:37:15.180
"Probably the midpoint will give
you the least squared error",00:37:15.180,00:37:17.560
"on these two points, right?",00:37:17.560,00:37:19.430
"So this would be your
final hypothesis.",00:37:19.430,00:37:22.030
"And you get back your target function,
in order to evaluate your",00:37:22.030,00:37:24.640
"out-of-sample error, and
this is what you get.",00:37:24.640,00:37:27.790
Now you can see what the problem is.,00:37:27.790,00:37:31.060
"I can compute the error here,
and I can have the error",00:37:31.060,00:37:32.980
"regions, and all of that.",00:37:32.980,00:37:34.030
"But this depends on which
two points I gave you.",00:37:34.030,00:37:36.310
"If I give you another two points, I
give you another two points, et",00:37:36.310,00:37:39.550
"cetera, I am not sure how to really
compare them, because it does depend",00:37:39.550,00:37:42.940
on your data set.,00:37:42.940,00:37:44.330
"That's why we needed the
bias-variance analysis.",00:37:44.330,00:37:46.970
"That's why we got the expected value
of the error, with respect to the",00:37:46.970,00:37:50.060
"choice of the data set, so that we
actually are talking inherently about",00:37:50.060,00:37:53.900
"a linear model learning a target using
two points, regardless of which two",00:37:53.900,00:37:59.220
points I'm talking about.,00:37:59.220,00:38:02.020
"So let's do the bias and variance
decomposition for the constant guy.",00:38:02.020,00:38:10.270
Here is the figure.,00:38:10.270,00:38:11.570
It's an interesting figure.,00:38:11.570,00:38:13.740
"Here I am generating data sets, each
of size 2 points, and then",00:38:13.740,00:38:20.400
fitting a line.,00:38:20.400,00:38:21.400
And the line would be the midpoint.,00:38:21.400,00:38:24.000
"I keep repeating this exercise,
and I am showing you the final",00:38:24.000,00:38:27.900
hypothesis you get.,00:38:27.900,00:38:29.530
"I repeated it a very large
number of times.",00:38:29.530,00:38:31.170
"This is a real simulation, and these
are the hypotheses you get.",00:38:31.170,00:38:34.170
"You can see that when you get this line,
it means that the two points",00:38:34.170,00:38:37.100
were equally distant from here.,00:38:37.100,00:38:38.570
Sometimes I get the points here.,00:38:38.570,00:38:39.800
"Sometimes I get them equal to
that, so I get here.",00:38:39.800,00:38:41.840
"The middle point is
a little bit heavier.",00:38:41.840,00:38:44.870
"Because, obviously, the chance of
getting them on the two lobes is",00:38:44.870,00:38:48.950
"there, and so on.",00:38:48.950,00:38:49.700
"So this is basically the
distribution you get.",00:38:49.700,00:38:52.890
"Each of them will give you
an out-of-sample error.",00:38:52.890,00:38:55.220
"And the interesting thing for us is
the expected out-of-sample error.",00:38:55.220,00:38:58.600
That's what will grade the model.,00:38:58.600,00:39:00.920
"Now what we are going to do, we are
going to get the bias and variance",00:39:00.920,00:39:03.530
decomposition based on that.,00:39:03.530,00:39:05.100
And that is our next figure.,00:39:05.100,00:39:06.350
Look at this carefully.,00:39:09.290,00:39:11.920
"The green guy, the very light
green guy, is g bar of x.",00:39:11.920,00:39:20.040
"This is the average hypothesis
you get.",00:39:20.040,00:39:22.380
How did I get that?,00:39:22.380,00:39:23.610
"I simply added up all of these guys,
and divided by their number.",00:39:23.610,00:39:28.250
"And it is expected obviously, by the
symmetry, that on average, I will get",00:39:28.250,00:39:31.000
something very close to 0.,00:39:31.000,00:39:33.310
"The interesting thing is that you can see
now that g bar, here, happens to be",00:39:33.310,00:39:38.180
also the best approximation.,00:39:38.180,00:39:39.810
"If I keep repeating this, I will
actually get the 0 guy, which I was",00:39:39.810,00:39:43.100
"able to get when I had the full target
function I was approximating.",00:39:43.100,00:39:46.630
"Here I don't have the full
target function.",00:39:46.630,00:39:48.400
I have one hypothesis at a time.,00:39:48.400,00:39:49.520
"I am getting the average,
but I am getting this.",00:39:49.520,00:39:51.880
"So there is a justification for saying
that g bar will be the best",00:39:51.880,00:39:54.590
hypothesis.,00:39:54.590,00:39:55.340
"Because this game of getting one at
a time, and then getting the average,",00:39:55.340,00:39:58.400
does get me somewhere.,00:39:58.400,00:39:59.800
"But do remember, this is not the output
of your learning process.",00:39:59.800,00:40:02.760
I wish it were.,00:40:02.760,00:40:03.840
It isn't.,00:40:03.840,00:40:04.930
"The output of your learning process
is one of those guys, and",00:40:04.930,00:40:07.130
you don't know which.,00:40:07.130,00:40:08.370
"It just happens that, if you repeat
it, this will be your average.",00:40:08.370,00:40:11.190
"And because you are getting different
guys here, there will be a variance",00:40:11.190,00:40:14.990
around this.,00:40:14.990,00:40:15.730
"And the variance, I'm describing it
basically by the standard deviation",00:40:15.730,00:40:19.010
you are going to get.,00:40:19.010,00:40:20.620
"So the error between the green line
and the target function will",00:40:20.620,00:40:24.560
give you the bias.,00:40:24.560,00:40:26.120
"And the width of the gray region
will give you the variance.",00:40:26.120,00:40:30.350
Understood what the analysis is?,00:40:30.350,00:40:32.680
So that takes care of H_0.,00:40:32.680,00:40:35.610
Let's go to H_1.,00:40:35.610,00:40:36.980
"So to remember, the learning
situation for H_0 was this.",00:40:36.980,00:40:40.630
This is when I had the constant model.,00:40:40.630,00:40:42.790
"What will happen if you are actually
fitting the two points, not with",00:40:42.790,00:40:46.730
"a constant, which you do at the midpoint,
but you are fitting them",00:40:46.730,00:40:50.240
with a complete line?,00:40:50.240,00:40:51.660
What will it look like?,00:40:51.660,00:40:54.030
It will look like this.,00:40:54.030,00:40:55.280
Wow.,00:40:58.840,00:40:59.070
You can see where the problem is.,00:40:59.070,00:41:00.580
Talk about variance.,00:41:00.580,00:41:02.310
Take two points.,00:41:02.310,00:41:02.930
You connect them.,00:41:02.930,00:41:03.660
"Wherever the two points, you
get this jungle of lines.",00:41:03.660,00:41:06.560
"This is for exactly the same data sets
that gave me the horizontal lines in",00:41:06.560,00:41:10.420
the previous slide.,00:41:10.420,00:41:12.910
So this is what I get.,00:41:12.910,00:41:14.360
"Now I ask myself, what on
average will I get?",00:41:14.360,00:41:17.510
"You can immediately say, on average,
you'd better get a positive slope.",00:41:17.510,00:41:21.743
"There is a tendency to
get a positive slope.",00:41:21.743,00:41:23.970
"Because when you get the points
split, you will get this.",00:41:23.970,00:41:26.870
"Sometimes you get a negative
slope here, here.",00:41:26.870,00:41:29.310
"But that is balanced by getting
a positive slope here.",00:41:29.310,00:41:32.310
"You can argue this, but
you can do the math.",00:41:32.310,00:41:34.710
"And then you get the bias-variance
decomposition.",00:41:34.710,00:41:38.190
This will be your average.,00:41:38.190,00:41:40.980
This is g bar.,00:41:40.980,00:41:42.940
And this will be the variance you get.,00:41:42.940,00:41:44.760
The variance depends on x.,00:41:44.760,00:41:46.020
This is the way we defined it.,00:41:46.020,00:41:47.070
"And when you want one variance to
describe it, you get the expected",00:41:47.070,00:41:49.780
"value of the width squared
of that gray region.",00:41:49.780,00:41:52.370
"This gray region has the
standard deviation.",00:41:52.370,00:41:55.320
Now you can see exactly that,00:41:55.320,00:41:56.640
"I am getting better approximation
than the previous guy.",00:41:56.640,00:41:59.940
"But I sure am getting very bad variance,
which is expected here.",00:41:59.940,00:42:05.360
Now you can see what the tradeoff is.,00:42:05.360,00:42:08.150
"And the question is, given these
two models, which one wins",00:42:08.150,00:42:13.410
from a learning scenario?,00:42:13.410,00:42:15.570
"You need to ask the question,
to remember what it is.",00:42:15.570,00:42:17.540
I am trying to approximate a sinusoid.,00:42:17.540,00:42:21.210
"Is it better to do it with
a constant or a general line?",00:42:21.210,00:42:26.210
"The answer to that question
is obvious.",00:42:26.210,00:42:28.690
"But that is not the question
I am asking in learning.",00:42:28.690,00:42:31.920
"The question I am asking in learning,
you have two points coming from",00:42:31.920,00:42:37.600
something I don't know.,00:42:37.600,00:42:39.630
"Is it better to use
a constant or a line?",00:42:39.630,00:42:43.310
You notice the difference.,00:42:43.310,00:42:44.560
"I am going to put them side by side,
and then see which is the winner.",00:42:46.790,00:42:51.960
"So this guy has a big bias
and a small variance.",00:42:51.960,00:42:54.990
"This guy has a small bias
and a big variance.",00:42:54.990,00:42:57.960
Let's get quantitative.,00:42:57.960,00:43:00.900
What is the bias here?,00:43:00.900,00:43:03.230
It's actually 0.5.,00:43:03.230,00:43:04.200
"Exactly the same we got when we
were approximating outright.",00:43:04.200,00:43:06.800
It's the 0.,00:43:06.800,00:43:07.360
That's the expected value.,00:43:07.360,00:43:08.310
"You get 0.5, the mean squared error.",00:43:08.310,00:43:12.790
What is the bias here?,00:43:12.790,00:43:16.220
It's 0.21.,00:43:16.220,00:43:17.150
"Interestingly enough, when we did the
approximation, it was about 0.2.",00:43:17.150,00:43:21.280
"And indeed, this is not
exactly the best fit.",00:43:21.280,00:43:24.500
"Remember when I told you there
is a nonlinearity aspect.",00:43:24.500,00:43:26.750
"You are taking two points at the time,
and then taking a fit, and then taking",00:43:26.750,00:43:29.610
the average.,00:43:29.610,00:43:30.120
"And it's conceivable that this will give
you something different from if",00:43:30.120,00:43:33.180
"you have the full curve, and you
are fitting it outright.",00:43:33.180,00:43:35.390
"The difference is usually
very small, and it is.",00:43:35.390,00:43:37.510
"But here you get something which is not
exactly perfect, but is very close",00:43:37.510,00:43:40.160
to perfect.,00:43:40.160,00:43:41.820
"So obviously, here the
bias is much smaller.",00:43:41.820,00:43:44.250
Let's look at the variance.,00:43:44.250,00:43:45.180
What is the variance here?,00:43:45.180,00:43:47.480
The variance here is 0.25.,00:43:47.480,00:43:50.360
It's not too bad.,00:43:50.360,00:43:52.830
"The variance here, we
expect it to bigger.",00:43:52.830,00:43:54.610
But is it big enough to kill us?,00:43:54.610,00:43:56.160
"It's a disaster, complete
and utter disaster.",00:44:01.150,00:44:05.080
"And now, when you see what is the
expected out-of-sample error, you add",00:44:05.080,00:44:07.750
these two numbers.,00:44:07.750,00:44:08.520
"Here I'm going to get 0.75, and
here you are going to get",00:44:08.520,00:44:11.220
something much bigger.,00:44:11.220,00:44:13.170
And the winner is--,00:44:13.170,00:44:14.420
"Now you go to your friends, and tell
them that I learned today that in",00:44:16.630,00:44:19.090
"order to approximate a sine, I am better
off approximating it with",00:44:19.090,00:44:22.240
a constant than with a general line.,00:44:22.240,00:44:24.810
And have a smile on your face.,00:44:24.810,00:44:26.110
"Of course you know what you're talking
about, but they might not really",00:44:26.110,00:44:29.110
appreciate the humor here.,00:44:29.110,00:44:30.850
This is the game.,00:44:32.170,00:44:33.210
I think we understand it well.,00:44:33.210,00:44:34.735
"So the lesson learned, if I want to
articulate it, is that when you are in",00:44:37.510,00:44:40.220
"a learning situation always remember: you
are matching the model complexity",00:44:40.220,00:44:48.210
"to the data resources you have,
not to the target complexity.",00:44:48.210,00:44:55.520
I don't know the target.,00:44:55.520,00:44:57.010
"And even if I knew the level of
complexity it has, I don't have the",00:44:57.010,00:45:01.210
resources to match it.,00:45:01.210,00:45:03.250
"Because if I match it, I will have the
target in my hypothesis set, but I",00:45:03.250,00:45:07.420
will never arrive at it.,00:45:07.420,00:45:09.720
"Pretty much like I'm sitting in my
office, and I want a document of some",00:45:09.720,00:45:13.960
"kind, an old letter.",00:45:13.960,00:45:15.590
"Someone has asked me for a letter of
recommendation, and I don't want to",00:45:15.590,00:45:17.930
rewrite it for you.,00:45:17.930,00:45:19.090
"So I want to take the old guy and just
see what I wrote, and then add the",00:45:19.090,00:45:21.410
update to that.,00:45:21.410,00:45:23.640
"Before everything was archived
in the computers, it used to",00:45:23.640,00:45:27.160
be a piece of paper.,00:45:27.160,00:45:27.870
"So I know the letter of recommendation
is somewhere.",00:45:27.870,00:45:30.750
"Now I face the question, should I
write the letter of recommendation",00:45:30.750,00:45:33.410
from scratch?,00:45:33.410,00:45:34.280
"Or should I look for the letter
of recommendation?",00:45:34.280,00:45:37.740
The recommendation is there.,00:45:37.740,00:45:39.100
It's much easier when I find it.,00:45:39.100,00:45:40.650
"However, finding it is a big deal.",00:45:40.650,00:45:43.980
"So the question is not that the
target function is there.",00:45:43.980,00:45:46.210
"The question is, can I find it?",00:45:46.210,00:45:48.940
"Therefore, when I give you 100 examples,
you choose the hypothesis",00:45:48.940,00:45:52.800
set to match the 100 examples.,00:45:52.800,00:45:54.740
"If the 100 examples are terribly
noisy, that's even worse.",00:45:54.740,00:45:58.480
"Because their information
to guide you is worse.",00:45:58.480,00:46:01.200
"That's what I mean by the
data resources you have.",00:46:01.200,00:46:04.150
"The data resources you have is, what do
you have in order to navigate the",00:46:04.150,00:46:07.650
hypothesis set?,00:46:07.650,00:46:09.090
"Let's pick a hypothesis set that
we can afford to navigate.",00:46:09.090,00:46:12.550
That is the game in learning.,00:46:12.550,00:46:13.800
Done with the bias and variance.,00:46:16.810,00:46:18.230
"Now we are going to take just
an illustrative tool, called",00:46:18.230,00:46:21.330
the learning curves.,00:46:21.330,00:46:22.750
"And then we are going to put the bias
and variance versus the VC analysis on",00:46:22.750,00:46:26.040
those curves.,00:46:26.040,00:46:27.130
So what are the learning curves?,00:46:27.130,00:46:28.950
"They are related to what we think of
intuitively as a learning curve.",00:46:28.950,00:46:31.520
But they are a technical term here.,00:46:31.520,00:46:33.300
"They are basically plotting the expected
value of E_out and E_in.",00:46:33.300,00:46:37.480
We have done E_out already.,00:46:37.480,00:46:38.980
"But here we also plot the expected value
of E_in, as a function of N.",00:46:38.980,00:46:43.330
Let's go through the details.,00:46:43.330,00:46:45.070
"I give you a data set of size N. We know
what the expected value of the",00:46:45.070,00:46:50.590
out-of-sample error is.,00:46:50.590,00:46:51.630
"We have seen that already in the
bias-variance decomposition.",00:46:51.630,00:46:54.110
And this is the quantity.,00:46:54.110,00:46:55.440
"I know this is the quantity that I will
get in any learning situation.",00:46:55.440,00:46:58.770
It depends on the data set.,00:46:58.770,00:47:00.300
"If I want a quantity that describes
just the size of the set, I will",00:47:00.300,00:47:03.620
"integrate this out, and get the expected
value with respect to D.",00:47:03.620,00:47:06.000
That's the quantity I have.,00:47:06.000,00:47:07.500
"And the other one is exactly the
same, except it's in-sample.",00:47:07.500,00:47:10.060
"We didn't use it in the bias-variance
analysis.",00:47:10.060,00:47:12.160
"This one, I am going to get the expected
value of the in-sample.",00:47:12.160,00:47:14.350
"So I want to get, given this situation,
if I give you N examples,",00:47:14.350,00:47:18.090
how well are you going to fit them?,00:47:18.090,00:47:19.240
"Well, it depends on the examples.",00:47:19.240,00:47:20.300
"But on average, this is how well
you are going to fit them.",00:47:20.300,00:47:23.510
"And you ask yourself, how
do these vary with N?",00:47:23.510,00:47:26.650
And here comes the learning curve.,00:47:26.650,00:47:27.960
"As you get more examples,
you learn better.",00:47:27.960,00:47:30.160
"So hopefully, the learning curve--
and we'll see what the learning",00:47:30.160,00:47:32.760
curve looks like.,00:47:32.760,00:47:35.440
Let's take a simple model first.,00:47:35.440,00:47:37.270
So it's a simple model.,00:47:39.950,00:47:41.540
"And because it's a simple model, it
does not approximate your target",00:47:41.540,00:47:44.860
function well.,00:47:44.860,00:47:45.900
"The best out-of-sample error
you can do is pretty high.",00:47:45.900,00:47:49.350
"When you learn, the in-sample will be
very close to the out-of-sample.",00:47:52.460,00:47:56.770
"So let's look first at the behavior as
you increase N. As you increase N,",00:47:56.770,00:48:00.980
"hopefully the out-of-sample
error is going down.",00:48:00.980,00:48:04.200
I have more examples to learn from.,00:48:04.200,00:48:05.940
"I have a better chance of approximating
the target function.",00:48:05.940,00:48:08.010
"And indeed, it goes.",00:48:08.010,00:48:09.280
"And it can go down and down, until it
gets to the absolute limit of your",00:48:09.280,00:48:12.330
hypothesis set.,00:48:12.330,00:48:13.480
Your hypothesis set very simple.,00:48:13.480,00:48:14.660
"It doesn't have a very good
approximation for your target.",00:48:14.660,00:48:16.710
This is the best it can do.,00:48:16.710,00:48:17.830
"The best you can do is
the best you can do.",00:48:17.830,00:48:19.600
So that's what you get.,00:48:19.600,00:48:21.341
"When you look at the in-sample, it
actually goes the other way around.",00:48:21.341,00:48:24.170
"Because here my task is
simpler than here.",00:48:24.170,00:48:27.520
Here I am trying to fit 5 examples.,00:48:27.520,00:48:29.700
Here I am trying to fit 20 examples.,00:48:29.700,00:48:32.490
And I only have the examples to fit.,00:48:32.490,00:48:33.710
"I'm not looking at target function,
or anything like that.",00:48:33.710,00:48:35.860
"So obviously, I can use my degrees of
freedom in the hypothesis set, and fit",00:48:35.860,00:48:40.490
"the 5 examples better, and get
a smaller in-sample error.",00:48:40.490,00:48:43.640
"Whereas if I increase N, I will
get a worse in-sample error.",00:48:43.640,00:48:46.790
"It doesn't bother me, because
the in-sample error is",00:48:46.790,00:48:48.470
not the bottom line.,00:48:48.470,00:48:49.250
The out-of-sample is.,00:48:49.250,00:48:50.310
"And as you can see, although I am
getting worse in-sample, I am getting",00:48:50.310,00:48:52.940
better out-of-sample.,00:48:52.940,00:48:53.980
"And indeed, the discrepancy between
them, which is the generalization error,",00:48:53.980,00:48:57.340
"is getting tighter and tighter
as N increases.",00:48:57.340,00:49:00.340
Completely logical.,00:49:00.340,00:49:01.700
"By the way, this is a real model, so when
we talk about overfitting, I will",00:49:01.700,00:49:05.250
"tell you what that model is, as the
simple model and the complex model.",00:49:05.250,00:49:09.230
"The complex model, exactly the same
behavior, except it's shifted.",00:49:09.230,00:49:11.950
"It's a complex model, so it has
a better approximation",00:49:11.950,00:49:15.750
for your target function.,00:49:15.750,00:49:16.740
"So it can achieve, in principle,
a better out-of-sample error.",00:49:16.740,00:49:20.950
"You have so many degrees of freedom, that
you were able to fit the training",00:49:20.950,00:49:24.530
set perfectly up to here.,00:49:24.530,00:49:26.410
"This corresponds, more or less,
to the VC dimension.",00:49:26.410,00:49:29.290
"The VC dimension can
shatter everything.",00:49:29.290,00:49:31.440
So you can shatter these guys.,00:49:31.440,00:49:32.440
You can fit them perfectly.,00:49:32.440,00:49:33.360
So you get zero error.,00:49:33.360,00:49:34.970
"You start compromising when you have
more guys and you cannot shatter, so",00:49:34.970,00:49:37.550
maybe you have to compromise.,00:49:37.550,00:49:38.520
"And you end up starting
to have in-sample error.",00:49:38.520,00:49:41.150
"And the in-sample error goes up, and the
out-of-sample error goes down.",00:49:41.150,00:49:44.740
"The interesting thing is that in
here, when you have this, I",00:49:44.740,00:49:47.330
fit the examples perfectly.,00:49:47.330,00:49:48.320
I'm so happy.,00:49:48.320,00:49:49.030
What is out-of-sample?,00:49:49.030,00:49:50.760
An utter disaster.,00:49:50.760,00:49:53.360
Absolutely no information.,00:49:53.360,00:49:54.390
We didn't learn anything.,00:49:54.390,00:49:55.080
We just memorized the examples.,00:49:55.080,00:49:58.030
"So here, again, the out-of-sample
error goes down.",00:49:58.030,00:50:03.680
The in-sample error goes up.,00:50:03.680,00:50:05.120
Same argument exactly.,00:50:05.120,00:50:06.230
They get closer together.,00:50:06.230,00:50:07.170
"But obviously the discrepancy between
them is bigger, because I have a more",00:50:07.170,00:50:10.350
complex set.,00:50:10.350,00:50:11.700
"Therefore, the generalization
error is bigger.",00:50:11.700,00:50:14.760
"The bound on it is bigger
in the VC analysis.",00:50:14.760,00:50:17.050
And the actual value is bigger.,00:50:17.050,00:50:19.330
So this is the analysis.,00:50:19.330,00:50:21.090
It's a very simple tool.,00:50:21.090,00:50:22.440
"And the reason I introduced it here is
that I want to illustrate the bias and",00:50:22.440,00:50:26.420
"variance analysis versus the VC analysis,
using the learning curves.",00:50:26.420,00:50:30.800
"It will be very illustrative to
understand how the two theories relate",00:50:30.800,00:50:34.240
to each other.,00:50:34.240,00:50:35.490
"Let's start with the VC analysis
on learning curves.",00:50:37.210,00:50:43.580
These are learning curves.,00:50:43.580,00:50:45.340
"The in-sample error goes
up, as promised.",00:50:45.340,00:50:46.765
The out-of-sample error goes down.,00:50:46.765,00:50:48.760
"There is a best approximation that
corresponds to this level of",00:50:48.760,00:50:52.210
"out-of-sample error, if we
actually knew the thing.",00:50:52.210,00:50:54.880
And what did we do in the VC analysis?,00:50:54.880,00:50:57.840
"We had the in-sample error, which is
this region, the height of this",00:50:57.840,00:51:01.630
