text,start,stop
"But essentially you can be translating
out to 70 word sentences without your",01:00:35.680,01:00:40.300
performance going downhill.,01:00:40.300,01:00:42.390
And that's interesting.,01:00:42.390,01:00:44.118
"The one thing that you might think freaky
about all of these charts is that they all",01:00:44.118,01:00:48.859
go downhill for very short sentences.,01:00:48.859,01:00:51.169
That's sort of weird.,01:00:51.169,01:00:52.885
"But I think it's sort of just
a weirdo fact about the data.",01:00:52.885,01:00:59.003
"That it turns out that
the things that are in this kind",01:00:59.003,01:01:03.160
"of data which is
European Parliament data actually.",01:01:03.160,01:01:07.427
That are five word sentences.,01:01:07.427,01:01:09.541
"They just aren't sentences,
like, I love my mum,",01:01:09.541,01:01:12.345
"which is a four word sentence that has
a really simple grammatical structure.",01:01:12.345,01:01:16.569
"That, when you're seeing five
word things that they're normally",01:01:16.569,01:01:21.442
things like titles of x.,01:01:21.442,01:01:23.240
"Or that there are half sentences
that were cut off in the middle and",01:01:23.240,01:01:26.213
things like that.,01:01:26.213,01:01:27.089
So that they're sort of weirdish stuff and,01:01:27.089,01:01:30.202
"that's why that tends to
prove hard to translate.",01:01:30.202,01:01:33.930
"Okay, here are just a couple of examples,",01:01:33.930,01:01:36.636
"of giving you again some
examples of translations.",01:01:36.636,01:01:39.952
"So we've got a source,
a human reference translation.",01:01:39.952,01:01:43.320
"Then down at the bottom,
we have the LSTM model.",01:01:43.320,01:01:47.160
"And above it, it's putting in attention.",01:01:47.160,01:01:49.700
"So for this sentence,
it does a decent job,",01:01:50.760,01:01:54.020
"the base model of translating it,
except for one really funny fact.",01:01:54.020,01:01:59.030
"It actually sticks in here a name that
has nothing whatsoever to do with",01:01:59.030,01:02:03.372
the source sentence.,01:02:03.372,01:02:04.782
"And that's something that you
actually notice quite a bit in neural",01:02:04.782,01:02:08.336
machine translation systems.,01:02:08.336,01:02:10.091
Especially ones without attention.,01:02:10.091,01:02:13.446
"That they are actually
very good language models.",01:02:13.446,01:02:16.642
"So that they generate sentences that
are good sentences of the target language.",01:02:16.642,01:02:22.328
"But they don't necessarily pay very much
attention to what the source sentence was.",01:02:22.328,01:02:27.359
"And so they kind of go, okay,
I'm generating a sentence and",01:02:27.359,01:02:30.572
"a name goes there, stick in some name.",01:02:30.572,01:02:32.659
"And let's get on with generating, it's got
nothing to do with the source sentence.",01:02:32.659,01:02:36.290
"That gets better in the other example,",01:02:36.290,01:02:38.640
"where it actually
generates the right name.",01:02:38.640,01:02:40.310
That's an improvement.,01:02:40.310,01:02:42.320
"Here's a much more complex example
where there's various stuff going on.",01:02:42.320,01:02:47.373
"One thing to focus on though, is that
the source has this ""not incompatible""",01:02:47.373,01:02:52.483
"whereas the base model translates
that as ""not compatible"",",01:02:52.483,01:02:56.950
which is the opposite semantics.,01:02:56.950,01:02:59.980
"Whereas our one here we're then
getting ""the incompatible"".",01:02:59.980,01:03:05.170
So not incompatible.,01:03:05.170,01:03:07.110
So that's definitely an improvement.,01:03:07.110,01:03:09.270
None of these translations are perfect.,01:03:09.270,01:03:12.407
"I mean in particular one of the things
that they do wrong is ""safety and",01:03:12.407,01:03:16.625
"security"".",01:03:16.625,01:03:17.366
"Where in the translation,",01:03:17.366,01:03:19.523
"we have exactly the same words,
so it's of the form A and A.",01:03:19.523,01:03:23.565
"Now really safety and
security have a fairly similar meaning.",01:03:23.565,01:03:28.162
So it's not actually so,01:03:28.162,01:03:29.497
"unreasonable to translate either
of those words with this word.",01:03:29.497,01:03:33.180
"But clearly you don't want to translate
safety and security as safety and safety.",01:03:33.180,01:03:38.220
"[LAUGH] That's just not
a very good translation.",01:03:38.220,01:03:41.000
So that could be better.,01:03:41.000,01:03:43.258
I'll go on.,01:03:43.258,01:03:46.610
Yeah.,01:03:46.610,01:03:47.190
"So this idea of attention
has been a great idea.",01:03:47.190,01:03:53.510
"Another idea that's been interesting
is the idea of coverage.",01:03:53.510,01:03:57.050
"That when you're attending,",01:03:57.050,01:03:58.520
"you want to make sure you've attended
to different parts of the input, and",01:03:58.520,01:04:03.670
"that was actually an idea that, sort of,
again, first came up in Vision.",01:04:03.670,01:04:08.010
"So, people have done Caption Generation,",01:04:08.010,01:04:10.670
"where you're wanting to generate
a caption that summarizes a picture.",01:04:10.670,01:04:15.585
"And so
one of the things you might wanna do",01:04:15.585,01:04:18.035
"is when you're paying
attention to different places,",01:04:18.035,01:04:22.215
"you wanna make sure you're paying
attention to the different main parts.",01:04:22.215,01:04:26.635
"So you both wanna pay
attention to the bird.",01:04:26.635,01:04:29.105
"And you wanna pay attention to
the background so you're producing",01:04:29.105,01:04:32.725
"a caption that's something like ""a
bird flying over a body of water"".",01:04:32.725,01:04:36.640
"And so you don't want to miss
important image patches.",01:04:38.010,01:04:42.030
"And so that's an idea that people have
also worked on in the neural MT case.",01:04:42.030,01:04:48.510
"So one idea is an idea of doing
sort of attention doubly, and",01:04:48.510,01:04:53.400
"so you're sort of working out
an attention in both directions.",01:04:53.400,01:04:56.880
"So there's a horizontal attention and
a vertical attention.",01:04:56.880,01:05:01.140
"And you're wanting to make sure you've
covered things in both directions.",01:05:01.140,01:05:06.130
"Okay, so that's one idea.",01:05:08.350,01:05:10.890
"And in general, something interesting
that's been happening is in the last",01:05:10.890,01:05:16.420
"roughly a year, I guess.",01:05:16.420,01:05:18.380
"That essentially,
people have been taking a number of",01:05:18.380,01:05:21.610
"the ideas that have been explored in other
approaches to machine translation and",01:05:21.610,01:05:26.290
"building them into more
linguistic attention functions.",01:05:26.290,01:05:30.420
So one idea is this idea of coverage.,01:05:30.420,01:05:34.050
"But actually if you look in the older
literature for word alignments, well there",01:05:34.050,01:05:38.570
"are some other ideas in those older
machine translation word alignment models.",01:05:38.570,01:05:45.750
"Some of the other ideas
were an idea of position.",01:05:45.750,01:05:50.510
"So normally attention or alignment isn't
completely sort of random in the sentence.",01:05:50.510,01:05:57.040
"Normally although there's some reordering,
stuff near the beginning of the source",01:05:57.040,01:06:01.470
"sentence goes somewhere near the beginning
of the translation, and stuff somewhere",01:06:01.470,01:06:05.850
"near the end of the source sentence
goes towards the end of the translation.",01:06:05.850,01:06:09.790
"And that's an idea you can put in
to your attention model as well.",01:06:09.790,01:06:15.790
And a final idea here is fertility.,01:06:15.790,01:06:18.560
"Fertility is sort of
the opposite of coverage.",01:06:18.560,01:06:21.620
"It's sort of saying it's bad if you pay
attention to the same place too often.",01:06:21.620,01:06:27.870
"Because sometimes one word is gonna
be translated with two words or",01:06:27.870,01:06:32.580
"three words in the target
language that happens.",01:06:32.580,01:06:36.020
"But if you're translating one word with
six words in your generated translation,",01:06:36.020,01:06:41.930
"that probably means that you've
ended up repeating yourself and",01:06:41.930,01:06:45.430
"that's another of the mistakes
of sometimes neural",01:06:45.430,01:06:48.300
"machine translations systems can make,
that they can repeat themselves.",01:06:48.300,01:06:52.430
"And so people have started to build
in those ideas of fertility as well.",01:06:52.430,01:06:56.960
Okay.,01:06:59.070,01:07:00.553
"Any questions or
people good with the attention?",01:07:00.553,01:07:03.538
Yeah?,01:07:08.109,01:07:08.791
"So the question is that when we're
doing the attention function,",01:07:22.147,01:07:26.350
"we were just We were just doing
it based on the hidden state.",01:07:26.350,01:07:33.050
"And another thing that we could do is
actually put in the previous word, the xt.",01:07:33.050,01:07:39.945
"And also put that into
the attention function.",01:07:39.945,01:07:43.540
"I mean one answer is to say yes,
of course you could.",01:07:44.770,01:07:48.470
And you could go off and try that.,01:07:48.470,01:07:50.810
And see if you could get value from it.,01:07:50.810,01:07:54.410
And it's not impossible you could.,01:07:55.720,01:07:59.240
"I suspect it's less likely that
that's really going to work",01:07:59.240,01:08:03.420
"because I think a lot of the time,
what you get with these LSTMs",01:08:03.420,01:08:08.410
"is that the hidden state,
to a fair degree.",01:08:08.410,01:08:12.690
"Is still representing the word
that you've just read in, but",01:08:12.690,01:08:16.290
"it actually has the advantage that
it's kind of a context-disambiguated",01:08:16.290,01:08:20.850
representation of the words.,01:08:20.850,01:08:22.790
"So one of the really useful things that
LSTMs do is that they're sort of very good",01:08:22.790,01:08:28.090
"at word-sense disambiguation because
you start with a word representation.",01:08:28.090,01:08:33.630
"Which is often the kind of average of
different senses and meanings of a word.",01:08:33.630,01:08:38.330
"And the LSTM can use its
preceeding context to decide,",01:08:38.330,01:08:44.020
"In this context, I should be
representing this word in this way.",01:08:44.020,01:08:48.380
"And you kind of get this
word sense disambiguation.",01:08:48.380,01:08:51.140
"So I suspect most of the time
that the hidden state",01:08:51.140,01:08:56.230
"records enough about the meaning of the
word and actually improves on it by some",01:08:56.230,01:09:00.760
"of this using of context that I'm a little
doubtful whether that would give gains.",01:09:00.760,01:09:06.860
"On the other hand, I'm not actually
aware of someone that's tried that.",01:09:06.860,01:09:10.050
"So it's totally in the space
of someone could try it and",01:09:10.050,01:09:13.180
see if you could get value from it.,01:09:13.180,01:09:15.450
Yes.,01:09:15.450,01:09:15.968
"Yes, there's a very good reason to use
an LSTM as your generator even if you're",01:09:21.031,01:09:25.403
going to do attention.,01:09:25.403,01:09:26.990
"Which is, the most powerful part of
these neural machine translation systems",01:09:26.990,01:09:33.880
"remains the fact that you've got this
neural language model as your generator",01:09:33.880,01:09:38.950
"which is extremely powerful and
good as a fluent text generator.",01:09:38.950,01:09:44.930
"And that's still being powered
by the LSTM of the decoder.",01:09:44.930,01:09:50.610
And so.,01:09:50.610,01:09:51.875
"[INAUDIBLE]
&gt;&gt; And no, I.",01:09:51.875,01:09:54.620
"The power you get from the LSTM at
better remembering the sort of longer",01:09:54.620,01:09:59.135
"short-term memory is really useful
as a language model for generation.",01:09:59.135,01:10:03.810
"So I'm sure that that's still
giving you huge value, and",01:10:03.810,01:10:06.970
you'd be much worse off without it.,01:10:06.970,01:10:09.360
Yeah.,01:10:10.600,01:10:11.100
"I mean the thing that you could wonder,
is in this picture I'm still feeding",01:10:11.100,01:10:16.460
"the final state in to initialize
the LSTM for the decoder.",01:10:16.460,01:10:23.830
"Do you need to do that, or
could you just cross that off and",01:10:23.830,01:10:26.620
"start with a zero hidden state, and
do it all with the attention model?",01:10:26.620,01:10:31.010
That might actually work fine.,01:10:31.010,01:10:32.348
Yeah?,01:10:32.348,01:10:33.524
"&gt;&gt; [INAUDIBLE]
&gt;&gt; That's a good question.",01:10:33.524,01:10:41.150
So where do I have that?,01:10:41.150,01:10:42.520
"Here, okay, yeah.",01:10:44.550,01:10:45.396
"So in this simple case,
if you sort of are making a hard decision",01:10:45.396,01:10:52.980
"to pay attention to only
a couple of places,",01:10:52.980,01:10:58.760
"that's a hard decision and so
that then kills differentiability.",01:10:58.760,01:11:04.250
"And so the easiest way to sort
of keep everything nice and",01:11:04.250,01:11:10.580
"simply differentiable is just to say,
use global attention.",01:11:10.580,01:11:15.150
"Put some attention weight
on each position that's",01:11:15.150,01:11:19.150
differentiable the whole way through.,01:11:19.150,01:11:21.410
"So if you're making a hard decision here,
traditionally,",01:11:21.410,01:11:26.540
"the most correct way to
do this properly and",01:11:26.540,01:11:29.950
"train the model is to say, okay, we have
to do this as reinforcement learning.",01:11:29.950,01:11:34.795
"'Cause, doing a reinforcement
learning system lets you get",01:11:34.795,01:11:38.440
around the non-differentiability.,01:11:38.440,01:11:40.540
"And then, you're in this space of deep
reinforcement learning which has been",01:11:40.540,01:11:44.110
very popular lately.,01:11:44.110,01:11:45.670
"And, there are a couple of papers
that have used local attention,",01:11:45.670,01:11:49.370
"which have done it using
reinforcement learning training.",01:11:49.370,01:11:53.890
"So in the paper that Thang did,
that's not what he did.",01:11:53.890,01:11:58.730
"He sort of, I think it's true to say that,
to some extent, he sort of fudged",01:11:58.730,01:12:03.082
"the non-differentiability but
it seemed to work okay for him.",01:12:03.082,01:12:07.160
"But, I mean,
this is actually an area in which,",01:12:07.160,01:12:10.714
"there's been some recent work,
in which people have explored methods",01:12:10.714,01:12:15.922
"which in some sense continuing this
tradition of fudging by putting it",01:12:15.922,01:12:21.043
"on the more of a theoretical footing and
finding this works very well.",01:12:21.043,01:12:26.200
"So, an idea that's been explored
quite a bit in recent work is to say,",01:12:26.200,01:12:31.242
"in the forward model we're going
to be making some discreet",01:12:31.242,01:12:35.515
"choices as to which positions
to pay attention to.",01:12:35.515,01:12:39.200
"In the backwards model,
were going to be using",01:12:39.200,01:12:44.006
"a soft approximation of those decisions,
and",01:12:44.006,01:12:48.579
"we will then do the back
propagation using that.",01:12:48.579,01:12:53.400
"So that kind of idea is, You are working
out, say, where to pay attention,",01:12:53.400,01:12:58.228
"and you are choosing the states
with the sort of a high need for",01:12:58.228,01:13:02.075
"attention, is a hard decision,
but in the backwards model you",01:13:02.075,01:13:06.073
"are then having a sort of soft attention
still and you are training with that.",01:13:06.073,01:13:11.000
"And so, that leads into ideas like
the Straight Through Estimator",01:13:11.000,01:13:15.857
"which has been explored by
Yoshua Bengio's group and",01:13:15.857,01:13:19.760
"other recent ideas of Gumbel-Softmaxes,
and things like that.",01:13:19.760,01:13:24.980
"And that's actually, sort of been
worked out as another way to explain,",01:13:24.980,01:13:29.331
"another way to train these not
really differentiable models,",01:13:29.331,01:13:33.051
"which is in some ways easier than
using reinforcement learning.",01:13:33.051,01:13:36.936
I'll go on.,01:13:40.502,01:13:41.860
"There was one other last thing,
I did want to sort of squeeze in for",01:13:41.860,01:13:47.670
"the end of today, is I just wanted
to say a little bit about what's.",01:13:47.670,01:13:53.704
"Okay, so assuming that at source time,
we've got our source sentence,",01:13:56.464,01:14:03.859
"we encode it in some way that
we're gonna make use of.",01:14:03.859,01:14:09.242
"And, decoders,
that really our decoders are just saying,",01:14:09.242,01:14:14.142
"okay here's the meaning we want convey,
produce a sentence,",01:14:14.142,01:14:19.442
"that expresses that meaning and
how can we do that decoding successfully.",01:14:19.442,01:14:25.760
And I just sort of wanted to mention for,01:14:25.760,01:14:27.648
"couple minutes, what are the options and
how do they work.",01:14:27.648,01:14:30.844
"So, one thing in theory
we could do is say,",01:14:30.844,01:14:35.919
"okay, well, let's just explore",01:14:35.919,01:14:39.420
"every possible sequence of words we
can generate up to a certain length.",01:14:39.420,01:14:43.890
"Let's score every one of them with
our model and pick the best one.",01:14:43.890,01:14:47.910
"So, we'd literally have an exhaustive
search of possible translations.,",01:14:47.910,01:14:53.010
"Well, that's obviously
completely impossible to do.",01:14:53.010,01:14:56.080
"Because, not only is that exponential
in the length of what we generate,",01:14:56.080,01:14:59.720
we have this enormous vocabulary.,01:14:59.720,01:15:01.670
"It's not even like we're doing
exponential on a base of two or three.",01:15:01.670,01:15:05.640
"We're doing exponential on the base
of 100,000 or something like that.",01:15:05.640,01:15:09.610
"So, that can't possibly work out.",01:15:09.610,01:15:12.320
"So, the obvious idea and the first
thing that people do is -- Sorry.",01:15:12.320,01:15:20.340
I'll get to the obvious one next.,01:15:20.340,01:15:21.892
"The second thing,
[LAUGH] the not quite so obvious but",01:15:21.892,01:15:26.270
"the probabilistically nice and good thing
to do is to do a sampling based approach.",01:15:26.270,01:15:31.890
Which is a sort of a succesive sampling.,01:15:31.890,01:15:34.720
"So, it's sometimes referred
to as Ancestral Sampling.",01:15:34.720,01:15:38.490
"So, what we're doing then is we've
generated up to word t-1 and",01:15:38.490,01:15:43.850
then saying okay.,01:15:43.850,01:15:45.570
"Based on our model, we have a probability
distribution over the t-th word.",01:15:45.570,01:15:51.240
"And so, we sample from that probability
distribution one symbol at a time.",01:15:51.240,01:15:56.378
"And we keep on generating
one word at a time,",01:15:56.378,01:15:59.606
"until we generate our end
of end of sentence symbol.",01:15:59.606,01:16:03.460
"So, we generate a word and
then based on what we have now we do",01:16:03.460,01:16:08.087
"a probabilistic sample of the next
word and we continue along.",01:16:08.087,01:16:13.650
"So, if you are a theoretician that's
the right practical thing to do",01:16:13.650,01:16:18.530
"because if you are doing that,",01:16:18.530,01:16:20.180
"you've gotten not only an efficient model
of generating, unlike the first model, but",01:16:20.180,01:16:25.010
"you've got one that's unbiased,
asymptotically exact, great model.",01:16:25.010,01:16:30.620
"If you're a practical person this
is not a very great thing to do",01:16:30.620,01:16:35.250
"because what comes out is
very high variants and",01:16:35.250,01:16:38.810
"it's different every time you
decode the same sentence.",01:16:38.810,01:16:42.430
"Okay, so the practical easy thing to do,",01:16:42.430,01:16:45.660
"which is the first thing that everybody
really does, is a greedy search.",01:16:45.660,01:16:51.290
"So, we've generated up
to the T minus one word.",01:16:51.290,01:16:54.750
We wanna generate the t-th word.,01:16:54.750,01:16:57.120
"We use our model, we work out what's
the most likely word to generate next,",01:16:57.120,01:17:02.223
"and we choose it and
then we repeat that over and",01:17:02.223,01:17:06.850
"generate successive next words,
so that's then a greedy search.",01:17:06.850,01:17:13.300
"We're choosing best thing given
the preceding subsequence.",01:17:13.300,01:17:17.900
"But that, doesn't guarantee us
the best whole sentence because we can",01:17:17.900,01:17:22.410
"go wrong in any of a number of ways
because of our greedy decisions.",01:17:22.410,01:17:26.920
So it's super-efficient.,01:17:26.920,01:17:28.590
But is heavily suboptimal.,01:17:28.590,01:17:30.830
"So, if you want to do a bit better
than that, which people commonly do,",01:17:30.830,01:17:34.030
"the next thing that you think about
trying is then doing a beam search.",01:17:34.030,01:17:39.320
"So, for a beam search we're
up to word t-1 and we say,",01:17:39.320,01:17:44.315
"gee, what are the five most
likely words to generate next.",01:17:44.315,01:17:49.520
"And, we generate all of them and
we have a beam of five.",01:17:49.520,01:17:54.330
"And then, when we go on to generate
word T plus one, we say for",01:17:54.330,01:17:58.340
"each of those sequences up to length T,
what are the five",01:17:58.340,01:18:03.460
"most likely words to generate
is the T plus first word and",01:18:03.460,01:18:07.260
"we generate all of them and
well then we've got 25 hypotheses and",01:18:07.260,01:18:11.920
"if we kept on doing that, we'd again
be exponential but with a smaller base.",01:18:11.920,01:18:16.740
But we don't wanna do that.,01:18:16.740,01:18:17.930
"So, what we do is say, well out of
those 25, which are the five best ones?",01:18:17.930,01:18:23.180
And we keep those five best ones.,01:18:23.180,01:18:25.460
"And then, we generate five
possibilities from each of those for",01:18:25.460,01:18:29.010
the T plus two time.,01:18:29.010,01:18:31.120
"And so we maintain a constant
size k hypotheses and",01:18:31.120,01:18:35.850
we head along and do things.,01:18:35.850,01:18:37.870
"So as K goes to infinity,
that becomes unbiased.",01:18:39.630,01:18:44.500
"But in practice our K is small,
so it is biased.",01:18:44.500,01:18:48.880
"It doesn't necessarily monotonically
improve as you increase K, but",01:18:48.880,01:18:53.260
"in practice it usually does
up to some point, at least.",01:18:53.260,01:18:57.320
"It turns out that often there's
a limit to how big you can go for",01:18:57.320,01:19:00.523
"it improving,
which might even be quite small.",01:19:00.523,01:19:03.000
"Because sometimes,
you actually tend to get worse",01:19:03.000,01:19:05.537
"if your model is not very good and
you explore things further down.",01:19:05.537,01:19:09.700
"It's not as efficient, right?",01:19:09.700,01:19:11.340
"That your efficiency is
going down in K squared.",01:19:11.340,01:19:15.090
"So, as soon as you're at a beam of 10
you're 2 orders of magnitude slower",01:19:15.090,01:19:20.370
"than the greedy search, but
nevertheless it gives good gains.",01:19:20.370,01:19:24.580
"So, here are some results.",01:19:24.580,01:19:28.580
"So this is from work
again of Kyunghyun Cho's.",01:19:28.580,01:19:32.310
"So, in the middle here we
have the greedy decoding.",01:19:32.310,01:19:36.787
"And, we're getting these
numbers like 15.5 and 16.66,",01:19:36.787,01:19:42.860
"so something I haven't actually done yet
is explain the machine translation",01:19:42.860,01:19:47.183
"evaluation, and that's something I'll
actually do in the next lecture.",01:19:47.183,01:19:51.800
But big is good for these scores.,01:19:51.800,01:19:55.390
"So, what you see is that if you
sort of sample 50 translations and",01:19:55.390,01:20:00.750
"go with the best one,",01:20:00.750,01:20:02.472
"although that gives you some
improvement over the greedy one best.",01:20:02.472,01:20:07.951
"The amount of improvement it gives
you isn't actually very much because",01:20:07.951,01:20:12.364
"there's such a vast space
that you're sampling from and",01:20:12.364,01:20:15.836
"it's quite likely that most of your 50
examples are sampling something bad.",01:20:15.836,01:20:20.990
"On the other hand, if you're using
a fairly modest beam of size five or",01:20:20.990,01:20:25.740
"ten, that's actually
giving you a very good and",01:20:25.740,01:20:28.190
"noticeable gain much bigger than you're
getting from the ancestral sampling.",01:20:28.190,01:20:34.140
"And so,
that's basically the state of the art for",01:20:34.140,01:20:37.115
"neural machine translation, is people
do beam search with a small beam.",01:20:37.115,01:20:41.960
"The good news about that
actually is in statistical",01:20:41.960,01:20:45.310
"phrase space machine translation,
people always used a very large beam.",01:20:45.310,01:20:50.118
"So people would typically use
a beam size of size 100 or 150, and",01:20:50.118,01:20:54.550
"really people would have
liked to use larger.",01:20:54.550,01:20:58.850
"Apart from where it's just
computationally too difficult.",01:20:58.850,01:21:01.870
"But what people found with neural
machine translation systems",01:21:01.870,01:21:05.400
"is small beams like 5 or
10 actually work extremely well and",01:21:05.400,01:21:09.865
"conversely bigger beams often
don't work much better.",01:21:09.865,01:21:12.975
"Okay, and so that gives us sort of Beam
Search with a small beam as the de facto",01:21:12.975,01:21:17.385
standard in NMT.,01:21:17.385,01:21:19.305
"Okay, that's it for today, and we'll have
more of these things on next Tuesday.",01:21:19.305,01:21:22.945
