text,start,stop
"That attention is again going to give
us a different mechanism of getting at",00:20:15.046,00:20:19.820
the input when we need it.,00:20:19.820,00:20:21.500
And to being able to condition on it.,00:20:21.500,00:20:23.070
"Let me just sort of give you
a couple more pictures and",00:20:24.350,00:20:28.958
"a sense of how exciting neural
machine translation has been.",00:20:28.958,00:20:34.421
"So for machine translation,
there are a couple of prominent",00:20:34.421,00:20:39.215
"evaluations of machine
translation that are done.",00:20:39.215,00:20:43.356
"But I mean I think the most prominent
one has been done by what's called",00:20:43.356,00:20:47.014
the workshop on machine translation.,00:20:47.014,00:20:49.290
Which has a yearly evaluation.,00:20:49.290,00:20:51.235
And so this is showing results from that.,00:20:51.235,00:20:54.033
"And most of the results shown
are the results from Edinburgh Systems.",00:20:54.033,00:20:58.326
"And the University of Edinburgh's
traditionally been one of the strongest",00:20:58.326,00:21:02.200
universities at doing machine translation.,00:21:02.200,00:21:04.570
And they have several systems.,00:21:04.570,00:21:06.600
"And so what we can see from these results,
up is good of machine translation quality.",00:21:06.600,00:21:13.045
"So we have the phrase-based syntactic
machine translation systems",00:21:13.045,00:21:18.204
"which is the kind of thing that you saw
on Google Translate until November 2016.",00:21:18.204,00:21:24.513
"That although they work reasonably,",00:21:24.513,00:21:27.825
"there is sort of a feeling that
although they are a pioneering",00:21:27.825,00:21:32.904
"a good use of large data
machine learning systems.",00:21:32.904,00:21:37.351
That they had kind of stalled.,00:21:37.351,00:21:41.000
"So there really was very little
progress in phrase-based machine",00:21:41.000,00:21:45.206
translation systems in recent years.,00:21:45.206,00:21:47.692
"Until neural machine translation came
along, the idea that people were most",00:21:47.692,00:21:52.506
"actively exploring was building
syntax-based statistical machine",00:21:52.506,00:21:56.955
"translation systems, which made more
use of the structure of language.",00:21:56.955,00:22:02.310
"They were improving a little bit
more quickly but not very quickly.",00:22:02.310,00:22:06.990
"How quickly kind of partly depends
on how you draw that line.",00:22:06.990,00:22:11.100
"It sort of depends on whether
you believe 2015 was a fluke or",00:22:11.100,00:22:15.540
"whether I should draw the line as I have,
in the middle between them.",00:22:15.540,00:22:20.270
"But you got slightly more slope,
then not a lot.",00:22:20.270,00:22:23.010
"But so compared to those two things,",00:22:23.010,00:22:25.079
"I mean actually just this amazing thing
happened with neural machine translation.",00:22:25.079,00:22:29.839
"So it was only in 2014,
after the WMT evaluation,",00:22:29.839,00:22:34.380
that people started playing with.,00:22:34.380,00:22:37.354
"Could we build an end-to-end
neural machine translation system?",00:22:37.354,00:22:41.441
"But then extremely quickly,
people were able to build these systems.",00:22:41.441,00:22:46.163
"And so by 2016 they were clearly winning
in the workshop and machine translation.",00:22:46.163,00:22:53.210
"In terms of how much slope you have for
improvement,",00:22:53.210,00:22:56.340
that the slope is extremely high.,00:22:56.340,00:22:58.412
"And indeed the numbers are kind of
continuing to go up too in the last year.",00:22:58.412,00:23:03.895
So that's actually been super exciting.,00:23:03.895,00:23:06.632
As I say in the next slide.,00:23:06.632,00:23:08.899
"That so
neural MT really went from this sort of,",00:23:08.899,00:23:12.804
"fringe research activity of let's try this
and see if it could possibly work in 2014.",00:23:12.804,00:23:20.069
"To two years later,",00:23:20.069,00:23:21.361
"it had become this is the way that
you have to do machine translation.",00:23:21.361,00:23:25.783
"Because it just works better
than everything else.",00:23:25.783,00:23:30.102
"So I'll say more about
machine translation.",00:23:30.102,00:23:32.257
"But I thought I'd just highlight
at the beginning, well,",00:23:32.257,00:23:35.716
"why do we get these big wins
from neural machine translation?",00:23:35.716,00:23:39.327
"And I think there are maybe
sort of four big wins.",00:23:39.327,00:23:42.200
"At any rate,
this is my attempt at dividing it up.",00:23:42.200,00:23:45.800
So the first big win,00:23:45.800,00:23:48.390
"is the fact that you're just
training these models end-to-end.",00:23:48.390,00:23:51.950
"So if you can train all parameters
of the model simultaneously for",00:23:51.950,00:23:57.094
one target driven loss function.,00:23:57.094,00:23:59.614
"That's just proved
a really powerful notion.",00:23:59.614,00:24:03.820
"And indeed I think quite a lot of
the success of deep learning systems is",00:24:03.820,00:24:08.831
"that because we have these sort
of big computational flow graphs",00:24:08.831,00:24:13.950
"that we can optimize everything over
in one big back propagation process.",00:24:13.950,00:24:19.427
So it's easy to do end to end training.,00:24:19.427,00:24:21.872
"But that's been a very productive
way to do end to end training.",00:24:21.872,00:24:26.132
"And it's the end to end training
more than neural nets are magical.",00:24:26.132,00:24:31.549
"I think sometimes they're just
given enormous amounts of power to",00:24:31.549,00:24:34.984
these systems.,00:24:34.984,00:24:35.850
But there are other factors as well.,00:24:35.850,00:24:37.940
"So as we stressed a lot,",00:24:37.940,00:24:39.522
"these distributed representations
are actually just worth a ton.",00:24:39.522,00:24:44.048
"So that they allow you to kind of
share statistical strength between",00:24:44.048,00:24:48.763
"similar words, similar phrases.",00:24:48.763,00:24:51.253
"And you can exploit that to
just get better predictions,",00:24:51.253,00:24:54.377
and that's given a lot of improvement.,00:24:54.377,00:24:57.240
"A third big cause of improvement
has been these neural MT",00:24:57.240,00:25:01.660
"systems are just much better
at exploiting context.",00:25:01.660,00:25:06.220
"So Richard briefly mentioned
traditional language models.",00:25:06.220,00:25:09.388
"So those were things like four gram and
five gram models which were just",00:25:09.388,00:25:14.094
"done on counts of how often
sequences of words occurred.",00:25:14.094,00:25:17.940
"And those were very useful parts
of machine translation systems.",00:25:17.940,00:25:23.521
"But the reality was that
the language models on",00:25:23.521,00:25:27.445
"the generation side only
used a very short context.",00:25:27.445,00:25:32.180
And when you are translating words and,00:25:32.180,00:25:34.360
"phrases that the standard systems
did that completely context free.",00:25:34.360,00:25:38.400
"So the neural machine translation systems
are just able to use much more context and",00:25:38.400,00:25:43.581
that means that they can do a lot better.,00:25:43.581,00:25:46.147
"And there's an interesting way
in which these things kind of",00:25:46.147,00:25:49.349
go together in a productive way.,00:25:49.349,00:25:51.117
"So precisely the reason why your
machine translation systems can",00:25:51.117,00:25:55.831
practically use much more context.,00:25:55.831,00:25:58.497
"Is because there are these distributed
representations that allow you",00:25:58.497,00:26:02.507
to share statistical strength.,00:26:02.507,00:26:04.390
"Effectively you could never use more
context in traditional systems.",00:26:04.390,00:26:08.581
"Because you were using these
one-hot representations of words.",00:26:08.581,00:26:12.342
"And therefore you couldn't build more than
five gram models usefully because you were",00:26:12.342,00:26:17.143
"just being killed by
the sparseness of the data.",00:26:17.143,00:26:20.325
"And then the fourth thing that
I want to call out is sort of",00:26:20.325,00:26:24.943
really related to all of one two or three.,00:26:24.943,00:26:28.400
"But I think it's just sort
of worth calling out.",00:26:28.400,00:26:30.750
"Is something really powerful
that's happened in the last couple",00:26:30.750,00:26:35.305
of years with neural NLP methods.,00:26:35.305,00:26:37.719
"Is that they've proven to just be
extremely good for generating fluent text.",00:26:37.719,00:26:44.089
"So, I think it's fair to say
that the field of sort of",00:26:44.089,00:26:49.149
"natural language generation was sort
of fairly moribund in the 2000s decade.",00:26:49.149,00:26:57.220
"Because although there were sort
of simple things that you can do,",00:26:57.220,00:27:00.638
"writing a printf,
that's a text generation method.",00:27:00.638,00:27:03.948
"[LAUGH] But people could do a bit
better than that with grammar driven",00:27:03.948,00:27:07.463
text generation and so on.,00:27:07.463,00:27:09.130
"But there really were not a lot of good
ideas as how to produce really good,",00:27:09.130,00:27:13.267
high quality natural language generation.,00:27:13.267,00:27:15.819
"Whereas, it's just proven
extremely easy and productive.",00:27:15.819,00:27:20.262
"To do high-quality,",00:27:20.262,00:27:21.812
"natural language generation using
these neural language models.",00:27:21.812,00:27:26.470
"Because it's very easy for
them to use big contexts,",00:27:26.470,00:27:29.651
"condition on other goals at the same time,
and they work really well.",00:27:29.651,00:27:33.829
"And so one of the big reasons why
neural machine translation has been so",00:27:33.829,00:27:38.400
successful and the results look very good.,00:27:38.400,00:27:41.280
"Is that the text that they're
generating is very fluent.",00:27:41.280,00:27:45.099
"In fact it's sometimes the case
that the actual quality",00:27:45.099,00:27:48.957
of the translation is worse.,00:27:48.957,00:27:51.018
"That the quality of the generation
in terms of fluency is much better.",00:27:51.018,00:27:55.840
"It's also worth knowing
what's not on that list.",00:27:57.520,00:28:00.502
"So one thing that's not on that list,
that's a good thing,",00:28:00.502,00:28:04.207
"is we don't have any separate
black box component models for",00:28:04.207,00:28:07.660
"things like reordering and
transliteration and things like that.",00:28:07.660,00:28:11.840
"And traditional statistical MT systems
have lots of these separate components.",00:28:11.840,00:28:17.020
"You had lexicalized reordering components
and distortion models and this models and",00:28:17.020,00:28:21.870
that models.,00:28:21.870,00:28:22.870
"And getting rid of all of that with
this end to end system is great.",00:28:22.870,00:28:27.455
"There are some other things
that are not so great.",00:28:27.455,00:28:30.019
"That our current NMT models really make
no use of any kind of explicit syntax or",00:28:30.019,00:28:35.366
semantics.,00:28:35.366,00:28:36.850
"You could sort of say, well maybe some
interesting stuff is happening inside",00:28:36.850,00:28:39.990
the word vectors and maybe it is.,00:28:39.990,00:28:42.030
"Sorry, there are current
hidden state vectors and",00:28:42.030,00:28:44.980
"maybe it is, but it's sort of unclear.",00:28:44.980,00:28:47.710
"But actually this is something
that has started to be worked on.",00:28:47.710,00:28:50.029
"There have been a couple of papers
that have come out just this year.",00:28:50.029,00:28:52.959
"Where people are starting to put more
syntax into neural machine translation",00:28:52.959,00:28:57.325
"models, and
are getting gains from doing so.",00:28:57.325,00:28:59.820
"So I think that's something
that will revive itself.",00:28:59.820,00:29:04.112
"Also another huge failing of machine
translation, has been a lot of the errors.",00:29:04.112,00:29:09.485
"That higher level textual
notions are really badly done",00:29:09.485,00:29:13.373
by machine translation systems.,00:29:13.373,00:29:16.020
"So those are things of sort of discourse
structure, clause linking, anaphora and",00:29:16.020,00:29:20.440
things like that.,00:29:20.440,00:29:21.710
And we haven't solved those ones.,00:29:21.710,00:29:24.070
"Yeah, so that's been the general picture.",00:29:25.170,00:29:28.622
"Before going on, one of the things we
haven't done very much of in this class.",00:29:28.622,00:29:34.444
"Is actually looking at linguistic
examples and having language on slide.",00:29:34.444,00:29:39.660
"So I thought I'd do at least one
sentence of machine translation.",00:29:39.660,00:29:44.650
"And I kind of guessed that
the highest density of",00:29:44.650,00:29:48.190
"knowledge of another language
in my audience is Chinese.",00:29:48.190,00:29:51.430
So we're doing Chinese.,00:29:51.430,00:29:53.732
And this is my one sentence test set for,00:29:53.732,00:29:58.760
Chinese to English machine translation.,00:29:58.760,00:30:04.428
"So I guess back in the mid 2000s,",00:30:04.428,00:30:07.667
"we were doing Chinese to
English machine translation.",00:30:07.667,00:30:13.050
"And there was this evaluation
that we did kind of badly on.",00:30:13.050,00:30:16.590
"And one of the sentences that we
translated terribly was this sentence.",00:30:16.590,00:30:21.699
"And ever since then, I've been using
this as my one sentence evaluation set.",00:30:21.699,00:30:25.891
"So I guess this sentence, it actually
comes from Jared Diamond's book,",00:30:25.891,00:30:31.614
"Guns, Germs, and Steel.",00:30:31.614,00:30:34.010
"So in a sense it's sort of a funny one
since it's starting with the Chinese",00:30:34.010,00:30:37.660
translation of Jared Diamond's text.,00:30:37.660,00:30:40.600
"And then we're trying to translate it
back into English, but never mind!",00:30:40.600,00:30:44.386
That's our sentence for now.,00:30:44.386,00:30:45.858
So what have we got here?,00:30:45.858,00:30:47.329
"So this is the 1519 year,",00:30:47.329,00:30:50.813
there were 600 Spanish people and,00:30:50.813,00:30:55.509
their landing in Mexico.,00:30:55.509,00:30:58.849
"And then we've got ""to conquer"".",00:30:58.849,00:31:01.250
"And the first bit I want to focus
on is then this next bit here.",00:31:01.250,00:31:05.650
"The several million population
of the Aztec Empire.",00:31:05.650,00:31:12.110
"And so, what you get in Chinese is so
here's our ""Aztec Empire"".",00:31:13.340,00:31:19.310
"So in general in Chinese all modifiers
of a noun are appearing before the noun.",00:31:19.310,00:31:25.850
"And Chinese has this really handy little
morpheme right here, the [FOREIGN].",00:31:25.850,00:31:29.692
"This is saying the thing
that comes before it,",00:31:29.692,00:31:35.330
"shown in that brownish color, is
a modifier of this noun that follows it.",00:31:35.330,00:31:40.820
"And this one's saying the sort
of several million population.",00:31:40.820,00:31:44.695
"So it's the Aztec Empire with
the population of a few million.",00:31:44.695,00:31:48.826
"And there's this very specific linguistic
marker that tells you how you're meant to",00:31:48.826,00:31:53.489
translate it.,00:31:53.489,00:31:54.820
"And then after that We
then got the part here,",00:31:54.820,00:32:00.340
"where then we've got so
first time confronted them,",00:32:00.340,00:32:04.790
"losses, two-thirds.",00:32:06.370,00:32:09.210
"And so that's just sort of tacked
on to the end of the sentence, so",00:32:09.210,00:32:12.680
"they lost two-thirds of their
soldiers in the first clash.",00:32:12.680,00:32:16.530
"This is just an interesting
thing in how translation works.",00:32:16.530,00:32:20.590
"So you could in an English translation try
and tack that onto the end of the sentence",00:32:20.590,00:32:26.330
"and sort of say ""losing two thirds of
their soldiers in the first clash"" or",00:32:26.330,00:32:31.800
"""and they lost two thirds of their
soldiers in the first clash"".",00:32:31.800,00:32:35.990
"But neither of those sound
very good in English.",00:32:35.990,00:32:38.780
"So, below here what we
have is the reference",00:32:38.780,00:32:42.060
"translation which is where we got some
competent human to translate this.",00:32:42.060,00:32:46.920
"And so, interestingly what they did and
I think correctly actually here is that",00:32:46.920,00:32:51.410
"they decide it would actually be much
better to make this into two sentences.",00:32:51.410,00:32:55.810
"And so, they put in a period and
then they made a second sentence.",00:32:55.810,00:32:59.450
"They lost two thirds of their
soldiers in the first clash.",00:32:59.450,00:33:02.822
"Okay, so
I won't tell you a bad translation, but",00:33:02.822,00:33:06.354
"every year since I've been running
since this sentence through Google and",00:33:06.354,00:33:11.417
so I'll show you the Google translations.,00:33:11.417,00:33:14.880
"So on 2009, this is what Google produced.",00:33:14.880,00:33:19.110
"1519, 600 Spaniards landed in Mexico.",00:33:19.110,00:33:23.020
So that start's not very good.,00:33:23.020,00:33:25.420
"But if we go in particular
to this focus part,",00:33:25.420,00:33:28.220
"millions of people to
conquer the Aztec empire.",00:33:28.220,00:33:31.490
"No, that's not correct.",00:33:31.490,00:33:33.670
"And well it's getting some of the words
right but it's completely not making any",00:33:33.670,00:33:38.660
"use of the structure of
the sentence in Chinese.",00:33:38.660,00:33:43.630
And it doesn't get much better.,00:33:43.630,00:33:45.270
"The first two-thirds of
soldiers against their loss.",00:33:45.270,00:33:50.311
"Okay, so we can go on to 2011.",00:33:50.311,00:33:53.814
"I left some of them out so
he font size stayed vaguely readable.",00:33:53.814,00:33:58.600
So it changes a bit but not really.,00:33:58.600,00:34:00.440
"1519, 600 Spaniards landed in Mexico.",00:34:00.440,00:34:03.540
"Millions of people to
conquer the Aztec empire.",00:34:03.540,00:34:05.820
"The initial loss of soldiers
two-thirds of their encounters.",00:34:05.820,00:34:09.440
"So that last bit may be a fraction
better but the rest of it is no better.",00:34:09.440,00:34:13.397
"In 2013, it seemed like they might
have made a bit of progress.",00:34:13.397,00:34:17.732
"1519 600 Spaniards landed in Mexico
to conquer the Aztec empire,",00:34:17.732,00:34:23.176
hundreds of million of people.,00:34:23.176,00:34:25.760
It's unclear if it's made progress.,00:34:25.760,00:34:27.183
"The fact that you can read the to conquer
the Aztec empire has mean the Spaniards",00:34:27.183,00:34:31.407
"sort of means it might have made some
progress but then after that they",00:34:31.407,00:34:35.119
"just dump the hundreds of millions
of people between two commas.",00:34:35.119,00:34:38.577
"And so it's really not quite
clear what that's doing but",00:34:38.577,00:34:42.351
"it sort of seemed like whatever that
change that was just kind of luck because",00:34:42.351,00:34:47.380
"in 2014 it sort of switch back 1519
600 Spaniards landed in Mexico,",00:34:47.380,00:34:52.647
"millions of people to
conquer the Aztec empire,",00:34:52.647,00:34:55.871
"the first two-thirds of the loss
of soldiers they clash.",00:34:55.871,00:34:59.760
"And not only that interestingly
when I ran it again in 2015 and",00:35:01.680,00:35:07.968
"2016, the translation
didn't change at all.",00:35:07.968,00:35:13.425
"So I don't know what all the people were
doing on the Google MT translation team in",00:35:13.425,00:35:18.480
"2015 and 2016, but they definitely weren't
making progress in Chinese translation.",00:35:18.480,00:35:24.180
"And I think this sort of
reflects as if the feeling",00:35:24.180,00:35:27.120
that the system wasn't really progressing.,00:35:27.120,00:35:29.110
"That they sort of built the models and
mined all the data they could for",00:35:29.110,00:35:34.388
"their Chinese English MT system
that wasn't getting any better.",00:35:34.388,00:35:39.486
"So then in late 2016, Google rolled out
their neural machine translation system,",00:35:39.486,00:35:44.407
"which you're gonna hear
more about in a moment.",00:35:44.407,00:35:47.143
"And there's actual and
distinct signs of progress.",00:35:47.143,00:35:51.110
"So in 1519 600,
Spaniards landed in Mexico.",00:35:51.110,00:35:54.779
"So the beginning of it is a lot better
'cause the whole time it'd just been",00:35:54.779,00:35:59.245
"plunking down 1519 and 600,
which wasn't a very promising beginning.",00:35:59.245,00:36:04.790
"In the Chinese there's no word for
""in"", right?",00:36:04.790,00:36:07.879
"So this character here is ""year"", right?",00:36:07.879,00:36:09.671
"So it's sort of 1519 year,
600 people, Spanish people, right?",00:36:09.671,00:36:16.450
"But clearly in English you wanna be
putting in it in there and say in 1519.",00:36:16.450,00:36:21.145
"But somehow Google it never manage
to get that right where you might",00:36:21.145,00:36:25.090
have thought it could.,00:36:25.090,00:36:26.170
"But now it is, right?",00:36:26.170,00:36:27.670
"In 1519 comma, great beginning, and",00:36:27.670,00:36:30.210
"it continues much better 600
Spaniards landed in Mexico",00:36:30.210,00:36:34.820
"to conquer the millions of people of the
Aztec empire, this is getting really good.",00:36:34.820,00:36:39.670
"Neural machine translation is much,
much better.",00:36:39.670,00:36:42.250
But there is still some work to do.,00:36:42.250,00:36:44.438
"I guess this last part is kind of
difficult in a sense the way it's so",00:36:44.438,00:36:49.199
tacked on to the end of the sentence.,00:36:49.199,00:36:51.848
"But you're right,
it still isn't working very well for",00:36:51.848,00:36:54.824
"that cuz they've just tacked on the first
confrontation they killed two-thirds,",00:36:54.824,00:36:59.226
"which sort of it seems to be
the wrong way around because",00:36:59.226,00:37:02.078
"that's suggesting they killed
two-thirds of the Aztecs.",00:37:02.078,00:37:05.490
"Whereas meant to be that they
lost two thirds of the Spaniards.",00:37:05.490,00:37:09.910
"So there's still work to be done from
proving neural machine translation.",00:37:09.910,00:37:13.860
"But, I do actually think that that's
showing very genuine progress and that's,",00:37:13.860,00:37:18.740
"in general, what's been shown.",00:37:18.740,00:37:20.710
"So neural machine translation
has just given big gains.",00:37:20.710,00:37:24.440
"It's been aggressively
rolled out by industry.",00:37:24.440,00:37:27.260
"So actually the first
people who rolled out",00:37:27.260,00:37:29.269
neural machine translation was Microsoft.,00:37:30.520,00:37:32.750
"So in February 2016, Microsoft",00:37:32.750,00:37:37.560
"launched neural machine translation
on Android phones no less.",00:37:37.560,00:37:42.480
"And another of the huge selling points
of neural machine translation systems,",00:37:42.480,00:37:47.180
"is that they're actually
massively more compact.",00:37:47.180,00:37:50.010
"So that they were able to build a neural
machine translation system that actually",00:37:50.010,00:37:54.600
ran on the cellphone.,00:37:54.600,00:37:56.600
"And actually that's a very useful
use case, 'cause the commonest",00:37:56.600,00:38:01.380
"time when people want machine translation
is when they're not in their home country.",00:38:01.380,00:38:06.350
And at that point it depends.,00:38:06.350,00:38:07.790
"But a lot of people don't actually have
cell plans that work in foreign countries,",00:38:07.790,00:38:11.760
at decent prices.,00:38:11.760,00:38:13.190
"And so it's really useful to be able to
run your MT system just on the phone.",00:38:13.190,00:38:16.960
"And that was sort of essentially
never possible with the huge",00:38:16.960,00:38:20.160
"kind of look up tables of phrase
based systems it is now possible.",00:38:20.160,00:38:24.040
"Systran is a veteran old MT company
that also launched this system.",00:38:24.040,00:38:29.290
"And then Google launched their
neural machine translation system",00:38:29.290,00:38:34.220
"with massively more hype than
either of the two predecessors,",00:38:34.220,00:38:38.690
"including some huge overclaims of
equaling human translation quality.",00:38:38.690,00:38:44.490
"Which we've just seen still isn't true,",00:38:44.490,00:38:46.560
"based on my one sentence test set,
that they still have some work to do.",00:38:46.560,00:38:50.800
"But on the other hand,
they did publish a really interesting",00:38:50.800,00:38:56.210
"paper on the novel research that they've
done on neural machine translation.",00:38:56.210,00:39:00.920
"And so for the research highlight
today Emma is gonna talk about that.",00:39:00.920,00:39:04.728
"&gt;&gt; Hi, today I'm gonna talk about Google's",00:39:12.994,00:39:16.277
"multi lingual NMT system which
enables zero shot translation.",00:39:16.277,00:39:21.980
"So as we have seen in the lecture,
this is the standard architecture for",00:39:21.980,00:39:25.561
"an NMT system which you have
an encoder and a decoder.",00:39:25.561,00:39:28.260
"However, this thin architecture supports
only bilingual translation, meaning",00:39:28.260,00:39:32.220
"that we can have only one specific source
language and one specific target language.",00:39:32.220,00:39:36.306
"So what if you want to have a system
that's able to do multilingual",00:39:36.306,00:39:39.412
translation?,00:39:39.412,00:39:40.152
"Meaning that we can have multiple source
languages and multiple target languages.",00:39:40.152,00:39:44.470
"So previously people have proposed
several different approaches.",00:39:44.470,00:39:47.920
"The first one, they proposed to have
multiple different encoders and",00:39:47.920,00:39:51.130
multiple different decoders.,00:39:51.130,00:39:52.740
"Where each pair correspond to one specific
pair of source and target languages.",00:39:52.740,00:39:57.370
"And the second one that proposed to
have a shared encoder that works for",00:39:57.370,00:40:01.380
"one specific source language, but",00:40:01.380,00:40:03.340
"have different decoders to decode
into different target languages.",00:40:03.340,00:40:07.950
